transaction_id,customer_id,product_id,product_name,category,quantity_sold,unit_price,transaction_date,store_id,store_location,inventory_level,reorder_point,reorder_quantity,supplier_id,supplier_lead_time,customer_age,customer_gender,customer_income,customer_loyalty_level,payment_method,promotion_applied,promotion_type,weather_conditions,holiday_indicator,weekday,stockout_indicator,forecasted_demand,actual_demand,Date,Year,Month,Week,Is_Holiday_Week
1,2824,843,Fridge,Electronics,3,188.46,3/31/2024 21:46,3,"Miami, FL",246,116,170,474,8,29,Other,98760.83,Silver,Credit Card,True,0,Stormy,False,Friday,True,172,179,2024-03-31 21:46:00,2024,3,13,0
2,1409,135,TV,Electronics,4,1912.04,7/28/2024 12:45,5,"Dallas, TX",43,70,212,135,4,34,Other,69781.93,Gold,Cash,True,Percentage Discount,Rainy,False,Monday,True,109,484,2024-07-28 12:45:00,2024,7,30,0
3,5506,391,Fridge,Electronics,4,1377.75,6/10/2024 4:55,1,"Los Angeles, CA",411,94,252,475,2,69,Other,77373.1,Platinum,Cash,False,0,Sunny,False,Tuesday,True,289,416,2024-06-10 04:55:00,2024,6,24,0
4,5012,710,Smartphone,Electronics,5,182.31,8/15/2024 1:03,5,"Miami, FL",452,87,112,118,7,47,Other,33383.04,Silver,Cash,True,Percentage Discount,Sunny,True,Sunday,False,174,446,2024-08-15 01:03:00,2024,8,33,0
5,4657,116,Laptop,Electronics,3,499.28,9/13/2024 0:45,6,"Chicago, IL",412,99,177,155,4,70,Female,108999.41,Bronze,Digital Wallet,False,0,Sunny,False,Thursday,True,287,469,2024-09-13 00:45:00,2024,9,37,0
6,3286,630,Camera,Electronics,4,1465.38,7/6/2024 7:24,1,"New York, NY",196,80,210,169,4,40,Male,31779.77,Bronze,Credit Card,True,0,Sunny,True,Saturday,False,294,265,2024-07-06 07:24:00,2024,7,27,0
7,2679,238,Laptop,Appliances,3,1904.7,3/17/2024 22:33,3,"Dallas, TX",24,52,287,250,3,54,Female,75813.17,Platinum,Cash,False,BOGO,Sunny,False,Sunday,True,178,257,2024-03-17 22:33:00,2024,3,11,0
8,9935,409,Tablet,Electronics,4,875.16,7/22/2024 13:57,16,"Los Angeles, CA",125,92,178,248,5,57,Female,115784.29,Silver,Debit Card,False,Percentage Discount,Rainy,True,Thursday,True,165,264,2024-07-22 13:57:00,2024,7,30,0
9,2424,106,Camera,Electronics,4,1627.48,3/30/2024 4:10,12,"New York, NY",103,129,172,368,4,64,Other,77392.78,Platinum,Credit Card,False,0,Sunny,True,Saturday,True,476,428,2024-03-30 04:10:00,2024,3,13,0
10,7912,407,Laptop,Appliances,5,666.27,6/17/2024 16:59,10,"Chicago, IL",424,88,253,494,1,24,Male,44787.7,Bronze,Digital Wallet,True,0,Sunny,True,Monday,True,395,400,2024-06-17 16:59:00,2024,6,25,0
11,1520,327,Tablet,Electronics,3,155.24,4/3/2024 11:37,12,"Los Angeles, CA",377,135,167,104,9,67,Male,101268.72,Platinum,Cash,False,0,Stormy,False,Sunday,True,303,181,2024-04-03 11:37:00,2024,4,14,0
12,1488,319,Smartphone,Appliances,3,1076.79,6/19/2024 10:41,9,"Miami, FL",411,60,115,290,8,25,Female,52253.32,Silver,Debit Card,True,0,Cloudy,True,Monday,True,270,185,2024-06-19 10:41:00,2024,6,25,0
13,2535,976,Headphones,Appliances,2,1165.56,3/1/2024 4:08,3,"New York, NY",346,144,297,300,3,49,Female,22027.62,Bronze,Digital Wallet,False,0,Sunny,True,Thursday,False,141,127,2024-03-01 04:08:00,2024,3,9,0
14,4582,422,Washing Machine,Appliances,3,778.17,6/24/2024 17:34,13,"Miami, FL",118,94,188,410,5,30,Female,65337.53,Gold,Digital Wallet,False,0,Rainy,True,Thursday,False,273,446,2024-06-24 17:34:00,2024,6,26,0
15,4811,122,TV,Appliances,2,399.52,7/11/2024 11:58,9,"Los Angeles, CA",31,104,274,427,5,54,Male,81043.27,Bronze,Digital Wallet,False,0,Stormy,False,Saturday,True,221,244,2024-07-11 11:58:00,2024,7,28,0
16,9279,890,Camera,Appliances,4,639.33,5/2/2024 19:28,17,"Dallas, TX",258,113,239,252,8,20,Male,55162.4,Silver,Debit Card,True,0,Sunny,True,Friday,False,433,294,2024-05-02 19:28:00,2024,5,18,0
17,1434,941,Laptop,Appliances,3,457.92,3/1/2024 14:26,16,"Miami, FL",417,65,116,165,9,68,Female,84105.52,Silver,Debit Card,False,0,Sunny,True,Friday,False,415,191,2024-03-01 14:26:00,2024,3,9,0
18,4257,806,Laptop,Electronics,5,1201.92,6/26/2024 4:41,20,"New York, NY",191,58,184,153,4,43,Other,28754.82,Platinum,Debit Card,False,0,Sunny,False,Tuesday,True,348,418,2024-06-26 04:41:00,2024,6,26,0
19,9928,942,TV,Electronics,4,649.8,6/2/2024 20:20,5,"Miami, FL",149,108,125,157,10,44,Male,65975.21,Bronze,Cash,False,0,Sunny,False,Monday,True,172,477,2024-06-02 20:20:00,2024,6,22,0
20,7873,382,TV,Appliances,3,1155.98,7/21/2024 20:20,3,"Miami, FL",144,106,254,478,1,38,Other,106725.94,Platinum,Digital Wallet,True,Percentage Discount,Rainy,False,Thursday,True,362,451,2024-07-21 20:20:00,2024,7,29,0
21,4611,666,Headphones,Electronics,4,160.4,5/18/2024 14:04,2,"Los Angeles, CA",44,90,294,360,8,21,Male,77489.83,Silver,Credit Card,False,BOGO,Sunny,False,Saturday,True,130,157,2024-05-18 14:04:00,2024,5,20,0
22,8359,623,Smartphone,Electronics,4,781.98,2/6/2024 9:06,9,"Dallas, TX",270,76,157,346,2,65,Other,86773.84,Gold,Credit Card,False,0,Rainy,True,Wednesday,True,315,507,2024-02-06 09:06:00,2024,2,6,0
23,5557,669,TV,Appliances,5,565.22,3/3/2024 11:00,13,"Chicago, IL",332,124,257,257,3,43,Female,90816.55,Bronze,Cash,False,0,Sunny,False,Monday,False,434,364,2024-03-03 11:00:00,2024,3,9,0
24,1106,684,Headphones,Electronics,5,1503.41,1/30/2024 9:19,14,"Chicago, IL",154,120,165,466,2,50,Female,57698.63,Gold,Debit Card,False,0,Stormy,True,Tuesday,True,146,330,2024-01-30 09:19:00,2024,1,5,0
25,3615,685,Smartphone,Electronics,4,466.9,8/3/2024 4:57,5,"Dallas, TX",127,148,139,400,3,51,Male,44320.68,Gold,Digital Wallet,True,Percentage Discount,Rainy,True,Friday,True,280,506,2024-08-03 04:57:00,2024,8,31,0
26,7924,258,Camera,Electronics,1,1376.02,7/17/2024 15:17,15,"Dallas, TX",214,142,226,434,6,58,Female,110254.19,Platinum,Digital Wallet,True,0,Cloudy,False,Tuesday,False,392,369,2024-07-17 15:17:00,2024,7,29,0
27,6574,196,TV,Appliances,4,673.75,4/15/2024 1:23,11,"Dallas, TX",334,150,243,110,8,64,Male,23520.55,Gold,Cash,True,0,Cloudy,False,Wednesday,True,483,445,2024-04-15 01:23:00,2024,4,16,0
28,5552,138,Smartphone,Appliances,2,1880.99,7/27/2024 3:42,1,"Miami, FL",411,106,244,113,10,50,Male,45558.46,Gold,Debit Card,True,0,Stormy,False,Wednesday,False,495,153,2024-07-27 03:42:00,2024,7,30,0
29,3547,571,TV,Electronics,3,1839.91,7/15/2024 17:29,4,"Miami, FL",442,71,123,243,9,41,Female,77669.59,Bronze,Debit Card,True,BOGO,Cloudy,True,Monday,True,154,128,2024-07-15 17:29:00,2024,7,29,0
30,4527,464,Laptop,Electronics,2,1187.87,2/6/2024 6:57,12,"New York, NY",220,85,280,231,10,47,Female,111298.17,Bronze,Digital Wallet,True,0,Stormy,False,Tuesday,True,297,306,2024-02-06 06:57:00,2024,2,6,0
31,6514,259,Smartphone,Electronics,1,672.67,7/31/2024 10:27,6,"Chicago, IL",27,131,260,399,7,63,Male,116645.94,Platinum,Digital Wallet,False,0,Rainy,False,Monday,True,386,156,2024-07-31 10:27:00,2024,7,31,0
32,2674,241,Headphones,Electronics,2,947.46,6/13/2024 23:45,13,"Chicago, IL",340,90,118,135,10,45,Other,60397.59,Gold,Debit Card,True,0,Rainy,False,Monday,False,316,255,2024-06-13 23:45:00,2024,6,24,0
33,2519,371,Tablet,Appliances,3,1166.71,5/2/2024 7:21,19,"New York, NY",92,120,259,127,2,67,Male,71524.97,Silver,Cash,False,0,Stormy,False,Thursday,False,312,415,2024-05-02 07:21:00,2024,5,18,0
34,7224,475,Laptop,Electronics,3,1483.91,5/8/2024 9:01,15,"Los Angeles, CA",346,61,275,436,1,20,Female,53675.06,Gold,Cash,True,0,Stormy,False,Sunday,False,158,398,2024-05-08 09:01:00,2024,5,19,0
35,2584,696,Smartphone,Electronics,3,1529.02,2/14/2024 7:00,9,"New York, NY",8,141,141,498,3,29,Other,46591.75,Bronze,Debit Card,False,Percentage Discount,Cloudy,False,Friday,False,451,367,2024-02-14 07:00:00,2024,2,7,0
36,6881,355,Fridge,Electronics,1,1868.19,8/28/2024 12:57,9,"New York, NY",322,125,211,470,5,47,Female,46110.47,Bronze,Credit Card,False,0,Sunny,True,Sunday,True,165,421,2024-08-28 12:57:00,2024,8,35,0
37,6635,338,Tablet,Electronics,5,1292.59,4/21/2024 7:24,6,"New York, NY",309,150,236,131,2,30,Male,84317.95,Bronze,Credit Card,True,Percentage Discount,Stormy,False,Saturday,True,373,208,2024-04-21 07:24:00,2024,4,16,0
38,5333,362,Camera,Appliances,1,1086.46,3/30/2024 22:38,2,"New York, NY",470,120,252,324,10,25,Other,99864.97,Platinum,Cash,False,0,Stormy,False,Thursday,False,279,423,2024-03-30 22:38:00,2024,3,13,0
39,1711,930,TV,Appliances,5,897.72,1/28/2024 23:03,8,"New York, NY",101,108,113,186,9,45,Male,102848.17,Gold,Digital Wallet,True,0,Rainy,True,Tuesday,False,441,481,2024-01-28 23:03:00,2024,1,4,0
40,8527,407,Headphones,Appliances,3,1500.01,2/25/2024 2:52,13,"Dallas, TX",44,135,105,457,3,19,Male,52485.34,Gold,Debit Card,False,BOGO,Stormy,False,Monday,True,290,505,2024-02-25 02:52:00,2024,2,8,0
41,9785,194,Washing Machine,Electronics,5,635.67,6/1/2024 22:32,2,"Miami, FL",113,54,259,198,8,33,Other,35558.79,Bronze,Debit Card,False,Percentage Discount,Rainy,True,Monday,True,449,385,2024-06-01 22:32:00,2024,6,22,0
42,3045,684,TV,Appliances,3,1451.08,2/13/2024 13:55,16,"New York, NY",241,114,228,452,3,40,Female,52420.13,Gold,Digital Wallet,False,0,Sunny,True,Friday,False,472,142,2024-02-13 13:55:00,2024,2,7,0
43,7201,509,Camera,Electronics,5,1182.44,4/11/2024 2:53,18,"Los Angeles, CA",466,135,209,136,5,21,Male,60290.79,Silver,Digital Wallet,False,0,Stormy,True,Saturday,True,129,201,2024-04-11 02:53:00,2024,4,15,0
44,2291,682,Camera,Electronics,1,887.89,6/27/2024 11:57,11,"Los Angeles, CA",283,114,273,474,5,27,Male,40580.96,Gold,Debit Card,False,Percentage Discount,Rainy,True,Thursday,True,182,268,2024-06-27 11:57:00,2024,6,26,0
45,5803,322,Smartphone,Electronics,3,807.27,3/6/2024 22:28,10,"Miami, FL",276,88,112,250,10,62,Female,106546.53,Platinum,Debit Card,True,Percentage Discount,Cloudy,True,Thursday,True,389,119,2024-03-06 22:28:00,2024,3,10,0
46,6925,851,Fridge,Appliances,2,289.96,4/26/2024 20:53,18,"New York, NY",24,50,263,391,6,37,Male,67684.91,Bronze,Cash,False,0,Cloudy,False,Saturday,True,248,348,2024-04-26 20:53:00,2024,4,17,0
47,4150,179,Tablet,Electronics,4,508.35,8/6/2024 5:40,7,"Los Angeles, CA",374,113,208,188,3,39,Female,44829.51,Gold,Cash,True,BOGO,Cloudy,True,Wednesday,True,119,214,2024-08-06 05:40:00,2024,8,32,0
48,2139,840,Tablet,Electronics,5,1768.16,9/6/2024 23:19,7,"Los Angeles, CA",81,92,233,115,1,18,Male,113713.11,Bronze,Debit Card,False,BOGO,Cloudy,True,Wednesday,True,311,170,2024-09-06 23:19:00,2024,9,36,0
49,1750,432,Smartphone,Electronics,2,1441.29,6/21/2024 16:04,1,"Dallas, TX",350,141,118,245,8,43,Female,24183.49,Silver,Credit Card,True,0,Cloudy,True,Sunday,True,177,418,2024-06-21 16:04:00,2024,6,25,0
50,4733,911,Smartphone,Appliances,3,1015.05,7/23/2024 5:50,19,"Dallas, TX",465,90,174,391,7,70,Other,92852.3,Platinum,Credit Card,True,0,Stormy,True,Wednesday,False,484,192,2024-07-23 05:50:00,2024,7,30,0
51,5741,594,TV,Appliances,3,1273.04,1/21/2024 5:04,12,"Chicago, IL",34,147,178,407,10,30,Male,47241.6,Platinum,Cash,False,0,Sunny,False,Monday,False,422,490,2024-01-21 05:04:00,2024,1,3,0
52,2307,277,TV,Electronics,5,1141.15,7/21/2024 23:28,17,"Los Angeles, CA",16,75,120,206,10,26,Female,29909.45,Bronze,Digital Wallet,True,0,Stormy,False,Wednesday,True,357,164,2024-07-21 23:28:00,2024,7,29,0
53,4814,599,Fridge,Appliances,4,822.18,5/25/2024 12:08,16,"Chicago, IL",297,138,209,108,2,65,Male,86761.58,Bronze,Credit Card,False,Percentage Discount,Sunny,True,Saturday,False,411,206,2024-05-25 12:08:00,2024,5,21,0
54,2654,945,Camera,Appliances,4,1911.95,4/3/2024 17:35,5,"Miami, FL",123,120,263,465,6,47,Other,101221.71,Gold,Debit Card,True,0,Stormy,False,Monday,False,451,435,2024-04-03 17:35:00,2024,4,14,0
55,7227,806,Camera,Electronics,3,779.8,3/17/2024 15:38,8,"Dallas, TX",476,50,209,312,3,68,Other,35157.7,Silver,Credit Card,False,BOGO,Sunny,True,Wednesday,False,369,258,2024-03-17 15:38:00,2024,3,11,0
56,5554,819,Fridge,Electronics,4,963.98,5/21/2024 8:02,18,"New York, NY",212,96,284,248,9,21,Other,48442.51,Silver,Debit Card,True,0,Cloudy,False,Sunday,False,171,392,2024-05-21 08:02:00,2024,5,21,0
57,8428,690,TV,Appliances,2,1555.39,5/20/2024 22:46,7,"Los Angeles, CA",248,75,199,128,4,62,Male,85217.95,Platinum,Credit Card,False,0,Cloudy,True,Saturday,False,497,130,2024-05-20 22:46:00,2024,5,21,0
58,6977,939,Laptop,Appliances,1,1942.61,5/22/2024 1:12,13,"Miami, FL",371,144,124,235,2,62,Male,56597.14,Silver,Debit Card,True,0,Sunny,True,Sunday,True,235,463,2024-05-22 01:12:00,2024,5,21,0
59,3664,197,TV,Electronics,2,1987.95,7/13/2024 12:07,18,"Miami, FL",499,100,126,143,2,61,Male,94487.48,Silver,Digital Wallet,False,0,Stormy,False,Saturday,False,490,300,2024-07-13 12:07:00,2024,7,28,0
60,7065,709,Headphones,Appliances,1,1403.43,7/8/2024 13:47,1,"New York, NY",370,93,222,166,10,40,Male,103118.84,Silver,Credit Card,True,0,Sunny,True,Tuesday,False,117,415,2024-07-08 13:47:00,2024,7,28,0
61,6820,757,Smartphone,Electronics,4,1702.75,2/23/2024 7:27,14,"New York, NY",477,129,294,137,8,27,Female,118178.0,Bronze,Credit Card,False,BOGO,Rainy,False,Friday,False,237,287,2024-02-23 07:27:00,2024,2,8,0
62,4432,407,Camera,Electronics,3,1612.51,5/23/2024 12:54,2,"New York, NY",211,130,219,130,8,35,Female,110883.1,Silver,Debit Card,True,0,Stormy,False,Thursday,True,177,427,2024-05-23 12:54:00,2024,5,21,0
63,5374,138,TV,Electronics,2,222.97,7/18/2024 23:38,3,"Miami, FL",255,111,275,334,9,23,Female,83341.85,Silver,Credit Card,True,BOGO,Sunny,False,Sunday,True,290,142,2024-07-18 23:38:00,2024,7,29,0
64,2169,848,Laptop,Electronics,2,567.45,8/9/2024 23:16,9,"Chicago, IL",481,68,138,120,10,60,Female,100745.24,Bronze,Cash,False,0,Sunny,True,Wednesday,True,464,118,2024-08-09 23:16:00,2024,8,32,0
65,3803,927,Headphones,Appliances,3,1718.3,3/29/2024 14:26,11,"New York, NY",234,105,255,443,6,45,Female,100375.5,Bronze,Debit Card,True,0,Sunny,False,Monday,True,154,329,2024-03-29 14:26:00,2024,3,13,0
66,9751,690,Smartphone,Appliances,5,1621.14,5/13/2024 18:13,15,"Chicago, IL",400,116,171,240,2,56,Female,79297.4,Platinum,Debit Card,False,0,Stormy,False,Tuesday,False,256,236,2024-05-13 18:13:00,2024,5,20,0
67,5010,490,Washing Machine,Electronics,1,245.51,4/1/2024 2:35,20,"Los Angeles, CA",237,77,141,450,7,70,Male,21194.58,Gold,Credit Card,False,Percentage Discount,Stormy,False,Saturday,False,410,286,2024-04-01 02:35:00,2024,4,14,0
68,3677,180,TV,Appliances,3,411.94,6/22/2024 22:55,5,"Chicago, IL",232,129,100,205,7,34,Male,20389.64,Bronze,Cash,True,0,Rainy,False,Sunday,False,349,238,2024-06-22 22:55:00,2024,6,25,0
69,8573,898,Tablet,Electronics,2,99.79,6/12/2024 2:03,8,"Miami, FL",122,97,204,138,6,67,Other,28977.08,Bronze,Digital Wallet,False,0,Sunny,False,Wednesday,False,235,475,2024-06-12 02:03:00,2024,6,24,0
70,7216,157,Washing Machine,Electronics,4,751.77,3/18/2024 5:57,5,"New York, NY",436,54,220,114,1,67,Male,78767.52,Platinum,Cash,False,BOGO,Cloudy,False,Tuesday,True,309,219,2024-03-18 05:57:00,2024,3,12,0
71,5422,889,Tablet,Appliances,1,1003.29,3/23/2024 21:42,13,"Los Angeles, CA",213,148,112,278,2,58,Other,33420.16,Gold,Digital Wallet,True,0,Stormy,True,Wednesday,True,206,198,2024-03-23 21:42:00,2024,3,12,0
72,4598,442,Smartphone,Electronics,3,473.18,3/18/2024 4:25,16,"Miami, FL",175,108,242,289,9,65,Female,68810.22,Silver,Cash,False,0,Rainy,True,Monday,True,488,404,2024-03-18 04:25:00,2024,3,12,0
73,6313,456,Fridge,Electronics,1,1708.1,5/12/2024 22:09,3,"Miami, FL",391,144,107,104,1,38,Other,92249.17,Silver,Credit Card,True,0,Sunny,False,Friday,True,236,492,2024-05-12 22:09:00,2024,5,19,0
74,1916,936,Camera,Appliances,3,330.13,9/13/2024 7:47,9,"New York, NY",488,139,187,211,1,45,Female,30211.0,Platinum,Debit Card,True,0,Cloudy,True,Sunday,True,393,408,2024-09-13 07:47:00,2024,9,37,0
75,4752,544,Washing Machine,Electronics,5,1427.61,1/8/2024 6:33,18,"Los Angeles, CA",233,53,289,145,6,37,Male,69504.2,Silver,Digital Wallet,True,0,Cloudy,False,Thursday,True,332,487,2024-01-08 06:33:00,2024,1,2,0
76,1525,526,Washing Machine,Electronics,5,1412.28,1/17/2024 16:44,11,"Chicago, IL",193,94,232,286,5,42,Other,85658.97,Gold,Digital Wallet,True,0,Sunny,True,Sunday,True,260,161,2024-01-17 16:44:00,2024,1,3,0
77,6168,988,Smartphone,Electronics,2,464.77,3/11/2024 5:28,17,"Dallas, TX",159,60,290,472,5,52,Female,29772.04,Silver,Cash,True,BOGO,Rainy,False,Monday,True,217,95,2024-03-11 05:28:00,2024,3,11,0
78,7572,223,Camera,Appliances,2,1381.09,6/4/2024 11:51,4,"Miami, FL",182,74,188,367,1,44,Other,58641.91,Silver,Digital Wallet,True,Percentage Discount,Rainy,True,Wednesday,True,268,506,2024-06-04 11:51:00,2024,6,23,0
79,5386,990,Camera,Electronics,2,460.15,5/20/2024 19:29,20,"New York, NY",178,55,241,362,3,42,Male,61610.34,Silver,Digital Wallet,True,BOGO,Sunny,False,Monday,True,224,308,2024-05-20 19:29:00,2024,5,21,0
80,2084,888,Washing Machine,Electronics,4,1996.67,6/20/2024 2:36,15,"Chicago, IL",152,102,139,333,8,47,Male,61760.44,Platinum,Digital Wallet,False,0,Cloudy,False,Thursday,True,334,152,2024-06-20 02:36:00,2024,6,25,0
81,4456,332,Washing Machine,Appliances,1,839.5,5/4/2024 15:09,1,"Chicago, IL",169,127,171,381,8,43,Male,43640.61,Platinum,Digital Wallet,True,0,Rainy,True,Saturday,True,244,497,2024-05-04 15:09:00,2024,5,18,0
82,6155,865,Washing Machine,Appliances,3,555.2,1/29/2024 1:58,4,"Miami, FL",316,103,273,262,7,67,Other,24442.75,Bronze,Cash,True,0,Rainy,True,Tuesday,False,390,124,2024-01-29 01:58:00,2024,1,5,0
83,4483,768,Headphones,Electronics,3,412.78,1/29/2024 14:44,12,"Miami, FL",453,107,102,119,1,58,Female,23721.97,Silver,Debit Card,False,Percentage Discount,Cloudy,False,Tuesday,False,269,118,2024-01-29 14:44:00,2024,1,5,0
84,9179,969,Fridge,Electronics,3,1143.31,9/5/2024 9:25,2,"Chicago, IL",29,73,165,298,2,60,Male,46071.3,Gold,Cash,True,0,Rainy,True,Wednesday,True,164,227,2024-09-05 09:25:00,2024,9,36,0
85,7482,716,Laptop,Electronics,2,310.07,6/24/2024 17:20,4,"Chicago, IL",106,58,259,312,3,64,Male,89027.25,Platinum,Digital Wallet,True,0,Cloudy,True,Friday,True,290,476,2024-06-24 17:20:00,2024,6,26,0
86,8517,111,TV,Electronics,1,518.14,1/18/2024 4:28,19,"Dallas, TX",128,149,265,107,4,63,Male,84024.27,Platinum,Digital Wallet,False,0,Rainy,False,Wednesday,True,195,429,2024-01-18 04:28:00,2024,1,3,0
87,3340,749,TV,Electronics,4,369.54,4/8/2024 12:55,14,"Chicago, IL",460,66,222,494,2,34,Other,67483.34,Silver,Debit Card,False,0,Rainy,False,Saturday,False,433,445,2024-04-08 12:55:00,2024,4,15,0
88,5339,896,TV,Appliances,5,819.83,3/7/2024 19:44,16,"Chicago, IL",492,118,224,320,7,44,Male,96546.69,Gold,Digital Wallet,True,0,Rainy,True,Friday,False,274,372,2024-03-07 19:44:00,2024,3,10,0
89,3287,747,Washing Machine,Electronics,4,1617.59,5/31/2024 21:18,20,"Dallas, TX",258,63,282,327,3,57,Female,65593.93,Gold,Cash,True,0,Sunny,False,Saturday,True,320,297,2024-05-31 21:18:00,2024,5,22,0
90,5040,491,TV,Electronics,2,1930.09,9/16/2024 10:49,16,"New York, NY",56,90,275,283,6,25,Female,56737.81,Silver,Debit Card,False,Percentage Discount,Sunny,False,Saturday,True,106,254,2024-09-16 10:49:00,2024,9,38,0
91,9830,155,Fridge,Appliances,4,783.32,7/7/2024 8:08,5,"Miami, FL",314,99,250,431,8,35,Male,45523.24,Gold,Cash,False,0,Rainy,True,Saturday,False,361,343,2024-07-07 08:08:00,2024,7,27,0
92,5304,412,TV,Electronics,2,1725.96,1/18/2024 18:20,1,"Chicago, IL",169,120,279,159,6,28,Male,57373.83,Platinum,Credit Card,True,0,Stormy,False,Friday,True,362,364,2024-01-18 18:20:00,2024,1,3,0
93,8019,636,Headphones,Electronics,1,1322.84,4/23/2024 2:13,20,"New York, NY",412,81,182,236,2,63,Male,43939.6,Silver,Credit Card,True,0,Cloudy,True,Tuesday,True,250,181,2024-04-23 02:13:00,2024,4,17,0
94,7543,142,Fridge,Electronics,1,553.66,3/17/2024 21:53,5,"New York, NY",440,120,279,159,1,50,Female,52116.97,Silver,Digital Wallet,True,0,Rainy,False,Friday,True,350,407,2024-03-17 21:53:00,2024,3,11,0
95,6930,426,Fridge,Electronics,1,906.63,3/18/2024 21:14,12,"Dallas, TX",356,107,223,235,1,37,Male,94210.23,Silver,Cash,False,BOGO,Sunny,False,Tuesday,False,450,441,2024-03-18 21:14:00,2024,3,12,0
96,4593,652,Smartphone,Electronics,5,1840.97,2/26/2024 9:16,3,"Dallas, TX",128,150,145,367,1,18,Other,62801.49,Platinum,Cash,False,0,Sunny,False,Sunday,False,437,250,2024-02-26 09:16:00,2024,2,9,0
97,3266,678,Camera,Appliances,1,1262.8,9/5/2024 2:59,19,"Chicago, IL",103,53,172,216,4,19,Other,36535.42,Gold,Cash,True,0,Sunny,True,Friday,False,101,323,2024-09-05 02:59:00,2024,9,36,0
98,9348,253,Headphones,Appliances,4,1432.76,2/23/2024 18:26,5,"Dallas, TX",183,73,101,276,7,18,Male,35234.93,Platinum,Debit Card,False,0,Sunny,True,Sunday,True,348,362,2024-02-23 18:26:00,2024,2,8,0
99,9085,434,Tablet,Appliances,5,486.48,3/19/2024 14:38,2,"Chicago, IL",395,111,108,136,7,18,Other,73542.56,Silver,Cash,False,BOGO,Sunny,False,Tuesday,False,432,339,2024-03-19 14:38:00,2024,3,12,0
100,2489,614,Smartphone,Appliances,3,1093.09,8/7/2024 2:50,4,"Los Angeles, CA",378,116,159,270,9,62,Other,90900.0,Silver,Digital Wallet,False,0,Rainy,True,Thursday,False,144,335,2024-08-07 02:50:00,2024,8,32,0
101,1771,814,Tablet,Appliances,2,709.39,1/3/2024 17:27,18,"Dallas, TX",369,92,115,306,6,25,Male,65819.84,Silver,Debit Card,True,Percentage Discount,Cloudy,True,Saturday,True,156,260,2024-01-03 17:27:00,2024,1,1,0
102,2796,326,Headphones,Electronics,2,324.35,2/12/2024 10:44,5,"Dallas, TX",56,78,150,110,8,31,Female,112414.59,Silver,Debit Card,True,0,Sunny,True,Sunday,True,337,257,2024-02-12 10:44:00,2024,2,7,0
103,3504,256,Washing Machine,Appliances,1,316.49,8/24/2024 15:02,18,"New York, NY",55,107,121,390,5,66,Male,58700.64,Gold,Digital Wallet,False,BOGO,Sunny,False,Saturday,True,301,93,2024-08-24 15:02:00,2024,8,34,0
104,3621,151,Camera,Appliances,1,1387.72,2/26/2024 23:09,12,"Los Angeles, CA",461,122,193,279,4,46,Other,25639.26,Silver,Credit Card,False,BOGO,Stormy,True,Tuesday,False,206,323,2024-02-26 23:09:00,2024,2,9,0
105,7916,789,TV,Appliances,3,92.3,9/7/2024 10:41,5,"Miami, FL",25,121,116,161,10,34,Other,68695.94,Silver,Debit Card,True,0,Rainy,False,Wednesday,False,204,143,2024-09-07 10:41:00,2024,9,36,0
106,2040,849,Laptop,Appliances,5,233.15,3/24/2024 13:44,8,"Chicago, IL",71,148,291,236,8,30,Female,98228.07,Platinum,Debit Card,False,0,Rainy,True,Wednesday,True,321,353,2024-03-24 13:44:00,2024,3,12,0
107,7304,502,Washing Machine,Appliances,4,1393.04,2/25/2024 16:31,8,"Miami, FL",195,69,233,468,4,46,Other,110199.45,Bronze,Credit Card,True,BOGO,Cloudy,True,Tuesday,True,482,129,2024-02-25 16:31:00,2024,2,8,0
108,7252,556,Camera,Electronics,1,50.26,4/5/2024 15:10,5,"Miami, FL",319,64,205,167,9,50,Male,77716.11,Silver,Credit Card,False,0,Cloudy,False,Tuesday,True,293,436,2024-04-05 15:10:00,2024,4,14,0
109,8668,870,Fridge,Appliances,5,875.4,2/1/2024 9:42,19,"Chicago, IL",104,86,123,334,5,35,Male,77554.84,Silver,Credit Card,False,0,Stormy,False,Thursday,False,151,97,2024-02-01 09:42:00,2024,2,5,0
110,9669,709,Washing Machine,Appliances,3,418.35,5/13/2024 2:08,15,"Dallas, TX",293,142,214,342,8,49,Other,111413.58,Silver,Debit Card,True,Percentage Discount,Stormy,False,Wednesday,False,383,181,2024-05-13 02:08:00,2024,5,20,0
111,5119,689,Washing Machine,Electronics,3,1534.23,5/14/2024 0:38,1,"Los Angeles, CA",161,123,188,126,2,64,Other,29122.87,Silver,Digital Wallet,True,0,Stormy,False,Sunday,True,436,281,2024-05-14 00:38:00,2024,5,20,0
112,1188,616,Fridge,Electronics,2,391.62,7/8/2024 16:45,9,"Los Angeles, CA",190,71,250,450,9,24,Female,35413.35,Platinum,Digital Wallet,False,0,Cloudy,False,Wednesday,True,433,264,2024-07-08 16:45:00,2024,7,28,0
113,2876,192,Fridge,Appliances,2,593.86,7/17/2024 4:47,19,"Miami, FL",105,89,242,179,5,19,Female,30786.94,Gold,Debit Card,True,0,Rainy,True,Thursday,True,133,421,2024-07-17 04:47:00,2024,7,29,0
114,9797,327,Camera,Electronics,3,319.69,5/28/2024 22:36,7,"Chicago, IL",120,60,255,133,6,66,Other,42643.65,Platinum,Digital Wallet,False,0,Stormy,False,Thursday,False,288,456,2024-05-28 22:36:00,2024,5,22,0
115,5371,542,Washing Machine,Appliances,3,1924.98,1/1/2024 22:11,16,"New York, NY",421,78,211,275,9,48,Female,75488.31,Bronze,Credit Card,True,0,Sunny,False,Friday,True,133,110,2024-01-01 22:11:00,2024,1,1,0
116,6573,396,Camera,Appliances,2,1014.56,2/23/2024 17:35,19,"Los Angeles, CA",25,110,145,498,2,33,Other,56879.25,Platinum,Credit Card,False,0,Rainy,False,Saturday,False,272,367,2024-02-23 17:35:00,2024,2,8,0
117,2827,905,Headphones,Electronics,4,187.67,1/2/2024 1:25,11,"Los Angeles, CA",275,63,297,217,7,50,Other,49753.83,Gold,Digital Wallet,True,0,Stormy,True,Saturday,True,400,243,2024-01-02 01:25:00,2024,1,1,0
118,5808,503,Fridge,Appliances,5,1202.43,4/1/2024 10:59,17,"Chicago, IL",316,111,138,376,4,69,Female,74406.83,Silver,Credit Card,True,0,Sunny,True,Friday,True,250,477,2024-04-01 10:59:00,2024,4,14,0
119,8123,251,Laptop,Electronics,4,341.23,2/29/2024 19:33,6,"Miami, FL",374,80,275,298,1,29,Female,106832.71,Gold,Cash,True,Percentage Discount,Cloudy,False,Friday,False,344,206,2024-02-29 19:33:00,2024,2,9,0
120,3591,235,Smartphone,Appliances,3,1235.81,7/6/2024 0:16,19,"Dallas, TX",384,50,179,158,3,30,Female,82217.52,Gold,Digital Wallet,True,0,Cloudy,False,Thursday,True,174,173,2024-07-06 00:16:00,2024,7,27,0
121,8433,444,Washing Machine,Appliances,3,1609.41,7/16/2024 17:23,4,"Dallas, TX",69,104,256,153,2,29,Other,111854.79,Bronze,Digital Wallet,False,0,Rainy,False,Saturday,False,380,191,2024-07-16 17:23:00,2024,7,29,0
122,1053,184,TV,Electronics,4,992.38,2/11/2024 19:48,11,"Chicago, IL",98,138,177,271,3,27,Other,25671.78,Platinum,Digital Wallet,True,0,Rainy,False,Saturday,False,235,238,2024-02-11 19:48:00,2024,2,6,0
123,5315,587,Headphones,Electronics,1,1648.76,6/20/2024 9:10,18,"Chicago, IL",353,74,262,162,10,38,Female,51082.58,Silver,Credit Card,False,0,Rainy,True,Thursday,False,145,229,2024-06-20 09:10:00,2024,6,25,0
124,9201,685,Tablet,Appliances,1,1730.93,1/6/2024 4:49,12,"New York, NY",127,122,219,160,2,64,Male,70959.07,Bronze,Credit Card,False,0,Sunny,False,Friday,True,192,386,2024-01-06 04:49:00,2024,1,1,0
125,3927,863,Camera,Appliances,4,690.1,3/9/2024 12:24,11,"New York, NY",96,54,207,140,9,60,Male,80543.74,Bronze,Credit Card,True,Percentage Discount,Stormy,False,Thursday,True,391,328,2024-03-09 12:24:00,2024,3,10,0
126,9317,150,Tablet,Electronics,2,574.02,3/23/2024 20:31,4,"New York, NY",334,117,167,463,3,61,Female,60161.34,Bronze,Debit Card,False,0,Sunny,False,Monday,False,263,490,2024-03-23 20:31:00,2024,3,12,0
127,2743,661,Headphones,Appliances,2,717.09,8/12/2024 10:41,3,"Los Angeles, CA",484,97,265,322,4,52,Male,63473.08,Silver,Debit Card,True,0,Cloudy,False,Tuesday,False,364,170,2024-08-12 10:41:00,2024,8,33,0
128,5889,508,Tablet,Electronics,1,1798.56,8/22/2024 21:06,14,"Los Angeles, CA",449,117,125,189,7,62,Female,75207.75,Gold,Credit Card,True,0,Sunny,False,Tuesday,False,285,341,2024-08-22 21:06:00,2024,8,34,0
129,9317,368,Headphones,Appliances,5,162.28,4/24/2024 8:23,7,"Miami, FL",42,77,256,471,4,32,Female,58663.26,Silver,Digital Wallet,True,0,Sunny,True,Sunday,False,270,509,2024-04-24 08:23:00,2024,4,17,0
130,4258,187,TV,Electronics,4,1855.66,6/14/2024 22:58,20,"New York, NY",105,54,169,341,8,32,Female,56894.87,Gold,Debit Card,True,0,Stormy,False,Wednesday,True,490,269,2024-06-14 22:58:00,2024,6,24,0
131,3504,508,Tablet,Appliances,3,681.03,2/12/2024 8:18,15,"Chicago, IL",186,102,250,149,3,48,Other,87032.72,Bronze,Debit Card,True,0,Sunny,True,Monday,False,446,419,2024-02-12 08:18:00,2024,2,7,0
132,7126,613,Tablet,Appliances,2,1158.37,4/15/2024 8:08,3,"Chicago, IL",347,121,188,231,6,45,Female,79753.13,Silver,Debit Card,False,0,Sunny,False,Tuesday,True,207,278,2024-04-15 08:08:00,2024,4,16,0
133,3646,544,Tablet,Appliances,2,1238.24,3/21/2024 3:39,10,"Dallas, TX",381,83,229,206,2,67,Female,51389.78,Platinum,Cash,False,0,Sunny,True,Tuesday,False,110,256,2024-03-21 03:39:00,2024,3,12,0
134,9837,892,Camera,Appliances,4,185.41,6/11/2024 10:50,20,"Dallas, TX",35,137,154,484,2,67,Female,57783.41,Silver,Credit Card,False,0,Cloudy,False,Thursday,True,111,310,2024-06-11 10:50:00,2024,6,24,0
135,9689,814,Laptop,Appliances,4,1124.67,9/15/2024 1:10,6,"Chicago, IL",159,114,146,289,3,28,Female,90105.0,Gold,Cash,False,0,Sunny,True,Thursday,True,136,321,2024-09-15 01:10:00,2024,9,37,0
136,1009,233,TV,Appliances,4,481.22,2/5/2024 19:28,1,"New York, NY",498,76,192,415,10,59,Other,76606.52,Platinum,Debit Card,True,0,Stormy,True,Saturday,False,391,509,2024-02-05 19:28:00,2024,2,6,0
137,6310,880,Camera,Appliances,2,107.44,8/14/2024 8:29,15,"Miami, FL",335,104,119,198,9,64,Female,66682.07,Gold,Credit Card,False,Percentage Discount,Stormy,True,Friday,True,381,434,2024-08-14 08:29:00,2024,8,33,0
138,9005,238,TV,Appliances,5,1447.41,3/16/2024 13:26,11,"Chicago, IL",266,149,253,234,1,27,Female,66238.35,Silver,Credit Card,False,0,Sunny,True,Friday,False,207,453,2024-03-16 13:26:00,2024,3,11,0
139,1319,592,Camera,Appliances,4,817.03,6/4/2024 9:38,15,"Miami, FL",161,147,246,157,4,31,Female,56856.21,Silver,Digital Wallet,False,0,Stormy,False,Thursday,False,305,121,2024-06-04 09:38:00,2024,6,23,0
140,2832,672,Headphones,Appliances,4,604.47,2/20/2024 5:21,10,"Los Angeles, CA",172,116,109,118,2,64,Male,111403.54,Silver,Cash,False,0,Cloudy,True,Thursday,False,196,337,2024-02-20 05:21:00,2024,2,8,0
141,6947,302,Headphones,Appliances,3,529.42,7/18/2024 12:03,4,"Chicago, IL",382,65,121,301,1,33,Other,96304.22,Silver,Credit Card,True,0,Cloudy,False,Tuesday,False,324,500,2024-07-18 12:03:00,2024,7,29,0
142,6038,599,Headphones,Appliances,4,1363.2,4/30/2024 18:10,10,"Miami, FL",402,104,102,153,3,35,Male,36043.99,Bronze,Credit Card,False,0,Rainy,False,Wednesday,False,301,121,2024-04-30 18:10:00,2024,4,18,0
143,4923,504,TV,Electronics,2,409.39,3/20/2024 17:35,6,"Miami, FL",14,106,134,431,7,39,Female,49173.07,Silver,Debit Card,False,0,Cloudy,True,Sunday,True,114,390,2024-03-20 17:35:00,2024,3,12,0
144,1949,767,Smartphone,Electronics,2,1528.82,8/31/2024 5:11,10,"Miami, FL",237,70,203,315,3,20,Female,24539.99,Platinum,Cash,True,0,Stormy,False,Thursday,True,116,133,2024-08-31 05:11:00,2024,8,35,0
145,4946,685,Headphones,Electronics,4,1986.15,1/10/2024 2:58,18,"Miami, FL",11,75,159,266,4,25,Female,28190.16,Gold,Cash,True,0,Rainy,True,Tuesday,True,273,454,2024-01-10 02:58:00,2024,1,2,0
146,2290,300,Laptop,Electronics,1,1463.18,1/9/2024 16:59,15,"Chicago, IL",73,118,154,105,8,39,Male,89770.37,Bronze,Debit Card,True,0,Sunny,True,Tuesday,False,362,419,2024-01-09 16:59:00,2024,1,2,0
147,2403,674,Headphones,Electronics,1,343.57,7/3/2024 14:56,8,"New York, NY",192,100,167,423,1,35,Male,33350.36,Bronze,Cash,True,BOGO,Stormy,True,Friday,False,405,303,2024-07-03 14:56:00,2024,7,27,0
148,8962,730,Headphones,Electronics,3,300.15,7/24/2024 9:24,19,"New York, NY",128,104,259,230,6,25,Other,81236.98,Silver,Cash,True,0,Rainy,False,Saturday,True,252,128,2024-07-24 09:24:00,2024,7,30,0
149,2133,853,Camera,Appliances,1,926.33,7/22/2024 18:07,14,"Miami, FL",8,93,134,457,1,48,Male,108231.74,Silver,Debit Card,True,0,Sunny,False,Friday,True,288,336,2024-07-22 18:07:00,2024,7,30,0
150,9727,636,Fridge,Appliances,1,960.38,4/21/2024 13:05,6,"Los Angeles, CA",221,135,137,355,7,49,Male,22535.55,Platinum,Credit Card,True,0,Cloudy,False,Monday,True,279,111,2024-04-21 13:05:00,2024,4,16,0
151,3060,352,Fridge,Appliances,3,447.32,1/20/2024 6:27,13,"Miami, FL",70,102,213,195,8,43,Female,28950.99,Platinum,Credit Card,False,0,Cloudy,False,Saturday,False,490,491,2024-01-20 06:27:00,2024,1,3,0
152,3103,348,Laptop,Appliances,2,197.09,3/27/2024 5:41,5,"Chicago, IL",409,55,292,262,5,41,Male,22562.55,Platinum,Debit Card,False,0,Cloudy,True,Thursday,True,139,362,2024-03-27 05:41:00,2024,3,13,0
153,8787,173,Washing Machine,Appliances,4,1779.07,2/28/2024 13:29,12,"Dallas, TX",407,101,224,278,9,47,Other,63045.29,Gold,Debit Card,True,0,Sunny,True,Friday,True,309,504,2024-02-28 13:29:00,2024,2,9,0
154,3705,372,Smartphone,Electronics,5,1037.15,3/13/2024 2:08,20,"Los Angeles, CA",216,110,278,210,3,52,Female,79357.58,Bronze,Cash,True,0,Cloudy,False,Saturday,False,115,470,2024-03-13 02:08:00,2024,3,11,0
155,5342,895,Fridge,Appliances,1,1922.18,6/15/2024 18:09,3,"Miami, FL",7,111,294,162,6,44,Female,101034.98,Gold,Credit Card,True,BOGO,Stormy,False,Friday,False,393,231,2024-06-15 18:09:00,2024,6,24,0
156,9645,540,TV,Electronics,1,1912.14,4/9/2024 14:07,17,"Chicago, IL",197,97,221,457,3,70,Female,37066.31,Gold,Credit Card,True,0,Cloudy,True,Tuesday,False,135,312,2024-04-09 14:07:00,2024,4,15,0
157,7932,431,TV,Appliances,3,833.53,5/9/2024 10:14,18,"Chicago, IL",225,94,114,118,3,45,Other,29824.29,Gold,Debit Card,False,0,Rainy,False,Saturday,True,142,105,2024-05-09 10:14:00,2024,5,19,0
158,4470,801,TV,Electronics,3,632.54,1/31/2024 18:25,8,"Miami, FL",144,122,236,354,10,23,Female,94545.43,Gold,Cash,True,0,Sunny,False,Thursday,False,337,401,2024-01-31 18:25:00,2024,1,5,0
159,9835,689,Washing Machine,Appliances,5,982.38,8/20/2024 2:32,3,"Los Angeles, CA",367,95,183,202,3,20,Male,65901.28,Gold,Credit Card,False,0,Rainy,True,Saturday,True,461,241,2024-08-20 02:32:00,2024,8,34,0
160,4295,191,TV,Appliances,1,1854.75,9/7/2024 0:27,6,"Dallas, TX",54,107,247,355,6,62,Male,97701.81,Gold,Credit Card,True,0,Cloudy,False,Thursday,False,415,487,2024-09-07 00:27:00,2024,9,36,0
161,6107,215,Washing Machine,Appliances,1,913.75,7/31/2024 18:22,10,"Dallas, TX",163,150,178,138,5,59,Male,24212.73,Gold,Debit Card,True,0,Cloudy,True,Tuesday,False,490,267,2024-07-31 18:22:00,2024,7,31,0
162,7537,787,Washing Machine,Electronics,1,454.3,7/25/2024 17:42,19,"Chicago, IL",323,81,273,195,7,21,Male,50055.95,Gold,Digital Wallet,False,0,Stormy,True,Monday,False,242,292,2024-07-25 17:42:00,2024,7,30,0
163,7118,523,Camera,Electronics,2,754.94,1/18/2024 16:41,16,"Los Angeles, CA",63,144,142,174,6,20,Female,45576.11,Silver,Credit Card,False,BOGO,Cloudy,True,Wednesday,True,412,338,2024-01-18 16:41:00,2024,1,3,0
164,8177,533,Tablet,Electronics,4,514.18,5/26/2024 14:34,15,"Los Angeles, CA",382,146,208,103,5,19,Female,38742.96,Platinum,Debit Card,False,0,Rainy,False,Thursday,True,480,276,2024-05-26 14:34:00,2024,5,21,0
165,9479,474,Camera,Appliances,2,1605.26,6/27/2024 14:02,8,"Chicago, IL",422,91,229,324,8,40,Male,71780.79,Silver,Credit Card,True,BOGO,Cloudy,True,Tuesday,False,207,374,2024-06-27 14:02:00,2024,6,26,0
166,8397,456,TV,Electronics,2,703.36,1/5/2024 18:03,14,"New York, NY",152,87,144,174,7,56,Other,33742.98,Platinum,Credit Card,True,0,Cloudy,False,Tuesday,False,368,100,2024-01-05 18:03:00,2024,1,1,0
167,2982,295,Fridge,Appliances,1,660.72,1/21/2024 18:02,15,"Dallas, TX",156,62,160,264,4,23,Female,116494.73,Silver,Digital Wallet,True,0,Rainy,False,Sunday,False,189,500,2024-01-21 18:02:00,2024,1,3,0
168,5061,428,Fridge,Appliances,3,1266.61,6/12/2024 20:13,16,"Chicago, IL",417,50,257,475,2,25,Male,119683.28,Platinum,Debit Card,True,0,Cloudy,True,Tuesday,False,198,420,2024-06-12 20:13:00,2024,6,24,0
169,4681,452,TV,Electronics,2,1602.49,5/4/2024 14:32,6,"Dallas, TX",259,90,268,116,7,51,Male,87321.53,Silver,Cash,True,0,Rainy,True,Saturday,False,181,387,2024-05-04 14:32:00,2024,5,18,0
170,2049,708,Washing Machine,Appliances,3,313.78,8/16/2024 19:29,9,"Dallas, TX",244,145,290,379,10,42,Other,74755.1,Silver,Credit Card,True,0,Rainy,False,Monday,False,460,473,2024-08-16 19:29:00,2024,8,33,0
171,6539,771,Washing Machine,Electronics,4,610.94,5/30/2024 2:24,10,"Chicago, IL",223,146,192,431,2,28,Male,55945.55,Silver,Digital Wallet,False,0,Cloudy,True,Tuesday,True,383,249,2024-05-30 02:24:00,2024,5,22,0
172,1344,124,Laptop,Electronics,2,1469.46,8/4/2024 19:14,7,"Chicago, IL",80,131,289,256,5,59,Female,65556.17,Silver,Cash,True,0,Rainy,True,Tuesday,True,331,369,2024-08-04 19:14:00,2024,8,31,0
173,4770,888,Camera,Appliances,1,123.31,8/7/2024 17:14,10,"Chicago, IL",54,135,194,264,6,64,Other,71207.1,Gold,Digital Wallet,False,0,Sunny,False,Wednesday,False,148,201,2024-08-07 17:14:00,2024,8,32,0
174,4608,412,Smartphone,Electronics,4,972.19,2/5/2024 11:11,7,"Chicago, IL",477,106,167,470,6,35,Other,41100.58,Silver,Debit Card,True,0,Sunny,True,Friday,True,279,440,2024-02-05 11:11:00,2024,2,6,0
175,1117,273,Smartphone,Appliances,1,1430.72,2/3/2024 13:45,11,"Los Angeles, CA",479,111,150,482,10,49,Female,31038.42,Silver,Credit Card,True,0,Cloudy,True,Tuesday,False,410,101,2024-02-03 13:45:00,2024,2,5,0
176,2163,458,Headphones,Electronics,5,1469.45,7/24/2024 7:39,10,"Miami, FL",463,134,277,190,1,56,Male,91524.12,Platinum,Credit Card,True,0,Rainy,True,Saturday,True,476,123,2024-07-24 07:39:00,2024,7,30,0
177,1964,731,Laptop,Appliances,3,307.94,5/9/2024 11:59,20,"Chicago, IL",215,66,171,253,4,66,Other,116021.02,Gold,Cash,True,0,Cloudy,True,Wednesday,False,478,193,2024-05-09 11:59:00,2024,5,19,0
178,4750,941,Washing Machine,Electronics,2,1017.32,4/12/2024 13:50,15,"Los Angeles, CA",491,95,165,110,7,33,Female,34905.07,Gold,Digital Wallet,False,0,Cloudy,True,Sunday,False,277,192,2024-04-12 13:50:00,2024,4,15,0
179,2104,922,Camera,Electronics,5,86.08,1/19/2024 12:48,17,"Los Angeles, CA",146,51,237,380,6,57,Male,23947.58,Platinum,Debit Card,True,BOGO,Rainy,True,Wednesday,False,281,396,2024-01-19 12:48:00,2024,1,3,0
180,1514,552,Camera,Appliances,1,1313.61,1/1/2024 8:40,16,"Miami, FL",287,87,146,364,4,31,Other,90287.74,Silver,Credit Card,False,0,Rainy,True,Thursday,False,231,263,2024-01-01 08:40:00,2024,1,1,0
181,6413,738,TV,Appliances,2,896.94,9/13/2024 0:34,6,"Chicago, IL",125,55,123,323,6,58,Male,42589.54,Platinum,Debit Card,False,Percentage Discount,Sunny,True,Monday,True,347,383,2024-09-13 00:34:00,2024,9,37,0
182,2160,249,Fridge,Appliances,4,1573.93,5/10/2024 14:05,20,"Chicago, IL",376,72,161,468,5,31,Other,69302.3,Gold,Credit Card,True,Percentage Discount,Rainy,False,Friday,True,157,111,2024-05-10 14:05:00,2024,5,19,0
183,9423,551,Fridge,Electronics,5,765.31,5/21/2024 4:08,13,"Chicago, IL",130,92,233,117,3,37,Other,83750.79,Bronze,Cash,True,0,Stormy,True,Saturday,False,348,328,2024-05-21 04:08:00,2024,5,21,0
184,4899,145,Fridge,Electronics,1,375.66,6/27/2024 20:13,12,"Miami, FL",338,138,262,478,4,50,Male,59019.46,Silver,Credit Card,False,0,Sunny,True,Tuesday,False,275,436,2024-06-27 20:13:00,2024,6,26,0
185,5562,937,Headphones,Appliances,4,934.21,2/27/2024 14:54,16,"Los Angeles, CA",69,145,101,412,8,60,Other,26869.44,Silver,Credit Card,False,0,Stormy,True,Wednesday,False,374,262,2024-02-27 14:54:00,2024,2,9,0
186,8953,339,Camera,Appliances,2,318.55,2/6/2024 20:13,4,"Miami, FL",232,118,130,319,3,54,Female,64463.75,Bronze,Digital Wallet,False,Percentage Discount,Stormy,False,Saturday,False,254,241,2024-02-06 20:13:00,2024,2,6,0
187,4510,304,Laptop,Electronics,1,1159.89,8/21/2024 11:45,11,"Los Angeles, CA",356,133,130,445,5,23,Female,45405.78,Bronze,Digital Wallet,True,Percentage Discount,Rainy,True,Sunday,True,436,447,2024-08-21 11:45:00,2024,8,34,0
188,9834,801,Laptop,Electronics,2,54.72,1/21/2024 1:56,13,"Chicago, IL",449,128,180,403,7,36,Female,69737.39,Platinum,Digital Wallet,False,BOGO,Rainy,True,Wednesday,True,325,462,2024-01-21 01:56:00,2024,1,3,0
189,3167,482,Smartphone,Electronics,1,1855.6,8/8/2024 20:50,10,"New York, NY",427,144,265,165,7,21,Female,110989.62,Gold,Credit Card,False,0,Cloudy,False,Sunday,True,125,133,2024-08-08 20:50:00,2024,8,32,0
190,8744,259,Smartphone,Electronics,2,1669.29,3/13/2024 10:32,8,"Los Angeles, CA",456,114,186,262,8,26,Other,79231.86,Silver,Credit Card,True,Percentage Discount,Cloudy,False,Sunday,True,138,127,2024-03-13 10:32:00,2024,3,11,0
191,4981,875,Camera,Electronics,4,76.9,5/7/2024 20:35,17,"Los Angeles, CA",296,120,222,492,7,43,Male,40886.39,Bronze,Debit Card,False,0,Sunny,False,Thursday,True,396,376,2024-05-07 20:35:00,2024,5,19,0
192,8749,845,Fridge,Electronics,5,128.02,4/21/2024 4:50,2,"Dallas, TX",232,58,203,217,3,55,Male,106697.19,Silver,Credit Card,True,BOGO,Cloudy,True,Thursday,False,490,486,2024-04-21 04:50:00,2024,4,16,0
193,7669,973,Fridge,Electronics,3,1427.85,8/25/2024 23:31,6,"Los Angeles, CA",127,53,254,220,3,59,Male,88273.32,Platinum,Credit Card,True,0,Stormy,True,Wednesday,True,350,187,2024-08-25 23:31:00,2024,8,34,0
194,4119,187,TV,Appliances,3,422.28,7/6/2024 20:44,20,"Chicago, IL",27,130,170,308,7,61,Female,110771.56,Gold,Digital Wallet,True,0,Rainy,False,Sunday,True,369,168,2024-07-06 20:44:00,2024,7,27,0
195,2545,215,Fridge,Electronics,2,1041.3,8/17/2024 10:19,19,"Los Angeles, CA",89,119,299,119,8,42,Male,36305.81,Gold,Cash,False,Percentage Discount,Rainy,True,Saturday,True,381,235,2024-08-17 10:19:00,2024,8,33,0
196,2588,857,Tablet,Appliances,5,1965.12,4/20/2024 14:39,2,"Los Angeles, CA",298,90,125,150,7,32,Female,73351.25,Platinum,Digital Wallet,False,Percentage Discount,Rainy,False,Monday,True,153,148,2024-04-20 14:39:00,2024,4,16,0
197,8062,155,Fridge,Appliances,4,1286.87,8/12/2024 9:49,8,"New York, NY",144,91,272,444,2,23,Other,106825.17,Platinum,Cash,True,0,Stormy,False,Tuesday,True,147,100,2024-08-12 09:49:00,2024,8,33,0
198,6804,348,TV,Electronics,2,1598.03,1/1/2024 21:35,9,"Dallas, TX",27,117,194,107,8,38,Male,100867.48,Platinum,Cash,True,Percentage Discount,Cloudy,True,Tuesday,True,116,452,2024-01-01 21:35:00,2024,1,1,0
199,7939,735,Washing Machine,Electronics,1,1890.48,2/9/2024 21:53,18,"Los Angeles, CA",223,107,126,398,5,62,Other,52361.73,Gold,Cash,True,0,Cloudy,True,Tuesday,True,396,157,2024-02-09 21:53:00,2024,2,6,0
200,7735,251,Tablet,Electronics,5,1771.92,6/24/2024 9:50,1,"New York, NY",290,69,153,476,8,40,Female,93687.81,Platinum,Digital Wallet,False,0,Rainy,True,Tuesday,True,113,478,2024-06-24 09:50:00,2024,6,26,0
201,8651,989,Camera,Appliances,2,1601.15,5/21/2024 2:21,10,"Los Angeles, CA",167,77,259,435,10,58,Other,77054.14,Bronze,Digital Wallet,True,BOGO,Sunny,False,Tuesday,False,463,229,2024-05-21 02:21:00,2024,5,21,0
202,1887,952,Washing Machine,Electronics,5,1894.44,6/2/2024 1:43,5,"Dallas, TX",422,93,239,413,1,40,Male,31992.35,Gold,Digital Wallet,False,BOGO,Cloudy,True,Friday,False,407,306,2024-06-02 01:43:00,2024,6,22,0
203,2612,939,Headphones,Appliances,4,1471.41,5/22/2024 19:58,10,"Chicago, IL",244,112,295,394,5,61,Female,47025.32,Platinum,Cash,False,Percentage Discount,Sunny,False,Wednesday,True,106,240,2024-05-22 19:58:00,2024,5,21,0
204,1993,394,Tablet,Appliances,2,601.31,9/12/2024 13:10,16,"Chicago, IL",470,114,192,221,6,51,Male,116942.59,Bronze,Cash,False,0,Stormy,False,Sunday,True,491,95,2024-09-12 13:10:00,2024,9,37,0
205,7596,114,Smartphone,Appliances,3,923.24,7/21/2024 1:20,19,"Dallas, TX",86,87,194,500,6,21,Male,44814.49,Platinum,Digital Wallet,True,0,Stormy,False,Tuesday,True,440,283,2024-07-21 01:20:00,2024,7,29,0
206,6559,451,Tablet,Appliances,2,664.37,5/18/2024 23:50,14,"Miami, FL",176,146,163,138,3,59,Male,112957.4,Bronze,Cash,True,0,Cloudy,True,Friday,False,256,204,2024-05-18 23:50:00,2024,5,20,0
207,2790,810,Smartphone,Appliances,3,997.12,5/25/2024 22:09,2,"New York, NY",85,96,140,402,3,19,Female,48893.13,Gold,Cash,True,BOGO,Cloudy,True,Friday,True,202,239,2024-05-25 22:09:00,2024,5,21,0
208,5073,923,Laptop,Electronics,5,1193.09,5/16/2024 14:05,1,"Miami, FL",341,150,152,150,5,50,Female,74760.35,Bronze,Cash,True,0,Rainy,False,Friday,True,227,403,2024-05-16 14:05:00,2024,5,20,0
209,4139,213,Washing Machine,Appliances,3,253.75,8/19/2024 6:49,2,"Los Angeles, CA",17,110,220,495,3,48,Other,32715.51,Silver,Credit Card,False,Percentage Discount,Cloudy,False,Monday,False,355,358,2024-08-19 06:49:00,2024,8,34,0
210,4116,412,Laptop,Appliances,2,1854.36,3/13/2024 22:30,19,"Miami, FL",80,130,192,461,1,41,Female,48691.07,Silver,Cash,False,Percentage Discount,Stormy,True,Tuesday,False,130,508,2024-03-13 22:30:00,2024,3,11,0
211,9786,560,Smartphone,Electronics,2,1962.83,7/21/2024 20:11,10,"Miami, FL",117,69,103,237,6,49,Male,20227.76,Silver,Digital Wallet,True,0,Rainy,True,Thursday,False,295,415,2024-07-21 20:11:00,2024,7,29,0
212,8350,582,TV,Electronics,2,1413.02,3/2/2024 9:19,1,"Chicago, IL",379,55,229,495,10,67,Male,74056.89,Silver,Cash,True,0,Cloudy,True,Thursday,False,137,415,2024-03-02 09:19:00,2024,3,9,0
213,3296,123,Tablet,Electronics,2,1162.93,3/21/2024 1:03,20,"Los Angeles, CA",408,117,294,130,7,39,Other,49416.81,Gold,Credit Card,True,0,Rainy,False,Wednesday,True,413,399,2024-03-21 01:03:00,2024,3,12,0
214,7912,439,Fridge,Electronics,2,994.59,1/7/2024 1:00,3,"Dallas, TX",396,52,155,113,5,47,Female,95678.61,Platinum,Cash,True,0,Cloudy,False,Tuesday,False,329,116,2024-01-07 01:00:00,2024,1,1,0
215,4006,314,Headphones,Appliances,4,1169.92,2/9/2024 21:17,14,"Miami, FL",490,69,256,404,3,39,Male,93061.53,Silver,Digital Wallet,False,0,Stormy,False,Sunday,False,377,422,2024-02-09 21:17:00,2024,2,6,0
216,5563,857,TV,Electronics,2,1106.28,1/26/2024 20:24,12,"Los Angeles, CA",184,86,226,412,6,24,Other,62618.67,Gold,Cash,False,0,Stormy,True,Sunday,True,328,218,2024-01-26 20:24:00,2024,1,4,0
217,8579,650,TV,Appliances,5,591.7,2/10/2024 18:37,16,"Los Angeles, CA",259,64,162,449,5,62,Female,46314.37,Gold,Cash,False,0,Cloudy,True,Friday,False,194,122,2024-02-10 18:37:00,2024,2,6,0
218,5092,316,Headphones,Electronics,2,1994.65,9/16/2024 0:35,8,"New York, NY",317,52,130,358,10,31,Female,31883.62,Bronze,Credit Card,False,0,Sunny,False,Wednesday,True,384,401,2024-09-16 00:35:00,2024,9,38,0
219,2235,308,Tablet,Appliances,5,1589.71,5/18/2024 5:54,16,"Dallas, TX",105,86,218,158,8,25,Female,114237.5,Bronze,Cash,True,0,Sunny,False,Saturday,False,454,110,2024-05-18 05:54:00,2024,5,20,0
220,8260,659,Washing Machine,Appliances,5,552.49,4/4/2024 4:09,14,"Chicago, IL",232,60,181,184,9,50,Other,50025.35,Silver,Debit Card,False,0,Stormy,False,Sunday,False,188,459,2024-04-04 04:09:00,2024,4,14,0
221,2604,635,Laptop,Electronics,5,1832.09,4/25/2024 11:47,5,"Los Angeles, CA",236,97,142,468,1,66,Female,35420.81,Gold,Credit Card,True,0,Stormy,False,Wednesday,True,429,161,2024-04-25 11:47:00,2024,4,17,0
222,1828,868,Camera,Electronics,2,1036.87,3/24/2024 6:44,10,"Los Angeles, CA",393,57,181,419,7,32,Male,94646.18,Gold,Cash,True,Percentage Discount,Cloudy,False,Sunday,False,149,275,2024-03-24 06:44:00,2024,3,12,0
223,9856,364,Laptop,Electronics,1,117.04,7/16/2024 20:53,6,"Miami, FL",57,109,138,331,5,65,Male,108563.87,Bronze,Cash,True,0,Stormy,True,Friday,False,333,137,2024-07-16 20:53:00,2024,7,29,0
224,1241,661,Smartphone,Appliances,3,1493.18,1/10/2024 13:48,13,"New York, NY",82,144,274,462,4,64,Other,24980.69,Bronze,Cash,True,0,Sunny,False,Saturday,True,247,141,2024-01-10 13:48:00,2024,1,2,0
225,2528,594,Camera,Electronics,3,1783.05,6/26/2024 10:40,13,"Chicago, IL",191,147,283,156,8,53,Female,106667.98,Silver,Debit Card,False,BOGO,Sunny,False,Sunday,False,348,380,2024-06-26 10:40:00,2024,6,26,0
226,4872,737,Fridge,Electronics,4,1637.04,7/14/2024 10:35,5,"Miami, FL",279,88,156,400,2,26,Female,58170.28,Gold,Debit Card,False,0,Stormy,False,Monday,False,346,96,2024-07-14 10:35:00,2024,7,28,0
227,3724,847,Fridge,Electronics,2,77.7,8/7/2024 10:32,5,"New York, NY",92,124,137,169,10,30,Other,39210.51,Bronze,Credit Card,True,0,Cloudy,False,Monday,True,417,162,2024-08-07 10:32:00,2024,8,32,0
228,7658,244,Smartphone,Appliances,3,600.09,7/6/2024 0:29,12,"Los Angeles, CA",274,81,171,438,7,49,Female,98119.81,Bronze,Digital Wallet,True,Percentage Discount,Cloudy,True,Wednesday,False,221,241,2024-07-06 00:29:00,2024,7,27,0
229,8956,811,Tablet,Appliances,2,1419.29,3/21/2024 4:05,9,"Dallas, TX",135,64,160,458,1,21,Other,53195.81,Silver,Debit Card,True,0,Rainy,True,Monday,False,461,232,2024-03-21 04:05:00,2024,3,12,0
230,8886,815,Smartphone,Appliances,2,1340.59,1/20/2024 6:23,20,"Miami, FL",271,101,164,429,4,60,Male,68578.0,Platinum,Digital Wallet,True,0,Rainy,False,Wednesday,False,213,130,2024-01-20 06:23:00,2024,1,3,0
231,4502,784,Fridge,Appliances,2,328.7,9/10/2024 6:31,5,"Dallas, TX",392,98,278,194,5,65,Female,88290.41,Silver,Digital Wallet,False,BOGO,Stormy,False,Tuesday,False,301,186,2024-09-10 06:31:00,2024,9,37,0
232,7570,118,Washing Machine,Electronics,4,863.04,9/6/2024 21:20,2,"Dallas, TX",286,51,137,364,9,52,Female,30091.28,Silver,Debit Card,True,0,Sunny,False,Saturday,True,326,291,2024-09-06 21:20:00,2024,9,36,0
233,1960,485,Tablet,Electronics,4,1751.17,2/6/2024 0:32,8,"Miami, FL",308,116,124,366,10,35,Female,115634.82,Bronze,Cash,False,0,Sunny,True,Thursday,True,320,451,2024-02-06 00:32:00,2024,2,6,0
234,3697,696,Fridge,Appliances,1,628.37,4/25/2024 12:48,14,"Los Angeles, CA",457,135,289,329,8,35,Female,115713.39,Silver,Credit Card,False,BOGO,Cloudy,False,Sunday,True,145,131,2024-04-25 12:48:00,2024,4,17,0
235,7209,779,TV,Appliances,5,298.74,8/6/2024 21:46,20,"Chicago, IL",43,65,152,256,4,34,Other,72918.11,Silver,Credit Card,True,BOGO,Sunny,True,Friday,False,156,305,2024-08-06 21:46:00,2024,8,32,0
236,1035,639,Smartphone,Electronics,3,1503.34,7/21/2024 20:04,8,"Miami, FL",302,104,245,475,2,42,Female,20099.92,Bronze,Credit Card,False,0,Cloudy,False,Sunday,False,447,329,2024-07-21 20:04:00,2024,7,29,0
237,7396,144,TV,Appliances,1,1951.95,9/2/2024 5:58,2,"Dallas, TX",342,148,189,139,2,52,Other,62802.8,Bronze,Credit Card,True,BOGO,Cloudy,True,Wednesday,True,355,160,2024-09-02 05:58:00,2024,9,36,0
238,5345,361,Headphones,Electronics,4,551.66,9/8/2024 18:05,20,"Dallas, TX",455,137,289,271,7,58,Other,77281.19,Platinum,Debit Card,True,Percentage Discount,Sunny,False,Wednesday,True,400,310,2024-09-08 18:05:00,2024,9,36,0
239,8454,274,Fridge,Appliances,4,792.96,8/22/2024 19:49,3,"Miami, FL",423,64,223,463,1,38,Male,72058.2,Silver,Credit Card,True,0,Sunny,True,Friday,False,456,358,2024-08-22 19:49:00,2024,8,34,0
240,5673,161,Washing Machine,Appliances,1,304.99,5/22/2024 2:02,9,"New York, NY",367,61,247,402,2,19,Female,53231.91,Silver,Debit Card,False,BOGO,Cloudy,False,Wednesday,False,314,424,2024-05-22 02:02:00,2024,5,21,0
241,7930,390,Smartphone,Appliances,1,356.05,2/5/2024 3:34,2,"Dallas, TX",301,93,210,231,6,24,Other,54720.84,Silver,Debit Card,False,BOGO,Sunny,True,Thursday,True,159,334,2024-02-05 03:34:00,2024,2,6,0
242,8973,305,Headphones,Electronics,5,1118.7,7/7/2024 17:51,4,"Chicago, IL",488,131,183,418,7,60,Other,82744.22,Platinum,Debit Card,False,0,Stormy,False,Sunday,False,308,330,2024-07-07 17:51:00,2024,7,27,0
243,3536,908,TV,Appliances,4,1422.58,1/25/2024 18:04,11,"Miami, FL",491,96,211,176,6,30,Other,109700.76,Bronze,Debit Card,True,BOGO,Stormy,True,Monday,False,461,183,2024-01-25 18:04:00,2024,1,4,0
244,4111,813,Washing Machine,Electronics,1,1767.01,5/8/2024 0:59,5,"Chicago, IL",153,130,142,282,4,58,Other,86032.59,Platinum,Digital Wallet,True,BOGO,Cloudy,True,Thursday,True,471,90,2024-05-08 00:59:00,2024,5,19,0
245,5861,732,Headphones,Electronics,5,1620.88,7/6/2024 12:16,15,"Los Angeles, CA",425,98,241,235,10,52,Female,38089.19,Platinum,Digital Wallet,False,0,Stormy,False,Thursday,True,326,475,2024-07-06 12:16:00,2024,7,27,0
246,4566,377,TV,Electronics,2,195.53,6/19/2024 20:12,8,"Miami, FL",308,105,101,425,10,23,Male,111420.27,Platinum,Cash,True,BOGO,Stormy,False,Wednesday,True,320,426,2024-06-19 20:12:00,2024,6,25,0
247,1958,154,Laptop,Appliances,4,1740.7,3/17/2024 0:39,4,"New York, NY",183,61,225,198,6,33,Other,58896.99,Platinum,Cash,True,0,Sunny,False,Sunday,False,292,343,2024-03-17 00:39:00,2024,3,11,0
248,9883,576,Smartphone,Appliances,5,253.44,1/17/2024 2:24,4,"Los Angeles, CA",487,79,150,252,3,50,Male,43893.25,Silver,Digital Wallet,True,0,Rainy,False,Monday,False,343,456,2024-01-17 02:24:00,2024,1,3,0
249,1998,770,Washing Machine,Electronics,4,1251.04,7/8/2024 9:55,15,"New York, NY",42,132,157,462,2,41,Other,24591.47,Bronze,Cash,False,Percentage Discount,Rainy,False,Monday,True,453,468,2024-07-08 09:55:00,2024,7,28,0
250,6138,108,Tablet,Electronics,1,1146.65,3/30/2024 2:31,6,"Chicago, IL",196,86,195,269,2,63,Male,106639.86,Platinum,Cash,False,Percentage Discount,Cloudy,False,Thursday,False,153,377,2024-03-30 02:31:00,2024,3,13,0
251,1936,168,Fridge,Electronics,5,711.9,1/20/2024 18:19,6,"Dallas, TX",347,52,104,122,6,61,Other,45423.7,Bronze,Digital Wallet,True,0,Stormy,True,Monday,False,282,496,2024-01-20 18:19:00,2024,1,3,0
252,1821,497,TV,Appliances,2,540.38,3/26/2024 9:34,13,"Chicago, IL",371,140,103,176,5,37,Female,61091.13,Platinum,Debit Card,False,BOGO,Stormy,True,Wednesday,True,341,217,2024-03-26 09:34:00,2024,3,13,0
253,8811,776,Camera,Appliances,2,57.96,3/28/2024 9:15,10,"Dallas, TX",170,85,207,307,3,24,Other,70236.31,Gold,Digital Wallet,True,0,Stormy,True,Saturday,True,154,413,2024-03-28 09:15:00,2024,3,13,0
254,9238,377,Washing Machine,Electronics,4,192.81,3/11/2024 8:29,3,"New York, NY",319,106,281,318,5,53,Female,26153.66,Platinum,Cash,False,0,Rainy,True,Friday,True,365,155,2024-03-11 08:29:00,2024,3,11,0
255,9701,778,Washing Machine,Appliances,1,1385.86,2/25/2024 1:41,9,"Los Angeles, CA",298,134,166,233,1,37,Other,75277.64,Silver,Debit Card,True,0,Stormy,True,Tuesday,False,335,238,2024-02-25 01:41:00,2024,2,8,0
256,3579,972,Washing Machine,Appliances,1,902.03,4/27/2024 11:14,16,"New York, NY",34,133,276,430,2,29,Male,114717.79,Platinum,Credit Card,True,0,Sunny,False,Monday,False,161,366,2024-04-27 11:14:00,2024,4,17,0
257,1931,775,Laptop,Electronics,1,1413.07,8/3/2024 14:21,11,"Los Angeles, CA",383,95,183,188,6,57,Female,59638.42,Gold,Credit Card,True,0,Sunny,True,Monday,False,387,201,2024-08-03 14:21:00,2024,8,31,0
258,9320,468,Tablet,Appliances,4,1842.45,6/20/2024 8:28,14,"New York, NY",361,55,297,345,1,32,Other,43541.37,Platinum,Credit Card,False,0,Sunny,True,Friday,True,172,271,2024-06-20 08:28:00,2024,6,25,0
259,2312,985,Headphones,Electronics,1,368.53,3/18/2024 11:22,19,"Chicago, IL",358,55,183,224,5,28,Other,51284.22,Bronze,Credit Card,True,0,Stormy,False,Saturday,True,123,299,2024-03-18 11:22:00,2024,3,12,0
260,4044,210,Washing Machine,Appliances,2,1823.76,7/21/2024 11:57,1,"Dallas, TX",298,55,284,372,4,43,Other,55543.93,Silver,Cash,True,0,Rainy,False,Friday,True,162,504,2024-07-21 11:57:00,2024,7,29,0
261,2122,119,Camera,Appliances,4,1642.41,8/6/2024 20:09,1,"Dallas, TX",141,89,233,463,8,65,Other,102411.14,Gold,Cash,True,0,Rainy,False,Monday,False,326,148,2024-08-06 20:09:00,2024,8,32,0
262,2113,399,Headphones,Electronics,1,1945.73,1/25/2024 7:20,3,"Los Angeles, CA",160,92,111,321,10,35,Female,43718.21,Bronze,Debit Card,False,0,Rainy,False,Monday,False,373,141,2024-01-25 07:20:00,2024,1,4,0
263,4853,988,Fridge,Appliances,3,1421.24,9/8/2024 8:45,17,"New York, NY",428,120,178,420,1,38,Other,50797.43,Bronze,Credit Card,True,Percentage Discount,Stormy,True,Monday,True,362,288,2024-09-08 08:45:00,2024,9,36,0
264,7615,764,Smartphone,Electronics,5,643.16,9/12/2024 0:32,9,"Los Angeles, CA",418,88,300,404,9,47,Male,23016.09,Bronze,Cash,False,Percentage Discount,Rainy,True,Monday,True,219,460,2024-09-12 00:32:00,2024,9,37,0
265,2964,495,Fridge,Appliances,2,1020.53,5/9/2024 7:56,5,"New York, NY",201,54,232,301,7,20,Other,65778.27,Silver,Debit Card,False,0,Cloudy,False,Saturday,True,348,443,2024-05-09 07:56:00,2024,5,19,0
266,5033,336,TV,Appliances,5,386.62,3/22/2024 8:59,20,"New York, NY",336,132,143,323,9,22,Other,56278.71,Gold,Cash,False,0,Rainy,True,Saturday,True,272,411,2024-03-22 08:59:00,2024,3,12,0
267,1651,489,Smartphone,Electronics,5,1784.53,7/29/2024 20:31,8,"Dallas, TX",150,120,256,242,1,48,Other,83446.58,Silver,Debit Card,True,0,Stormy,True,Thursday,False,380,152,2024-07-29 20:31:00,2024,7,31,0
268,2343,620,Fridge,Electronics,2,1292.1,8/12/2024 16:27,7,"Chicago, IL",152,125,174,380,9,69,Male,87655.27,Silver,Digital Wallet,True,0,Stormy,False,Tuesday,True,350,320,2024-08-12 16:27:00,2024,8,33,0
269,7868,826,Washing Machine,Electronics,1,714.97,1/30/2024 9:35,11,"Los Angeles, CA",221,67,110,132,9,46,Female,32447.93,Gold,Credit Card,True,0,Rainy,False,Sunday,False,267,203,2024-01-30 09:35:00,2024,1,5,0
270,9565,201,Fridge,Appliances,4,1444.51,7/24/2024 14:30,20,"Miami, FL",128,66,221,142,4,33,Other,47593.1,Bronze,Debit Card,False,BOGO,Sunny,True,Sunday,False,254,209,2024-07-24 14:30:00,2024,7,30,0
271,6183,423,Smartphone,Appliances,4,1505.72,5/6/2024 16:04,17,"Dallas, TX",392,130,273,119,6,32,Female,108535.45,Silver,Credit Card,False,0,Stormy,True,Wednesday,True,260,421,2024-05-06 16:04:00,2024,5,19,0
272,5272,596,Tablet,Appliances,3,1407.36,1/29/2024 14:14,9,"Miami, FL",164,111,238,271,9,49,Female,78947.85,Silver,Digital Wallet,False,0,Sunny,False,Monday,True,402,352,2024-01-29 14:14:00,2024,1,5,0
273,4346,987,Fridge,Appliances,5,175.22,3/28/2024 14:18,15,"Chicago, IL",73,52,140,135,6,60,Male,22056.86,Platinum,Credit Card,True,Percentage Discount,Sunny,True,Monday,True,292,329,2024-03-28 14:18:00,2024,3,13,0
274,6147,711,Laptop,Appliances,3,1051.11,6/3/2024 0:23,10,"Miami, FL",121,101,232,492,6,20,Other,82969.26,Gold,Cash,False,0,Rainy,True,Saturday,False,143,443,2024-06-03 00:23:00,2024,6,23,0
275,4910,644,TV,Electronics,4,1027.31,2/21/2024 2:05,6,"Chicago, IL",422,123,197,187,9,22,Male,62781.5,Silver,Cash,False,0,Sunny,False,Sunday,True,446,136,2024-02-21 02:05:00,2024,2,8,0
276,5351,190,Smartphone,Appliances,4,325.62,5/22/2024 15:14,6,"Dallas, TX",299,129,147,389,4,21,Female,44463.72,Silver,Digital Wallet,True,0,Stormy,False,Friday,False,388,379,2024-05-22 15:14:00,2024,5,21,0
277,7484,290,Headphones,Appliances,2,1932.12,7/13/2024 20:16,19,"Dallas, TX",3,137,193,427,7,45,Female,74393.35,Platinum,Credit Card,False,0,Stormy,False,Monday,True,124,151,2024-07-13 20:16:00,2024,7,28,0
278,3144,303,Headphones,Electronics,3,449.81,7/5/2024 22:07,18,"Los Angeles, CA",15,54,288,473,5,41,Male,49914.72,Gold,Credit Card,True,0,Sunny,True,Thursday,True,180,354,2024-07-05 22:07:00,2024,7,27,0
279,5915,612,Tablet,Appliances,4,1075.43,7/26/2024 5:15,8,"Chicago, IL",132,133,188,169,6,30,Female,35459.42,Platinum,Debit Card,False,0,Rainy,True,Thursday,True,186,482,2024-07-26 05:15:00,2024,7,30,0
280,8491,568,TV,Electronics,3,1114.77,4/21/2024 16:41,11,"Chicago, IL",37,99,233,457,5,43,Female,30261.81,Silver,Cash,True,0,Rainy,True,Thursday,False,353,212,2024-04-21 16:41:00,2024,4,16,0
281,6180,674,Washing Machine,Electronics,2,992.0,6/25/2024 15:46,20,"Los Angeles, CA",495,89,212,339,9,20,Male,22882.77,Silver,Debit Card,True,0,Rainy,False,Sunday,True,406,349,2024-06-25 15:46:00,2024,6,26,0
282,2188,829,Fridge,Electronics,2,693.16,3/23/2024 22:16,14,"Chicago, IL",189,127,291,175,8,40,Male,54582.67,Bronze,Digital Wallet,False,0,Rainy,True,Sunday,True,225,328,2024-03-23 22:16:00,2024,3,12,0
283,1152,122,Tablet,Electronics,2,1115.98,2/20/2024 16:11,14,"Los Angeles, CA",86,89,146,238,6,36,Other,95234.7,Bronze,Digital Wallet,True,BOGO,Sunny,False,Thursday,False,252,371,2024-02-20 16:11:00,2024,2,8,0
284,8508,140,Camera,Appliances,2,1703.25,7/5/2024 18:18,16,"Chicago, IL",155,129,247,196,10,68,Female,71955.25,Silver,Debit Card,True,0,Stormy,True,Monday,True,461,214,2024-07-05 18:18:00,2024,7,27,0
285,2638,353,Tablet,Appliances,2,181.42,4/4/2024 11:53,16,"Chicago, IL",446,80,148,109,8,64,Female,82805.84,Bronze,Cash,True,0,Cloudy,True,Tuesday,False,317,186,2024-04-04 11:53:00,2024,4,14,0
286,2200,642,Tablet,Electronics,2,1068.21,8/30/2024 15:58,3,"New York, NY",79,92,287,476,10,70,Female,103382.84,Platinum,Debit Card,True,0,Cloudy,True,Monday,False,341,177,2024-08-30 15:58:00,2024,8,35,0
287,9808,412,Camera,Appliances,2,799.62,4/25/2024 9:49,12,"Dallas, TX",500,105,291,318,10,54,Male,97877.09,Gold,Cash,True,Percentage Discount,Stormy,True,Saturday,False,254,313,2024-04-25 09:49:00,2024,4,17,0
288,4492,441,Fridge,Appliances,5,200.22,9/16/2024 3:20,8,"Dallas, TX",448,133,215,352,8,49,Male,48771.41,Silver,Digital Wallet,False,Percentage Discount,Cloudy,False,Saturday,True,366,351,2024-09-16 03:20:00,2024,9,38,0
289,9288,601,Washing Machine,Appliances,1,1476.01,4/22/2024 22:31,20,"Dallas, TX",449,94,105,341,5,23,Female,22630.66,Silver,Cash,False,0,Sunny,True,Tuesday,True,454,333,2024-04-22 22:31:00,2024,4,17,0
290,5345,502,Smartphone,Electronics,1,1410.92,5/4/2024 22:18,1,"Chicago, IL",437,144,296,354,3,29,Female,55948.7,Silver,Credit Card,False,0,Stormy,True,Monday,True,371,458,2024-05-04 22:18:00,2024,5,18,0
291,3170,862,Headphones,Appliances,5,548.06,5/22/2024 18:38,6,"Dallas, TX",377,139,209,416,6,48,Other,110677.56,Silver,Cash,True,0,Sunny,False,Thursday,True,267,299,2024-05-22 18:38:00,2024,5,21,0
292,6718,260,TV,Appliances,3,1302.75,5/2/2024 23:28,6,"Miami, FL",269,133,292,364,5,54,Other,83469.4,Platinum,Digital Wallet,False,0,Cloudy,True,Tuesday,False,158,500,2024-05-02 23:28:00,2024,5,18,0
293,2127,118,Laptop,Appliances,3,831.59,6/24/2024 4:55,14,"Miami, FL",192,114,140,219,3,32,Other,41295.66,Bronze,Cash,True,0,Sunny,True,Friday,True,378,199,2024-06-24 04:55:00,2024,6,26,0
294,5002,455,Washing Machine,Appliances,2,961.7,4/19/2024 20:20,6,"Chicago, IL",253,55,261,439,10,23,Male,82022.89,Bronze,Debit Card,False,BOGO,Rainy,False,Monday,False,361,320,2024-04-19 20:20:00,2024,4,16,0
295,7054,800,Laptop,Appliances,3,1960.11,7/30/2024 7:56,10,"Los Angeles, CA",275,136,263,297,1,58,Other,61080.97,Platinum,Credit Card,False,0,Sunny,False,Friday,False,279,328,2024-07-30 07:56:00,2024,7,31,0
296,5669,460,Tablet,Appliances,5,1218.94,3/12/2024 21:25,15,"New York, NY",187,78,192,333,5,20,Other,63702.21,Platinum,Cash,False,0,Stormy,True,Wednesday,True,144,212,2024-03-12 21:25:00,2024,3,11,0
297,3584,463,Washing Machine,Appliances,5,1946.31,6/14/2024 6:41,8,"Los Angeles, CA",169,150,229,334,4,52,Female,112477.58,Gold,Debit Card,False,0,Sunny,False,Thursday,True,196,119,2024-06-14 06:41:00,2024,6,24,0
298,8179,740,Fridge,Electronics,2,1938.65,2/7/2024 21:38,13,"Miami, FL",130,133,218,359,7,27,Other,50989.92,Bronze,Cash,True,BOGO,Cloudy,False,Monday,False,296,293,2024-02-07 21:38:00,2024,2,6,0
299,9900,409,Camera,Appliances,2,813.26,7/3/2024 6:04,11,"Dallas, TX",252,100,285,134,9,42,Female,32428.51,Bronze,Cash,True,Percentage Discount,Stormy,False,Monday,False,213,106,2024-07-03 06:04:00,2024,7,27,0
300,5956,341,Fridge,Appliances,2,1518.42,5/25/2024 21:05,1,"New York, NY",455,77,155,105,3,28,Male,57595.31,Gold,Cash,False,0,Sunny,True,Saturday,False,315,467,2024-05-25 21:05:00,2024,5,21,0
301,9666,613,TV,Electronics,3,682.91,5/25/2024 13:49,2,"Miami, FL",4,121,197,352,8,59,Male,25386.35,Bronze,Debit Card,True,BOGO,Sunny,True,Monday,True,182,189,2024-05-25 13:49:00,2024,5,21,0
302,1128,382,Fridge,Appliances,4,885.34,4/17/2024 3:36,7,"Los Angeles, CA",403,77,104,101,6,59,Female,94243.61,Platinum,Cash,False,0,Sunny,True,Wednesday,False,139,292,2024-04-17 03:36:00,2024,4,16,0
303,5905,931,Laptop,Appliances,1,915.45,4/1/2024 3:05,5,"New York, NY",35,101,234,361,7,48,Other,69297.55,Gold,Debit Card,False,0,Cloudy,True,Wednesday,True,209,447,2024-04-01 03:05:00,2024,4,14,0
304,2697,163,Laptop,Appliances,4,575.21,6/8/2024 4:58,20,"New York, NY",257,87,115,453,9,47,Other,116334.25,Gold,Cash,False,Percentage Discount,Stormy,False,Saturday,False,351,150,2024-06-08 04:58:00,2024,6,23,0
305,3200,740,Headphones,Electronics,2,1561.34,2/6/2024 13:01,19,"New York, NY",301,112,194,168,5,38,Other,104977.68,Platinum,Debit Card,False,BOGO,Rainy,False,Thursday,False,416,337,2024-02-06 13:01:00,2024,2,6,0
306,5333,363,Tablet,Appliances,5,804.3,3/27/2024 0:02,1,"New York, NY",240,67,190,228,10,44,Male,77499.14,Gold,Credit Card,False,0,Cloudy,False,Monday,True,301,378,2024-03-27 00:02:00,2024,3,13,0
307,2891,999,Smartphone,Electronics,3,1773.01,8/15/2024 17:08,19,"Dallas, TX",390,71,237,127,8,67,Male,46094.6,Silver,Cash,False,0,Cloudy,False,Monday,True,412,157,2024-08-15 17:08:00,2024,8,33,0
308,2753,496,Camera,Appliances,2,1106.07,4/29/2024 18:12,2,"Chicago, IL",249,88,134,357,9,64,Female,53642.89,Silver,Cash,False,0,Sunny,True,Thursday,True,203,355,2024-04-29 18:12:00,2024,4,18,0
309,3546,934,Washing Machine,Electronics,3,1943.58,1/17/2024 14:40,2,"Chicago, IL",306,96,273,412,6,56,Male,49577.45,Platinum,Digital Wallet,False,0,Sunny,False,Sunday,False,151,305,2024-01-17 14:40:00,2024,1,3,0
310,5462,130,Washing Machine,Electronics,1,1719.82,4/1/2024 15:37,14,"New York, NY",351,91,134,214,1,56,Other,61627.13,Gold,Credit Card,True,BOGO,Sunny,False,Sunday,True,149,94,2024-04-01 15:37:00,2024,4,14,0
311,5616,668,Washing Machine,Electronics,4,1723.26,5/27/2024 23:21,10,"Chicago, IL",177,148,207,424,8,63,Other,38617.07,Platinum,Credit Card,True,0,Rainy,True,Saturday,True,351,439,2024-05-27 23:21:00,2024,5,22,0
312,4450,386,Tablet,Electronics,2,917.31,8/31/2024 14:26,15,"Miami, FL",391,115,136,283,9,57,Female,42203.45,Silver,Debit Card,True,Percentage Discount,Stormy,False,Friday,True,345,247,2024-08-31 14:26:00,2024,8,35,0
313,6617,330,Tablet,Electronics,4,442.59,3/28/2024 2:03,14,"New York, NY",23,145,293,142,7,65,Male,28062.22,Platinum,Digital Wallet,False,0,Rainy,False,Tuesday,True,201,318,2024-03-28 02:03:00,2024,3,13,0
314,4335,255,TV,Electronics,2,1617.77,8/23/2024 7:44,3,"Miami, FL",63,62,151,466,8,18,Other,118750.33,Bronze,Credit Card,True,0,Sunny,False,Sunday,False,261,328,2024-08-23 07:44:00,2024,8,34,0
315,5325,449,Washing Machine,Electronics,1,148.86,1/15/2024 3:24,10,"Los Angeles, CA",457,112,280,455,3,45,Female,118889.25,Bronze,Credit Card,False,0,Rainy,False,Wednesday,True,275,211,2024-01-15 03:24:00,2024,1,3,0
316,9280,502,Smartphone,Appliances,1,1108.86,4/5/2024 22:06,10,"New York, NY",350,54,270,212,6,62,Male,41161.22,Bronze,Credit Card,False,BOGO,Sunny,True,Sunday,True,277,156,2024-04-05 22:06:00,2024,4,14,0
317,9004,772,Washing Machine,Electronics,5,1169.16,1/12/2024 22:56,5,"Chicago, IL",154,117,121,197,4,19,Male,89805.81,Bronze,Cash,True,0,Sunny,True,Sunday,True,315,338,2024-01-12 22:56:00,2024,1,2,0
318,5114,240,Headphones,Electronics,1,324.38,8/9/2024 0:06,15,"Los Angeles, CA",192,143,204,480,1,37,Other,88610.3,Gold,Cash,True,0,Cloudy,True,Tuesday,False,218,452,2024-08-09 00:06:00,2024,8,32,0
319,1832,189,Smartphone,Electronics,3,213.16,7/22/2024 5:47,17,"Miami, FL",231,78,217,490,9,25,Male,91842.84,Platinum,Digital Wallet,False,Percentage Discount,Sunny,False,Monday,False,294,269,2024-07-22 05:47:00,2024,7,30,0
320,2512,847,Smartphone,Electronics,4,831.51,7/9/2024 12:29,16,"Los Angeles, CA",480,80,195,149,2,50,Female,75531.43,Bronze,Credit Card,True,0,Stormy,False,Tuesday,True,391,182,2024-07-09 12:29:00,2024,7,28,0
321,7939,491,Laptop,Electronics,4,64.45,9/2/2024 17:20,8,"Miami, FL",22,94,105,281,6,45,Other,31754.23,Silver,Debit Card,False,BOGO,Sunny,True,Monday,False,206,358,2024-09-02 17:20:00,2024,9,36,0
322,5533,633,Tablet,Electronics,3,866.45,5/14/2024 3:41,11,"Chicago, IL",383,58,116,332,9,57,Male,116422.23,Silver,Digital Wallet,False,0,Cloudy,False,Saturday,True,231,413,2024-05-14 03:41:00,2024,5,20,0
323,1722,794,Smartphone,Electronics,1,744.84,1/13/2024 15:04,11,"Chicago, IL",477,150,121,395,1,70,Other,24069.22,Silver,Debit Card,False,BOGO,Stormy,True,Friday,True,346,462,2024-01-13 15:04:00,2024,1,2,0
324,1058,727,Headphones,Appliances,2,671.38,9/7/2024 21:36,9,"Miami, FL",315,147,194,191,9,42,Male,74270.48,Platinum,Debit Card,True,0,Sunny,False,Thursday,True,461,354,2024-09-07 21:36:00,2024,9,36,0
325,6464,993,Tablet,Electronics,1,926.76,1/25/2024 10:53,2,"Chicago, IL",347,148,150,128,7,18,Female,67128.74,Bronze,Digital Wallet,False,0,Sunny,False,Sunday,True,392,169,2024-01-25 10:53:00,2024,1,4,0
326,3143,740,Fridge,Electronics,4,1037.81,6/21/2024 11:56,10,"Dallas, TX",385,87,134,387,8,57,Female,112864.42,Bronze,Debit Card,True,BOGO,Stormy,True,Saturday,True,445,485,2024-06-21 11:56:00,2024,6,25,0
327,5291,802,Smartphone,Appliances,3,1904.61,4/14/2024 0:24,6,"Miami, FL",116,132,262,192,9,41,Male,116683.06,Gold,Digital Wallet,True,0,Stormy,False,Monday,True,236,95,2024-04-14 00:24:00,2024,4,15,0
328,3647,332,Tablet,Appliances,2,694.56,1/11/2024 23:32,8,"Dallas, TX",216,135,215,443,10,42,Other,111545.68,Silver,Digital Wallet,True,BOGO,Cloudy,False,Sunday,True,228,393,2024-01-11 23:32:00,2024,1,2,0
329,8239,527,Laptop,Electronics,5,1347.74,4/24/2024 21:21,4,"Dallas, TX",250,73,291,227,5,43,Female,22609.52,Bronze,Credit Card,False,BOGO,Rainy,True,Monday,False,125,266,2024-04-24 21:21:00,2024,4,17,0
330,8007,346,Headphones,Electronics,3,1069.34,3/12/2024 6:28,13,"New York, NY",73,83,106,321,6,24,Male,23361.28,Silver,Debit Card,False,0,Rainy,True,Friday,True,459,117,2024-03-12 06:28:00,2024,3,11,0
331,1158,686,Smartphone,Electronics,1,827.26,7/2/2024 12:50,20,"Chicago, IL",388,84,298,297,2,23,Male,64614.0,Gold,Credit Card,False,0,Stormy,True,Saturday,False,199,407,2024-07-02 12:50:00,2024,7,27,0
332,2832,256,Washing Machine,Electronics,5,689.17,8/10/2024 23:39,16,"New York, NY",328,132,155,142,2,70,Female,69946.68,Platinum,Cash,False,0,Rainy,True,Thursday,True,205,328,2024-08-10 23:39:00,2024,8,32,0
333,2232,536,Camera,Electronics,3,1529.37,3/6/2024 0:36,20,"Los Angeles, CA",487,131,176,463,10,65,Male,115675.81,Silver,Credit Card,True,BOGO,Sunny,True,Saturday,False,224,246,2024-03-06 00:36:00,2024,3,10,0
334,3442,419,Smartphone,Electronics,2,1782.51,2/19/2024 18:35,5,"Los Angeles, CA",175,150,296,298,4,53,Female,80139.34,Bronze,Cash,False,0,Cloudy,False,Sunday,True,313,393,2024-02-19 18:35:00,2024,2,8,0
335,9938,719,TV,Electronics,1,736.53,8/4/2024 3:43,2,"Dallas, TX",462,128,124,429,3,29,Other,102177.08,Bronze,Cash,True,0,Rainy,False,Tuesday,False,332,402,2024-08-04 03:43:00,2024,8,31,0
336,1590,437,Laptop,Electronics,1,1982.84,1/21/2024 10:31,14,"Los Angeles, CA",22,130,173,183,5,53,Male,29406.46,Gold,Cash,True,0,Cloudy,False,Friday,True,120,446,2024-01-21 10:31:00,2024,1,3,0
337,7049,559,TV,Electronics,2,385.69,4/27/2024 22:48,15,"Chicago, IL",380,140,213,108,7,54,Male,77136.61,Silver,Digital Wallet,True,Percentage Discount,Rainy,True,Monday,True,186,92,2024-04-27 22:48:00,2024,4,17,0
338,3426,655,Washing Machine,Electronics,4,967.01,8/1/2024 22:12,12,"Los Angeles, CA",65,102,222,142,8,26,Female,60294.6,Silver,Digital Wallet,True,0,Rainy,False,Monday,True,297,259,2024-08-01 22:12:00,2024,8,31,0
339,8041,234,Laptop,Appliances,2,585.46,4/7/2024 6:20,9,"Los Angeles, CA",464,101,186,328,2,23,Other,97493.09,Bronze,Cash,False,0,Rainy,True,Friday,True,152,349,2024-04-07 06:20:00,2024,4,14,0
340,3088,311,Tablet,Electronics,4,63.35,5/24/2024 8:01,19,"Chicago, IL",257,139,293,177,10,63,Female,65288.5,Silver,Cash,False,0,Cloudy,False,Friday,True,458,111,2024-05-24 08:01:00,2024,5,21,0
341,1685,768,Fridge,Electronics,1,803.51,4/1/2024 11:18,8,"Miami, FL",357,81,197,401,10,19,Female,21085.85,Bronze,Credit Card,False,0,Cloudy,False,Friday,True,203,380,2024-04-01 11:18:00,2024,4,14,0
342,6050,241,Headphones,Electronics,5,920.5,8/19/2024 18:40,20,"Miami, FL",14,135,278,266,10,48,Other,112509.32,Gold,Cash,False,0,Rainy,False,Thursday,False,355,375,2024-08-19 18:40:00,2024,8,34,0
343,6974,694,Washing Machine,Electronics,3,1065.99,4/5/2024 6:10,7,"Dallas, TX",29,127,239,475,3,38,Male,106220.95,Gold,Digital Wallet,True,BOGO,Cloudy,True,Friday,False,302,411,2024-04-05 06:10:00,2024,4,14,0
344,1653,654,Laptop,Appliances,4,1628.13,8/17/2024 8:53,10,"Los Angeles, CA",408,54,230,159,8,50,Female,114144.79,Silver,Cash,False,BOGO,Sunny,True,Saturday,False,134,330,2024-08-17 08:53:00,2024,8,33,0
345,6862,800,Laptop,Appliances,2,1626.3,1/20/2024 5:02,8,"New York, NY",353,148,278,447,6,45,Female,70933.93,Silver,Cash,True,0,Cloudy,False,Sunday,True,131,120,2024-01-20 05:02:00,2024,1,3,0
346,4441,919,Laptop,Electronics,5,1718.88,2/22/2024 5:23,19,"Los Angeles, CA",158,55,272,171,3,37,Male,70705.68,Silver,Cash,True,Percentage Discount,Rainy,True,Thursday,True,214,415,2024-02-22 05:23:00,2024,2,8,0
347,5088,307,Fridge,Appliances,4,617.78,5/4/2024 4:53,13,"Dallas, TX",341,143,207,295,4,32,Female,113094.12,Platinum,Credit Card,False,0,Cloudy,True,Saturday,True,264,326,2024-05-04 04:53:00,2024,5,18,0
348,2684,983,TV,Electronics,3,162.11,6/22/2024 5:32,19,"Chicago, IL",39,54,154,429,8,41,Male,102283.76,Bronze,Cash,True,0,Sunny,False,Sunday,True,193,486,2024-06-22 05:32:00,2024,6,25,0
349,6794,241,TV,Appliances,4,189.02,2/6/2024 14:36,1,"New York, NY",236,83,288,305,2,53,Female,113813.65,Platinum,Cash,True,BOGO,Sunny,False,Wednesday,False,196,482,2024-02-06 14:36:00,2024,2,6,0
350,7658,416,Camera,Electronics,1,796.1,2/18/2024 22:23,9,"Dallas, TX",247,95,224,129,1,69,Other,63354.16,Bronze,Credit Card,True,0,Rainy,False,Thursday,True,420,394,2024-02-18 22:23:00,2024,2,7,0
351,3532,805,TV,Appliances,3,547.94,2/27/2024 16:56,11,"Chicago, IL",460,77,122,449,1,33,Male,23247.89,Bronze,Credit Card,False,0,Cloudy,True,Tuesday,False,209,125,2024-02-27 16:56:00,2024,2,9,0
352,4878,822,TV,Appliances,3,257.7,8/7/2024 16:22,7,"New York, NY",364,125,160,387,3,19,Other,74292.8,Bronze,Credit Card,True,Percentage Discount,Sunny,True,Friday,True,141,397,2024-08-07 16:22:00,2024,8,32,0
353,3662,636,Tablet,Electronics,4,391.49,1/5/2024 7:48,19,"Chicago, IL",16,140,212,314,10,55,Male,42515.65,Platinum,Digital Wallet,True,0,Stormy,True,Tuesday,True,407,481,2024-01-05 07:48:00,2024,1,1,0
354,3900,238,Laptop,Appliances,1,550.54,9/1/2024 3:39,6,"Miami, FL",424,120,251,400,6,49,Other,73241.62,Silver,Cash,False,0,Cloudy,False,Thursday,False,105,136,2024-09-01 03:39:00,2024,9,35,0
355,7755,540,Fridge,Electronics,3,639.95,8/2/2024 10:07,12,"Chicago, IL",325,52,250,316,10,38,Female,86383.31,Silver,Digital Wallet,True,0,Rainy,True,Tuesday,True,352,480,2024-08-02 10:07:00,2024,8,31,0
356,1406,888,Laptop,Electronics,3,183.99,5/4/2024 9:58,6,"Los Angeles, CA",253,84,237,497,7,32,Other,69038.02,Silver,Debit Card,True,BOGO,Stormy,False,Tuesday,False,458,411,2024-05-04 09:58:00,2024,5,18,0
357,3938,248,Laptop,Electronics,3,1048.97,3/29/2024 13:20,17,"Chicago, IL",123,139,220,156,4,30,Female,98849.01,Bronze,Credit Card,False,Percentage Discount,Sunny,False,Sunday,False,188,272,2024-03-29 13:20:00,2024,3,13,0
358,6442,771,Camera,Electronics,5,1242.66,6/17/2024 13:30,16,"Chicago, IL",138,142,102,144,6,62,Male,80636.41,Silver,Cash,False,0,Stormy,True,Thursday,False,402,473,2024-06-17 13:30:00,2024,6,25,0
359,7745,678,TV,Electronics,1,1869.26,8/23/2024 12:49,18,"New York, NY",358,120,234,110,2,42,Other,24458.96,Bronze,Credit Card,True,0,Stormy,True,Friday,False,339,359,2024-08-23 12:49:00,2024,8,34,0
360,5065,261,Tablet,Appliances,2,59.63,4/23/2024 0:05,8,"Chicago, IL",435,147,107,383,9,30,Other,104473.09,Bronze,Cash,False,0,Cloudy,False,Saturday,True,100,373,2024-04-23 00:05:00,2024,4,17,0
361,5371,425,TV,Electronics,1,1613.27,3/24/2024 4:06,11,"New York, NY",216,119,276,238,8,25,Male,46944.25,Bronze,Cash,True,0,Cloudy,True,Wednesday,True,159,201,2024-03-24 04:06:00,2024,3,12,0
362,3608,169,Tablet,Electronics,3,1674.72,7/20/2024 5:04,15,"Miami, FL",21,144,185,100,6,34,Other,55993.41,Gold,Credit Card,False,0,Rainy,True,Wednesday,False,116,220,2024-07-20 05:04:00,2024,7,29,0
363,2771,670,Smartphone,Electronics,1,443.1,8/27/2024 17:54,7,"New York, NY",344,103,163,444,8,55,Male,39924.06,Bronze,Digital Wallet,True,0,Sunny,False,Wednesday,False,227,273,2024-08-27 17:54:00,2024,8,35,0
364,7267,645,Smartphone,Electronics,4,842.74,5/9/2024 9:36,8,"Dallas, TX",127,113,229,222,1,26,Other,79592.57,Bronze,Debit Card,True,0,Sunny,False,Saturday,False,492,183,2024-05-09 09:36:00,2024,5,19,0
365,1634,836,Laptop,Electronics,3,1092.1,4/12/2024 22:04,17,"Miami, FL",54,130,147,419,6,50,Male,47940.47,Platinum,Cash,False,0,Rainy,True,Saturday,False,440,223,2024-04-12 22:04:00,2024,4,15,0
366,8711,221,Fridge,Electronics,1,880.31,3/26/2024 22:09,4,"Dallas, TX",211,71,238,113,4,58,Male,116305.9,Bronze,Credit Card,True,Percentage Discount,Sunny,False,Friday,False,220,250,2024-03-26 22:09:00,2024,3,13,0
367,4644,288,Tablet,Appliances,1,1049.49,4/29/2024 17:48,8,"Dallas, TX",50,90,249,480,3,55,Female,71666.35,Platinum,Cash,False,BOGO,Stormy,True,Friday,False,363,231,2024-04-29 17:48:00,2024,4,18,0
368,4269,425,Camera,Electronics,5,505.09,7/11/2024 7:30,8,"Chicago, IL",113,63,240,390,1,44,Other,72116.57,Gold,Credit Card,False,0,Rainy,False,Saturday,True,390,298,2024-07-11 07:30:00,2024,7,28,0
369,8541,959,Camera,Electronics,3,670.64,9/13/2024 7:18,1,"New York, NY",339,88,289,192,10,55,Male,67845.38,Platinum,Debit Card,True,0,Stormy,False,Friday,False,255,328,2024-09-13 07:18:00,2024,9,37,0
370,6728,249,TV,Appliances,3,966.41,1/29/2024 21:46,16,"Dallas, TX",152,51,119,437,4,24,Male,44522.13,Bronze,Digital Wallet,False,Percentage Discount,Stormy,False,Friday,False,380,442,2024-01-29 21:46:00,2024,1,5,0
371,6000,844,TV,Appliances,4,131.7,5/24/2024 7:03,8,"Miami, FL",6,137,145,435,7,51,Other,107570.14,Gold,Cash,True,BOGO,Cloudy,True,Sunday,True,111,339,2024-05-24 07:03:00,2024,5,21,0
372,4728,130,Fridge,Appliances,3,173.87,5/19/2024 11:04,9,"New York, NY",382,123,280,443,2,61,Female,44813.85,Silver,Credit Card,True,0,Sunny,False,Sunday,False,221,262,2024-05-19 11:04:00,2024,5,20,0
373,4652,883,Fridge,Appliances,1,88.77,5/6/2024 5:27,11,"Dallas, TX",249,98,138,344,4,43,Male,51655.92,Bronze,Credit Card,False,BOGO,Sunny,False,Tuesday,True,343,166,2024-05-06 05:27:00,2024,5,19,0
374,1387,426,Tablet,Electronics,5,528.04,2/3/2024 3:08,8,"Dallas, TX",300,64,267,300,1,25,Male,41467.3,Platinum,Cash,False,0,Cloudy,True,Thursday,True,200,137,2024-02-03 03:08:00,2024,2,5,0
375,4164,523,TV,Appliances,1,428.27,2/3/2024 5:40,7,"Chicago, IL",316,144,300,347,2,60,Female,68714.59,Platinum,Digital Wallet,False,0,Rainy,True,Wednesday,False,305,97,2024-02-03 05:40:00,2024,2,5,0
376,7528,521,TV,Appliances,5,1769.7,6/7/2024 6:22,2,"Chicago, IL",65,106,298,210,5,48,Female,117961.14,Platinum,Digital Wallet,False,Percentage Discount,Rainy,True,Thursday,False,133,361,2024-06-07 06:22:00,2024,6,23,0
377,6378,410,Tablet,Appliances,4,631.68,2/29/2024 15:59,6,"Los Angeles, CA",410,56,157,487,5,38,Female,92165.87,Platinum,Debit Card,True,0,Cloudy,True,Wednesday,False,102,182,2024-02-29 15:59:00,2024,2,9,0
378,5564,553,Camera,Electronics,5,1876.39,1/7/2024 20:14,8,"Los Angeles, CA",350,122,268,310,7,59,Other,21269.13,Silver,Cash,False,BOGO,Rainy,False,Sunday,True,140,496,2024-01-07 20:14:00,2024,1,1,0
379,2137,863,Camera,Electronics,2,350.07,2/24/2024 1:48,14,"Miami, FL",381,124,256,110,5,43,Male,101915.84,Bronze,Credit Card,True,0,Rainy,False,Sunday,False,379,142,2024-02-24 01:48:00,2024,2,8,0
380,5573,941,Smartphone,Appliances,5,463.71,5/17/2024 17:17,10,"Miami, FL",44,114,199,496,2,52,Male,53625.25,Bronze,Debit Card,False,Percentage Discount,Sunny,False,Friday,True,125,391,2024-05-17 17:17:00,2024,5,20,0
381,6753,752,Laptop,Appliances,3,1303.83,7/5/2024 14:12,4,"Miami, FL",197,107,184,370,10,45,Male,43217.33,Bronze,Credit Card,False,BOGO,Cloudy,True,Saturday,True,159,142,2024-07-05 14:12:00,2024,7,27,0
382,9346,856,Fridge,Electronics,4,168.49,1/2/2024 18:44,6,"Los Angeles, CA",453,76,215,313,8,31,Male,113623.19,Gold,Debit Card,True,0,Rainy,True,Saturday,True,410,234,2024-01-02 18:44:00,2024,1,1,0
383,7548,380,Camera,Electronics,5,138.18,6/10/2024 18:12,5,"New York, NY",137,59,276,217,3,34,Male,72120.57,Gold,Cash,True,0,Rainy,True,Wednesday,False,456,199,2024-06-10 18:12:00,2024,6,24,0
384,9785,255,Laptop,Electronics,4,1402.69,7/21/2024 2:36,10,"Dallas, TX",179,113,291,205,10,38,Male,77105.76,Silver,Cash,False,0,Sunny,False,Sunday,True,317,493,2024-07-21 02:36:00,2024,7,29,0
385,6425,897,Fridge,Electronics,3,1476.08,5/24/2024 2:04,16,"Dallas, TX",246,51,193,211,5,60,Female,35279.11,Bronze,Credit Card,False,0,Sunny,False,Wednesday,True,173,437,2024-05-24 02:04:00,2024,5,21,0
386,1452,292,TV,Appliances,2,1104.09,8/7/2024 4:08,9,"Chicago, IL",165,125,149,398,2,35,Other,21771.3,Gold,Digital Wallet,True,Percentage Discount,Stormy,True,Sunday,False,179,369,2024-08-07 04:08:00,2024,8,32,0
387,2889,209,Washing Machine,Appliances,1,1484.97,7/30/2024 22:12,1,"Chicago, IL",431,114,294,404,1,69,Other,40447.09,Silver,Cash,False,0,Rainy,True,Tuesday,False,309,418,2024-07-30 22:12:00,2024,7,31,0
388,5279,234,TV,Electronics,4,485.51,8/21/2024 12:57,19,"Miami, FL",90,64,265,431,4,55,Other,103993.75,Silver,Debit Card,True,Percentage Discount,Rainy,False,Saturday,False,106,99,2024-08-21 12:57:00,2024,8,34,0
389,3925,289,Tablet,Appliances,1,1967.08,8/28/2024 9:47,18,"Chicago, IL",249,100,224,277,7,42,Other,23529.4,Silver,Digital Wallet,False,BOGO,Sunny,False,Wednesday,True,444,179,2024-08-28 09:47:00,2024,8,35,0
390,5349,126,Headphones,Electronics,2,1564.88,9/3/2024 8:06,12,"New York, NY",176,102,294,122,8,35,Male,21091.14,Platinum,Digital Wallet,True,0,Cloudy,False,Tuesday,False,483,102,2024-09-03 08:06:00,2024,9,36,0
391,1626,880,Camera,Appliances,1,592.06,2/21/2024 21:22,7,"Los Angeles, CA",147,118,199,300,6,60,Female,111284.36,Gold,Cash,True,0,Sunny,True,Monday,False,383,362,2024-02-21 21:22:00,2024,2,8,0
392,2776,726,Laptop,Electronics,3,184.87,6/26/2024 4:36,15,"Miami, FL",331,121,169,300,9,61,Female,80831.71,Silver,Debit Card,False,0,Cloudy,True,Thursday,False,143,405,2024-06-26 04:36:00,2024,6,26,0
393,8119,731,Tablet,Electronics,2,574.77,9/4/2024 11:31,6,"New York, NY",91,63,173,459,1,28,Other,57962.56,Silver,Cash,False,0,Stormy,False,Tuesday,True,459,483,2024-09-04 11:31:00,2024,9,36,0
394,6663,373,TV,Appliances,4,1177.85,9/8/2024 10:12,2,"Chicago, IL",367,78,185,307,7,29,Female,73592.65,Platinum,Credit Card,False,0,Rainy,True,Sunday,False,397,301,2024-09-08 10:12:00,2024,9,36,0
395,6139,720,Fridge,Appliances,2,1188.57,6/15/2024 16:05,8,"Miami, FL",257,52,129,429,10,19,Male,110519.57,Bronze,Digital Wallet,False,0,Stormy,True,Tuesday,True,273,336,2024-06-15 16:05:00,2024,6,24,0
396,8149,680,Headphones,Electronics,1,894.85,5/5/2024 22:23,8,"New York, NY",364,79,140,352,4,44,Male,59864.42,Gold,Cash,False,0,Stormy,False,Wednesday,True,452,495,2024-05-05 22:23:00,2024,5,18,0
397,9379,727,Washing Machine,Appliances,1,179.12,1/17/2024 19:04,12,"New York, NY",471,130,260,319,3,69,Female,104515.68,Platinum,Digital Wallet,False,0,Rainy,False,Thursday,False,460,148,2024-01-17 19:04:00,2024,1,3,0
398,2894,336,Tablet,Appliances,5,1234.43,4/1/2024 13:00,2,"Chicago, IL",341,119,183,104,9,70,Male,69120.11,Silver,Debit Card,True,0,Cloudy,True,Thursday,True,401,509,2024-04-01 13:00:00,2024,4,14,0
399,7311,710,Smartphone,Appliances,4,1212.93,7/3/2024 23:36,11,"Los Angeles, CA",447,87,198,466,10,67,Male,70749.52,Gold,Cash,False,0,Cloudy,True,Thursday,True,479,406,2024-07-03 23:36:00,2024,7,27,0
400,4114,337,Headphones,Appliances,1,1742.61,7/26/2024 13:55,3,"New York, NY",103,98,139,274,5,54,Other,52328.47,Bronze,Debit Card,True,0,Stormy,True,Thursday,False,383,139,2024-07-26 13:55:00,2024,7,30,0
401,5173,336,Tablet,Appliances,2,1842.63,1/16/2024 8:38,13,"New York, NY",445,127,143,281,1,66,Male,56419.9,Platinum,Debit Card,False,0,Rainy,True,Thursday,False,287,485,2024-01-16 08:38:00,2024,1,3,0
402,1727,803,Camera,Appliances,1,1795.88,2/8/2024 4:36,2,"Chicago, IL",64,63,139,110,2,54,Other,55391.97,Platinum,Cash,False,0,Cloudy,False,Tuesday,False,155,464,2024-02-08 04:36:00,2024,2,6,0
403,8144,126,Fridge,Appliances,2,1761.4,1/11/2024 21:00,5,"Los Angeles, CA",389,136,103,369,2,60,Other,54561.26,Silver,Credit Card,True,BOGO,Stormy,True,Monday,False,364,392,2024-01-11 21:00:00,2024,1,2,0
404,1027,467,Smartphone,Appliances,3,313.11,7/5/2024 7:07,8,"New York, NY",287,73,238,430,8,27,Female,82594.75,Silver,Credit Card,False,Percentage Discount,Cloudy,False,Wednesday,False,323,480,2024-07-05 07:07:00,2024,7,27,0
405,9518,181,Camera,Appliances,1,581.84,4/20/2024 1:31,5,"Chicago, IL",386,120,268,113,2,39,Female,29197.65,Silver,Debit Card,True,Percentage Discount,Rainy,False,Thursday,False,330,144,2024-04-20 01:31:00,2024,4,16,0
406,9821,804,Smartphone,Appliances,2,1980.56,1/28/2024 11:30,11,"New York, NY",204,62,152,432,4,67,Male,90406.07,Silver,Debit Card,False,0,Stormy,False,Monday,True,488,298,2024-01-28 11:30:00,2024,1,4,0
407,4228,898,Camera,Electronics,5,1132.72,1/16/2024 14:38,4,"Chicago, IL",250,96,300,118,1,39,Male,109874.54,Platinum,Cash,False,0,Stormy,False,Monday,False,298,115,2024-01-16 14:38:00,2024,1,3,0
408,6967,588,Washing Machine,Electronics,2,263.56,1/15/2024 21:00,1,"Miami, FL",351,56,171,273,4,51,Male,104831.41,Gold,Cash,True,0,Cloudy,True,Tuesday,False,306,392,2024-01-15 21:00:00,2024,1,3,0
409,8066,237,Tablet,Electronics,4,757.03,5/14/2024 5:33,16,"Dallas, TX",460,62,297,124,8,67,Other,112502.94,Bronze,Digital Wallet,False,Percentage Discount,Rainy,True,Thursday,False,349,149,2024-05-14 05:33:00,2024,5,20,0
410,2146,614,Camera,Electronics,5,1238.32,7/5/2024 3:58,3,"Miami, FL",257,98,204,447,1,33,Other,113563.12,Gold,Cash,True,0,Cloudy,False,Saturday,False,253,492,2024-07-05 03:58:00,2024,7,27,0
411,6409,966,Laptop,Appliances,4,1076.92,8/6/2024 17:12,12,"Los Angeles, CA",173,82,165,411,10,21,Female,29168.53,Gold,Debit Card,True,0,Sunny,False,Friday,False,392,159,2024-08-06 17:12:00,2024,8,32,0
412,6143,719,Washing Machine,Appliances,4,632.71,4/17/2024 21:01,12,"Chicago, IL",471,91,273,127,8,18,Other,35921.82,Gold,Cash,True,BOGO,Sunny,True,Tuesday,True,425,288,2024-04-17 21:01:00,2024,4,16,0
413,3041,580,Fridge,Appliances,5,1833.03,1/18/2024 6:07,11,"Miami, FL",46,83,168,380,2,30,Female,99133.7,Silver,Debit Card,False,0,Stormy,False,Sunday,True,270,375,2024-01-18 06:07:00,2024,1,3,0
414,5920,829,TV,Appliances,5,954.88,7/22/2024 1:45,18,"Los Angeles, CA",491,102,133,211,9,69,Male,33855.02,Bronze,Debit Card,True,0,Stormy,True,Monday,False,156,384,2024-07-22 01:45:00,2024,7,30,0
415,9308,765,Laptop,Appliances,4,740.18,5/31/2024 2:04,16,"Miami, FL",181,99,250,122,5,40,Other,50567.84,Platinum,Debit Card,True,BOGO,Rainy,True,Thursday,False,210,314,2024-05-31 02:04:00,2024,5,22,0
416,6067,482,TV,Appliances,4,1551.64,1/29/2024 23:02,2,"Dallas, TX",348,69,244,313,7,52,Male,61189.89,Gold,Digital Wallet,True,BOGO,Stormy,False,Friday,False,238,495,2024-01-29 23:02:00,2024,1,5,0
417,7691,288,Laptop,Appliances,1,1515.99,3/6/2024 6:18,19,"New York, NY",26,97,275,420,8,21,Other,67747.64,Silver,Credit Card,False,0,Stormy,False,Wednesday,True,483,502,2024-03-06 06:18:00,2024,3,10,0
418,6344,972,Tablet,Appliances,5,1009.68,4/10/2024 22:19,9,"Dallas, TX",216,106,287,418,10,60,Other,90639.14,Platinum,Cash,True,0,Stormy,False,Sunday,True,410,263,2024-04-10 22:19:00,2024,4,15,0
419,7592,496,Headphones,Appliances,5,1976.32,5/10/2024 22:31,2,"Los Angeles, CA",464,79,198,195,1,62,Female,102723.54,Bronze,Credit Card,True,0,Sunny,False,Thursday,False,386,213,2024-05-10 22:31:00,2024,5,19,0
420,5844,603,TV,Electronics,4,1948.68,3/13/2024 12:23,9,"Miami, FL",452,64,131,284,9,63,Other,82942.58,Bronze,Digital Wallet,False,0,Stormy,False,Sunday,False,275,387,2024-03-13 12:23:00,2024,3,11,0
421,3085,585,Fridge,Electronics,2,77.61,4/20/2024 4:20,5,"Los Angeles, CA",200,69,153,124,8,53,Male,89907.0,Platinum,Cash,True,0,Rainy,True,Friday,False,419,465,2024-04-20 04:20:00,2024,4,16,0
422,4143,240,TV,Appliances,1,677.64,8/17/2024 2:30,5,"Chicago, IL",266,94,232,454,8,67,Female,28682.2,Bronze,Credit Card,True,Percentage Discount,Cloudy,False,Sunday,True,373,435,2024-08-17 02:30:00,2024,8,33,0
423,7888,267,Tablet,Appliances,2,1298.43,8/10/2024 5:49,10,"Dallas, TX",478,78,114,463,4,47,Male,70127.23,Platinum,Cash,False,Percentage Discount,Rainy,False,Tuesday,False,170,256,2024-08-10 05:49:00,2024,8,32,0
424,7211,297,Laptop,Electronics,4,1909.01,6/19/2024 7:59,11,"Chicago, IL",260,103,214,402,8,41,Other,25335.83,Platinum,Debit Card,False,0,Stormy,False,Tuesday,True,334,201,2024-06-19 07:59:00,2024,6,25,0
425,3851,331,Smartphone,Electronics,4,1167.42,1/5/2024 11:41,13,"Los Angeles, CA",35,63,119,489,4,43,Female,108727.87,Platinum,Digital Wallet,True,0,Stormy,False,Tuesday,False,424,157,2024-01-05 11:41:00,2024,1,1,0
426,5930,133,Camera,Appliances,4,1369.82,5/8/2024 17:24,10,"Los Angeles, CA",177,66,243,358,2,58,Female,84423.47,Silver,Debit Card,True,0,Rainy,True,Friday,False,213,176,2024-05-08 17:24:00,2024,5,19,0
427,7653,518,Washing Machine,Appliances,2,1782.13,6/29/2024 14:18,3,"New York, NY",183,106,273,118,7,33,Female,59302.86,Bronze,Digital Wallet,True,0,Cloudy,False,Saturday,True,168,337,2024-06-29 14:18:00,2024,6,26,0
428,9977,882,Headphones,Electronics,1,1189.73,3/19/2024 7:17,3,"Los Angeles, CA",380,101,196,279,10,34,Female,47553.37,Platinum,Credit Card,True,0,Cloudy,True,Wednesday,True,206,102,2024-03-19 07:17:00,2024,3,12,0
429,1006,115,TV,Appliances,5,1274.48,2/15/2024 13:40,19,"Los Angeles, CA",239,125,111,289,3,65,Other,30309.71,Silver,Digital Wallet,True,BOGO,Stormy,True,Monday,True,334,462,2024-02-15 13:40:00,2024,2,7,0
430,5978,376,Smartphone,Appliances,2,1119.59,5/3/2024 11:49,20,"Miami, FL",56,114,286,320,8,36,Male,112705.3,Platinum,Cash,True,Percentage Discount,Cloudy,True,Sunday,True,328,371,2024-05-03 11:49:00,2024,5,18,0
431,5700,522,Fridge,Electronics,2,323.69,9/16/2024 1:14,6,"Dallas, TX",354,107,210,251,6,57,Male,85637.68,Silver,Credit Card,True,0,Cloudy,True,Wednesday,True,315,311,2024-09-16 01:14:00,2024,9,38,0
432,4443,327,TV,Appliances,4,1966.05,3/16/2024 4:06,12,"Chicago, IL",166,100,245,259,10,24,Other,67656.5,Silver,Digital Wallet,True,Percentage Discount,Sunny,True,Saturday,False,447,266,2024-03-16 04:06:00,2024,3,11,0
433,8043,860,Laptop,Electronics,4,52.13,5/17/2024 16:55,12,"Dallas, TX",186,72,251,139,3,64,Male,104478.07,Gold,Credit Card,True,0,Cloudy,False,Sunday,True,458,349,2024-05-17 16:55:00,2024,5,20,0
434,6279,787,TV,Electronics,1,1448.59,8/9/2024 23:42,3,"Miami, FL",427,148,266,399,8,20,Male,119736.53,Platinum,Credit Card,True,0,Rainy,False,Saturday,False,381,177,2024-08-09 23:42:00,2024,8,32,0
435,8618,307,Washing Machine,Electronics,4,539.4,1/18/2024 22:58,5,"New York, NY",212,70,151,393,5,50,Male,79264.04,Gold,Cash,False,0,Stormy,True,Friday,True,212,329,2024-01-18 22:58:00,2024,1,3,0
436,8238,875,Camera,Electronics,3,336.92,8/25/2024 14:36,11,"Miami, FL",346,150,254,483,7,51,Male,114396.41,Gold,Debit Card,True,BOGO,Stormy,False,Wednesday,False,184,131,2024-08-25 14:36:00,2024,8,34,0
437,8244,309,Smartphone,Electronics,5,1750.23,3/23/2024 10:00,8,"New York, NY",213,146,253,247,1,40,Female,46591.24,Silver,Digital Wallet,True,BOGO,Sunny,True,Thursday,False,452,460,2024-03-23 10:00:00,2024,3,12,0
438,4501,167,Headphones,Electronics,5,1720.4,3/23/2024 12:43,17,"Dallas, TX",41,124,167,496,2,32,Female,57188.06,Platinum,Cash,True,0,Stormy,True,Monday,False,307,197,2024-03-23 12:43:00,2024,3,12,0
439,9375,281,Camera,Appliances,5,1612.79,6/7/2024 2:11,2,"New York, NY",440,95,187,134,1,36,Female,69165.68,Silver,Digital Wallet,True,BOGO,Sunny,False,Saturday,True,375,455,2024-06-07 02:11:00,2024,6,23,0
440,8752,549,Laptop,Appliances,5,1940.42,7/25/2024 14:15,16,"Chicago, IL",215,113,119,164,1,53,Male,94460.2,Bronze,Cash,False,Percentage Discount,Cloudy,True,Friday,True,382,211,2024-07-25 14:15:00,2024,7,30,0
441,3780,987,Fridge,Electronics,4,739.86,9/11/2024 0:04,17,"Miami, FL",212,145,109,233,7,52,Other,29022.58,Platinum,Cash,True,0,Cloudy,False,Monday,True,485,301,2024-09-11 00:04:00,2024,9,37,0
442,2389,731,Headphones,Appliances,5,1084.37,3/24/2024 14:12,3,"Miami, FL",286,131,198,208,10,33,Other,68833.49,Bronze,Debit Card,False,0,Sunny,False,Saturday,True,305,336,2024-03-24 14:12:00,2024,3,12,0
443,5649,601,Laptop,Appliances,4,1951.17,7/20/2024 2:47,19,"Dallas, TX",298,124,268,313,8,23,Female,78417.7,Bronze,Credit Card,True,0,Sunny,True,Saturday,False,188,310,2024-07-20 02:47:00,2024,7,29,0
444,9445,804,TV,Electronics,3,322.83,5/18/2024 21:20,3,"Chicago, IL",456,89,235,133,8,56,Male,27017.83,Silver,Digital Wallet,False,0,Cloudy,False,Monday,True,162,506,2024-05-18 21:20:00,2024,5,20,0
445,6491,432,Camera,Electronics,2,1065.14,4/28/2024 13:09,8,"Los Angeles, CA",154,112,151,300,5,66,Female,56274.17,Bronze,Cash,True,Percentage Discount,Sunny,True,Thursday,True,464,389,2024-04-28 13:09:00,2024,4,17,0
446,2530,987,Camera,Appliances,2,1240.52,8/19/2024 16:07,12,"Dallas, TX",22,85,232,124,1,29,Male,43089.54,Bronze,Digital Wallet,True,0,Cloudy,True,Saturday,True,394,276,2024-08-19 16:07:00,2024,8,34,0
447,4848,568,TV,Appliances,5,1748.46,3/21/2024 11:01,1,"New York, NY",289,96,284,290,1,46,Male,37490.94,Silver,Credit Card,True,Percentage Discount,Stormy,True,Thursday,False,474,153,2024-03-21 11:01:00,2024,3,12,0
448,6085,352,TV,Electronics,3,963.86,5/1/2024 18:45,12,"Chicago, IL",122,54,138,106,10,64,Female,55812.19,Gold,Digital Wallet,True,BOGO,Stormy,False,Monday,False,243,392,2024-05-01 18:45:00,2024,5,18,0
449,4680,537,Laptop,Appliances,2,1696.55,2/10/2024 2:10,8,"Chicago, IL",215,121,257,457,8,28,Other,54406.42,Platinum,Debit Card,True,BOGO,Rainy,True,Saturday,True,297,244,2024-02-10 02:10:00,2024,2,6,0
450,4262,514,TV,Appliances,1,349.45,5/27/2024 11:27,10,"Miami, FL",478,57,136,192,1,46,Male,42399.24,Silver,Cash,True,0,Stormy,False,Friday,True,160,406,2024-05-27 11:27:00,2024,5,22,0
451,3414,894,TV,Electronics,5,493.35,8/20/2024 2:58,20,"Los Angeles, CA",382,130,118,405,2,69,Female,40837.16,Silver,Credit Card,True,BOGO,Cloudy,True,Wednesday,True,480,152,2024-08-20 02:58:00,2024,8,34,0
452,1400,142,Fridge,Electronics,1,1148.87,4/25/2024 23:13,9,"Miami, FL",122,122,197,425,9,46,Female,39790.98,Silver,Cash,True,0,Cloudy,False,Tuesday,True,132,383,2024-04-25 23:13:00,2024,4,17,0
453,1757,722,Camera,Appliances,4,908.04,6/23/2024 8:10,3,"Miami, FL",198,132,137,484,4,50,Other,45734.44,Silver,Digital Wallet,True,Percentage Discount,Stormy,True,Friday,True,110,509,2024-06-23 08:10:00,2024,6,25,0
454,5011,852,Smartphone,Appliances,3,946.68,3/15/2024 3:16,20,"Los Angeles, CA",128,114,249,399,3,68,Male,104813.77,Gold,Cash,True,0,Sunny,False,Sunday,False,299,378,2024-03-15 03:16:00,2024,3,11,0
455,8784,944,Washing Machine,Appliances,3,607.12,7/18/2024 15:30,16,"Los Angeles, CA",208,128,232,412,6,31,Female,74667.64,Platinum,Credit Card,False,Percentage Discount,Sunny,True,Thursday,False,471,409,2024-07-18 15:30:00,2024,7,29,0
456,2193,489,Laptop,Appliances,2,901.73,6/3/2024 1:51,4,"Los Angeles, CA",327,150,287,121,7,36,Female,80788.52,Silver,Cash,True,0,Rainy,False,Sunday,False,274,305,2024-06-03 01:51:00,2024,6,23,0
457,8461,837,Tablet,Electronics,1,757.02,8/22/2024 23:59,11,"New York, NY",7,107,196,325,7,21,Female,81764.8,Silver,Credit Card,True,0,Cloudy,False,Friday,True,104,445,2024-08-22 23:59:00,2024,8,34,0
458,7790,420,Washing Machine,Appliances,5,762.33,2/28/2024 16:40,16,"Miami, FL",174,65,103,304,2,49,Female,22521.98,Gold,Credit Card,True,0,Rainy,False,Wednesday,True,431,241,2024-02-28 16:40:00,2024,2,9,0
459,4185,503,Tablet,Electronics,5,1899.81,2/15/2024 4:48,11,"Miami, FL",291,109,178,147,9,55,Male,103110.94,Silver,Digital Wallet,False,0,Sunny,False,Friday,False,461,416,2024-02-15 04:48:00,2024,2,7,0
460,7291,726,TV,Appliances,3,1329.8,4/12/2024 5:17,12,"Miami, FL",451,79,277,397,1,61,Other,95293.26,Silver,Credit Card,True,0,Stormy,True,Saturday,False,375,357,2024-04-12 05:17:00,2024,4,15,0
461,9099,860,Laptop,Electronics,2,180.05,2/25/2024 10:06,16,"Los Angeles, CA",189,133,147,160,7,58,Other,112421.17,Silver,Debit Card,True,0,Stormy,False,Tuesday,True,191,152,2024-02-25 10:06:00,2024,2,8,0
462,7547,685,Smartphone,Electronics,2,1803.74,3/3/2024 1:49,4,"Miami, FL",160,78,224,490,2,69,Other,36849.66,Gold,Digital Wallet,False,0,Cloudy,True,Friday,True,278,489,2024-03-03 01:49:00,2024,3,9,0
463,4997,708,TV,Appliances,1,1488.74,2/17/2024 4:13,13,"Dallas, TX",61,61,229,422,1,30,Female,37696.88,Silver,Digital Wallet,True,0,Cloudy,True,Tuesday,True,463,403,2024-02-17 04:13:00,2024,2,7,0
464,3417,649,Smartphone,Appliances,2,1987.19,1/20/2024 16:35,14,"New York, NY",356,147,195,358,9,26,Other,111372.4,Silver,Credit Card,True,Percentage Discount,Sunny,True,Wednesday,True,334,150,2024-01-20 16:35:00,2024,1,3,0
465,1090,637,Tablet,Appliances,1,1389.13,5/21/2024 22:37,8,"Dallas, TX",211,93,279,156,6,50,Male,27226.32,Platinum,Digital Wallet,False,BOGO,Rainy,False,Tuesday,True,186,414,2024-05-21 22:37:00,2024,5,21,0
466,2746,756,Smartphone,Electronics,2,1457.19,3/3/2024 0:13,6,"Dallas, TX",59,149,226,479,4,23,Other,33254.57,Gold,Digital Wallet,True,0,Sunny,False,Tuesday,False,446,494,2024-03-03 00:13:00,2024,3,9,0
467,7965,996,TV,Electronics,1,442.86,1/6/2024 4:49,17,"New York, NY",442,113,127,258,8,53,Other,66218.71,Bronze,Debit Card,False,BOGO,Sunny,False,Tuesday,True,302,252,2024-01-06 04:49:00,2024,1,1,0
468,4585,821,TV,Appliances,5,1026.68,7/22/2024 3:29,5,"Chicago, IL",464,62,292,412,1,23,Female,99192.41,Bronze,Digital Wallet,False,0,Rainy,True,Monday,True,412,398,2024-07-22 03:29:00,2024,7,30,0
469,3881,905,Tablet,Electronics,1,1521.5,8/26/2024 10:26,9,"Los Angeles, CA",36,104,114,374,1,42,Male,58911.71,Bronze,Debit Card,False,0,Rainy,True,Thursday,False,316,342,2024-08-26 10:26:00,2024,8,35,0
470,9486,139,Fridge,Appliances,3,301.82,4/22/2024 0:54,14,"Chicago, IL",112,54,162,207,8,60,Female,59786.76,Gold,Credit Card,True,0,Cloudy,False,Wednesday,False,336,344,2024-04-22 00:54:00,2024,4,17,0
471,8611,633,Washing Machine,Appliances,1,1232.43,1/29/2024 21:46,8,"New York, NY",106,85,207,311,1,48,Other,108029.95,Gold,Cash,True,Percentage Discount,Stormy,True,Tuesday,False,341,353,2024-01-29 21:46:00,2024,1,5,0
472,1822,211,Headphones,Electronics,3,1584.08,3/16/2024 15:12,1,"Los Angeles, CA",300,72,266,352,1,23,Other,57323.78,Silver,Cash,False,0,Rainy,True,Thursday,False,246,131,2024-03-16 15:12:00,2024,3,11,0
473,5082,562,Smartphone,Appliances,4,1064.0,9/1/2024 17:59,14,"Dallas, TX",171,98,148,367,2,49,Male,78218.42,Silver,Credit Card,False,0,Stormy,True,Monday,False,269,460,2024-09-01 17:59:00,2024,9,35,0
474,2988,567,TV,Electronics,4,823.04,3/17/2024 4:27,4,"Chicago, IL",212,60,262,234,1,46,Male,117644.71,Bronze,Debit Card,True,BOGO,Stormy,True,Tuesday,True,314,219,2024-03-17 04:27:00,2024,3,11,0
475,8478,946,TV,Appliances,3,1052.89,5/21/2024 6:14,14,"Miami, FL",96,83,103,412,3,60,Male,67085.81,Gold,Credit Card,False,0,Rainy,False,Saturday,False,264,292,2024-05-21 06:14:00,2024,5,21,0
476,3184,998,Fridge,Appliances,3,1878.24,7/4/2024 14:54,5,"Miami, FL",95,148,192,107,3,24,Female,67234.55,Platinum,Cash,False,0,Stormy,True,Friday,True,444,280,2024-07-04 14:54:00,2024,7,27,0
477,8612,143,Smartphone,Appliances,5,256.74,7/18/2024 8:44,3,"New York, NY",67,82,196,221,3,25,Female,49832.98,Platinum,Digital Wallet,False,0,Stormy,True,Wednesday,False,358,475,2024-07-18 08:44:00,2024,7,29,0
478,9702,998,TV,Electronics,4,869.56,3/22/2024 7:46,18,"New York, NY",133,107,253,168,2,18,Male,29714.14,Gold,Credit Card,True,Percentage Discount,Sunny,False,Saturday,False,400,375,2024-03-22 07:46:00,2024,3,12,0
479,6198,351,Headphones,Electronics,3,527.15,4/14/2024 6:19,12,"Los Angeles, CA",464,61,185,147,3,32,Other,93188.58,Platinum,Digital Wallet,True,BOGO,Sunny,False,Tuesday,False,388,405,2024-04-14 06:19:00,2024,4,15,0
480,8251,631,Headphones,Appliances,4,1544.58,7/17/2024 10:38,14,"Dallas, TX",190,103,266,330,7,36,Female,51064.12,Platinum,Cash,True,BOGO,Stormy,False,Tuesday,True,311,324,2024-07-17 10:38:00,2024,7,29,0
481,9270,650,Washing Machine,Appliances,1,378.21,8/7/2024 20:36,8,"Dallas, TX",476,92,266,326,9,20,Other,48703.83,Platinum,Cash,True,0,Rainy,True,Thursday,False,484,480,2024-08-07 20:36:00,2024,8,32,0
482,7991,505,TV,Appliances,1,1788.43,4/7/2024 4:09,11,"New York, NY",38,54,293,242,4,29,Other,29346.53,Bronze,Digital Wallet,False,0,Rainy,True,Monday,False,101,197,2024-04-07 04:09:00,2024,4,14,0
483,9976,852,Headphones,Electronics,1,110.7,7/16/2024 17:50,5,"Dallas, TX",261,83,206,388,10,21,Male,117281.31,Platinum,Digital Wallet,False,0,Rainy,True,Monday,True,227,323,2024-07-16 17:50:00,2024,7,29,0
484,8305,140,Washing Machine,Appliances,2,1303.51,2/2/2024 9:27,1,"Miami, FL",76,83,145,456,1,49,Female,37541.52,Bronze,Credit Card,True,Percentage Discount,Sunny,False,Wednesday,True,477,273,2024-02-02 09:27:00,2024,2,5,0
485,3607,671,Tablet,Appliances,4,1459.01,5/7/2024 4:38,1,"Miami, FL",191,148,180,147,6,32,Male,98932.78,Silver,Cash,False,0,Cloudy,False,Thursday,True,434,504,2024-05-07 04:38:00,2024,5,19,0
486,8777,496,Camera,Electronics,5,784.65,8/17/2024 20:00,15,"Miami, FL",202,63,260,160,2,45,Male,45350.15,Gold,Credit Card,False,BOGO,Rainy,False,Friday,False,205,113,2024-08-17 20:00:00,2024,8,33,0
487,8373,628,Fridge,Electronics,4,1264.29,6/28/2024 21:13,14,"Chicago, IL",310,97,108,492,1,22,Female,110028.22,Bronze,Debit Card,True,BOGO,Sunny,True,Saturday,True,277,324,2024-06-28 21:13:00,2024,6,26,0
488,5246,883,Fridge,Appliances,4,595.9,7/23/2024 22:39,3,"Chicago, IL",206,73,275,344,2,49,Other,83130.31,Platinum,Credit Card,True,Percentage Discount,Sunny,True,Friday,True,322,100,2024-07-23 22:39:00,2024,7,30,0
489,5050,745,Smartphone,Appliances,3,945.53,1/8/2024 18:22,11,"Dallas, TX",34,105,248,322,2,37,Female,27778.84,Gold,Debit Card,True,BOGO,Rainy,True,Friday,True,203,92,2024-01-08 18:22:00,2024,1,2,0
490,5543,150,Washing Machine,Appliances,3,1685.36,3/28/2024 5:30,2,"Dallas, TX",303,83,198,324,9,38,Other,90979.99,Silver,Credit Card,True,Percentage Discount,Cloudy,True,Thursday,True,484,336,2024-03-28 05:30:00,2024,3,13,0
491,9540,294,Washing Machine,Electronics,5,620.44,3/5/2024 21:45,10,"New York, NY",65,86,257,270,2,47,Female,45620.72,Gold,Cash,False,0,Rainy,False,Monday,True,229,450,2024-03-05 21:45:00,2024,3,10,0
492,8939,398,Fridge,Electronics,4,1056.89,7/22/2024 7:51,5,"Miami, FL",41,94,176,290,7,66,Other,85937.11,Silver,Digital Wallet,True,0,Cloudy,True,Wednesday,True,382,357,2024-07-22 07:51:00,2024,7,30,0
493,4919,550,Fridge,Appliances,4,242.38,3/20/2024 1:54,2,"Dallas, TX",485,137,118,111,10,34,Other,108653.29,Bronze,Debit Card,False,Percentage Discount,Sunny,True,Saturday,True,211,178,2024-03-20 01:54:00,2024,3,12,0
494,5499,507,Smartphone,Electronics,4,1965.27,3/1/2024 17:06,11,"Dallas, TX",74,134,135,454,4,24,Female,118260.82,Bronze,Cash,True,0,Cloudy,False,Saturday,True,327,356,2024-03-01 17:06:00,2024,3,9,0
495,8206,411,Washing Machine,Appliances,3,425.32,4/15/2024 5:27,20,"Los Angeles, CA",328,114,154,441,5,48,Female,67284.99,Gold,Debit Card,False,0,Cloudy,True,Monday,True,491,148,2024-04-15 05:27:00,2024,4,16,0
496,2269,892,Laptop,Appliances,5,54.85,7/6/2024 19:11,18,"Chicago, IL",363,144,181,120,10,58,Other,92364.54,Silver,Cash,True,0,Cloudy,False,Friday,True,419,391,2024-07-06 19:11:00,2024,7,27,0
497,5681,947,Fridge,Appliances,4,835.57,9/3/2024 1:27,13,"Los Angeles, CA",219,131,143,242,2,57,Female,104926.48,Silver,Cash,False,0,Cloudy,True,Friday,False,474,462,2024-09-03 01:27:00,2024,9,36,0
498,4841,392,Fridge,Appliances,5,1694.68,2/23/2024 22:38,17,"Los Angeles, CA",462,68,240,196,1,22,Male,87149.49,Bronze,Digital Wallet,True,0,Sunny,True,Tuesday,False,291,344,2024-02-23 22:38:00,2024,2,8,0
499,5451,572,Tablet,Appliances,4,466.59,4/26/2024 5:24,12,"New York, NY",290,126,235,352,7,50,Male,40259.02,Silver,Digital Wallet,True,BOGO,Stormy,False,Wednesday,False,185,260,2024-04-26 05:24:00,2024,4,17,0
500,6502,270,Headphones,Electronics,3,1934.88,8/31/2024 12:51,14,"Dallas, TX",230,103,239,273,8,35,Male,67987.98,Bronze,Debit Card,False,BOGO,Rainy,False,Sunday,True,218,397,2024-08-31 12:51:00,2024,8,35,0
501,6238,532,Smartphone,Electronics,1,1833.78,2/10/2024 12:18,20,"New York, NY",432,144,257,428,7,58,Male,63666.78,Platinum,Cash,False,0,Sunny,True,Friday,True,198,388,2024-02-10 12:18:00,2024,2,6,0
502,9849,401,Smartphone,Appliances,4,218.58,5/21/2024 20:20,15,"Chicago, IL",378,126,249,201,10,51,Female,83058.31,Platinum,Debit Card,False,BOGO,Sunny,True,Tuesday,True,317,156,2024-05-21 20:20:00,2024,5,21,0
503,2320,727,Headphones,Electronics,2,229.93,3/27/2024 18:48,15,"Miami, FL",456,86,272,477,9,18,Other,72495.46,Gold,Digital Wallet,True,BOGO,Sunny,False,Wednesday,True,403,414,2024-03-27 18:48:00,2024,3,13,0
504,3267,155,Fridge,Electronics,4,1633.33,5/1/2024 3:21,3,"Miami, FL",159,143,100,153,8,19,Female,49459.72,Platinum,Digital Wallet,False,0,Rainy,True,Saturday,False,460,187,2024-05-01 03:21:00,2024,5,18,0
505,3471,806,Washing Machine,Electronics,3,1850.48,4/21/2024 8:28,10,"New York, NY",285,97,273,270,2,68,Female,78817.98,Platinum,Debit Card,False,BOGO,Cloudy,True,Monday,True,410,463,2024-04-21 08:28:00,2024,4,16,0
506,4788,629,Headphones,Appliances,4,1606.55,1/14/2024 0:05,7,"Los Angeles, CA",429,82,240,328,1,21,Other,104912.74,Bronze,Credit Card,True,0,Stormy,True,Friday,True,331,96,2024-01-14 00:05:00,2024,1,2,0
507,7275,245,Washing Machine,Appliances,1,226.14,8/5/2024 9:33,7,"Los Angeles, CA",389,61,231,281,2,19,Male,82851.02,Silver,Digital Wallet,True,0,Stormy,False,Saturday,False,476,218,2024-08-05 09:33:00,2024,8,32,0
508,3503,574,Headphones,Electronics,3,1104.72,4/12/2024 12:25,14,"New York, NY",358,134,294,430,5,66,Male,110070.54,Platinum,Debit Card,True,0,Stormy,True,Wednesday,True,147,301,2024-04-12 12:25:00,2024,4,15,0
509,4505,949,Fridge,Appliances,3,341.68,4/18/2024 10:03,1,"Dallas, TX",449,136,295,440,10,18,Male,79925.97,Platinum,Debit Card,False,Percentage Discount,Cloudy,True,Tuesday,True,328,265,2024-04-18 10:03:00,2024,4,16,0
510,2052,761,Washing Machine,Electronics,1,1568.93,6/17/2024 19:55,17,"Chicago, IL",198,123,232,167,5,70,Other,27534.67,Gold,Cash,False,0,Stormy,False,Saturday,False,244,470,2024-06-17 19:55:00,2024,6,25,0
511,7797,562,Tablet,Appliances,1,1778.39,1/23/2024 17:35,2,"Dallas, TX",296,64,198,190,2,23,Male,35275.01,Gold,Cash,True,0,Sunny,False,Tuesday,False,289,362,2024-01-23 17:35:00,2024,1,4,0
512,7678,192,Camera,Electronics,4,1655.49,6/1/2024 21:47,19,"Dallas, TX",248,78,295,417,2,32,Female,107303.81,Bronze,Digital Wallet,False,BOGO,Sunny,True,Sunday,True,102,348,2024-06-01 21:47:00,2024,6,22,0
513,6421,839,Smartphone,Appliances,2,1652.32,6/3/2024 9:14,2,"New York, NY",283,143,107,264,7,33,Female,88995.17,Bronze,Digital Wallet,False,0,Rainy,True,Tuesday,False,217,310,2024-06-03 09:14:00,2024,6,23,0
514,9890,612,Washing Machine,Electronics,3,1148.1,6/16/2024 2:38,4,"New York, NY",155,109,234,126,4,21,Female,88785.28,Platinum,Credit Card,False,0,Rainy,True,Tuesday,False,213,201,2024-06-16 02:38:00,2024,6,24,0
515,8633,215,TV,Appliances,3,857.92,9/6/2024 22:24,2,"Dallas, TX",269,121,117,466,3,61,Male,32690.38,Platinum,Debit Card,True,Percentage Discount,Cloudy,False,Friday,True,272,384,2024-09-06 22:24:00,2024,9,36,0
516,7812,284,Smartphone,Appliances,2,1120.08,2/27/2024 21:10,3,"Miami, FL",246,55,123,375,9,58,Female,107982.16,Platinum,Cash,True,0,Rainy,True,Thursday,False,351,216,2024-02-27 21:10:00,2024,2,9,0
517,2020,897,TV,Appliances,4,1680.15,9/6/2024 19:58,10,"Los Angeles, CA",292,82,100,226,3,28,Male,50854.05,Bronze,Debit Card,True,0,Sunny,True,Friday,False,455,136,2024-09-06 19:58:00,2024,9,36,0
518,4388,699,Laptop,Electronics,2,1870.45,8/25/2024 14:03,14,"Dallas, TX",385,126,217,386,3,64,Female,50647.53,Silver,Digital Wallet,False,BOGO,Sunny,True,Saturday,True,142,182,2024-08-25 14:03:00,2024,8,34,0
519,7883,812,Laptop,Appliances,1,1859.31,4/28/2024 4:29,4,"New York, NY",423,114,125,301,6,25,Other,84532.89,Gold,Digital Wallet,False,Percentage Discount,Rainy,False,Monday,True,352,246,2024-04-28 04:29:00,2024,4,17,0
520,7381,659,Camera,Appliances,5,509.35,8/13/2024 1:44,2,"Miami, FL",259,112,172,118,2,35,Male,98946.43,Platinum,Debit Card,True,0,Stormy,False,Sunday,False,334,366,2024-08-13 01:44:00,2024,8,33,0
521,1320,238,Washing Machine,Electronics,4,947.33,2/21/2024 21:50,7,"Los Angeles, CA",321,104,252,201,10,70,Other,20318.78,Platinum,Cash,True,0,Rainy,False,Wednesday,False,175,318,2024-02-21 21:50:00,2024,2,8,0
522,7232,502,Fridge,Appliances,3,331.6,4/6/2024 11:28,20,"New York, NY",310,67,290,398,7,53,Other,66560.61,Gold,Debit Card,True,0,Rainy,True,Wednesday,True,311,429,2024-04-06 11:28:00,2024,4,14,0
523,8814,523,Fridge,Electronics,5,1324.84,6/25/2024 19:36,5,"New York, NY",209,52,144,130,5,55,Female,107348.51,Platinum,Credit Card,False,0,Cloudy,False,Monday,False,293,500,2024-06-25 19:36:00,2024,6,26,0
524,1096,431,Fridge,Appliances,4,282.14,1/19/2024 23:47,16,"Los Angeles, CA",378,127,152,209,3,19,Female,41100.73,Platinum,Digital Wallet,True,0,Stormy,False,Tuesday,True,414,103,2024-01-19 23:47:00,2024,1,3,0
525,6763,561,Camera,Electronics,5,1268.11,3/13/2024 23:22,17,"Dallas, TX",101,74,280,317,10,34,Female,109201.01,Platinum,Digital Wallet,True,0,Cloudy,False,Friday,False,149,456,2024-03-13 23:22:00,2024,3,11,0
526,5892,125,Fridge,Appliances,2,1894.39,3/5/2024 12:22,17,"Dallas, TX",43,120,202,353,6,18,Female,80343.08,Gold,Digital Wallet,False,Percentage Discount,Stormy,False,Thursday,False,300,408,2024-03-05 12:22:00,2024,3,10,0
527,7389,283,Washing Machine,Electronics,4,102.6,9/1/2024 22:18,17,"New York, NY",292,74,106,249,9,23,Male,72138.0,Platinum,Debit Card,True,0,Stormy,False,Monday,True,244,331,2024-09-01 22:18:00,2024,9,35,0
528,7865,564,Headphones,Electronics,4,345.43,3/12/2024 6:32,18,"Miami, FL",217,106,162,384,7,23,Other,24644.02,Silver,Credit Card,False,0,Stormy,True,Friday,True,295,467,2024-03-12 06:32:00,2024,3,11,0
529,9818,704,Tablet,Electronics,1,383.96,5/17/2024 17:05,4,"Dallas, TX",476,81,299,319,2,64,Other,105488.62,Platinum,Debit Card,False,0,Stormy,True,Monday,True,192,183,2024-05-17 17:05:00,2024,5,20,0
530,9947,829,Fridge,Appliances,1,969.48,5/11/2024 1:48,18,"New York, NY",114,126,205,326,7,70,Male,71396.73,Gold,Cash,False,Percentage Discount,Stormy,False,Monday,False,192,107,2024-05-11 01:48:00,2024,5,19,0
531,4613,306,Laptop,Appliances,5,1663.67,6/1/2024 2:10,20,"Chicago, IL",29,100,230,284,8,33,Female,90436.32,Bronze,Digital Wallet,False,Percentage Discount,Sunny,True,Wednesday,False,131,483,2024-06-01 02:10:00,2024,6,22,0
532,8999,565,Tablet,Appliances,3,160.4,7/19/2024 0:54,7,"Miami, FL",177,91,107,302,3,68,Female,104115.94,Silver,Cash,False,0,Rainy,False,Sunday,True,274,295,2024-07-19 00:54:00,2024,7,29,0
533,4595,192,Fridge,Electronics,2,1431.44,5/1/2024 0:43,2,"Dallas, TX",82,144,229,341,2,67,Female,111041.81,Silver,Debit Card,True,0,Stormy,True,Tuesday,True,421,359,2024-05-01 00:43:00,2024,5,18,0
534,5471,356,Smartphone,Appliances,5,1603.32,7/16/2024 23:00,9,"New York, NY",253,71,266,288,2,59,Female,74663.35,Platinum,Credit Card,False,Percentage Discount,Stormy,True,Tuesday,True,314,363,2024-07-16 23:00:00,2024,7,29,0
535,8140,431,TV,Appliances,4,1958.06,8/3/2024 14:36,13,"Los Angeles, CA",321,89,185,204,8,54,Other,94945.08,Platinum,Debit Card,False,Percentage Discount,Cloudy,False,Thursday,True,491,471,2024-08-03 14:36:00,2024,8,31,0
536,8956,808,Fridge,Appliances,2,666.9,3/20/2024 10:23,4,"Miami, FL",26,72,242,495,1,28,Male,69621.66,Gold,Digital Wallet,False,0,Sunny,True,Tuesday,True,157,122,2024-03-20 10:23:00,2024,3,12,0
537,1475,764,Headphones,Appliances,3,581.83,3/18/2024 19:43,13,"New York, NY",133,110,269,266,3,24,Male,49216.83,Platinum,Digital Wallet,True,0,Cloudy,False,Tuesday,False,281,433,2024-03-18 19:43:00,2024,3,12,0
538,7371,828,Camera,Electronics,2,1608.93,5/1/2024 0:06,8,"New York, NY",362,135,229,138,6,40,Other,64580.14,Gold,Debit Card,True,0,Rainy,False,Monday,True,410,241,2024-05-01 00:06:00,2024,5,18,0
539,6507,915,Washing Machine,Electronics,1,1107.2,2/13/2024 11:32,18,"Miami, FL",104,103,173,261,5,60,Male,86524.92,Silver,Credit Card,True,Percentage Discount,Cloudy,True,Wednesday,False,400,327,2024-02-13 11:32:00,2024,2,7,0
540,7624,267,Camera,Electronics,3,1293.64,6/25/2024 1:20,17,"Dallas, TX",199,50,166,227,5,58,Other,47769.17,Gold,Debit Card,True,0,Sunny,True,Sunday,True,357,397,2024-06-25 01:20:00,2024,6,26,0
541,3704,835,Laptop,Appliances,5,158.48,3/1/2024 14:54,4,"New York, NY",292,140,300,232,10,53,Male,110957.87,Gold,Debit Card,False,BOGO,Sunny,False,Tuesday,True,440,349,2024-03-01 14:54:00,2024,3,9,0
542,8657,850,Fridge,Electronics,4,1782.72,1/29/2024 7:23,14,"Los Angeles, CA",448,112,297,438,7,64,Male,114400.99,Gold,Digital Wallet,False,0,Sunny,False,Monday,False,484,238,2024-01-29 07:23:00,2024,1,5,0
543,3091,226,Fridge,Electronics,1,597.11,3/12/2024 16:28,17,"Los Angeles, CA",425,86,169,457,6,22,Female,58987.95,Platinum,Credit Card,True,0,Stormy,True,Friday,False,117,488,2024-03-12 16:28:00,2024,3,11,0
544,9751,193,TV,Appliances,2,958.73,4/8/2024 4:10,16,"Miami, FL",93,134,153,352,6,55,Male,40953.79,Platinum,Credit Card,False,0,Sunny,True,Monday,False,428,186,2024-04-08 04:10:00,2024,4,15,0
545,1441,216,TV,Electronics,3,920.92,2/6/2024 13:42,18,"Los Angeles, CA",92,136,224,245,1,27,Other,85888.31,Silver,Cash,True,0,Sunny,False,Friday,True,213,505,2024-02-06 13:42:00,2024,2,6,0
546,7455,823,Washing Machine,Appliances,3,679.77,7/1/2024 14:31,12,"Chicago, IL",390,65,134,203,3,47,Female,58294.16,Gold,Debit Card,False,0,Cloudy,True,Wednesday,False,352,145,2024-07-01 14:31:00,2024,7,27,0
547,1444,560,Laptop,Appliances,1,556.01,1/19/2024 13:06,3,"Dallas, TX",177,89,299,406,5,67,Female,68095.41,Gold,Credit Card,True,0,Sunny,True,Friday,False,287,424,2024-01-19 13:06:00,2024,1,3,0
548,2375,749,Camera,Electronics,2,1272.88,2/4/2024 17:54,17,"Miami, FL",416,105,128,169,3,49,Male,76927.3,Platinum,Cash,True,0,Sunny,True,Tuesday,True,497,181,2024-02-04 17:54:00,2024,2,5,0
549,8022,471,Laptop,Appliances,5,918.08,8/6/2024 20:34,12,"Los Angeles, CA",288,83,150,354,2,27,Other,105133.06,Silver,Debit Card,True,0,Rainy,False,Thursday,True,175,489,2024-08-06 20:34:00,2024,8,32,0
550,3223,187,Smartphone,Appliances,2,1017.98,7/25/2024 13:25,14,"Chicago, IL",374,147,144,100,9,35,Female,76765.74,Bronze,Credit Card,True,0,Stormy,True,Wednesday,False,213,293,2024-07-25 13:25:00,2024,7,30,0
551,8564,636,Headphones,Electronics,4,662.06,7/24/2024 0:32,20,"Chicago, IL",40,84,210,365,3,36,Male,44940.27,Bronze,Credit Card,False,0,Stormy,False,Monday,False,478,239,2024-07-24 00:32:00,2024,7,30,0
552,3977,824,Washing Machine,Electronics,4,1207.03,4/29/2024 14:09,2,"Miami, FL",216,50,282,153,6,33,Male,28307.31,Bronze,Debit Card,True,BOGO,Rainy,True,Friday,True,129,336,2024-04-29 14:09:00,2024,4,18,0
553,1823,493,Smartphone,Appliances,2,200.92,6/16/2024 22:37,12,"Chicago, IL",128,71,281,187,5,59,Other,27033.87,Silver,Credit Card,True,0,Sunny,False,Tuesday,False,464,509,2024-06-16 22:37:00,2024,6,24,0
554,5262,844,Headphones,Electronics,4,1646.16,3/3/2024 4:47,2,"Dallas, TX",68,105,226,129,9,46,Other,97774.68,Platinum,Credit Card,False,0,Stormy,True,Thursday,True,219,216,2024-03-03 04:47:00,2024,3,9,0
555,7211,910,TV,Electronics,3,1736.54,1/7/2024 14:14,19,"Miami, FL",120,138,226,334,1,63,Other,32710.9,Platinum,Credit Card,False,0,Stormy,False,Monday,True,422,375,2024-01-07 14:14:00,2024,1,1,0
556,6363,623,Smartphone,Appliances,2,1104.53,1/6/2024 23:09,13,"Miami, FL",2,65,206,379,6,44,Female,36540.84,Silver,Debit Card,False,0,Stormy,False,Tuesday,False,436,434,2024-01-06 23:09:00,2024,1,1,0
557,4467,726,Laptop,Electronics,1,1386.71,8/29/2024 11:34,11,"Dallas, TX",481,74,154,122,8,36,Male,27401.87,Gold,Digital Wallet,True,0,Sunny,True,Thursday,True,417,508,2024-08-29 11:34:00,2024,8,35,0
558,8449,263,Tablet,Appliances,3,1693.84,8/12/2024 7:58,13,"Los Angeles, CA",61,95,243,490,6,38,Female,106387.12,Silver,Credit Card,True,0,Sunny,True,Monday,True,206,313,2024-08-12 07:58:00,2024,8,33,0
559,6355,487,Tablet,Appliances,5,1510.45,5/30/2024 0:08,18,"Los Angeles, CA",68,74,300,466,10,42,Female,73113.93,Bronze,Cash,False,BOGO,Rainy,False,Tuesday,True,487,357,2024-05-30 00:08:00,2024,5,22,0
560,6529,663,Fridge,Electronics,3,952.4,3/14/2024 16:52,18,"Los Angeles, CA",247,86,157,113,6,22,Other,55111.89,Silver,Cash,False,BOGO,Sunny,True,Monday,False,139,352,2024-03-14 16:52:00,2024,3,11,0
561,7211,489,Fridge,Appliances,5,179.3,2/8/2024 2:41,6,"Dallas, TX",144,69,298,206,1,51,Female,95554.87,Platinum,Cash,True,0,Sunny,True,Wednesday,True,148,92,2024-02-08 02:41:00,2024,2,6,0
562,5558,144,Tablet,Appliances,5,1187.21,8/12/2024 7:38,13,"Miami, FL",207,91,118,352,3,64,Female,55540.15,Silver,Digital Wallet,False,0,Sunny,False,Saturday,False,112,377,2024-08-12 07:38:00,2024,8,33,0
563,7906,886,TV,Electronics,5,674.79,5/23/2024 20:45,16,"New York, NY",300,95,283,376,5,65,Male,74054.17,Gold,Debit Card,True,0,Stormy,False,Friday,True,174,143,2024-05-23 20:45:00,2024,5,21,0
564,5133,274,Fridge,Appliances,5,1224.93,6/20/2024 9:14,6,"Los Angeles, CA",469,93,250,145,3,37,Male,27226.42,Silver,Credit Card,True,0,Cloudy,False,Thursday,False,296,154,2024-06-20 09:14:00,2024,6,25,0
565,2341,443,Smartphone,Appliances,3,1137.76,4/26/2024 21:42,17,"New York, NY",367,99,119,101,5,45,Female,39540.87,Bronze,Credit Card,False,0,Cloudy,False,Thursday,True,458,299,2024-04-26 21:42:00,2024,4,17,0
566,8705,679,Fridge,Electronics,5,639.87,5/18/2024 2:04,2,"Miami, FL",392,61,275,159,3,53,Male,99783.06,Gold,Credit Card,True,Percentage Discount,Sunny,False,Monday,False,228,472,2024-05-18 02:04:00,2024,5,20,0
567,1317,992,Headphones,Appliances,4,1044.36,6/7/2024 19:34,1,"Dallas, TX",5,121,229,101,7,54,Female,92818.7,Platinum,Digital Wallet,False,Percentage Discount,Rainy,True,Thursday,False,201,435,2024-06-07 19:34:00,2024,6,23,0
568,9837,775,Headphones,Appliances,3,1236.62,8/23/2024 0:40,16,"Chicago, IL",56,75,114,227,4,24,Male,72678.01,Gold,Digital Wallet,False,BOGO,Cloudy,True,Monday,False,155,135,2024-08-23 00:40:00,2024,8,34,0
569,1853,983,Fridge,Appliances,3,1438.8,6/18/2024 4:13,5,"Dallas, TX",249,68,177,424,4,41,Other,58420.44,Silver,Digital Wallet,True,BOGO,Stormy,False,Thursday,True,347,355,2024-06-18 04:13:00,2024,6,25,0
570,6733,253,Headphones,Electronics,4,811.68,8/15/2024 7:56,16,"Dallas, TX",199,105,159,173,6,62,Female,70821.63,Gold,Debit Card,True,BOGO,Stormy,True,Thursday,False,408,507,2024-08-15 07:56:00,2024,8,33,0
571,4673,266,Fridge,Appliances,4,839.72,4/17/2024 4:39,6,"Miami, FL",104,142,231,102,3,58,Other,75265.86,Silver,Digital Wallet,False,0,Rainy,False,Thursday,True,436,432,2024-04-17 04:39:00,2024,4,16,0
572,2124,989,Tablet,Appliances,2,1122.36,1/21/2024 9:38,1,"Dallas, TX",498,69,176,357,4,52,Female,37306.97,Bronze,Digital Wallet,False,0,Sunny,True,Friday,False,288,91,2024-01-21 09:38:00,2024,1,3,0
573,1659,248,Tablet,Electronics,3,1035.78,7/28/2024 13:56,18,"Chicago, IL",55,61,278,177,2,65,Male,34814.39,Platinum,Credit Card,True,0,Sunny,False,Friday,False,451,325,2024-07-28 13:56:00,2024,7,30,0
574,1508,283,Camera,Electronics,3,1123.46,4/28/2024 10:26,4,"Los Angeles, CA",385,76,161,222,8,30,Female,113874.35,Bronze,Credit Card,True,0,Sunny,True,Sunday,True,372,379,2024-04-28 10:26:00,2024,4,17,0
575,5051,887,Smartphone,Appliances,3,914.42,5/25/2024 3:44,10,"Dallas, TX",310,118,111,231,6,31,Other,30112.05,Gold,Cash,True,0,Sunny,False,Saturday,False,173,109,2024-05-25 03:44:00,2024,5,21,0
576,4266,829,Headphones,Electronics,3,450.46,4/6/2024 7:16,15,"Miami, FL",46,82,297,149,5,43,Female,44639.93,Platinum,Digital Wallet,False,0,Sunny,False,Saturday,False,467,113,2024-04-06 07:16:00,2024,4,14,0
577,1333,152,TV,Electronics,2,94.57,1/27/2024 0:19,5,"Los Angeles, CA",292,65,251,493,9,39,Other,78566.3,Silver,Cash,False,BOGO,Stormy,False,Saturday,False,489,315,2024-01-27 00:19:00,2024,1,4,0
578,3496,529,Fridge,Electronics,3,353.33,1/18/2024 16:33,7,"New York, NY",422,138,220,307,8,57,Other,91031.3,Platinum,Cash,True,0,Sunny,True,Saturday,False,278,316,2024-01-18 16:33:00,2024,1,3,0
579,4908,415,Headphones,Appliances,3,82.94,5/16/2024 22:11,15,"Miami, FL",257,96,245,104,8,66,Other,37265.67,Platinum,Debit Card,False,0,Sunny,True,Wednesday,True,173,242,2024-05-16 22:11:00,2024,5,20,0
580,3068,416,Laptop,Appliances,1,984.02,6/30/2024 8:55,7,"Los Angeles, CA",441,94,224,405,2,46,Other,92008.65,Platinum,Credit Card,False,0,Rainy,False,Saturday,False,192,355,2024-06-30 08:55:00,2024,6,26,0
581,8758,847,Smartphone,Appliances,3,204.58,3/9/2024 15:51,12,"Dallas, TX",217,59,184,450,4,37,Other,77537.62,Silver,Debit Card,True,0,Sunny,False,Tuesday,False,182,268,2024-03-09 15:51:00,2024,3,10,0
582,2874,887,Washing Machine,Electronics,5,513.7,4/11/2024 1:29,14,"Los Angeles, CA",124,51,297,414,3,49,Other,99568.46,Bronze,Credit Card,True,Percentage Discount,Cloudy,True,Tuesday,False,493,144,2024-04-11 01:29:00,2024,4,15,0
583,4571,556,Laptop,Appliances,1,828.34,8/26/2024 6:20,10,"Los Angeles, CA",238,123,196,112,1,20,Male,56159.7,Bronze,Cash,True,BOGO,Stormy,False,Thursday,False,409,505,2024-08-26 06:20:00,2024,8,35,0
584,8619,395,Tablet,Appliances,4,262.11,9/13/2024 11:46,1,"Chicago, IL",349,135,231,395,3,58,Male,21927.14,Silver,Cash,True,BOGO,Rainy,False,Wednesday,False,389,423,2024-09-13 11:46:00,2024,9,37,0
585,5198,741,Tablet,Electronics,5,273.31,4/2/2024 22:12,15,"Chicago, IL",333,95,283,337,1,55,Male,27996.76,Bronze,Credit Card,True,BOGO,Stormy,True,Wednesday,True,134,106,2024-04-02 22:12:00,2024,4,14,0
586,7043,285,Fridge,Appliances,5,1281.61,3/11/2024 11:38,17,"Miami, FL",8,84,166,277,7,24,Female,60212.85,Silver,Debit Card,True,0,Sunny,True,Wednesday,True,477,129,2024-03-11 11:38:00,2024,3,11,0
587,3749,220,Fridge,Appliances,5,1352.41,9/10/2024 4:32,8,"Miami, FL",428,66,145,350,2,36,Male,85907.53,Bronze,Cash,False,0,Stormy,False,Friday,True,158,321,2024-09-10 04:32:00,2024,9,37,0
588,2876,234,Headphones,Appliances,2,104.32,7/19/2024 0:10,1,"New York, NY",268,130,130,460,4,50,Female,25592.37,Gold,Digital Wallet,False,0,Sunny,False,Sunday,False,441,437,2024-07-19 00:10:00,2024,7,29,0
589,3683,307,Fridge,Electronics,5,1706.96,2/15/2024 23:20,18,"Los Angeles, CA",185,96,242,366,10,47,Male,103315.31,Silver,Cash,False,0,Rainy,True,Wednesday,True,497,254,2024-02-15 23:20:00,2024,2,7,0
590,6096,103,Smartphone,Appliances,2,1489.54,7/12/2024 14:04,8,"Los Angeles, CA",341,148,131,373,3,65,Male,28662.81,Silver,Credit Card,False,0,Cloudy,True,Sunday,True,373,144,2024-07-12 14:04:00,2024,7,28,0
591,2771,737,Smartphone,Electronics,3,1117.0,4/27/2024 12:45,2,"Miami, FL",177,68,242,281,1,62,Male,95608.93,Bronze,Debit Card,True,0,Cloudy,True,Sunday,True,451,312,2024-04-27 12:45:00,2024,4,17,0
592,1420,883,Camera,Appliances,3,1624.2,8/24/2024 5:46,13,"New York, NY",115,111,294,158,4,25,Female,41459.27,Platinum,Debit Card,True,Percentage Discount,Cloudy,False,Thursday,True,237,323,2024-08-24 05:46:00,2024,8,34,0
593,6111,359,Smartphone,Appliances,5,244.55,8/29/2024 23:51,20,"Dallas, TX",415,93,108,305,2,56,Female,35834.75,Platinum,Debit Card,False,0,Cloudy,False,Friday,True,126,286,2024-08-29 23:51:00,2024,8,35,0
594,7149,112,Smartphone,Electronics,4,1860.38,9/9/2024 19:23,15,"New York, NY",198,50,116,304,9,29,Female,66982.41,Bronze,Cash,True,BOGO,Sunny,True,Monday,True,102,490,2024-09-09 19:23:00,2024,9,37,0
595,7498,569,TV,Electronics,3,1311.73,4/25/2024 11:47,17,"Miami, FL",2,97,234,143,7,62,Other,104951.43,Bronze,Cash,False,0,Cloudy,False,Sunday,True,168,426,2024-04-25 11:47:00,2024,4,17,0
596,4249,609,Washing Machine,Electronics,2,1103.04,4/12/2024 10:06,20,"New York, NY",215,101,291,388,8,61,Female,38802.1,Bronze,Debit Card,False,0,Sunny,False,Saturday,False,284,370,2024-04-12 10:06:00,2024,4,15,0
597,2245,975,Smartphone,Appliances,5,1304.97,8/30/2024 23:40,19,"Miami, FL",403,119,220,109,7,56,Other,71111.79,Silver,Debit Card,True,BOGO,Rainy,True,Thursday,True,175,216,2024-08-30 23:40:00,2024,8,35,0
598,4978,610,Tablet,Electronics,3,1702.3,8/6/2024 20:18,19,"Chicago, IL",76,114,171,355,8,66,Other,49253.53,Bronze,Digital Wallet,True,BOGO,Rainy,False,Saturday,True,116,240,2024-08-06 20:18:00,2024,8,32,0
599,2669,656,Washing Machine,Electronics,4,1579.07,6/1/2024 22:26,12,"Miami, FL",88,131,218,302,5,18,Male,47739.87,Gold,Debit Card,False,0,Rainy,True,Sunday,False,352,483,2024-06-01 22:26:00,2024,6,22,0
600,5941,926,TV,Electronics,3,241.67,9/8/2024 19:23,4,"Los Angeles, CA",98,57,142,233,5,50,Male,114864.46,Silver,Debit Card,True,BOGO,Rainy,False,Sunday,False,236,155,2024-09-08 19:23:00,2024,9,36,0
601,2983,105,Smartphone,Electronics,1,1545.68,5/12/2024 23:09,9,"Los Angeles, CA",6,115,253,259,9,68,Male,63893.82,Silver,Debit Card,True,0,Stormy,True,Sunday,True,198,284,2024-05-12 23:09:00,2024,5,19,0
602,1672,722,TV,Electronics,5,1640.18,2/9/2024 16:37,12,"Los Angeles, CA",211,85,123,236,3,32,Other,63823.13,Silver,Digital Wallet,True,Percentage Discount,Stormy,True,Wednesday,True,481,405,2024-02-09 16:37:00,2024,2,6,0
603,6688,605,Laptop,Electronics,5,101.78,1/21/2024 18:44,10,"Miami, FL",96,132,282,406,3,32,Female,47570.21,Gold,Digital Wallet,True,BOGO,Cloudy,True,Sunday,False,246,460,2024-01-21 18:44:00,2024,1,3,0
604,9728,343,Smartphone,Electronics,2,1663.66,2/11/2024 4:18,20,"Chicago, IL",178,117,277,124,9,51,Female,54332.66,Bronze,Debit Card,True,Percentage Discount,Sunny,False,Tuesday,False,322,506,2024-02-11 04:18:00,2024,2,6,0
605,8018,322,TV,Electronics,2,63.73,5/17/2024 8:08,18,"Chicago, IL",213,72,158,243,8,26,Male,47388.31,Gold,Cash,True,0,Sunny,True,Thursday,True,239,456,2024-05-17 08:08:00,2024,5,20,0
606,7071,702,Headphones,Appliances,2,833.49,3/3/2024 8:29,7,"New York, NY",240,139,126,214,9,65,Male,103102.25,Gold,Debit Card,True,0,Sunny,False,Sunday,False,374,91,2024-03-03 08:29:00,2024,3,9,0
607,2129,775,Fridge,Appliances,1,1444.77,3/6/2024 14:53,14,"Los Angeles, CA",105,51,131,402,1,42,Female,57409.91,Gold,Debit Card,True,0,Stormy,True,Friday,False,432,214,2024-03-06 14:53:00,2024,3,10,0
608,9289,587,Washing Machine,Appliances,5,1707.13,2/16/2024 7:42,15,"New York, NY",328,106,140,247,8,40,Male,85014.11,Bronze,Digital Wallet,True,0,Sunny,False,Thursday,True,163,276,2024-02-16 07:42:00,2024,2,7,0
609,6590,564,Tablet,Electronics,3,1212.18,1/15/2024 3:47,3,"Los Angeles, CA",377,70,198,481,4,45,Female,119880.95,Platinum,Digital Wallet,True,0,Cloudy,False,Wednesday,True,358,383,2024-01-15 03:47:00,2024,1,3,0
610,1207,519,Smartphone,Appliances,5,1752.5,3/11/2024 7:41,9,"Miami, FL",180,110,191,443,10,25,Other,64159.16,Silver,Debit Card,True,BOGO,Stormy,True,Friday,True,307,133,2024-03-11 07:41:00,2024,3,11,0
611,7882,552,Tablet,Appliances,4,141.8,6/10/2024 22:53,13,"Miami, FL",251,59,258,461,1,54,Female,114715.85,Platinum,Credit Card,True,0,Cloudy,True,Saturday,False,472,128,2024-06-10 22:53:00,2024,6,24,0
612,9031,181,Headphones,Electronics,2,1192.97,6/27/2024 19:32,16,"Los Angeles, CA",232,69,277,304,1,48,Other,95767.51,Bronze,Credit Card,True,0,Sunny,True,Monday,False,369,117,2024-06-27 19:32:00,2024,6,26,0
613,2729,715,Tablet,Appliances,5,477.92,7/4/2024 13:25,9,"Miami, FL",191,100,212,467,5,52,Other,39378.23,Bronze,Debit Card,True,BOGO,Cloudy,False,Thursday,True,231,136,2024-07-04 13:25:00,2024,7,27,0
614,8102,714,Fridge,Appliances,4,1569.7,7/20/2024 7:32,19,"New York, NY",200,74,179,138,10,58,Female,26718.32,Bronze,Cash,True,BOGO,Cloudy,False,Friday,False,165,233,2024-07-20 07:32:00,2024,7,29,0
615,6934,106,Tablet,Electronics,2,1199.49,3/29/2024 5:16,2,"Los Angeles, CA",317,76,199,322,7,69,Other,53869.42,Platinum,Digital Wallet,True,BOGO,Stormy,True,Sunday,True,283,135,2024-03-29 05:16:00,2024,3,13,0
616,8532,350,Headphones,Appliances,5,330.76,3/25/2024 3:46,14,"New York, NY",374,89,101,431,4,67,Female,118418.4,Silver,Credit Card,True,0,Cloudy,False,Sunday,False,303,254,2024-03-25 03:46:00,2024,3,13,0
617,3506,660,Tablet,Appliances,5,1128.89,1/18/2024 10:26,13,"Miami, FL",148,54,155,172,1,55,Male,104102.27,Bronze,Debit Card,True,BOGO,Stormy,True,Thursday,True,210,176,2024-01-18 10:26:00,2024,1,3,0
618,8135,384,Camera,Electronics,5,1792.26,4/28/2024 14:59,17,"Miami, FL",85,138,114,164,10,42,Male,65555.77,Gold,Credit Card,True,BOGO,Sunny,True,Thursday,False,327,93,2024-04-28 14:59:00,2024,4,17,0
619,3885,734,Laptop,Electronics,5,486.61,4/6/2024 6:07,17,"Dallas, TX",392,134,133,453,7,52,Male,56886.99,Gold,Debit Card,True,Percentage Discount,Cloudy,False,Wednesday,False,462,205,2024-04-06 06:07:00,2024,4,14,0
620,9548,743,TV,Electronics,3,1815.31,2/8/2024 0:20,14,"Los Angeles, CA",311,73,275,186,7,22,Male,73068.72,Gold,Cash,False,BOGO,Rainy,True,Thursday,False,397,351,2024-02-08 00:20:00,2024,2,6,0
621,5425,670,Washing Machine,Appliances,1,1047.19,2/7/2024 22:41,15,"Los Angeles, CA",266,134,154,338,7,26,Other,115840.87,Bronze,Cash,True,BOGO,Cloudy,False,Sunday,True,401,348,2024-02-07 22:41:00,2024,2,6,0
622,9817,939,Washing Machine,Electronics,2,1862.91,1/12/2024 21:17,12,"Chicago, IL",158,129,127,453,8,42,Other,57156.41,Platinum,Debit Card,False,0,Sunny,False,Saturday,True,336,166,2024-01-12 21:17:00,2024,1,2,0
623,8921,945,Tablet,Electronics,2,901.48,6/6/2024 19:45,3,"Los Angeles, CA",409,77,134,327,7,43,Other,76343.24,Platinum,Debit Card,True,Percentage Discount,Rainy,True,Friday,False,484,381,2024-06-06 19:45:00,2024,6,23,0
624,8616,312,Laptop,Appliances,1,642.39,8/28/2024 20:50,18,"New York, NY",33,112,118,167,3,44,Male,62070.37,Platinum,Digital Wallet,False,0,Sunny,True,Thursday,False,490,171,2024-08-28 20:50:00,2024,8,35,0
625,8136,150,Laptop,Electronics,1,1809.13,5/23/2024 4:40,11,"Dallas, TX",0,117,225,320,10,61,Other,113169.31,Platinum,Debit Card,True,0,Sunny,False,Tuesday,False,220,300,2024-05-23 04:40:00,2024,5,21,0
626,5397,289,Headphones,Electronics,5,1846.57,3/22/2024 1:55,16,"Los Angeles, CA",409,63,235,153,7,57,Male,116832.22,Gold,Cash,False,0,Cloudy,True,Wednesday,True,375,258,2024-03-22 01:55:00,2024,3,12,0
627,6280,251,Laptop,Electronics,4,523.09,1/6/2024 20:03,4,"New York, NY",152,143,129,109,1,55,Male,98130.79,Platinum,Debit Card,True,BOGO,Cloudy,True,Tuesday,False,383,316,2024-01-06 20:03:00,2024,1,1,0
628,5022,156,Laptop,Electronics,2,666.56,3/18/2024 7:20,3,"Chicago, IL",450,150,214,274,3,25,Other,53576.28,Silver,Debit Card,False,BOGO,Sunny,True,Friday,False,110,151,2024-03-18 07:20:00,2024,3,12,0
629,2419,768,Tablet,Electronics,1,870.41,5/2/2024 0:35,14,"Chicago, IL",4,81,292,237,10,42,Female,87282.45,Bronze,Cash,False,0,Cloudy,True,Tuesday,True,281,295,2024-05-02 00:35:00,2024,5,18,0
630,5569,457,TV,Electronics,2,689.41,1/31/2024 10:49,10,"Miami, FL",429,69,104,499,7,64,Male,29296.03,Platinum,Cash,False,Percentage Discount,Rainy,False,Tuesday,False,186,164,2024-01-31 10:49:00,2024,1,5,0
631,8385,137,Laptop,Appliances,1,1046.51,3/19/2024 14:10,12,"Los Angeles, CA",498,102,178,431,5,54,Other,63855.1,Gold,Debit Card,True,Percentage Discount,Cloudy,True,Wednesday,True,382,129,2024-03-19 14:10:00,2024,3,12,0
632,4995,248,Fridge,Electronics,4,856.84,3/1/2024 5:27,14,"Los Angeles, CA",363,110,145,119,10,54,Male,98313.58,Bronze,Credit Card,True,Percentage Discount,Rainy,False,Saturday,False,275,199,2024-03-01 05:27:00,2024,3,9,0
633,8613,974,Headphones,Electronics,1,1061.2,8/3/2024 21:33,2,"Los Angeles, CA",18,70,280,186,10,28,Male,58689.08,Platinum,Cash,False,0,Stormy,False,Friday,True,102,95,2024-08-03 21:33:00,2024,8,31,0
634,7209,133,Washing Machine,Electronics,4,1472.73,5/5/2024 17:51,12,"Miami, FL",111,107,162,470,2,64,Other,35417.12,Gold,Debit Card,True,0,Cloudy,True,Sunday,True,415,223,2024-05-05 17:51:00,2024,5,18,0
635,6511,783,Washing Machine,Electronics,3,489.31,8/16/2024 19:15,20,"Dallas, TX",437,81,135,295,1,63,Female,96835.55,Bronze,Credit Card,False,0,Stormy,True,Monday,False,470,478,2024-08-16 19:15:00,2024,8,33,0
636,1470,691,Camera,Electronics,3,1950.11,8/13/2024 5:21,12,"Los Angeles, CA",381,81,226,109,5,47,Male,63417.24,Silver,Digital Wallet,True,0,Cloudy,False,Monday,True,499,474,2024-08-13 05:21:00,2024,8,33,0
637,9098,958,Fridge,Electronics,5,709.72,5/27/2024 4:55,13,"Los Angeles, CA",81,69,180,481,8,46,Male,109063.65,Platinum,Cash,False,BOGO,Stormy,False,Sunday,False,308,236,2024-05-27 04:55:00,2024,5,22,0
638,6325,717,Camera,Appliances,3,1396.51,2/19/2024 0:51,7,"Miami, FL",240,102,234,192,2,61,Male,68016.95,Gold,Debit Card,False,0,Stormy,False,Monday,False,278,119,2024-02-19 00:51:00,2024,2,8,0
639,3979,405,Camera,Appliances,2,75.88,7/10/2024 14:44,10,"Miami, FL",104,66,239,367,7,19,Male,29304.51,Gold,Digital Wallet,False,0,Cloudy,False,Wednesday,False,302,235,2024-07-10 14:44:00,2024,7,28,0
640,8988,439,Camera,Appliances,3,999.33,4/18/2024 16:02,8,"New York, NY",9,107,241,432,5,61,Other,113829.76,Platinum,Credit Card,True,Percentage Discount,Cloudy,True,Wednesday,True,376,353,2024-04-18 16:02:00,2024,4,16,0
641,4475,189,Camera,Appliances,4,510.44,6/15/2024 17:36,3,"New York, NY",111,107,123,254,10,50,Other,111117.48,Silver,Debit Card,False,BOGO,Rainy,False,Tuesday,True,294,373,2024-06-15 17:36:00,2024,6,24,0
642,6813,150,TV,Electronics,3,248.04,1/15/2024 12:07,17,"Miami, FL",385,142,120,311,6,69,Female,36014.3,Platinum,Debit Card,True,0,Sunny,False,Sunday,False,261,417,2024-01-15 12:07:00,2024,1,3,0
643,5232,211,Camera,Appliances,3,383.08,7/31/2024 17:34,2,"Dallas, TX",65,104,236,282,5,58,Other,116831.38,Bronze,Cash,False,Percentage Discount,Rainy,True,Sunday,False,158,315,2024-07-31 17:34:00,2024,7,31,0
644,6576,526,Fridge,Appliances,4,1620.51,3/24/2024 1:05,15,"Dallas, TX",157,106,181,469,6,45,Male,101563.47,Gold,Credit Card,True,BOGO,Stormy,True,Tuesday,True,378,238,2024-03-24 01:05:00,2024,3,12,0
645,5581,282,Fridge,Electronics,5,1802.66,8/23/2024 14:02,7,"Chicago, IL",392,87,256,269,9,62,Other,32551.3,Silver,Cash,False,Percentage Discount,Sunny,False,Saturday,True,419,290,2024-08-23 14:02:00,2024,8,34,0
646,5526,265,Laptop,Appliances,2,475.14,3/2/2024 14:41,19,"Chicago, IL",268,105,142,399,5,68,Female,116279.13,Bronze,Cash,False,Percentage Discount,Sunny,False,Monday,False,109,394,2024-03-02 14:41:00,2024,3,9,0
647,1166,788,Camera,Electronics,2,679.66,3/5/2024 5:50,5,"Los Angeles, CA",89,128,106,172,5,42,Female,99503.73,Gold,Credit Card,True,BOGO,Stormy,False,Monday,False,164,311,2024-03-05 05:50:00,2024,3,10,0
648,9464,391,Camera,Electronics,1,713.51,1/6/2024 6:28,1,"Los Angeles, CA",363,92,206,146,7,40,Male,99916.32,Bronze,Debit Card,True,0,Cloudy,True,Thursday,True,498,140,2024-01-06 06:28:00,2024,1,1,0
649,4130,725,Tablet,Electronics,2,133.28,5/3/2024 13:17,2,"Chicago, IL",227,114,155,462,6,47,Female,53063.66,Gold,Digital Wallet,True,Percentage Discount,Cloudy,False,Saturday,True,444,489,2024-05-03 13:17:00,2024,5,18,0
650,2402,776,Laptop,Electronics,1,1696.11,7/26/2024 13:21,5,"Chicago, IL",155,115,106,371,8,68,Male,114626.48,Silver,Digital Wallet,False,Percentage Discount,Stormy,False,Monday,True,455,93,2024-07-26 13:21:00,2024,7,30,0
651,4954,808,Washing Machine,Electronics,1,670.67,7/3/2024 6:02,12,"Chicago, IL",442,65,166,400,8,36,Male,76423.55,Silver,Debit Card,True,0,Sunny,True,Saturday,True,248,422,2024-07-03 06:02:00,2024,7,27,0
652,7658,816,Fridge,Electronics,3,1368.43,5/14/2024 1:40,17,"Chicago, IL",355,124,129,262,2,52,Male,90618.0,Platinum,Cash,True,0,Cloudy,True,Monday,True,326,254,2024-05-14 01:40:00,2024,5,20,0
653,9004,709,Smartphone,Appliances,3,113.83,8/15/2024 21:05,12,"Los Angeles, CA",195,131,197,296,4,64,Male,51737.83,Platinum,Digital Wallet,True,0,Sunny,False,Saturday,True,186,392,2024-08-15 21:05:00,2024,8,33,0
654,4937,686,Laptop,Electronics,5,297.61,7/3/2024 3:15,14,"Los Angeles, CA",105,87,188,376,8,45,Female,58443.37,Platinum,Credit Card,False,BOGO,Rainy,True,Wednesday,False,212,407,2024-07-03 03:15:00,2024,7,27,0
655,8800,906,Tablet,Appliances,4,232.55,1/22/2024 3:09,11,"Miami, FL",383,147,133,359,2,41,Other,99255.88,Bronze,Cash,True,0,Sunny,True,Sunday,False,184,123,2024-01-22 03:09:00,2024,1,4,0
656,9041,675,Headphones,Electronics,3,982.96,5/6/2024 12:17,7,"Dallas, TX",406,99,216,305,6,56,Other,107877.95,Bronze,Cash,False,0,Cloudy,False,Monday,True,212,178,2024-05-06 12:17:00,2024,5,19,0
657,8342,281,TV,Appliances,4,1226.83,3/16/2024 7:42,8,"Los Angeles, CA",166,118,142,228,4,46,Female,29848.38,Bronze,Digital Wallet,False,0,Cloudy,True,Sunday,True,365,214,2024-03-16 07:42:00,2024,3,11,0
658,1282,566,Camera,Electronics,1,1760.49,4/20/2024 19:06,16,"Los Angeles, CA",65,107,201,419,5,46,Male,86182.01,Gold,Digital Wallet,False,0,Sunny,False,Sunday,True,372,341,2024-04-20 19:06:00,2024,4,16,0
659,2524,867,Washing Machine,Appliances,2,484.16,7/10/2024 18:24,16,"New York, NY",349,131,122,394,3,60,Other,98183.24,Gold,Credit Card,False,0,Cloudy,False,Friday,True,330,300,2024-07-10 18:24:00,2024,7,28,0
660,5820,692,Washing Machine,Electronics,5,584.0,7/8/2024 11:38,16,"Dallas, TX",371,140,241,211,8,38,Male,46808.4,Gold,Cash,False,BOGO,Rainy,True,Monday,False,329,330,2024-07-08 11:38:00,2024,7,28,0
661,4630,468,Fridge,Electronics,2,1653.23,7/22/2024 3:45,8,"Dallas, TX",117,108,245,198,9,56,Female,21048.17,Bronze,Cash,False,BOGO,Cloudy,False,Monday,False,316,333,2024-07-22 03:45:00,2024,7,30,0
662,7625,136,TV,Electronics,5,563.64,1/22/2024 18:31,1,"Miami, FL",402,146,126,442,10,47,Female,71902.14,Platinum,Credit Card,True,0,Cloudy,True,Wednesday,True,394,159,2024-01-22 18:31:00,2024,1,4,0
663,4986,195,Laptop,Appliances,1,656.8,2/21/2024 0:02,7,"Chicago, IL",174,87,102,399,4,49,Female,92634.18,Silver,Digital Wallet,True,Percentage Discount,Stormy,False,Wednesday,True,219,345,2024-02-21 00:02:00,2024,2,8,0
664,6016,886,Camera,Appliances,1,1964.62,6/24/2024 11:32,4,"Dallas, TX",429,124,247,330,3,45,Other,71772.82,Gold,Credit Card,False,Percentage Discount,Stormy,False,Thursday,False,401,457,2024-06-24 11:32:00,2024,6,26,0
665,7046,406,Laptop,Appliances,2,1097.92,3/14/2024 5:34,13,"Los Angeles, CA",211,137,188,240,9,48,Female,100810.22,Platinum,Digital Wallet,True,0,Rainy,True,Monday,True,418,106,2024-03-14 05:34:00,2024,3,11,0
666,8753,430,Camera,Appliances,3,254.11,8/3/2024 10:01,16,"Miami, FL",41,69,157,280,8,31,Other,21355.46,Platinum,Cash,False,0,Cloudy,True,Friday,False,364,256,2024-08-03 10:01:00,2024,8,31,0
667,9698,477,Laptop,Electronics,1,198.88,3/12/2024 17:22,18,"Dallas, TX",59,123,124,197,4,62,Male,86310.63,Silver,Credit Card,False,0,Cloudy,False,Tuesday,False,129,322,2024-03-12 17:22:00,2024,3,11,0
668,6632,488,Camera,Electronics,2,174.59,3/15/2024 13:38,16,"Chicago, IL",285,87,110,410,3,60,Female,47321.03,Silver,Digital Wallet,False,0,Sunny,True,Wednesday,False,301,492,2024-03-15 13:38:00,2024,3,11,0
669,7971,939,Washing Machine,Appliances,1,1781.14,6/13/2024 5:48,4,"Miami, FL",263,84,104,132,3,68,Female,35950.39,Bronze,Cash,True,0,Rainy,False,Thursday,False,365,355,2024-06-13 05:48:00,2024,6,24,0
670,6419,169,TV,Appliances,2,1904.4,8/1/2024 3:09,19,"Chicago, IL",353,127,117,372,8,69,Other,98119.52,Silver,Digital Wallet,False,0,Rainy,True,Monday,False,168,465,2024-08-01 03:09:00,2024,8,31,0
671,6764,876,Washing Machine,Electronics,4,1320.23,7/3/2024 7:17,6,"Miami, FL",385,128,217,121,7,58,Female,107572.86,Silver,Digital Wallet,False,0,Sunny,True,Thursday,True,133,313,2024-07-03 07:17:00,2024,7,27,0
672,8434,537,Fridge,Appliances,3,1418.04,9/5/2024 7:54,14,"New York, NY",77,74,254,190,7,50,Other,96093.26,Gold,Digital Wallet,True,0,Cloudy,True,Tuesday,True,209,267,2024-09-05 07:54:00,2024,9,36,0
673,5438,963,Tablet,Appliances,4,1517.46,5/24/2024 8:28,4,"New York, NY",6,150,268,219,6,19,Other,59787.57,Gold,Credit Card,False,0,Stormy,False,Friday,True,175,265,2024-05-24 08:28:00,2024,5,21,0
674,6023,663,Camera,Appliances,3,1875.61,7/8/2024 4:06,12,"Chicago, IL",494,59,146,377,5,20,Female,30701.13,Silver,Digital Wallet,False,0,Sunny,True,Saturday,False,286,444,2024-07-08 04:06:00,2024,7,28,0
675,5118,166,Fridge,Electronics,5,1956.66,4/13/2024 15:27,10,"New York, NY",124,75,293,250,9,47,Other,81330.92,Silver,Cash,True,0,Stormy,True,Monday,True,268,501,2024-04-13 15:27:00,2024,4,15,0
676,4777,399,Washing Machine,Appliances,5,1596.89,4/12/2024 13:35,18,"Los Angeles, CA",427,103,182,384,5,38,Male,23729.62,Platinum,Digital Wallet,True,0,Stormy,False,Thursday,False,138,168,2024-04-12 13:35:00,2024,4,15,0
677,2976,582,Tablet,Appliances,4,1709.12,7/10/2024 20:35,16,"Los Angeles, CA",499,112,116,325,3,20,Other,82944.27,Bronze,Cash,True,0,Sunny,True,Monday,True,333,92,2024-07-10 20:35:00,2024,7,28,0
678,4155,237,Fridge,Electronics,2,436.98,6/12/2024 11:38,5,"Los Angeles, CA",276,94,157,310,8,64,Other,66304.28,Platinum,Cash,True,0,Cloudy,True,Sunday,False,102,257,2024-06-12 11:38:00,2024,6,24,0
679,6169,224,Headphones,Appliances,3,1094.72,4/6/2024 13:23,1,"Miami, FL",1,131,201,143,5,70,Female,74193.64,Silver,Digital Wallet,True,0,Rainy,True,Wednesday,True,391,227,2024-04-06 13:23:00,2024,4,14,0
680,2958,811,TV,Appliances,5,915.74,9/12/2024 16:47,4,"Los Angeles, CA",351,113,263,427,10,44,Other,79155.86,Bronze,Credit Card,True,0,Rainy,True,Tuesday,False,162,375,2024-09-12 16:47:00,2024,9,37,0
681,9779,980,Smartphone,Electronics,3,682.38,7/26/2024 19:28,5,"Miami, FL",431,70,143,255,5,51,Other,52914.17,Silver,Credit Card,False,Percentage Discount,Cloudy,False,Tuesday,False,285,201,2024-07-26 19:28:00,2024,7,30,0
682,4033,381,Laptop,Electronics,4,1512.6,5/22/2024 0:21,9,"Los Angeles, CA",219,143,139,255,7,26,Female,77615.53,Platinum,Debit Card,True,0,Stormy,False,Wednesday,True,395,325,2024-05-22 00:21:00,2024,5,21,0
683,4138,437,Smartphone,Electronics,1,1647.31,4/9/2024 15:46,2,"Miami, FL",438,146,149,230,5,30,Other,27975.9,Platinum,Cash,True,Percentage Discount,Cloudy,True,Sunday,True,443,502,2024-04-09 15:46:00,2024,4,15,0
684,4545,639,Washing Machine,Electronics,5,1564.07,2/5/2024 0:43,5,"Chicago, IL",422,101,239,214,6,59,Male,30070.31,Bronze,Credit Card,True,0,Stormy,False,Sunday,True,211,488,2024-02-05 00:43:00,2024,2,6,0
685,8933,523,Tablet,Appliances,4,1223.39,3/19/2024 0:03,12,"Chicago, IL",344,102,266,474,5,64,Male,75598.81,Silver,Digital Wallet,True,0,Stormy,True,Thursday,False,133,248,2024-03-19 00:03:00,2024,3,12,0
686,5530,637,Headphones,Electronics,1,1500.13,2/26/2024 13:27,10,"Los Angeles, CA",360,114,104,466,1,33,Other,69957.37,Bronze,Credit Card,False,0,Cloudy,True,Saturday,True,298,294,2024-02-26 13:27:00,2024,2,9,0
687,9595,314,Washing Machine,Electronics,5,1186.42,3/12/2024 18:43,11,"New York, NY",368,83,119,214,4,67,Other,117647.48,Platinum,Credit Card,True,0,Sunny,False,Friday,True,248,400,2024-03-12 18:43:00,2024,3,11,0
688,5636,812,Smartphone,Electronics,5,903.93,9/4/2024 11:19,11,"Chicago, IL",298,140,155,442,1,48,Female,86354.06,Bronze,Cash,False,0,Cloudy,True,Saturday,True,408,457,2024-09-04 11:19:00,2024,9,36,0
689,2647,314,Washing Machine,Appliances,2,1751.79,7/3/2024 23:47,1,"Chicago, IL",168,127,269,446,1,33,Female,72339.39,Platinum,Digital Wallet,True,0,Cloudy,True,Friday,False,427,437,2024-07-03 23:47:00,2024,7,27,0
690,4180,726,Tablet,Electronics,1,1254.92,7/18/2024 21:03,2,"Dallas, TX",258,50,214,493,3,32,Female,71932.17,Silver,Credit Card,False,0,Stormy,True,Wednesday,False,199,112,2024-07-18 21:03:00,2024,7,29,0
691,5853,159,Washing Machine,Appliances,3,1098.57,2/24/2024 6:56,11,"Dallas, TX",341,137,108,325,2,54,Other,27649.43,Platinum,Digital Wallet,False,0,Stormy,False,Thursday,True,470,307,2024-02-24 06:56:00,2024,2,8,0
692,4727,211,TV,Appliances,3,1753.74,9/5/2024 2:18,10,"Miami, FL",211,92,145,218,5,33,Female,64765.94,Silver,Digital Wallet,True,0,Stormy,False,Friday,True,337,477,2024-09-05 02:18:00,2024,9,36,0
693,6912,685,TV,Appliances,5,327.14,2/22/2024 2:09,19,"Los Angeles, CA",494,79,107,293,4,35,Male,46092.45,Platinum,Cash,False,Percentage Discount,Cloudy,False,Monday,False,376,244,2024-02-22 02:09:00,2024,2,8,0
694,3939,847,TV,Electronics,3,1295.68,1/23/2024 8:21,2,"Chicago, IL",71,101,244,494,7,47,Other,78455.08,Platinum,Cash,True,0,Cloudy,False,Thursday,True,130,344,2024-01-23 08:21:00,2024,1,4,0
695,5952,744,Smartphone,Electronics,2,639.98,7/16/2024 10:58,17,"Chicago, IL",338,133,267,429,7,67,Male,88118.47,Bronze,Digital Wallet,True,0,Cloudy,True,Sunday,True,371,486,2024-07-16 10:58:00,2024,7,29,0
696,1231,641,Tablet,Appliances,3,1567.06,3/12/2024 0:53,2,"New York, NY",34,104,243,430,6,36,Other,62227.15,Silver,Digital Wallet,True,0,Rainy,True,Sunday,True,283,301,2024-03-12 00:53:00,2024,3,11,0
697,9751,189,Tablet,Electronics,3,570.67,3/12/2024 5:39,19,"Dallas, TX",287,106,123,118,10,62,Female,68599.76,Bronze,Cash,False,0,Sunny,True,Wednesday,True,112,218,2024-03-12 05:39:00,2024,3,11,0
698,3073,595,Fridge,Electronics,4,881.39,5/11/2024 7:15,19,"Los Angeles, CA",171,132,252,417,5,23,Female,62360.64,Platinum,Cash,True,BOGO,Rainy,False,Monday,True,340,120,2024-05-11 07:15:00,2024,5,19,0
699,5494,841,Laptop,Appliances,4,619.25,3/19/2024 18:09,18,"Los Angeles, CA",102,114,179,131,6,60,Female,52055.05,Platinum,Digital Wallet,True,0,Stormy,True,Sunday,True,407,280,2024-03-19 18:09:00,2024,3,12,0
700,1745,805,Smartphone,Electronics,2,853.43,7/15/2024 10:11,7,"Miami, FL",470,76,101,362,4,64,Male,67212.2,Platinum,Cash,False,0,Stormy,False,Tuesday,True,126,405,2024-07-15 10:11:00,2024,7,29,0
701,1893,719,Camera,Electronics,1,972.41,4/8/2024 3:33,19,"Dallas, TX",332,147,119,268,9,29,Female,87551.28,Bronze,Debit Card,True,BOGO,Rainy,False,Friday,False,434,90,2024-04-08 03:33:00,2024,4,15,0
702,5786,907,Fridge,Electronics,1,1629.9,4/18/2024 9:58,16,"Los Angeles, CA",495,73,293,324,9,45,Female,72596.23,Platinum,Credit Card,True,0,Rainy,True,Wednesday,True,115,487,2024-04-18 09:58:00,2024,4,16,0
703,3068,823,Headphones,Appliances,2,98.24,4/9/2024 4:06,13,"New York, NY",340,54,170,273,3,49,Other,63016.42,Bronze,Debit Card,False,BOGO,Stormy,False,Wednesday,True,371,416,2024-04-09 04:06:00,2024,4,15,0
704,9042,394,TV,Electronics,5,1534.5,4/29/2024 11:32,15,"Dallas, TX",447,74,199,214,4,53,Female,69226.17,Gold,Credit Card,False,0,Rainy,True,Monday,False,423,443,2024-04-29 11:32:00,2024,4,18,0
705,2680,537,Headphones,Appliances,5,502.21,2/10/2024 4:14,8,"Chicago, IL",32,59,257,498,3,50,Male,103015.58,Platinum,Debit Card,True,BOGO,Stormy,False,Thursday,True,399,236,2024-02-10 04:14:00,2024,2,6,0
706,1200,723,Washing Machine,Appliances,3,1555.69,2/15/2024 23:08,17,"Chicago, IL",363,100,199,477,4,43,Other,73496.21,Platinum,Debit Card,True,BOGO,Cloudy,False,Saturday,True,462,225,2024-02-15 23:08:00,2024,2,7,0
707,5658,968,Tablet,Appliances,1,1464.98,3/11/2024 11:50,17,"Chicago, IL",52,65,121,339,5,70,Male,31824.75,Bronze,Credit Card,True,0,Rainy,True,Wednesday,True,231,96,2024-03-11 11:50:00,2024,3,11,0
708,8690,424,Smartphone,Appliances,2,883.18,8/31/2024 2:19,16,"Los Angeles, CA",48,141,280,408,6,39,Male,62546.03,Bronze,Digital Wallet,False,0,Rainy,False,Tuesday,True,482,449,2024-08-31 02:19:00,2024,8,35,0
709,8843,365,Washing Machine,Appliances,3,631.42,1/29/2024 13:35,5,"Miami, FL",335,141,160,256,4,46,Other,37789.81,Gold,Debit Card,False,0,Stormy,False,Thursday,False,135,372,2024-01-29 13:35:00,2024,1,5,0
710,8216,638,Tablet,Electronics,2,92.22,6/21/2024 0:31,10,"New York, NY",476,149,203,326,4,21,Other,40130.69,Gold,Debit Card,False,0,Cloudy,True,Thursday,False,267,504,2024-06-21 00:31:00,2024,6,25,0
711,6582,688,Camera,Appliances,2,892.41,8/13/2024 3:37,13,"Chicago, IL",83,76,109,300,6,46,Other,75667.2,Silver,Digital Wallet,True,Percentage Discount,Sunny,True,Thursday,False,353,217,2024-08-13 03:37:00,2024,8,33,0
712,4020,738,TV,Appliances,4,1878.38,7/10/2024 17:16,4,"Los Angeles, CA",257,63,219,485,7,33,Other,113136.98,Bronze,Cash,False,0,Cloudy,False,Monday,True,194,186,2024-07-10 17:16:00,2024,7,28,0
713,1841,462,Tablet,Appliances,2,1245.65,6/17/2024 22:02,13,"New York, NY",390,111,226,210,7,59,Other,56767.19,Gold,Cash,True,0,Sunny,False,Monday,False,173,466,2024-06-17 22:02:00,2024,6,25,0
714,5136,232,Camera,Electronics,2,985.54,7/17/2024 1:14,7,"Dallas, TX",40,107,136,153,9,70,Female,85474.49,Silver,Debit Card,True,BOGO,Stormy,False,Friday,True,148,466,2024-07-17 01:14:00,2024,7,29,0
715,8827,729,Fridge,Electronics,1,1528.85,8/30/2024 23:21,1,"Dallas, TX",238,126,225,370,3,52,Male,56590.89,Gold,Credit Card,True,0,Sunny,True,Sunday,True,417,289,2024-08-30 23:21:00,2024,8,35,0
716,2869,676,Fridge,Electronics,2,1036.76,5/7/2024 21:53,7,"Chicago, IL",248,51,140,466,3,41,Female,81196.2,Gold,Debit Card,False,Percentage Discount,Stormy,True,Saturday,True,315,389,2024-05-07 21:53:00,2024,5,19,0
717,2070,608,Fridge,Electronics,2,456.21,1/18/2024 19:47,10,"Dallas, TX",407,93,109,211,9,34,Female,100831.73,Bronze,Credit Card,True,BOGO,Cloudy,True,Wednesday,False,415,165,2024-01-18 19:47:00,2024,1,3,0
718,7565,632,TV,Electronics,3,282.1,5/13/2024 3:03,8,"Chicago, IL",308,81,261,434,10,43,Female,26598.75,Platinum,Cash,True,0,Stormy,False,Saturday,False,199,128,2024-05-13 03:03:00,2024,5,20,0
719,9056,846,TV,Electronics,4,1185.47,5/28/2024 9:24,17,"Chicago, IL",15,88,290,230,7,18,Male,106130.26,Bronze,Cash,False,Percentage Discount,Rainy,True,Friday,False,385,260,2024-05-28 09:24:00,2024,5,22,0
720,2213,747,Headphones,Electronics,3,1021.53,8/15/2024 13:24,8,"Los Angeles, CA",414,55,172,192,6,65,Male,114791.03,Gold,Digital Wallet,True,0,Rainy,False,Monday,False,150,437,2024-08-15 13:24:00,2024,8,33,0
721,1878,609,Tablet,Appliances,2,933.36,5/18/2024 1:21,2,"Dallas, TX",480,76,193,463,8,65,Female,48845.0,Bronze,Cash,False,0,Rainy,False,Thursday,False,443,160,2024-05-18 01:21:00,2024,5,20,0
722,3485,604,Headphones,Electronics,3,1838.14,5/8/2024 8:38,1,"New York, NY",107,120,112,393,6,66,Male,89953.43,Silver,Cash,False,0,Rainy,False,Saturday,False,105,299,2024-05-08 08:38:00,2024,5,19,0
723,3444,927,Tablet,Appliances,4,1222.77,4/30/2024 0:11,1,"Los Angeles, CA",326,137,278,108,5,41,Other,86647.82,Platinum,Cash,True,Percentage Discount,Stormy,False,Friday,True,186,110,2024-04-30 00:11:00,2024,4,18,0
724,5978,284,Tablet,Appliances,2,1421.44,5/20/2024 7:23,19,"Los Angeles, CA",200,118,282,106,10,27,Male,114017.22,Silver,Digital Wallet,True,BOGO,Sunny,True,Thursday,True,162,423,2024-05-20 07:23:00,2024,5,21,0
725,2395,724,Tablet,Appliances,1,337.24,8/13/2024 4:21,3,"New York, NY",217,78,246,181,3,23,Other,59896.57,Platinum,Credit Card,False,0,Rainy,True,Thursday,False,112,295,2024-08-13 04:21:00,2024,8,33,0
726,5066,338,Camera,Electronics,1,906.41,8/27/2024 7:58,10,"Dallas, TX",197,74,241,246,1,47,Male,98514.85,Silver,Debit Card,True,0,Sunny,True,Saturday,True,183,498,2024-08-27 07:58:00,2024,8,35,0
727,2940,825,TV,Electronics,3,253.7,9/3/2024 9:13,8,"Los Angeles, CA",201,75,101,403,4,31,Male,75755.96,Silver,Debit Card,False,0,Cloudy,True,Thursday,True,276,242,2024-09-03 09:13:00,2024,9,36,0
728,7818,397,Tablet,Electronics,2,817.33,8/26/2024 19:37,11,"New York, NY",117,63,211,184,10,26,Female,28944.26,Gold,Cash,True,0,Rainy,True,Friday,True,145,247,2024-08-26 19:37:00,2024,8,35,0
729,4697,298,Camera,Appliances,4,1141.14,5/29/2024 13:40,6,"Chicago, IL",200,133,288,428,9,22,Female,74321.67,Gold,Credit Card,False,BOGO,Sunny,False,Tuesday,False,367,433,2024-05-29 13:40:00,2024,5,22,0
730,9561,101,Smartphone,Electronics,5,1498.93,9/5/2024 23:58,20,"New York, NY",333,90,152,349,1,33,Other,84102.52,Gold,Credit Card,False,Percentage Discount,Sunny,False,Monday,True,262,141,2024-09-05 23:58:00,2024,9,36,0
731,7232,221,Camera,Electronics,4,1435.81,8/13/2024 15:43,10,"New York, NY",368,135,276,375,2,31,Male,28047.89,Platinum,Debit Card,False,0,Rainy,False,Sunday,True,365,306,2024-08-13 15:43:00,2024,8,33,0
732,8381,124,Fridge,Appliances,5,316.58,5/17/2024 23:59,20,"Los Angeles, CA",480,143,275,275,4,18,Female,87840.81,Gold,Credit Card,True,0,Stormy,True,Sunday,False,182,161,2024-05-17 23:59:00,2024,5,20,0
733,8253,576,Laptop,Appliances,4,1668.24,5/1/2024 23:07,8,"Los Angeles, CA",315,62,189,180,4,58,Other,96873.57,Bronze,Credit Card,False,0,Rainy,True,Wednesday,False,481,184,2024-05-01 23:07:00,2024,5,18,0
734,5871,740,Headphones,Electronics,5,696.28,2/28/2024 11:51,1,"Los Angeles, CA",155,115,158,203,8,39,Male,69017.37,Gold,Digital Wallet,False,Percentage Discount,Cloudy,False,Tuesday,False,216,95,2024-02-28 11:51:00,2024,2,9,0
735,8025,915,Laptop,Appliances,1,768.16,7/9/2024 3:19,16,"Los Angeles, CA",245,52,161,251,7,50,Female,104404.74,Gold,Cash,False,0,Sunny,False,Wednesday,True,343,189,2024-07-09 03:19:00,2024,7,28,0
736,6003,220,TV,Appliances,1,1425.18,2/12/2024 5:46,9,"Miami, FL",89,63,152,304,2,69,Other,68992.74,Bronze,Digital Wallet,True,0,Rainy,True,Wednesday,False,408,223,2024-02-12 05:46:00,2024,2,7,0
737,1986,855,Fridge,Electronics,5,643.38,6/28/2024 18:12,4,"Dallas, TX",259,100,192,470,10,46,Female,47183.58,Bronze,Digital Wallet,True,0,Stormy,False,Friday,False,151,282,2024-06-28 18:12:00,2024,6,26,0
738,2625,968,Fridge,Appliances,3,369.17,9/13/2024 5:15,15,"Los Angeles, CA",37,101,106,437,2,61,Female,118829.51,Platinum,Debit Card,False,0,Rainy,False,Friday,True,382,365,2024-09-13 05:15:00,2024,9,37,0
739,4404,312,Camera,Electronics,2,1652.21,5/29/2024 3:38,19,"Los Angeles, CA",332,85,128,140,6,53,Male,75949.6,Platinum,Credit Card,True,0,Stormy,False,Wednesday,True,287,417,2024-05-29 03:38:00,2024,5,22,0
740,4457,918,Camera,Electronics,5,491.95,9/2/2024 9:54,19,"Los Angeles, CA",126,119,202,262,8,55,Female,52038.25,Bronze,Credit Card,True,0,Cloudy,False,Sunday,True,386,235,2024-09-02 09:54:00,2024,9,36,0
741,5335,730,Smartphone,Appliances,3,635.17,3/31/2024 0:48,14,"Miami, FL",81,51,281,135,8,28,Other,89768.63,Silver,Credit Card,False,BOGO,Stormy,False,Tuesday,False,233,207,2024-03-31 00:48:00,2024,3,13,0
742,2330,524,TV,Electronics,4,783.03,7/3/2024 4:44,11,"Los Angeles, CA",212,70,147,181,1,69,Female,81481.24,Platinum,Cash,True,0,Rainy,False,Thursday,True,320,357,2024-07-03 04:44:00,2024,7,27,0
743,3573,523,Tablet,Appliances,5,1985.7,8/17/2024 10:00,9,"Los Angeles, CA",487,81,207,157,2,58,Other,60377.7,Silver,Debit Card,True,0,Cloudy,False,Wednesday,True,335,432,2024-08-17 10:00:00,2024,8,33,0
744,4929,146,Fridge,Appliances,1,777.05,1/11/2024 18:02,14,"Chicago, IL",434,104,133,486,5,50,Other,61132.32,Gold,Credit Card,False,0,Rainy,False,Tuesday,False,365,392,2024-01-11 18:02:00,2024,1,2,0
745,3847,441,Laptop,Electronics,2,1122.48,9/7/2024 3:14,13,"Dallas, TX",167,67,183,318,2,51,Male,57450.74,Bronze,Debit Card,True,0,Rainy,True,Saturday,True,239,263,2024-09-07 03:14:00,2024,9,36,0
746,2229,458,Washing Machine,Electronics,1,1272.32,5/28/2024 1:20,5,"New York, NY",297,118,117,351,2,18,Male,85885.22,Bronze,Cash,False,0,Cloudy,False,Wednesday,True,192,218,2024-05-28 01:20:00,2024,5,22,0
747,3564,673,Camera,Electronics,4,545.86,4/6/2024 9:20,17,"Chicago, IL",263,57,109,306,2,28,Other,89582.68,Platinum,Credit Card,True,0,Rainy,True,Friday,False,493,344,2024-04-06 09:20:00,2024,4,14,0
748,1043,925,Smartphone,Appliances,4,532.51,9/8/2024 1:27,20,"Miami, FL",143,65,179,476,6,63,Other,58064.36,Bronze,Digital Wallet,False,Percentage Discount,Rainy,False,Wednesday,True,346,318,2024-09-08 01:27:00,2024,9,36,0
749,7693,752,Headphones,Electronics,3,894.08,9/8/2024 19:17,16,"Dallas, TX",172,126,247,102,9,67,Female,51646.26,Platinum,Credit Card,True,0,Rainy,True,Thursday,True,181,459,2024-09-08 19:17:00,2024,9,36,0
750,8381,317,TV,Electronics,1,808.67,1/1/2024 19:18,7,"Dallas, TX",5,78,169,367,2,61,Male,22428.66,Silver,Cash,True,BOGO,Stormy,True,Thursday,True,141,129,2024-01-01 19:18:00,2024,1,1,0
751,8699,111,Washing Machine,Electronics,4,1896.13,6/14/2024 12:49,12,"Los Angeles, CA",98,114,196,411,7,28,Female,39201.53,Bronze,Debit Card,False,0,Stormy,True,Thursday,False,423,420,2024-06-14 12:49:00,2024,6,24,0
752,5771,755,Washing Machine,Electronics,3,1825.24,1/28/2024 15:55,4,"Chicago, IL",102,117,130,309,3,55,Female,118773.76,Silver,Credit Card,True,0,Cloudy,False,Monday,False,330,287,2024-01-28 15:55:00,2024,1,4,0
753,1534,306,Smartphone,Electronics,2,634.79,4/10/2024 19:34,17,"Chicago, IL",500,138,224,122,4,60,Other,117357.53,Silver,Digital Wallet,False,0,Cloudy,True,Wednesday,False,427,486,2024-04-10 19:34:00,2024,4,15,0
754,4792,806,Headphones,Appliances,1,1599.68,8/31/2024 19:24,20,"Chicago, IL",350,144,162,145,2,70,Female,96075.93,Silver,Cash,True,BOGO,Rainy,True,Monday,True,408,106,2024-08-31 19:24:00,2024,8,35,0
755,5720,388,Smartphone,Appliances,3,1700.79,2/6/2024 19:30,13,"Miami, FL",251,128,109,110,6,40,Female,48722.76,Platinum,Credit Card,True,Percentage Discount,Sunny,False,Monday,True,359,224,2024-02-06 19:30:00,2024,2,6,0
756,5632,360,Laptop,Appliances,2,1432.59,9/12/2024 21:23,6,"New York, NY",312,132,192,293,4,39,Female,38435.05,Silver,Digital Wallet,False,0,Rainy,False,Sunday,True,179,359,2024-09-12 21:23:00,2024,9,37,0
757,8438,909,Camera,Electronics,3,808.11,5/19/2024 19:23,5,"Miami, FL",25,96,270,318,10,67,Female,58497.71,Gold,Cash,False,Percentage Discount,Stormy,False,Friday,False,275,105,2024-05-19 19:23:00,2024,5,20,0
758,2166,169,Headphones,Appliances,1,1467.95,5/6/2024 15:02,11,"Miami, FL",367,74,119,262,5,66,Male,39637.38,Gold,Credit Card,False,0,Sunny,False,Tuesday,False,122,278,2024-05-06 15:02:00,2024,5,19,0
759,4824,415,Tablet,Electronics,2,723.48,8/2/2024 1:59,5,"Los Angeles, CA",88,59,286,358,3,70,Male,85408.74,Silver,Credit Card,True,0,Stormy,False,Wednesday,True,336,329,2024-08-02 01:59:00,2024,8,31,0
760,5334,407,Headphones,Electronics,2,1282.77,1/26/2024 12:34,15,"New York, NY",341,64,186,418,9,49,Female,87101.74,Bronze,Debit Card,False,BOGO,Cloudy,False,Wednesday,True,269,210,2024-01-26 12:34:00,2024,1,4,0
761,4241,618,Washing Machine,Electronics,5,745.64,7/3/2024 5:49,11,"Los Angeles, CA",339,95,125,328,2,43,Female,78781.1,Gold,Credit Card,False,0,Sunny,True,Saturday,True,213,257,2024-07-03 05:49:00,2024,7,27,0
762,7965,663,TV,Electronics,3,602.7,2/10/2024 18:23,13,"Miami, FL",307,85,152,357,2,57,Other,54408.85,Silver,Debit Card,False,0,Stormy,True,Saturday,False,185,368,2024-02-10 18:23:00,2024,2,6,0
763,2880,431,Washing Machine,Appliances,1,210.55,2/12/2024 18:18,2,"New York, NY",142,149,156,446,6,66,Other,29508.92,Silver,Debit Card,False,0,Rainy,True,Sunday,False,105,346,2024-02-12 18:18:00,2024,2,7,0
764,9922,885,Headphones,Appliances,2,1272.87,6/10/2024 13:04,1,"New York, NY",15,135,268,181,9,31,Other,41986.66,Silver,Cash,True,0,Sunny,True,Saturday,False,441,224,2024-06-10 13:04:00,2024,6,24,0
765,4683,106,Fridge,Electronics,2,572.08,1/21/2024 21:43,6,"Miami, FL",426,80,132,461,8,21,Other,109721.72,Platinum,Digital Wallet,True,BOGO,Sunny,True,Monday,False,494,225,2024-01-21 21:43:00,2024,1,3,0
766,3441,216,Laptop,Electronics,5,1867.19,7/16/2024 1:21,5,"Chicago, IL",115,122,107,258,7,50,Female,83425.4,Gold,Debit Card,True,0,Stormy,True,Wednesday,False,493,266,2024-07-16 01:21:00,2024,7,29,0
767,5352,802,Camera,Appliances,5,1861.72,8/6/2024 1:31,8,"New York, NY",251,111,251,166,6,51,Other,101912.11,Gold,Credit Card,True,Percentage Discount,Sunny,True,Saturday,False,459,225,2024-08-06 01:31:00,2024,8,32,0
768,3330,441,Smartphone,Appliances,3,274.06,4/26/2024 3:16,2,"Los Angeles, CA",184,119,201,476,1,52,Male,66398.14,Gold,Digital Wallet,False,BOGO,Sunny,False,Thursday,False,373,374,2024-04-26 03:16:00,2024,4,17,0
769,2169,449,TV,Appliances,4,174.1,9/16/2024 6:06,5,"Dallas, TX",111,62,213,289,10,31,Female,24543.66,Gold,Debit Card,True,0,Rainy,True,Monday,True,140,153,2024-09-16 06:06:00,2024,9,38,0
770,1977,505,TV,Appliances,4,55.73,4/6/2024 2:22,8,"New York, NY",176,96,151,315,2,49,Female,62243.15,Bronze,Cash,True,0,Cloudy,True,Sunday,True,260,154,2024-04-06 02:22:00,2024,4,14,0
771,3718,841,Laptop,Electronics,3,75.6,7/30/2024 8:29,10,"Chicago, IL",324,112,114,284,7,70,Male,117893.46,Platinum,Debit Card,False,0,Sunny,True,Wednesday,True,408,249,2024-07-30 08:29:00,2024,7,31,0
772,6039,682,Smartphone,Electronics,2,365.05,3/25/2024 18:11,2,"New York, NY",352,81,250,382,4,61,Female,54764.18,Gold,Debit Card,True,Percentage Discount,Rainy,False,Tuesday,True,213,297,2024-03-25 18:11:00,2024,3,13,0
773,5728,730,Washing Machine,Electronics,4,372.89,2/24/2024 7:59,12,"Los Angeles, CA",101,83,138,166,10,20,Male,82564.39,Gold,Digital Wallet,False,0,Stormy,False,Monday,False,424,138,2024-02-24 07:59:00,2024,2,8,0
774,8195,129,Fridge,Electronics,3,1051.56,4/25/2024 20:23,13,"Los Angeles, CA",341,61,175,486,8,46,Male,36835.83,Platinum,Debit Card,False,0,Sunny,False,Sunday,True,341,433,2024-04-25 20:23:00,2024,4,17,0
775,3037,952,Headphones,Appliances,2,233.38,2/23/2024 2:50,15,"Chicago, IL",380,90,100,395,6,56,Other,47090.59,Bronze,Digital Wallet,True,Percentage Discount,Rainy,True,Friday,False,206,505,2024-02-23 02:50:00,2024,2,8,0
776,8679,279,Smartphone,Appliances,2,1150.86,4/5/2024 16:26,15,"Miami, FL",55,124,222,211,1,64,Male,83013.48,Gold,Credit Card,True,0,Stormy,True,Tuesday,False,237,490,2024-04-05 16:26:00,2024,4,14,0
777,5982,298,Laptop,Appliances,2,190.02,5/25/2024 2:11,4,"Los Angeles, CA",337,60,179,385,6,55,Female,26201.83,Silver,Digital Wallet,False,BOGO,Sunny,False,Thursday,False,124,256,2024-05-25 02:11:00,2024,5,21,0
778,7594,438,Fridge,Electronics,2,1676.55,8/28/2024 13:26,6,"Dallas, TX",102,52,123,268,8,64,Female,42117.8,Platinum,Digital Wallet,False,0,Rainy,False,Thursday,True,160,325,2024-08-28 13:26:00,2024,8,35,0
779,5460,953,Camera,Appliances,5,609.02,7/5/2024 7:50,12,"New York, NY",79,136,263,228,10,22,Female,96025.17,Bronze,Debit Card,False,0,Stormy,True,Tuesday,True,436,113,2024-07-05 07:50:00,2024,7,27,0
780,9199,446,Fridge,Electronics,2,1996.95,2/24/2024 13:24,3,"Miami, FL",363,98,151,459,3,62,Male,100855.29,Gold,Debit Card,False,0,Sunny,False,Monday,False,201,389,2024-02-24 13:24:00,2024,2,8,0
781,9847,788,Washing Machine,Appliances,5,494.46,3/16/2024 3:42,12,"Chicago, IL",128,149,186,426,2,61,Other,73603.95,Bronze,Credit Card,True,BOGO,Cloudy,False,Saturday,False,470,363,2024-03-16 03:42:00,2024,3,11,0
782,9090,590,Camera,Electronics,2,1538.26,6/19/2024 1:03,17,"Miami, FL",378,104,245,121,6,56,Male,87689.87,Gold,Debit Card,False,0,Stormy,True,Sunday,True,219,157,2024-06-19 01:03:00,2024,6,25,0
783,8172,585,Fridge,Electronics,1,1683.67,8/24/2024 1:49,19,"Dallas, TX",175,51,261,421,2,68,Male,38910.0,Platinum,Cash,False,BOGO,Cloudy,True,Tuesday,True,283,333,2024-08-24 01:49:00,2024,8,34,0
784,2317,916,Fridge,Appliances,2,1351.91,9/9/2024 21:22,2,"Dallas, TX",64,114,274,437,1,64,Female,40300.35,Platinum,Digital Wallet,False,0,Cloudy,False,Tuesday,False,336,157,2024-09-09 21:22:00,2024,9,37,0
785,1653,136,Tablet,Electronics,1,803.88,8/15/2024 22:58,9,"Chicago, IL",432,103,207,253,10,18,Other,31528.94,Gold,Cash,True,0,Stormy,False,Thursday,False,244,380,2024-08-15 22:58:00,2024,8,33,0
786,8078,761,Headphones,Electronics,2,1784.25,8/4/2024 2:21,4,"Miami, FL",352,73,206,469,9,44,Other,49549.41,Bronze,Debit Card,False,0,Cloudy,False,Wednesday,True,431,93,2024-08-04 02:21:00,2024,8,31,0
787,6280,239,Headphones,Appliances,3,1425.21,2/7/2024 10:04,17,"Chicago, IL",229,80,186,250,2,26,Female,66541.09,Platinum,Debit Card,False,0,Cloudy,False,Friday,True,311,359,2024-02-07 10:04:00,2024,2,6,0
788,5102,593,TV,Appliances,4,547.53,1/18/2024 15:26,6,"New York, NY",487,141,161,420,1,30,Female,114743.26,Gold,Digital Wallet,False,0,Rainy,True,Friday,True,268,380,2024-01-18 15:26:00,2024,1,3,0
789,1423,259,Fridge,Electronics,5,1146.78,8/18/2024 9:09,17,"Miami, FL",352,98,160,272,1,61,Female,25133.68,Bronze,Cash,True,0,Sunny,True,Saturday,False,206,177,2024-08-18 09:09:00,2024,8,33,0
790,2496,742,Tablet,Electronics,1,1403.29,4/23/2024 14:52,1,"Dallas, TX",168,95,244,109,10,60,Male,20261.51,Platinum,Credit Card,True,BOGO,Sunny,True,Monday,False,314,391,2024-04-23 14:52:00,2024,4,17,0
791,4750,571,Smartphone,Appliances,2,1631.18,2/13/2024 21:48,11,"New York, NY",212,57,112,452,5,59,Female,59612.79,Bronze,Debit Card,True,BOGO,Rainy,True,Sunday,True,289,105,2024-02-13 21:48:00,2024,2,7,0
792,1339,985,Camera,Appliances,2,611.21,5/24/2024 13:29,3,"Chicago, IL",231,87,156,219,5,23,Other,89912.39,Platinum,Credit Card,False,0,Sunny,True,Wednesday,False,181,198,2024-05-24 13:29:00,2024,5,21,0
793,5415,649,Laptop,Electronics,1,1485.09,5/15/2024 8:32,14,"New York, NY",425,100,198,394,4,40,Other,38396.98,Bronze,Credit Card,True,BOGO,Rainy,True,Friday,True,462,151,2024-05-15 08:32:00,2024,5,20,0
794,1659,443,Headphones,Appliances,2,300.5,7/5/2024 0:15,13,"Miami, FL",50,54,157,381,1,65,Male,111358.08,Bronze,Cash,False,Percentage Discount,Stormy,False,Thursday,False,124,476,2024-07-05 00:15:00,2024,7,27,0
795,3870,573,Washing Machine,Appliances,1,1630.21,6/5/2024 12:01,14,"Miami, FL",298,68,269,304,1,36,Male,34421.17,Silver,Debit Card,True,0,Rainy,False,Sunday,True,465,371,2024-06-05 12:01:00,2024,6,23,0
796,8708,902,Smartphone,Appliances,2,1725.89,2/17/2024 11:27,2,"Miami, FL",323,102,232,199,3,32,Other,76325.25,Gold,Cash,False,0,Cloudy,True,Tuesday,False,275,364,2024-02-17 11:27:00,2024,2,7,0
797,9502,933,Smartphone,Electronics,2,1095.23,7/19/2024 18:21,18,"Miami, FL",175,133,192,369,8,67,Male,36046.98,Platinum,Digital Wallet,False,0,Cloudy,True,Friday,True,483,144,2024-07-19 18:21:00,2024,7,29,0
798,8245,523,Washing Machine,Appliances,3,612.8,7/4/2024 8:01,4,"Miami, FL",24,72,223,201,8,37,Male,54954.28,Bronze,Digital Wallet,True,0,Rainy,True,Wednesday,False,225,186,2024-07-04 08:01:00,2024,7,27,0
799,5557,860,Washing Machine,Appliances,4,1292.0,8/19/2024 11:21,6,"Los Angeles, CA",416,68,171,482,4,36,Other,114924.04,Platinum,Cash,False,0,Rainy,True,Saturday,False,392,274,2024-08-19 11:21:00,2024,8,34,0
800,3973,157,Headphones,Electronics,4,520.66,1/10/2024 2:35,7,"New York, NY",412,89,151,229,3,57,Female,98386.64,Bronze,Credit Card,True,0,Sunny,False,Sunday,True,119,276,2024-01-10 02:35:00,2024,1,2,0
801,8141,955,Smartphone,Appliances,4,442.5,2/11/2024 15:16,19,"New York, NY",424,113,156,293,1,23,Female,91101.65,Silver,Cash,False,0,Rainy,True,Sunday,True,291,483,2024-02-11 15:16:00,2024,2,6,0
802,9056,633,TV,Appliances,1,1871.76,9/13/2024 9:16,5,"New York, NY",401,120,254,299,7,54,Female,40304.22,Silver,Cash,False,BOGO,Rainy,False,Thursday,False,123,480,2024-09-13 09:16:00,2024,9,37,0
803,2494,406,TV,Appliances,1,1633.22,3/5/2024 2:05,16,"Los Angeles, CA",374,131,125,408,6,70,Male,62583.46,Silver,Credit Card,True,0,Cloudy,False,Sunday,False,237,367,2024-03-05 02:05:00,2024,3,10,0
804,8700,678,TV,Electronics,4,878.27,2/29/2024 19:42,17,"Los Angeles, CA",127,127,250,486,7,49,Female,31877.82,Gold,Credit Card,True,0,Stormy,False,Tuesday,True,440,423,2024-02-29 19:42:00,2024,2,9,0
805,6700,842,Laptop,Appliances,4,1712.85,2/29/2024 14:45,18,"Miami, FL",27,66,181,111,10,37,Other,20554.34,Platinum,Cash,True,0,Rainy,True,Monday,False,271,138,2024-02-29 14:45:00,2024,2,9,0
806,7690,794,Camera,Appliances,3,728.37,3/5/2024 22:11,10,"Dallas, TX",189,68,229,367,5,47,Female,76540.52,Bronze,Debit Card,False,BOGO,Stormy,True,Tuesday,True,359,100,2024-03-05 22:11:00,2024,3,10,0
807,6460,423,Tablet,Appliances,1,1869.01,4/11/2024 4:54,9,"Miami, FL",206,93,104,161,3,18,Female,105645.95,Gold,Credit Card,True,0,Cloudy,False,Sunday,False,106,441,2024-04-11 04:54:00,2024,4,15,0
808,6260,668,Smartphone,Appliances,4,107.66,5/18/2024 22:42,16,"New York, NY",256,63,279,231,8,58,Female,39928.0,Platinum,Debit Card,False,0,Sunny,False,Saturday,True,244,436,2024-05-18 22:42:00,2024,5,20,0
809,2713,648,Fridge,Appliances,4,1465.72,7/15/2024 7:39,20,"New York, NY",232,131,102,250,7,52,Other,91572.64,Bronze,Digital Wallet,True,BOGO,Rainy,False,Thursday,True,332,503,2024-07-15 07:39:00,2024,7,29,0
810,3634,119,Fridge,Electronics,2,1191.03,1/15/2024 13:59,2,"New York, NY",284,150,107,410,4,36,Female,32941.58,Platinum,Digital Wallet,True,0,Cloudy,True,Friday,True,114,204,2024-01-15 13:59:00,2024,1,3,0
811,6403,313,Smartphone,Appliances,4,1428.81,8/5/2024 1:24,19,"Los Angeles, CA",31,120,241,371,9,52,Other,100193.3,Platinum,Digital Wallet,True,0,Sunny,True,Tuesday,False,394,483,2024-08-05 01:24:00,2024,8,32,0
812,7744,691,Laptop,Appliances,5,414.97,8/9/2024 4:25,18,"Dallas, TX",233,139,176,300,1,65,Female,99734.1,Gold,Debit Card,True,0,Cloudy,True,Tuesday,False,181,381,2024-08-09 04:25:00,2024,8,32,0
813,9117,801,Tablet,Appliances,5,1137.77,5/3/2024 5:02,13,"Dallas, TX",404,68,126,122,9,43,Male,24017.84,Platinum,Cash,True,Percentage Discount,Cloudy,True,Sunday,False,376,118,2024-05-03 05:02:00,2024,5,18,0
814,5722,439,Camera,Appliances,3,417.78,1/6/2024 21:13,7,"New York, NY",34,104,200,170,3,49,Male,59690.08,Gold,Credit Card,False,0,Stormy,True,Tuesday,True,377,384,2024-01-06 21:13:00,2024,1,1,0
815,7561,918,Washing Machine,Electronics,3,785.37,2/14/2024 13:15,14,"Dallas, TX",64,132,136,409,7,25,Female,56860.18,Bronze,Digital Wallet,True,0,Sunny,True,Sunday,False,397,364,2024-02-14 13:15:00,2024,2,7,0
816,1601,914,Smartphone,Appliances,2,946.38,2/10/2024 19:03,3,"Chicago, IL",358,62,274,464,4,25,Other,47418.97,Bronze,Debit Card,True,0,Sunny,True,Tuesday,False,207,361,2024-02-10 19:03:00,2024,2,6,0
817,8451,462,Laptop,Electronics,1,1219.58,1/1/2024 19:34,11,"Los Angeles, CA",439,149,196,307,3,63,Other,78192.01,Bronze,Credit Card,False,BOGO,Sunny,False,Thursday,False,124,91,2024-01-01 19:34:00,2024,1,1,0
818,2442,167,Tablet,Appliances,2,786.23,2/21/2024 13:54,5,"New York, NY",395,81,224,269,7,46,Other,21490.25,Silver,Credit Card,False,BOGO,Sunny,False,Thursday,False,262,456,2024-02-21 13:54:00,2024,2,8,0
819,6153,252,Camera,Appliances,3,860.2,2/20/2024 19:55,16,"New York, NY",203,93,192,215,8,66,Male,113810.89,Bronze,Cash,False,0,Stormy,True,Tuesday,False,399,208,2024-02-20 19:55:00,2024,2,8,0
820,5135,387,Fridge,Appliances,3,899.24,9/6/2024 15:38,13,"Miami, FL",168,55,111,193,7,67,Male,69776.61,Platinum,Credit Card,False,0,Rainy,False,Tuesday,True,412,177,2024-09-06 15:38:00,2024,9,36,0
821,6296,960,Smartphone,Appliances,2,202.02,9/4/2024 16:27,20,"Dallas, TX",77,103,123,451,4,28,Female,116324.7,Platinum,Cash,True,0,Rainy,True,Saturday,False,326,492,2024-09-04 16:27:00,2024,9,36,0
822,2899,131,Fridge,Electronics,1,322.12,2/7/2024 5:47,11,"Dallas, TX",145,66,282,384,2,36,Female,44050.58,Platinum,Cash,False,0,Sunny,False,Tuesday,True,284,417,2024-02-07 05:47:00,2024,2,6,0
823,7622,447,TV,Electronics,1,661.22,5/23/2024 6:11,18,"Dallas, TX",434,58,179,463,2,57,Male,52364.94,Gold,Debit Card,False,Percentage Discount,Sunny,True,Wednesday,False,261,273,2024-05-23 06:11:00,2024,5,21,0
824,9431,484,Laptop,Appliances,2,818.6,5/6/2024 10:47,10,"Miami, FL",437,57,210,214,5,51,Female,44174.99,Platinum,Credit Card,True,BOGO,Sunny,True,Wednesday,True,402,241,2024-05-06 10:47:00,2024,5,19,0
825,1018,741,Tablet,Electronics,2,519.0,3/20/2024 4:36,10,"Chicago, IL",318,117,232,139,4,58,Female,97528.3,Bronze,Debit Card,True,0,Cloudy,False,Monday,True,282,174,2024-03-20 04:36:00,2024,3,12,0
826,9889,647,TV,Appliances,5,389.1,5/6/2024 16:39,10,"Dallas, TX",149,87,161,276,2,38,Female,57448.99,Gold,Credit Card,True,0,Rainy,True,Wednesday,False,491,348,2024-05-06 16:39:00,2024,5,19,0
827,8569,962,Fridge,Electronics,5,1902.75,8/3/2024 3:06,5,"Chicago, IL",407,54,265,439,1,55,Other,98837.67,Platinum,Digital Wallet,False,0,Sunny,False,Friday,False,421,309,2024-08-03 03:06:00,2024,8,31,0
828,7770,269,Washing Machine,Electronics,3,112.54,5/11/2024 9:53,1,"Miami, FL",277,59,131,203,8,42,Female,88899.91,Bronze,Credit Card,True,0,Rainy,True,Tuesday,False,133,479,2024-05-11 09:53:00,2024,5,19,0
829,1888,684,Headphones,Electronics,4,1597.2,4/8/2024 21:00,5,"New York, NY",309,91,168,111,6,33,Other,26075.79,Bronze,Cash,True,0,Stormy,True,Saturday,True,167,471,2024-04-08 21:00:00,2024,4,15,0
830,4073,720,Smartphone,Appliances,2,1684.66,1/25/2024 6:01,6,"Dallas, TX",36,111,200,345,4,34,Other,70661.19,Platinum,Debit Card,False,BOGO,Sunny,True,Wednesday,True,138,243,2024-01-25 06:01:00,2024,1,4,0
831,9494,498,Fridge,Electronics,2,310.6,3/19/2024 23:42,9,"New York, NY",256,128,192,108,10,30,Other,90327.42,Gold,Debit Card,True,0,Stormy,False,Wednesday,False,496,417,2024-03-19 23:42:00,2024,3,12,0
832,6927,291,Tablet,Appliances,1,1412.95,2/7/2024 11:48,18,"Dallas, TX",182,124,101,338,9,45,Male,40374.63,Platinum,Debit Card,True,Percentage Discount,Rainy,True,Thursday,True,187,439,2024-02-07 11:48:00,2024,2,6,0
833,9167,709,Washing Machine,Electronics,2,479.35,2/16/2024 0:05,5,"Miami, FL",81,113,300,407,8,41,Other,91802.28,Bronze,Credit Card,False,0,Rainy,False,Sunday,False,356,225,2024-02-16 00:05:00,2024,2,7,0
834,8242,219,Fridge,Electronics,3,1246.75,8/4/2024 3:59,9,"Miami, FL",409,133,104,153,2,68,Other,76072.41,Silver,Debit Card,False,0,Sunny,False,Thursday,True,305,220,2024-08-04 03:59:00,2024,8,31,0
835,1845,985,Headphones,Electronics,2,1111.22,5/14/2024 21:11,18,"Chicago, IL",370,52,157,416,5,64,Male,33874.71,Gold,Digital Wallet,False,BOGO,Rainy,False,Thursday,True,442,402,2024-05-14 21:11:00,2024,5,20,0
836,4335,901,Washing Machine,Electronics,1,191.12,9/13/2024 10:41,18,"Miami, FL",306,100,247,121,2,21,Female,46035.51,Platinum,Digital Wallet,True,0,Cloudy,False,Friday,True,398,500,2024-09-13 10:41:00,2024,9,37,0
837,5375,869,Camera,Appliances,2,1977.71,6/14/2024 7:45,13,"Dallas, TX",489,67,165,249,5,57,Other,32301.67,Platinum,Credit Card,False,0,Stormy,True,Thursday,False,379,241,2024-06-14 07:45:00,2024,6,24,0
838,9998,415,Laptop,Electronics,5,1464.14,8/25/2024 18:15,7,"New York, NY",258,140,296,461,3,34,Male,64213.42,Silver,Cash,False,0,Stormy,True,Saturday,True,178,337,2024-08-25 18:15:00,2024,8,34,0
839,3146,822,Tablet,Electronics,3,1945.3,8/4/2024 4:40,3,"Miami, FL",121,128,262,369,7,24,Other,108687.53,Gold,Credit Card,False,0,Sunny,False,Thursday,False,473,488,2024-08-04 04:40:00,2024,8,31,0
840,5719,978,Tablet,Appliances,4,1129.77,7/26/2024 1:19,8,"Miami, FL",259,117,194,456,5,44,Male,47826.65,Platinum,Digital Wallet,True,0,Cloudy,False,Sunday,False,120,297,2024-07-26 01:19:00,2024,7,30,0
841,8178,422,Tablet,Appliances,1,1787.65,2/10/2024 3:15,15,"Miami, FL",257,58,192,354,3,27,Female,77893.4,Gold,Debit Card,False,Percentage Discount,Rainy,True,Tuesday,False,186,428,2024-02-10 03:15:00,2024,2,6,0
842,8941,826,Tablet,Electronics,5,1002.03,1/24/2024 1:48,8,"Dallas, TX",460,54,230,364,10,58,Other,61974.46,Bronze,Debit Card,False,Percentage Discount,Sunny,True,Thursday,False,285,432,2024-01-24 01:48:00,2024,1,4,0
843,2989,132,Washing Machine,Appliances,1,1253.53,1/11/2024 19:48,15,"Miami, FL",86,122,283,317,4,62,Other,34896.48,Silver,Debit Card,False,0,Stormy,True,Thursday,False,249,419,2024-01-11 19:48:00,2024,1,2,0
844,1472,378,TV,Appliances,1,81.48,8/28/2024 19:57,3,"Los Angeles, CA",465,128,272,111,1,67,Male,49856.36,Gold,Credit Card,True,Percentage Discount,Rainy,False,Tuesday,False,182,310,2024-08-28 19:57:00,2024,8,35,0
845,4920,523,Laptop,Appliances,4,974.99,6/28/2024 5:48,10,"Los Angeles, CA",2,111,285,138,7,62,Female,64594.51,Bronze,Digital Wallet,True,BOGO,Sunny,False,Saturday,False,123,425,2024-06-28 05:48:00,2024,6,26,0
846,3594,188,Washing Machine,Appliances,2,932.06,7/29/2024 14:33,12,"Chicago, IL",464,132,283,283,5,67,Male,82010.55,Platinum,Credit Card,False,BOGO,Cloudy,True,Saturday,True,109,135,2024-07-29 14:33:00,2024,7,31,0
847,6091,608,Headphones,Electronics,2,190.73,3/21/2024 1:39,2,"Miami, FL",365,95,174,131,7,43,Female,28431.87,Silver,Debit Card,False,0,Sunny,True,Wednesday,False,214,241,2024-03-21 01:39:00,2024,3,12,0
848,1224,998,Tablet,Appliances,2,341.95,1/22/2024 14:45,8,"New York, NY",37,73,199,363,2,47,Other,78433.89,Bronze,Cash,True,Percentage Discount,Rainy,False,Wednesday,False,143,183,2024-01-22 14:45:00,2024,1,4,0
849,7684,343,Smartphone,Appliances,3,643.64,2/28/2024 11:16,3,"Chicago, IL",167,104,290,463,5,29,Other,27030.96,Silver,Debit Card,True,0,Cloudy,True,Sunday,True,274,259,2024-02-28 11:16:00,2024,2,9,0
850,2527,480,Fridge,Electronics,1,1637.79,2/16/2024 1:15,4,"Chicago, IL",61,117,173,491,4,35,Other,110769.13,Platinum,Credit Card,False,0,Rainy,False,Sunday,False,111,361,2024-02-16 01:15:00,2024,2,7,0
851,4681,562,Washing Machine,Electronics,3,284.58,3/17/2024 17:40,18,"Chicago, IL",141,100,264,426,9,18,Male,107086.39,Bronze,Credit Card,True,0,Cloudy,True,Tuesday,False,353,259,2024-03-17 17:40:00,2024,3,11,0
852,2858,949,Fridge,Appliances,1,622.84,7/25/2024 23:36,2,"Chicago, IL",300,103,141,215,4,50,Other,41222.07,Gold,Digital Wallet,True,0,Rainy,True,Monday,True,357,338,2024-07-25 23:36:00,2024,7,30,0
853,8560,409,Headphones,Electronics,4,1252.72,2/25/2024 3:07,5,"Dallas, TX",239,97,115,222,9,56,Male,89378.15,Silver,Digital Wallet,True,BOGO,Sunny,True,Monday,True,117,403,2024-02-25 03:07:00,2024,2,8,0
854,2924,321,Smartphone,Electronics,4,462.01,9/9/2024 17:53,13,"Los Angeles, CA",226,56,125,241,2,42,Other,72302.78,Silver,Cash,False,Percentage Discount,Stormy,True,Thursday,False,144,213,2024-09-09 17:53:00,2024,9,37,0
855,3522,637,Tablet,Electronics,3,1564.88,3/10/2024 22:57,13,"Dallas, TX",254,118,228,263,7,28,Male,113935.24,Gold,Debit Card,False,0,Sunny,False,Monday,True,489,245,2024-03-10 22:57:00,2024,3,10,0
856,9165,409,Camera,Electronics,5,733.4,1/14/2024 11:05,19,"New York, NY",211,77,127,136,8,53,Male,23571.5,Platinum,Cash,False,Percentage Discount,Sunny,False,Tuesday,False,275,325,2024-01-14 11:05:00,2024,1,2,0
857,5781,279,Tablet,Appliances,4,942.95,7/26/2024 2:46,4,"Miami, FL",137,103,295,191,5,60,Other,95513.06,Gold,Digital Wallet,True,Percentage Discount,Cloudy,True,Monday,False,303,117,2024-07-26 02:46:00,2024,7,30,0
858,9337,214,Smartphone,Electronics,1,1710.36,1/8/2024 19:44,9,"Dallas, TX",294,120,265,410,3,49,Male,64741.73,Platinum,Debit Card,False,BOGO,Rainy,False,Thursday,False,142,385,2024-01-08 19:44:00,2024,1,2,0
859,5479,483,Fridge,Electronics,4,1820.53,7/18/2024 15:59,4,"Los Angeles, CA",45,61,253,370,9,21,Other,20153.56,Platinum,Digital Wallet,False,0,Rainy,False,Saturday,True,306,317,2024-07-18 15:59:00,2024,7,29,0
860,7807,903,Laptop,Appliances,4,896.85,6/17/2024 12:47,20,"Miami, FL",125,147,105,176,10,23,Female,89280.9,Gold,Credit Card,False,BOGO,Rainy,False,Thursday,True,468,268,2024-06-17 12:47:00,2024,6,25,0
861,8905,138,Fridge,Electronics,3,648.98,6/27/2024 9:09,8,"New York, NY",204,100,135,408,6,63,Other,73064.78,Bronze,Digital Wallet,True,0,Sunny,True,Saturday,True,490,137,2024-06-27 09:09:00,2024,6,26,0
862,8736,896,Washing Machine,Appliances,3,1743.68,5/26/2024 5:40,19,"Dallas, TX",371,121,154,430,5,33,Other,73763.24,Silver,Credit Card,False,0,Rainy,True,Thursday,False,229,162,2024-05-26 05:40:00,2024,5,21,0
863,4993,306,Tablet,Appliances,4,784.94,2/23/2024 5:51,14,"Los Angeles, CA",43,136,143,480,1,27,Other,91041.37,Platinum,Debit Card,True,0,Cloudy,False,Tuesday,True,436,220,2024-02-23 05:51:00,2024,2,8,0
864,8483,194,Tablet,Electronics,1,152.47,1/3/2024 12:22,1,"Dallas, TX",209,70,100,228,6,24,Female,118908.07,Bronze,Digital Wallet,False,0,Sunny,True,Sunday,True,456,127,2024-01-03 12:22:00,2024,1,1,0
865,3369,554,TV,Electronics,5,1121.69,8/24/2024 9:51,13,"Chicago, IL",438,64,124,277,9,41,Female,77829.69,Gold,Digital Wallet,False,0,Cloudy,True,Thursday,True,160,420,2024-08-24 09:51:00,2024,8,34,0
866,7284,618,Tablet,Electronics,5,530.35,1/3/2024 15:00,3,"Chicago, IL",180,87,196,239,5,43,Other,76250.22,Bronze,Digital Wallet,True,0,Rainy,True,Thursday,False,205,316,2024-01-03 15:00:00,2024,1,1,0
867,4122,125,Smartphone,Electronics,2,1515.64,1/4/2024 12:40,1,"Los Angeles, CA",225,55,189,485,8,45,Female,106512.5,Gold,Digital Wallet,True,0,Stormy,True,Sunday,False,140,495,2024-01-04 12:40:00,2024,1,1,0
868,9327,918,Smartphone,Electronics,3,790.24,2/28/2024 22:32,9,"Chicago, IL",211,106,126,144,5,46,Female,68820.92,Gold,Credit Card,True,0,Stormy,False,Wednesday,False,437,476,2024-02-28 22:32:00,2024,2,9,0
869,3236,594,Laptop,Electronics,1,179.64,2/26/2024 15:35,15,"Los Angeles, CA",429,78,253,360,4,21,Female,96707.15,Platinum,Cash,True,BOGO,Stormy,True,Monday,False,378,400,2024-02-26 15:35:00,2024,2,9,0
870,2143,612,Washing Machine,Appliances,4,1189.89,9/14/2024 15:20,3,"Dallas, TX",177,110,233,206,9,22,Other,114139.99,Silver,Cash,True,Percentage Discount,Cloudy,True,Saturday,False,240,248,2024-09-14 15:20:00,2024,9,37,0
871,5526,257,Camera,Electronics,3,1513.35,8/19/2024 0:58,17,"Chicago, IL",70,75,240,202,10,61,Female,64033.63,Gold,Digital Wallet,True,0,Cloudy,False,Thursday,False,357,180,2024-08-19 00:58:00,2024,8,34,0
872,7798,294,Tablet,Electronics,5,1483.38,1/12/2024 16:42,19,"Los Angeles, CA",260,56,254,498,5,57,Other,23902.09,Bronze,Cash,False,BOGO,Rainy,False,Wednesday,False,442,510,2024-01-12 16:42:00,2024,1,2,0
873,6568,448,Laptop,Electronics,2,1303.55,6/21/2024 3:03,4,"Los Angeles, CA",461,117,101,354,8,22,Female,26909.2,Bronze,Cash,True,BOGO,Cloudy,True,Thursday,False,118,237,2024-06-21 03:03:00,2024,6,25,0
874,9318,595,Smartphone,Electronics,5,1792.57,5/17/2024 12:49,4,"New York, NY",85,137,203,386,6,50,Male,86756.31,Silver,Digital Wallet,False,Percentage Discount,Rainy,True,Tuesday,False,202,260,2024-05-17 12:49:00,2024,5,20,0
875,5377,850,TV,Electronics,4,1285.73,4/6/2024 17:29,19,"Los Angeles, CA",490,108,290,366,3,47,Male,109339.06,Platinum,Digital Wallet,False,0,Rainy,True,Thursday,True,166,110,2024-04-06 17:29:00,2024,4,14,0
876,1042,994,Smartphone,Appliances,2,744.23,2/4/2024 18:47,20,"Chicago, IL",68,60,104,155,9,25,Male,50016.64,Silver,Cash,False,0,Cloudy,True,Monday,True,359,391,2024-02-04 18:47:00,2024,2,5,0
877,5634,636,Tablet,Appliances,4,1527.97,1/29/2024 10:43,5,"Miami, FL",360,85,252,255,10,47,Female,37288.9,Bronze,Debit Card,True,0,Rainy,True,Tuesday,False,175,161,2024-01-29 10:43:00,2024,1,5,0
878,5891,417,Headphones,Electronics,2,1296.75,8/1/2024 6:11,11,"Dallas, TX",484,146,128,433,8,25,Male,46748.65,Platinum,Cash,True,0,Cloudy,True,Wednesday,False,163,113,2024-08-01 06:11:00,2024,8,31,0
879,9022,894,Laptop,Appliances,3,997.64,9/16/2024 1:11,13,"Dallas, TX",412,75,224,351,3,18,Other,44871.58,Bronze,Debit Card,False,Percentage Discount,Cloudy,True,Thursday,False,476,212,2024-09-16 01:11:00,2024,9,38,0
880,3434,435,Tablet,Appliances,5,905.41,3/13/2024 9:05,20,"Chicago, IL",384,124,296,485,5,35,Male,24442.95,Gold,Cash,False,0,Stormy,True,Sunday,False,245,121,2024-03-13 09:05:00,2024,3,11,0
881,8316,246,Tablet,Appliances,1,1709.08,2/26/2024 4:38,5,"Miami, FL",198,52,189,462,6,68,Male,115499.08,Bronze,Cash,False,0,Cloudy,True,Monday,False,164,134,2024-02-26 04:38:00,2024,2,9,0
882,9824,887,Headphones,Electronics,2,562.28,5/23/2024 6:03,10,"Chicago, IL",55,74,108,257,10,39,Female,82063.44,Bronze,Credit Card,True,0,Cloudy,True,Wednesday,True,348,409,2024-05-23 06:03:00,2024,5,21,0
883,8935,992,Camera,Appliances,2,230.73,4/9/2024 7:05,16,"Chicago, IL",429,129,216,174,8,63,Other,41712.98,Silver,Debit Card,True,0,Stormy,True,Monday,False,348,269,2024-04-09 07:05:00,2024,4,15,0
884,6654,200,Smartphone,Appliances,3,1235.32,8/12/2024 15:51,14,"Dallas, TX",290,51,187,279,10,57,Female,34268.19,Bronze,Credit Card,False,0,Stormy,True,Sunday,True,379,176,2024-08-12 15:51:00,2024,8,33,0
885,6446,941,Fridge,Appliances,5,101.34,5/3/2024 16:09,18,"Chicago, IL",335,127,130,112,9,54,Female,22164.49,Silver,Debit Card,True,Percentage Discount,Rainy,True,Thursday,True,140,494,2024-05-03 16:09:00,2024,5,18,0
886,9903,628,Laptop,Appliances,1,1858.22,5/9/2024 10:54,18,"Miami, FL",167,69,290,334,10,69,Male,41479.98,Bronze,Debit Card,True,0,Cloudy,False,Monday,False,117,160,2024-05-09 10:54:00,2024,5,19,0
887,7180,792,TV,Electronics,5,1939.06,2/4/2024 22:05,7,"Los Angeles, CA",336,53,248,257,9,56,Other,60396.22,Gold,Credit Card,True,BOGO,Rainy,False,Tuesday,False,356,366,2024-02-04 22:05:00,2024,2,5,0
888,8460,235,Headphones,Appliances,3,1842.53,8/16/2024 2:58,10,"Miami, FL",137,56,141,213,3,28,Other,85312.96,Gold,Digital Wallet,True,0,Stormy,False,Thursday,True,244,264,2024-08-16 02:58:00,2024,8,33,0
889,6272,310,Laptop,Appliances,4,1117.77,1/28/2024 0:09,3,"New York, NY",362,93,199,369,3,63,Male,46402.01,Bronze,Cash,False,0,Sunny,True,Wednesday,False,317,90,2024-01-28 00:09:00,2024,1,4,0
890,4090,841,Headphones,Appliances,4,54.84,4/1/2024 15:04,2,"Miami, FL",475,144,218,168,5,20,Female,23522.45,Silver,Credit Card,True,0,Stormy,False,Friday,True,376,464,2024-04-01 15:04:00,2024,4,14,0
891,4912,137,Washing Machine,Electronics,5,398.86,7/24/2024 22:33,8,"Chicago, IL",288,135,221,123,6,48,Other,78867.92,Platinum,Credit Card,False,BOGO,Cloudy,False,Monday,True,229,444,2024-07-24 22:33:00,2024,7,30,0
892,7274,570,Smartphone,Appliances,3,1613.08,6/6/2024 17:27,9,"Chicago, IL",341,100,262,202,6,69,Female,119899.27,Silver,Credit Card,True,0,Rainy,False,Monday,False,440,165,2024-06-06 17:27:00,2024,6,23,0
893,4826,496,Washing Machine,Electronics,3,719.39,8/15/2024 0:04,3,"Los Angeles, CA",417,72,190,404,5,23,Other,54067.54,Platinum,Debit Card,True,0,Rainy,False,Thursday,False,174,491,2024-08-15 00:04:00,2024,8,33,0
894,7730,830,Camera,Appliances,5,1470.78,5/29/2024 18:16,9,"Los Angeles, CA",12,100,105,282,1,51,Male,97589.71,Silver,Cash,True,Percentage Discount,Sunny,False,Monday,False,270,243,2024-05-29 18:16:00,2024,5,22,0
895,1715,985,Camera,Appliances,2,1958.6,3/8/2024 1:54,3,"Miami, FL",455,55,171,444,5,56,Other,93356.1,Bronze,Credit Card,True,BOGO,Stormy,False,Wednesday,True,155,324,2024-03-08 01:54:00,2024,3,10,0
896,6213,634,TV,Appliances,2,1671.9,7/6/2024 16:29,7,"Miami, FL",438,111,202,130,3,53,Other,34700.85,Silver,Credit Card,False,0,Sunny,True,Sunday,False,296,141,2024-07-06 16:29:00,2024,7,27,0
897,8749,218,Tablet,Electronics,4,1574.5,8/11/2024 2:55,3,"Dallas, TX",489,50,124,432,2,60,Female,22395.62,Gold,Digital Wallet,False,Percentage Discount,Rainy,True,Wednesday,True,377,275,2024-08-11 02:55:00,2024,8,32,0
898,7246,104,Laptop,Appliances,2,578.62,1/18/2024 19:52,17,"Los Angeles, CA",67,130,200,464,1,19,Other,78922.9,Gold,Digital Wallet,False,0,Stormy,True,Monday,False,209,175,2024-01-18 19:52:00,2024,1,3,0
899,7325,418,TV,Appliances,2,612.67,6/1/2024 19:28,4,"Chicago, IL",288,72,265,128,1,27,Male,41524.31,Platinum,Credit Card,True,0,Rainy,False,Thursday,True,478,343,2024-06-01 19:28:00,2024,6,22,0
900,3492,145,Laptop,Appliances,4,1382.52,1/2/2024 20:59,4,"Miami, FL",156,133,140,326,2,29,Other,89182.38,Bronze,Debit Card,False,0,Cloudy,True,Tuesday,True,151,498,2024-01-02 20:59:00,2024,1,1,0
901,9115,803,TV,Electronics,5,1756.26,7/17/2024 5:13,18,"Chicago, IL",287,86,269,360,5,23,Male,71407.7,Platinum,Debit Card,True,0,Cloudy,True,Thursday,False,109,283,2024-07-17 05:13:00,2024,7,29,0
902,1606,968,Smartphone,Appliances,1,828.69,4/2/2024 15:54,4,"New York, NY",438,113,137,319,10,33,Female,32195.08,Bronze,Credit Card,True,BOGO,Cloudy,False,Saturday,False,380,215,2024-04-02 15:54:00,2024,4,14,0
903,3068,708,Headphones,Appliances,2,324.33,3/23/2024 5:53,10,"Los Angeles, CA",134,86,272,328,10,24,Male,74515.15,Silver,Digital Wallet,False,Percentage Discount,Rainy,True,Thursday,True,251,452,2024-03-23 05:53:00,2024,3,12,0
904,9229,992,TV,Appliances,1,1090.22,3/15/2024 13:24,1,"Los Angeles, CA",297,115,263,328,7,53,Other,43717.69,Gold,Credit Card,True,0,Rainy,True,Tuesday,True,303,287,2024-03-15 13:24:00,2024,3,11,0
905,6439,189,Smartphone,Electronics,2,1095.09,9/16/2024 14:35,11,"Chicago, IL",398,91,231,270,2,55,Other,47856.4,Silver,Digital Wallet,False,Percentage Discount,Cloudy,True,Thursday,False,276,284,2024-09-16 14:35:00,2024,9,38,0
906,2644,441,TV,Appliances,1,1166.69,7/7/2024 11:43,3,"Miami, FL",151,133,260,271,2,59,Other,22933.58,Bronze,Debit Card,False,Percentage Discount,Rainy,True,Thursday,False,295,358,2024-07-07 11:43:00,2024,7,27,0
907,8213,578,Camera,Electronics,1,636.35,6/25/2024 9:45,8,"Dallas, TX",97,107,172,100,8,43,Other,65692.62,Silver,Debit Card,False,0,Sunny,False,Thursday,False,447,508,2024-06-25 09:45:00,2024,6,26,0
908,2633,147,Headphones,Appliances,1,1522.31,1/30/2024 7:50,6,"Miami, FL",343,129,150,117,8,20,Female,50176.82,Gold,Credit Card,False,0,Stormy,False,Tuesday,True,235,337,2024-01-30 07:50:00,2024,1,5,0
909,9617,205,Smartphone,Electronics,1,1915.57,4/16/2024 14:14,11,"Miami, FL",436,116,287,497,9,38,Female,74122.96,Silver,Debit Card,True,BOGO,Stormy,True,Monday,False,421,102,2024-04-16 14:14:00,2024,4,16,0
910,8486,633,Fridge,Appliances,5,178.9,9/13/2024 10:25,4,"Los Angeles, CA",381,141,254,264,6,20,Male,75072.51,Silver,Credit Card,False,0,Rainy,False,Saturday,True,464,389,2024-09-13 10:25:00,2024,9,37,0
911,1251,884,Tablet,Appliances,4,1854.05,1/10/2024 23:25,15,"Dallas, TX",416,118,272,197,5,30,Female,41723.29,Silver,Debit Card,False,BOGO,Sunny,True,Tuesday,False,193,372,2024-01-10 23:25:00,2024,1,2,0
912,3361,774,Headphones,Electronics,5,588.19,5/28/2024 14:29,19,"New York, NY",131,117,210,483,6,37,Female,24190.51,Silver,Cash,False,0,Rainy,False,Thursday,True,198,389,2024-05-28 14:29:00,2024,5,22,0
913,7717,863,Headphones,Electronics,1,1475.87,2/20/2024 7:06,1,"Los Angeles, CA",379,128,188,263,4,42,Male,53052.9,Bronze,Cash,True,0,Cloudy,False,Wednesday,True,190,95,2024-02-20 07:06:00,2024,2,8,0
914,3529,419,Fridge,Electronics,2,1406.73,2/5/2024 3:52,10,"Los Angeles, CA",439,71,208,347,10,24,Other,119074.51,Bronze,Cash,False,Percentage Discount,Stormy,True,Friday,False,258,236,2024-02-05 03:52:00,2024,2,6,0
915,2225,123,Smartphone,Electronics,3,778.89,3/28/2024 16:53,10,"Chicago, IL",163,58,237,426,1,58,Male,54526.78,Gold,Credit Card,True,0,Sunny,True,Tuesday,True,475,271,2024-03-28 16:53:00,2024,3,13,0
916,8692,691,Fridge,Appliances,5,990.29,5/14/2024 8:49,15,"Chicago, IL",234,79,290,423,6,23,Other,98984.34,Silver,Credit Card,False,Percentage Discount,Sunny,True,Tuesday,True,289,111,2024-05-14 08:49:00,2024,5,20,0
917,5342,876,Washing Machine,Appliances,4,1181.51,9/14/2024 11:17,2,"Los Angeles, CA",245,71,262,296,8,48,Other,99066.57,Silver,Cash,True,0,Stormy,True,Monday,False,228,366,2024-09-14 11:17:00,2024,9,37,0
918,6546,419,Tablet,Appliances,5,436.05,5/11/2024 1:40,17,"Dallas, TX",426,109,242,465,10,33,Other,33201.94,Bronze,Credit Card,False,0,Rainy,True,Wednesday,True,265,190,2024-05-11 01:40:00,2024,5,19,0
919,7512,754,Headphones,Electronics,1,747.32,2/11/2024 2:26,12,"Dallas, TX",414,79,294,130,9,36,Female,69407.13,Bronze,Credit Card,False,BOGO,Rainy,False,Friday,True,230,505,2024-02-11 02:26:00,2024,2,6,0
920,2315,314,Fridge,Appliances,1,273.19,3/2/2024 14:10,14,"Miami, FL",209,118,263,433,7,23,Other,55812.98,Gold,Credit Card,True,0,Stormy,True,Wednesday,False,144,407,2024-03-02 14:10:00,2024,3,9,0
921,6383,428,Smartphone,Electronics,4,1408.53,5/5/2024 19:16,1,"Los Angeles, CA",442,65,227,212,7,48,Other,108827.01,Gold,Credit Card,True,0,Cloudy,True,Monday,False,461,218,2024-05-05 19:16:00,2024,5,18,0
922,9742,305,TV,Appliances,1,1197.3,3/18/2024 3:13,19,"New York, NY",202,92,300,300,3,63,Other,74461.33,Platinum,Digital Wallet,True,0,Sunny,False,Monday,True,410,331,2024-03-18 03:13:00,2024,3,12,0
923,7226,297,Tablet,Appliances,4,1075.67,8/3/2024 18:49,9,"Dallas, TX",39,72,142,331,7,34,Other,90981.25,Platinum,Cash,False,BOGO,Cloudy,False,Friday,True,141,182,2024-08-03 18:49:00,2024,8,31,0
924,6188,393,Headphones,Appliances,3,959.79,1/20/2024 17:45,2,"Chicago, IL",369,69,102,206,10,23,Other,71844.41,Bronze,Credit Card,True,0,Sunny,True,Monday,True,206,510,2024-01-20 17:45:00,2024,1,3,0
925,8994,383,TV,Electronics,1,1656.6,4/3/2024 16:53,13,"Miami, FL",451,126,136,211,3,35,Female,119926.42,Gold,Debit Card,False,0,Stormy,True,Saturday,True,273,117,2024-04-03 16:53:00,2024,4,14,0
926,9864,645,Camera,Appliances,2,466.63,3/26/2024 9:17,15,"New York, NY",121,150,100,299,4,44,Other,29681.62,Silver,Digital Wallet,True,0,Stormy,True,Monday,True,500,327,2024-03-26 09:17:00,2024,3,13,0
927,1588,426,Smartphone,Electronics,5,311.33,2/27/2024 7:07,4,"Miami, FL",470,76,165,134,4,40,Male,115994.54,Bronze,Credit Card,False,0,Cloudy,True,Thursday,False,251,305,2024-02-27 07:07:00,2024,2,9,0
928,2121,891,Fridge,Electronics,2,1392.0,1/12/2024 19:39,10,"Miami, FL",277,72,242,237,10,41,Male,48014.2,Silver,Digital Wallet,False,0,Rainy,False,Friday,False,289,384,2024-01-12 19:39:00,2024,1,2,0
929,4846,551,Smartphone,Electronics,3,614.55,7/12/2024 1:15,17,"Chicago, IL",274,67,224,192,6,37,Female,75163.28,Bronze,Debit Card,False,0,Cloudy,True,Thursday,True,468,276,2024-07-12 01:15:00,2024,7,28,0
930,5708,787,Camera,Electronics,1,1187.17,5/4/2024 0:15,15,"Los Angeles, CA",432,123,120,229,4,38,Female,90119.1,Platinum,Cash,True,0,Sunny,False,Tuesday,False,256,192,2024-05-04 00:15:00,2024,5,18,0
931,4727,220,Fridge,Appliances,5,606.56,8/30/2024 5:14,17,"Miami, FL",223,108,107,341,1,23,Male,49886.38,Bronze,Cash,True,0,Cloudy,True,Friday,True,194,502,2024-08-30 05:14:00,2024,8,35,0
932,2480,379,Fridge,Electronics,5,909.58,6/5/2024 0:44,7,"Chicago, IL",175,135,158,243,1,69,Female,85548.66,Gold,Debit Card,False,BOGO,Cloudy,False,Thursday,False,195,294,2024-06-05 00:44:00,2024,6,23,0
933,8110,252,Laptop,Electronics,5,1318.73,9/15/2024 13:32,3,"Chicago, IL",320,136,198,143,3,29,Male,45827.53,Silver,Digital Wallet,True,0,Stormy,True,Wednesday,True,326,367,2024-09-15 13:32:00,2024,9,37,0
934,2612,261,TV,Appliances,3,878.61,9/6/2024 7:46,1,"Chicago, IL",174,72,300,282,6,33,Female,108006.13,Gold,Debit Card,True,0,Rainy,True,Sunday,False,172,493,2024-09-06 07:46:00,2024,9,36,0
935,2646,380,Tablet,Appliances,3,1051.97,3/20/2024 15:12,7,"Miami, FL",8,148,272,491,6,31,Male,37072.51,Gold,Credit Card,True,Percentage Discount,Stormy,True,Saturday,False,305,404,2024-03-20 15:12:00,2024,3,12,0
936,8269,217,Headphones,Appliances,2,150.95,1/24/2024 2:48,4,"New York, NY",397,91,186,147,4,39,Male,37098.8,Silver,Debit Card,True,BOGO,Cloudy,False,Thursday,False,157,167,2024-01-24 02:48:00,2024,1,4,0
937,3725,115,Tablet,Electronics,5,1080.26,7/20/2024 14:26,9,"New York, NY",377,82,158,322,10,41,Female,73724.11,Silver,Credit Card,True,0,Cloudy,True,Saturday,True,380,185,2024-07-20 14:26:00,2024,7,29,0
938,5906,737,Tablet,Appliances,3,779.25,9/1/2024 21:24,12,"Miami, FL",489,54,172,476,6,55,Female,117047.84,Gold,Credit Card,True,0,Rainy,False,Thursday,False,224,174,2024-09-01 21:24:00,2024,9,35,0
939,1474,673,Fridge,Electronics,1,150.62,7/23/2024 10:07,13,"Dallas, TX",451,64,224,214,3,22,Male,45396.8,Gold,Debit Card,True,0,Rainy,True,Monday,True,172,360,2024-07-23 10:07:00,2024,7,30,0
940,1753,626,Tablet,Appliances,4,244.82,3/11/2024 22:38,9,"Dallas, TX",468,87,196,176,6,44,Female,101666.46,Bronze,Credit Card,False,BOGO,Cloudy,False,Saturday,True,369,382,2024-03-11 22:38:00,2024,3,11,0
941,6314,204,Camera,Electronics,1,1408.58,9/11/2024 13:09,11,"Miami, FL",17,125,292,415,7,68,Female,20831.93,Silver,Cash,False,0,Sunny,True,Wednesday,True,257,441,2024-09-11 13:09:00,2024,9,37,0
942,1919,311,Tablet,Appliances,2,986.83,8/28/2024 2:13,16,"Dallas, TX",362,135,175,261,4,66,Male,60756.32,Silver,Cash,True,Percentage Discount,Stormy,False,Sunday,True,471,349,2024-08-28 02:13:00,2024,8,35,0
943,5806,655,Camera,Appliances,2,524.26,3/23/2024 11:05,5,"Dallas, TX",458,136,122,323,8,37,Male,115981.27,Platinum,Cash,True,Percentage Discount,Rainy,False,Sunday,False,382,329,2024-03-23 11:05:00,2024,3,12,0
944,6873,458,Camera,Electronics,2,658.44,9/5/2024 18:02,5,"Dallas, TX",298,81,164,312,8,65,Male,29359.02,Gold,Cash,True,BOGO,Sunny,False,Monday,True,389,357,2024-09-05 18:02:00,2024,9,36,0
945,7141,662,Headphones,Electronics,4,1185.48,4/14/2024 16:53,15,"Los Angeles, CA",435,120,174,462,4,57,Other,89654.68,Silver,Cash,True,0,Cloudy,False,Wednesday,True,202,188,2024-04-14 16:53:00,2024,4,15,0
946,8056,426,Smartphone,Appliances,4,682.92,3/22/2024 6:09,11,"Chicago, IL",46,137,136,132,2,23,Other,104334.15,Bronze,Cash,False,0,Sunny,True,Tuesday,False,281,491,2024-03-22 06:09:00,2024,3,12,0
947,3385,377,TV,Appliances,3,1879.72,8/28/2024 23:02,16,"Miami, FL",357,87,284,428,3,40,Female,90039.4,Bronze,Cash,True,Percentage Discount,Cloudy,False,Saturday,True,389,182,2024-08-28 23:02:00,2024,8,35,0
948,5000,244,Headphones,Appliances,2,537.83,8/13/2024 18:10,20,"Chicago, IL",188,112,281,240,6,59,Other,68539.81,Platinum,Cash,False,0,Cloudy,False,Wednesday,False,399,286,2024-08-13 18:10:00,2024,8,33,0
949,9702,821,Laptop,Electronics,2,894.61,3/31/2024 10:03,9,"Dallas, TX",304,148,291,360,3,44,Other,33869.29,Gold,Digital Wallet,True,0,Rainy,True,Tuesday,False,433,386,2024-03-31 10:03:00,2024,3,13,0
950,7751,923,Tablet,Electronics,5,1092.98,3/16/2024 14:20,2,"Dallas, TX",177,97,220,493,5,43,Other,56181.98,Bronze,Cash,True,0,Cloudy,True,Tuesday,True,357,335,2024-03-16 14:20:00,2024,3,11,0
951,3950,390,Fridge,Electronics,4,383.12,3/14/2024 21:15,15,"New York, NY",368,87,129,453,6,30,Male,101820.6,Gold,Debit Card,True,0,Stormy,True,Wednesday,True,291,112,2024-03-14 21:15:00,2024,3,11,0
952,3785,687,TV,Electronics,2,252.58,3/13/2024 11:46,9,"Dallas, TX",204,80,275,180,9,19,Other,74484.84,Platinum,Digital Wallet,False,BOGO,Stormy,True,Friday,True,157,203,2024-03-13 11:46:00,2024,3,11,0
953,3868,350,Fridge,Appliances,2,1610.37,5/30/2024 12:37,1,"Chicago, IL",381,132,249,458,8,62,Female,100107.94,Platinum,Digital Wallet,False,0,Cloudy,False,Saturday,True,130,491,2024-05-30 12:37:00,2024,5,22,0
954,2293,275,Tablet,Appliances,1,997.48,8/1/2024 17:44,8,"Dallas, TX",227,60,212,235,1,30,Male,111458.12,Gold,Debit Card,True,0,Rainy,True,Sunday,True,490,297,2024-08-01 17:44:00,2024,8,31,0
955,7267,172,Tablet,Electronics,3,1119.58,1/5/2024 1:49,7,"Dallas, TX",263,114,175,434,2,42,Other,116767.49,Silver,Cash,False,0,Cloudy,False,Tuesday,False,146,328,2024-01-05 01:49:00,2024,1,1,0
956,4945,418,Smartphone,Electronics,3,1120.15,6/16/2024 5:28,15,"Chicago, IL",96,118,186,223,4,30,Male,60724.4,Platinum,Debit Card,False,0,Stormy,True,Thursday,True,333,272,2024-06-16 05:28:00,2024,6,24,0
957,9153,727,Headphones,Appliances,2,239.77,7/15/2024 12:00,9,"Miami, FL",72,101,155,313,2,32,Male,99364.57,Silver,Credit Card,False,0,Rainy,True,Friday,False,340,419,2024-07-15 12:00:00,2024,7,29,0
958,3344,446,Washing Machine,Electronics,2,1249.52,3/22/2024 13:00,9,"Los Angeles, CA",484,150,116,254,2,50,Other,111230.18,Bronze,Digital Wallet,False,0,Stormy,True,Thursday,True,133,346,2024-03-22 13:00:00,2024,3,12,0
959,4804,653,Tablet,Appliances,1,840.51,8/5/2024 17:53,20,"New York, NY",106,89,175,379,2,44,Male,46988.95,Bronze,Cash,False,BOGO,Cloudy,True,Thursday,False,163,358,2024-08-05 17:53:00,2024,8,32,0
960,8555,554,Camera,Electronics,4,1072.79,3/5/2024 6:55,19,"Chicago, IL",288,96,193,275,8,63,Female,22549.66,Silver,Digital Wallet,False,0,Rainy,False,Friday,True,242,122,2024-03-05 06:55:00,2024,3,10,0
961,5161,151,Headphones,Appliances,2,875.33,6/17/2024 14:34,20,"New York, NY",356,126,248,138,6,37,Female,27018.71,Bronze,Credit Card,True,0,Stormy,False,Sunday,True,321,198,2024-06-17 14:34:00,2024,6,25,0
962,8529,233,Headphones,Electronics,4,301.3,5/25/2024 0:42,17,"Dallas, TX",333,84,194,327,2,50,Other,86842.4,Bronze,Credit Card,True,0,Stormy,True,Friday,False,329,276,2024-05-25 00:42:00,2024,5,21,0
963,5183,129,Tablet,Electronics,3,1533.92,8/4/2024 23:09,15,"Miami, FL",498,108,190,370,8,43,Female,101047.22,Platinum,Debit Card,True,0,Stormy,False,Thursday,True,172,178,2024-08-04 23:09:00,2024,8,31,0
964,1153,582,Laptop,Appliances,3,1685.95,7/6/2024 2:49,1,"Chicago, IL",379,119,103,182,4,39,Male,35696.91,Bronze,Cash,True,0,Sunny,False,Wednesday,False,302,508,2024-07-06 02:49:00,2024,7,27,0
965,8622,791,Smartphone,Appliances,5,842.76,3/17/2024 9:55,20,"Chicago, IL",401,56,243,456,4,19,Male,83681.21,Platinum,Credit Card,False,0,Sunny,True,Saturday,False,261,371,2024-03-17 09:55:00,2024,3,11,0
966,5712,151,Camera,Electronics,4,1118.44,7/12/2024 1:45,8,"Los Angeles, CA",391,57,113,330,6,21,Other,90385.55,Silver,Debit Card,True,Percentage Discount,Rainy,False,Thursday,False,472,435,2024-07-12 01:45:00,2024,7,28,0
967,9955,208,Fridge,Appliances,2,1683.81,6/12/2024 10:53,8,"Miami, FL",186,110,112,448,9,46,Other,119141.03,Silver,Debit Card,False,Percentage Discount,Sunny,False,Thursday,True,340,269,2024-06-12 10:53:00,2024,6,24,0
968,3588,492,Smartphone,Electronics,2,328.44,1/19/2024 5:47,20,"Los Angeles, CA",491,130,137,285,4,36,Male,103389.03,Silver,Digital Wallet,True,0,Stormy,False,Wednesday,False,409,407,2024-01-19 05:47:00,2024,1,3,0
969,2210,155,Camera,Electronics,1,884.24,3/21/2024 8:04,4,"Chicago, IL",479,123,260,481,7,34,Male,30508.93,Gold,Debit Card,True,0,Stormy,False,Wednesday,True,197,105,2024-03-21 08:04:00,2024,3,12,0
970,8237,188,Fridge,Electronics,5,1177.46,9/12/2024 17:24,8,"Miami, FL",387,72,258,353,3,31,Male,89065.97,Bronze,Debit Card,True,Percentage Discount,Sunny,False,Monday,False,355,337,2024-09-12 17:24:00,2024,9,37,0
971,6661,536,Washing Machine,Electronics,2,435.95,5/14/2024 9:39,13,"Dallas, TX",302,144,104,342,5,38,Female,25277.94,Bronze,Debit Card,False,0,Cloudy,False,Sunday,True,190,303,2024-05-14 09:39:00,2024,5,20,0
972,5901,501,Smartphone,Electronics,2,1852.77,5/29/2024 11:54,20,"New York, NY",387,84,209,203,10,29,Other,59722.44,Bronze,Debit Card,False,0,Stormy,False,Friday,True,464,272,2024-05-29 11:54:00,2024,5,22,0
973,7951,283,Headphones,Electronics,3,1456.9,8/29/2024 18:31,10,"Los Angeles, CA",96,146,284,130,3,69,Other,94014.99,Platinum,Debit Card,True,BOGO,Cloudy,True,Monday,True,476,395,2024-08-29 18:31:00,2024,8,35,0
974,5097,821,Laptop,Appliances,3,775.96,6/2/2024 18:26,3,"Los Angeles, CA",196,104,249,490,2,38,Male,22297.53,Silver,Debit Card,False,BOGO,Sunny,True,Monday,True,153,479,2024-06-02 18:26:00,2024,6,22,0
975,8484,710,Smartphone,Appliances,3,563.39,8/14/2024 0:11,6,"Los Angeles, CA",413,77,189,298,6,59,Female,113776.7,Bronze,Credit Card,True,BOGO,Cloudy,True,Monday,False,383,272,2024-08-14 00:11:00,2024,8,33,0
976,5949,706,Smartphone,Appliances,4,1428.12,7/17/2024 0:20,13,"Miami, FL",7,101,178,134,2,18,Female,59980.81,Bronze,Cash,True,0,Stormy,True,Monday,True,477,252,2024-07-17 00:20:00,2024,7,29,0
977,4263,744,Smartphone,Appliances,1,432.54,9/1/2024 21:15,10,"Chicago, IL",472,102,220,233,6,22,Male,84931.23,Platinum,Credit Card,True,0,Sunny,False,Sunday,False,344,379,2024-09-01 21:15:00,2024,9,35,0
978,7302,956,Fridge,Electronics,3,838.28,5/18/2024 14:15,3,"Los Angeles, CA",59,126,150,300,7,54,Male,92037.72,Bronze,Digital Wallet,True,0,Stormy,False,Monday,True,476,119,2024-05-18 14:15:00,2024,5,20,0
979,8916,806,Headphones,Appliances,5,152.95,6/23/2024 22:40,1,"Chicago, IL",296,116,180,115,10,23,Male,60870.34,Platinum,Cash,True,0,Rainy,False,Saturday,True,348,119,2024-06-23 22:40:00,2024,6,25,0
980,2747,816,Laptop,Electronics,5,430.71,6/15/2024 21:29,13,"Chicago, IL",399,80,208,140,5,44,Other,38114.92,Silver,Debit Card,True,0,Cloudy,True,Wednesday,False,433,393,2024-06-15 21:29:00,2024,6,24,0
981,4886,556,Camera,Appliances,4,410.79,2/5/2024 14:20,1,"Los Angeles, CA",145,111,165,352,5,41,Other,57664.94,Silver,Cash,True,0,Sunny,True,Monday,True,227,271,2024-02-05 14:20:00,2024,2,6,0
982,7248,731,TV,Appliances,5,1029.29,8/17/2024 22:04,8,"Chicago, IL",44,94,134,442,4,32,Female,47124.63,Bronze,Credit Card,True,0,Sunny,True,Tuesday,True,279,199,2024-08-17 22:04:00,2024,8,33,0
983,6881,464,Fridge,Electronics,5,1754.84,3/13/2024 9:54,6,"Miami, FL",78,96,214,230,9,43,Female,38060.41,Platinum,Credit Card,True,0,Sunny,True,Saturday,True,415,386,2024-03-13 09:54:00,2024,3,11,0
984,5847,419,Washing Machine,Appliances,5,1954.77,7/15/2024 19:10,14,"Chicago, IL",326,131,276,492,8,34,Other,21855.98,Gold,Debit Card,False,0,Stormy,False,Monday,False,284,452,2024-07-15 19:10:00,2024,7,29,0
985,5837,440,Smartphone,Appliances,3,1398.2,7/27/2024 1:43,15,"Miami, FL",235,133,135,144,9,47,Other,24715.67,Bronze,Debit Card,False,0,Stormy,True,Saturday,True,450,350,2024-07-27 01:43:00,2024,7,30,0
986,1359,937,Washing Machine,Appliances,1,703.52,8/15/2024 22:27,12,"New York, NY",15,96,251,404,8,19,Other,39491.89,Platinum,Cash,True,0,Stormy,True,Wednesday,True,104,240,2024-08-15 22:27:00,2024,8,33,0
987,7484,302,Camera,Electronics,3,1405.98,1/26/2024 6:21,8,"New York, NY",212,132,165,293,2,69,Other,98372.94,Platinum,Cash,False,0,Cloudy,False,Thursday,False,359,418,2024-01-26 06:21:00,2024,1,4,0
988,5497,830,Washing Machine,Electronics,4,1366.8,4/5/2024 5:57,3,"Los Angeles, CA",196,52,152,256,8,43,Other,26776.41,Silver,Digital Wallet,False,Percentage Discount,Cloudy,False,Thursday,True,241,398,2024-04-05 05:57:00,2024,4,14,0
989,1132,876,Headphones,Electronics,1,1835.25,2/3/2024 15:05,18,"Los Angeles, CA",54,85,205,113,2,59,Other,23477.41,Bronze,Debit Card,True,0,Cloudy,False,Friday,True,462,500,2024-02-03 15:05:00,2024,2,5,0
990,1803,786,Headphones,Appliances,2,319.31,2/9/2024 2:13,2,"New York, NY",287,93,261,471,4,45,Female,79148.4,Bronze,Debit Card,True,0,Sunny,True,Wednesday,False,456,335,2024-02-09 02:13:00,2024,2,6,0
991,9138,928,Fridge,Appliances,1,612.2,4/2/2024 11:10,12,"Dallas, TX",396,119,123,130,6,57,Male,48123.72,Platinum,Digital Wallet,True,0,Cloudy,True,Friday,False,405,94,2024-04-02 11:10:00,2024,4,14,0
992,5689,646,TV,Appliances,3,236.37,6/20/2024 11:30,16,"Chicago, IL",167,81,109,131,10,45,Female,41435.97,Platinum,Debit Card,True,Percentage Discount,Stormy,False,Friday,True,214,241,2024-06-20 11:30:00,2024,6,25,0
993,4770,180,Headphones,Appliances,5,614.09,7/11/2024 20:55,13,"Chicago, IL",343,119,300,472,4,69,Male,78511.37,Gold,Digital Wallet,True,0,Sunny,True,Sunday,False,294,332,2024-07-11 20:55:00,2024,7,28,0
994,6772,873,Tablet,Electronics,4,349.13,4/29/2024 19:02,8,"Chicago, IL",117,113,256,401,6,58,Male,94704.12,Bronze,Cash,True,0,Rainy,True,Thursday,False,247,121,2024-04-29 19:02:00,2024,4,18,0
995,4588,882,Headphones,Electronics,5,837.25,7/25/2024 17:32,3,"Los Angeles, CA",209,96,106,179,9,67,Other,119318.06,Gold,Debit Card,True,BOGO,Sunny,False,Sunday,True,321,456,2024-07-25 17:32:00,2024,7,30,0
996,4115,576,Fridge,Electronics,3,986.78,7/5/2024 10:37,2,"Los Angeles, CA",17,54,244,267,10,61,Female,20422.58,Platinum,Debit Card,False,BOGO,Sunny,True,Friday,True,294,203,2024-07-05 10:37:00,2024,7,27,0
997,5106,681,Camera,Electronics,1,251.04,6/11/2024 22:02,3,"Miami, FL",361,51,233,311,2,48,Male,54403.72,Gold,Credit Card,False,Percentage Discount,Stormy,True,Thursday,False,412,458,2024-06-11 22:02:00,2024,6,24,0
998,3240,234,Tablet,Electronics,5,197.01,5/3/2024 21:34,1,"Los Angeles, CA",271,144,140,446,1,49,Other,63556.52,Gold,Debit Card,True,0,Rainy,True,Wednesday,True,307,234,2024-05-03 21:34:00,2024,5,18,0
999,2591,195,Tablet,Electronics,3,673.53,4/25/2024 12:19,18,"Dallas, TX",252,113,166,361,6,50,Male,73110.14,Silver,Credit Card,True,0,Rainy,False,Monday,True,119,91,2024-04-25 12:19:00,2024,4,17,0
1000,1645,932,Tablet,Electronics,2,1198.21,7/5/2024 14:15,20,"Chicago, IL",273,145,182,203,5,58,Male,59057.12,Gold,Debit Card,True,0,Cloudy,False,Thursday,True,158,261,2024-07-05 14:15:00,2024,7,27,0
1001,6061,921,TV,Electronics,4,326.25,2/4/2024 13:09,13,"Dallas, TX",21,109,114,446,9,24,Other,34807.05,Bronze,Digital Wallet,False,BOGO,Stormy,False,Tuesday,True,345,158,2024-02-04 13:09:00,2024,2,5,0
1002,8222,815,Tablet,Appliances,4,236.12,3/11/2024 23:26,11,"Dallas, TX",479,54,265,268,3,70,Female,77323.29,Bronze,Credit Card,False,0,Cloudy,True,Friday,True,256,440,2024-03-11 23:26:00,2024,3,11,0
1003,1546,579,Smartphone,Appliances,3,1726.84,4/13/2024 10:13,10,"Chicago, IL",224,128,233,407,6,31,Female,59381.53,Silver,Credit Card,True,Percentage Discount,Sunny,True,Saturday,True,102,387,2024-04-13 10:13:00,2024,4,15,0
1004,6977,199,Laptop,Appliances,5,877.61,6/15/2024 14:08,14,"New York, NY",69,124,129,435,7,34,Female,32340.59,Platinum,Cash,True,0,Sunny,True,Wednesday,False,389,494,2024-06-15 14:08:00,2024,6,24,0
1005,3153,566,Tablet,Appliances,2,537.21,5/24/2024 22:24,4,"Los Angeles, CA",0,56,167,318,3,22,Male,112490.45,Platinum,Credit Card,False,Percentage Discount,Cloudy,False,Friday,True,294,226,2024-05-24 22:24:00,2024,5,21,0
1006,2476,417,Headphones,Electronics,4,1705.17,8/1/2024 1:55,6,"Chicago, IL",342,143,281,164,8,37,Female,37288.64,Bronze,Digital Wallet,True,0,Rainy,False,Saturday,True,292,125,2024-08-01 01:55:00,2024,8,31,0
1007,5835,800,Washing Machine,Electronics,4,1062.65,8/21/2024 21:23,11,"New York, NY",71,74,210,328,4,68,Other,47707.83,Platinum,Credit Card,True,0,Sunny,True,Sunday,False,316,387,2024-08-21 21:23:00,2024,8,34,0
1008,6352,759,Laptop,Appliances,2,301.01,1/14/2024 17:49,8,"Los Angeles, CA",14,64,270,366,10,39,Male,119914.1,Bronze,Digital Wallet,False,0,Cloudy,True,Friday,True,193,146,2024-01-14 17:49:00,2024,1,2,0
1009,7807,827,Fridge,Electronics,2,1713.12,4/3/2024 17:53,13,"Chicago, IL",462,106,176,227,7,27,Other,65794.51,Platinum,Cash,False,0,Rainy,True,Thursday,False,178,502,2024-04-03 17:53:00,2024,4,14,0
1010,3877,884,Smartphone,Electronics,5,591.86,6/22/2024 14:40,2,"Los Angeles, CA",439,68,213,420,5,35,Other,98133.61,Silver,Credit Card,False,BOGO,Cloudy,True,Thursday,False,227,234,2024-06-22 14:40:00,2024,6,25,0
1011,4289,576,Washing Machine,Electronics,3,111.44,6/28/2024 13:57,13,"Dallas, TX",462,62,110,385,4,35,Female,100377.81,Platinum,Credit Card,True,BOGO,Stormy,True,Wednesday,False,237,260,2024-06-28 13:57:00,2024,6,26,0
1012,3165,581,Washing Machine,Electronics,4,673.06,1/9/2024 13:29,10,"Los Angeles, CA",114,130,138,342,4,53,Other,87494.93,Platinum,Digital Wallet,True,BOGO,Cloudy,True,Wednesday,False,312,364,2024-01-09 13:29:00,2024,1,2,0
1013,9837,337,Tablet,Electronics,2,1744.67,4/30/2024 10:06,1,"Los Angeles, CA",474,59,150,344,2,45,Female,26828.89,Gold,Cash,True,BOGO,Sunny,False,Saturday,True,164,502,2024-04-30 10:06:00,2024,4,18,0
1014,6994,329,Fridge,Appliances,3,1194.86,1/1/2024 4:05,2,"Dallas, TX",324,79,207,345,7,35,Other,106145.06,Silver,Credit Card,True,0,Rainy,False,Thursday,False,393,407,2024-01-01 04:05:00,2024,1,1,0
1015,9697,247,Laptop,Electronics,2,409.17,1/31/2024 10:29,9,"New York, NY",364,148,101,295,2,67,Male,76940.25,Gold,Digital Wallet,False,0,Rainy,False,Wednesday,True,476,179,2024-01-31 10:29:00,2024,1,5,0
1016,9221,981,TV,Appliances,4,393.4,6/10/2024 17:24,15,"New York, NY",109,96,212,268,3,55,Male,23708.12,Gold,Credit Card,True,Percentage Discount,Cloudy,True,Tuesday,False,450,409,2024-06-10 17:24:00,2024,6,24,0
1017,5465,731,Laptop,Electronics,4,776.25,5/22/2024 10:04,10,"Los Angeles, CA",281,125,175,233,1,22,Female,111444.54,Silver,Credit Card,True,0,Sunny,False,Sunday,True,330,321,2024-05-22 10:04:00,2024,5,21,0
1018,3695,364,Fridge,Appliances,4,322.68,7/19/2024 12:29,17,"Dallas, TX",481,140,128,100,10,61,Female,50869.7,Bronze,Digital Wallet,True,0,Rainy,True,Tuesday,True,404,105,2024-07-19 12:29:00,2024,7,29,0
1019,5210,472,Camera,Electronics,3,103.69,8/5/2024 13:13,13,"New York, NY",281,114,225,168,10,70,Other,58930.28,Platinum,Cash,True,BOGO,Sunny,True,Sunday,False,157,419,2024-08-05 13:13:00,2024,8,32,0
1020,8894,501,TV,Electronics,2,1923.72,3/3/2024 21:57,15,"Miami, FL",51,50,115,214,3,38,Male,21733.22,Bronze,Digital Wallet,True,Percentage Discount,Stormy,False,Saturday,True,269,365,2024-03-03 21:57:00,2024,3,9,0
1021,5835,287,Laptop,Electronics,2,1491.36,1/21/2024 2:15,20,"Chicago, IL",483,86,300,252,9,31,Female,64291.33,Bronze,Cash,False,0,Sunny,True,Wednesday,False,160,491,2024-01-21 02:15:00,2024,1,3,0
1022,6549,816,Washing Machine,Appliances,3,1527.14,5/21/2024 10:35,10,"Chicago, IL",34,74,209,341,7,40,Female,113109.83,Platinum,Digital Wallet,False,Percentage Discount,Rainy,False,Tuesday,False,463,176,2024-05-21 10:35:00,2024,5,21,0
1023,2886,781,Smartphone,Electronics,5,1708.16,2/21/2024 2:51,18,"Los Angeles, CA",80,76,103,490,9,19,Male,93149.46,Bronze,Digital Wallet,False,0,Sunny,False,Monday,True,470,419,2024-02-21 02:51:00,2024,2,8,0
1024,8673,438,TV,Appliances,2,272.05,8/29/2024 10:46,13,"Chicago, IL",5,80,142,162,8,54,Other,67552.96,Gold,Digital Wallet,True,0,Cloudy,False,Thursday,False,234,450,2024-08-29 10:46:00,2024,8,35,0
1025,2233,907,Smartphone,Electronics,1,455.08,7/29/2024 23:46,19,"New York, NY",388,64,144,244,9,19,Other,77676.5,Silver,Cash,True,Percentage Discount,Cloudy,True,Monday,False,198,106,2024-07-29 23:46:00,2024,7,31,0
1026,3306,981,Tablet,Appliances,4,1091.66,2/11/2024 0:02,17,"Los Angeles, CA",467,146,192,276,5,60,Other,27617.25,Bronze,Digital Wallet,False,0,Rainy,False,Friday,False,113,298,2024-02-11 00:02:00,2024,2,6,0
1027,4696,432,Camera,Electronics,1,457.7,3/31/2024 5:52,19,"Dallas, TX",295,97,143,158,3,34,Male,63634.13,Gold,Digital Wallet,True,0,Rainy,True,Tuesday,True,408,490,2024-03-31 05:52:00,2024,3,13,0
1028,7511,564,Smartphone,Appliances,4,1172.96,1/4/2024 6:13,9,"New York, NY",316,136,185,198,8,30,Male,67688.18,Silver,Debit Card,False,BOGO,Cloudy,True,Thursday,False,477,377,2024-01-04 06:13:00,2024,1,1,0
1029,6992,599,Camera,Electronics,3,425.26,5/20/2024 5:30,17,"Dallas, TX",218,103,182,331,8,40,Female,48157.11,Silver,Credit Card,False,0,Rainy,False,Wednesday,False,138,107,2024-05-20 05:30:00,2024,5,21,0
1030,2479,130,Laptop,Electronics,5,1301.4,9/8/2024 7:14,9,"Los Angeles, CA",202,124,151,239,6,65,Other,34816.51,Bronze,Digital Wallet,True,0,Stormy,False,Friday,True,354,355,2024-09-08 07:14:00,2024,9,36,0
1031,7464,166,Fridge,Appliances,1,759.05,3/7/2024 21:06,17,"New York, NY",436,103,269,437,2,66,Other,82694.94,Bronze,Credit Card,False,0,Stormy,False,Tuesday,True,483,499,2024-03-07 21:06:00,2024,3,10,0
1032,1228,586,Washing Machine,Appliances,2,1058.2,8/12/2024 4:32,3,"Miami, FL",244,83,268,103,6,22,Female,45424.84,Gold,Debit Card,True,BOGO,Rainy,False,Thursday,False,477,297,2024-08-12 04:32:00,2024,8,33,0
1033,5332,215,Fridge,Appliances,5,1912.95,1/28/2024 23:17,15,"New York, NY",219,52,120,499,4,51,Other,115222.59,Gold,Digital Wallet,True,Percentage Discount,Cloudy,False,Monday,True,329,485,2024-01-28 23:17:00,2024,1,4,0
1034,9791,459,Smartphone,Electronics,2,277.65,6/21/2024 21:14,1,"Miami, FL",500,64,148,165,7,35,Other,29926.15,Silver,Cash,True,0,Stormy,False,Friday,True,421,199,2024-06-21 21:14:00,2024,6,25,0
1035,3024,590,Camera,Electronics,1,468.62,4/9/2024 23:58,8,"Miami, FL",112,56,165,372,8,20,Female,22473.66,Silver,Debit Card,False,0,Sunny,False,Saturday,False,381,290,2024-04-09 23:58:00,2024,4,15,0
1036,8451,572,Tablet,Electronics,3,524.35,3/15/2024 13:48,13,"Los Angeles, CA",226,60,290,431,3,42,Female,85611.33,Gold,Debit Card,False,Percentage Discount,Stormy,False,Tuesday,True,381,308,2024-03-15 13:48:00,2024,3,11,0
1037,7038,966,Camera,Appliances,5,1215.52,4/6/2024 17:06,4,"New York, NY",83,89,123,500,1,31,Other,97338.52,Platinum,Credit Card,False,0,Rainy,False,Wednesday,True,464,170,2024-04-06 17:06:00,2024,4,14,0
1038,5295,274,TV,Electronics,2,704.29,6/5/2024 10:50,1,"Los Angeles, CA",483,101,215,183,10,56,Other,106345.43,Platinum,Credit Card,False,BOGO,Stormy,True,Saturday,False,480,454,2024-06-05 10:50:00,2024,6,23,0
1039,7242,389,Tablet,Electronics,2,1726.84,7/25/2024 2:45,2,"Chicago, IL",8,53,207,314,8,27,Male,116563.11,Platinum,Cash,True,BOGO,Cloudy,False,Sunday,False,312,420,2024-07-25 02:45:00,2024,7,30,0
1040,7086,886,Headphones,Electronics,5,1374.59,5/26/2024 22:44,15,"Los Angeles, CA",102,61,147,282,6,56,Other,86355.71,Bronze,Cash,True,0,Cloudy,True,Friday,True,461,152,2024-05-26 22:44:00,2024,5,21,0
1041,2775,456,Headphones,Electronics,3,699.85,7/2/2024 1:55,15,"New York, NY",331,129,147,430,1,63,Other,102133.01,Platinum,Digital Wallet,True,0,Stormy,False,Wednesday,True,101,208,2024-07-02 01:55:00,2024,7,27,0
1042,4830,718,Washing Machine,Electronics,1,472.33,3/18/2024 10:39,1,"Dallas, TX",227,136,239,495,7,34,Female,79753.34,Platinum,Debit Card,True,0,Stormy,True,Tuesday,True,103,451,2024-03-18 10:39:00,2024,3,12,0
1043,8724,688,Headphones,Appliances,1,412.06,8/8/2024 10:57,3,"Dallas, TX",114,75,107,320,7,58,Female,102588.54,Bronze,Credit Card,True,0,Cloudy,False,Friday,True,412,145,2024-08-08 10:57:00,2024,8,32,0
1044,1410,230,Headphones,Electronics,3,829.47,4/29/2024 13:49,15,"Los Angeles, CA",151,76,247,275,10,64,Other,20999.5,Bronze,Debit Card,False,0,Stormy,True,Wednesday,True,206,207,2024-04-29 13:49:00,2024,4,18,0
1045,6374,620,TV,Electronics,4,1556.4,3/4/2024 23:08,16,"Miami, FL",396,91,188,192,10,43,Other,25730.53,Gold,Digital Wallet,False,0,Sunny,True,Thursday,True,411,110,2024-03-04 23:08:00,2024,3,10,0
1046,4626,205,Laptop,Electronics,2,631.0,8/30/2024 18:02,8,"Los Angeles, CA",128,73,176,391,2,41,Female,71761.54,Platinum,Cash,False,Percentage Discount,Sunny,False,Friday,True,141,323,2024-08-30 18:02:00,2024,8,35,0
1047,2035,515,Fridge,Appliances,1,913.3,2/23/2024 8:54,16,"New York, NY",257,50,117,214,3,24,Male,42168.64,Bronze,Digital Wallet,False,0,Sunny,False,Thursday,True,421,129,2024-02-23 08:54:00,2024,2,8,0
1048,8606,937,TV,Appliances,2,1596.45,1/2/2024 13:12,11,"Miami, FL",114,105,225,441,9,67,Male,76371.95,Bronze,Cash,False,Percentage Discount,Sunny,False,Sunday,True,318,472,2024-01-02 13:12:00,2024,1,1,0
1049,5951,831,Headphones,Electronics,5,387.86,9/2/2024 12:45,19,"New York, NY",458,71,194,292,6,31,Male,37294.52,Bronze,Digital Wallet,False,Percentage Discount,Cloudy,True,Wednesday,False,162,298,2024-09-02 12:45:00,2024,9,36,0
1050,7689,915,Laptop,Appliances,3,1188.12,3/11/2024 22:28,10,"Los Angeles, CA",192,72,168,345,7,27,Male,31452.88,Bronze,Debit Card,True,0,Rainy,False,Saturday,False,353,394,2024-03-11 22:28:00,2024,3,11,0
1051,2911,209,Washing Machine,Appliances,3,888.59,3/20/2024 1:46,20,"Dallas, TX",185,99,273,285,9,47,Male,94669.47,Silver,Cash,True,0,Sunny,True,Friday,False,376,272,2024-03-20 01:46:00,2024,3,12,0
1052,3290,433,Washing Machine,Electronics,5,426.99,8/3/2024 11:43,7,"Dallas, TX",215,56,108,298,6,23,Female,92721.13,Bronze,Debit Card,False,0,Sunny,False,Monday,True,494,173,2024-08-03 11:43:00,2024,8,31,0
1053,1742,669,Laptop,Appliances,4,389.04,2/22/2024 3:01,7,"Dallas, TX",247,137,124,191,10,21,Other,34297.51,Platinum,Credit Card,True,0,Stormy,False,Thursday,False,318,126,2024-02-22 03:01:00,2024,2,8,0
1054,1609,765,Camera,Electronics,2,156.29,3/31/2024 14:32,2,"Miami, FL",0,122,199,332,5,20,Female,68946.62,Silver,Digital Wallet,True,BOGO,Rainy,False,Saturday,False,153,270,2024-03-31 14:32:00,2024,3,13,0
1055,5986,172,Laptop,Appliances,4,1629.97,4/14/2024 2:30,15,"Miami, FL",235,76,163,289,5,37,Male,61608.6,Platinum,Cash,True,Percentage Discount,Cloudy,True,Friday,True,118,293,2024-04-14 02:30:00,2024,4,15,0
1056,9071,911,Washing Machine,Appliances,2,1903.97,2/14/2024 3:26,17,"Chicago, IL",327,59,214,489,2,57,Female,109968.63,Platinum,Digital Wallet,True,BOGO,Stormy,True,Monday,False,313,441,2024-02-14 03:26:00,2024,2,7,0
1057,2902,409,Camera,Electronics,4,532.66,8/1/2024 2:58,4,"Chicago, IL",51,99,257,228,7,59,Other,86547.9,Platinum,Credit Card,False,0,Cloudy,False,Sunday,False,467,102,2024-08-01 02:58:00,2024,8,31,0
1058,2592,645,Headphones,Electronics,2,1513.19,7/5/2024 4:25,4,"Chicago, IL",296,145,109,274,5,55,Other,76889.12,Gold,Digital Wallet,False,Percentage Discount,Sunny,True,Saturday,False,228,269,2024-07-05 04:25:00,2024,7,27,0
1059,4846,572,Camera,Appliances,4,1291.48,7/8/2024 23:56,3,"Dallas, TX",322,85,189,445,10,24,Male,32820.13,Gold,Credit Card,True,Percentage Discount,Cloudy,False,Monday,True,403,285,2024-07-08 23:56:00,2024,7,28,0
1060,9807,510,Tablet,Appliances,2,973.43,3/6/2024 10:21,15,"Dallas, TX",356,66,297,232,4,29,Female,32781.54,Platinum,Credit Card,True,0,Stormy,False,Tuesday,False,283,386,2024-03-06 10:21:00,2024,3,10,0
1061,3222,704,Laptop,Appliances,5,1814.58,1/10/2024 15:44,4,"Chicago, IL",1,147,240,107,4,45,Male,89522.32,Bronze,Cash,False,0,Sunny,False,Monday,True,255,363,2024-01-10 15:44:00,2024,1,2,0
1062,7367,523,Camera,Electronics,3,1650.84,1/7/2024 8:10,19,"Miami, FL",177,99,168,219,2,67,Other,99837.09,Gold,Digital Wallet,False,Percentage Discount,Sunny,True,Monday,True,238,331,2024-01-07 08:10:00,2024,1,1,0
1063,8432,344,Smartphone,Electronics,2,589.62,4/22/2024 11:11,14,"New York, NY",207,101,241,498,2,67,Female,95975.47,Gold,Credit Card,True,Percentage Discount,Rainy,True,Wednesday,False,142,207,2024-04-22 11:11:00,2024,4,17,0
1064,7078,735,Fridge,Appliances,1,1167.05,7/17/2024 1:39,2,"Los Angeles, CA",337,79,142,256,2,35,Male,62116.25,Platinum,Digital Wallet,False,0,Cloudy,True,Friday,False,319,259,2024-07-17 01:39:00,2024,7,29,0
1065,9850,349,Camera,Appliances,4,1292.1,8/11/2024 3:55,2,"Dallas, TX",438,79,241,399,6,66,Female,108357.87,Silver,Cash,True,0,Rainy,False,Monday,False,389,430,2024-08-11 03:55:00,2024,8,32,0
1066,7866,661,Laptop,Electronics,4,753.02,5/17/2024 6:56,9,"Dallas, TX",166,64,129,424,7,33,Male,24956.18,Bronze,Cash,False,0,Sunny,True,Tuesday,False,195,160,2024-05-17 06:56:00,2024,5,20,0
1067,3531,262,Tablet,Electronics,1,1262.57,5/3/2024 13:51,20,"Dallas, TX",251,98,214,361,9,51,Male,22828.13,Silver,Digital Wallet,True,0,Sunny,False,Thursday,False,203,299,2024-05-03 13:51:00,2024,5,18,0
1068,7797,593,Fridge,Appliances,3,1669.24,9/15/2024 12:57,1,"Miami, FL",412,62,148,487,6,34,Female,105027.28,Gold,Digital Wallet,True,0,Cloudy,True,Thursday,False,436,378,2024-09-15 12:57:00,2024,9,37,0
1069,2622,493,Washing Machine,Appliances,3,744.61,2/29/2024 18:55,6,"New York, NY",146,87,257,393,5,66,Male,110569.53,Bronze,Digital Wallet,False,0,Cloudy,False,Sunday,False,367,121,2024-02-29 18:55:00,2024,2,9,0
1070,9017,167,TV,Electronics,5,1677.94,8/26/2024 6:13,3,"New York, NY",429,56,152,226,1,48,Female,90582.01,Silver,Debit Card,True,BOGO,Sunny,False,Tuesday,False,134,379,2024-08-26 06:13:00,2024,8,35,0
1071,7686,448,Tablet,Appliances,5,229.62,1/19/2024 20:57,9,"Chicago, IL",441,120,154,409,3,63,Female,56004.83,Platinum,Digital Wallet,True,0,Rainy,True,Monday,True,168,111,2024-01-19 20:57:00,2024,1,3,0
1072,5583,313,Smartphone,Electronics,1,1392.3,9/10/2024 8:07,10,"New York, NY",433,69,293,329,7,19,Other,36303.77,Gold,Cash,False,0,Cloudy,True,Sunday,False,404,125,2024-09-10 08:07:00,2024,9,37,0
1073,1536,933,Fridge,Appliances,5,1994.69,1/3/2024 8:38,10,"Miami, FL",99,74,256,284,3,64,Male,31720.1,Bronze,Digital Wallet,False,0,Cloudy,False,Thursday,False,448,245,2024-01-03 08:38:00,2024,1,1,0
1074,7070,810,Tablet,Electronics,3,1964.58,3/24/2024 1:55,3,"Miami, FL",301,63,290,417,2,57,Female,42209.32,Platinum,Cash,True,0,Sunny,False,Wednesday,False,448,348,2024-03-24 01:55:00,2024,3,12,0
1075,4559,705,Washing Machine,Electronics,1,838.35,1/19/2024 1:17,12,"New York, NY",208,50,203,283,9,53,Male,48084.25,Platinum,Digital Wallet,False,0,Cloudy,False,Sunday,True,499,407,2024-01-19 01:17:00,2024,1,3,0
1076,8264,541,Laptop,Electronics,2,1637.44,3/20/2024 6:26,11,"Chicago, IL",250,58,258,268,1,24,Male,103243.89,Platinum,Digital Wallet,True,0,Cloudy,False,Thursday,False,127,414,2024-03-20 06:26:00,2024,3,12,0
1077,8285,903,Smartphone,Electronics,2,1147.31,5/29/2024 0:21,19,"New York, NY",244,110,261,221,7,54,Male,90318.68,Silver,Credit Card,False,Percentage Discount,Sunny,False,Monday,False,234,339,2024-05-29 00:21:00,2024,5,22,0
1078,4868,545,Headphones,Appliances,1,179.35,3/30/2024 1:32,14,"New York, NY",17,60,126,304,1,69,Other,89357.37,Platinum,Cash,True,0,Sunny,True,Tuesday,True,171,274,2024-03-30 01:32:00,2024,3,13,0
1079,6942,680,TV,Appliances,2,1001.45,3/25/2024 21:39,15,"Los Angeles, CA",162,138,106,436,4,28,Other,62892.5,Silver,Cash,True,0,Stormy,True,Sunday,False,475,241,2024-03-25 21:39:00,2024,3,13,0
1080,2627,906,Washing Machine,Appliances,5,1799.59,7/4/2024 22:56,9,"Dallas, TX",133,107,294,252,7,59,Female,60824.17,Platinum,Debit Card,True,0,Stormy,True,Monday,True,150,347,2024-07-04 22:56:00,2024,7,27,0
1081,7018,450,Fridge,Appliances,1,1922.86,9/9/2024 11:38,8,"Dallas, TX",200,65,295,421,4,19,Male,59458.29,Silver,Digital Wallet,True,BOGO,Cloudy,False,Sunday,True,244,232,2024-09-09 11:38:00,2024,9,37,0
1082,9920,657,Camera,Appliances,1,770.98,1/21/2024 22:00,8,"Miami, FL",419,127,239,186,3,41,Other,80351.72,Gold,Cash,False,Percentage Discount,Cloudy,True,Tuesday,False,465,132,2024-01-21 22:00:00,2024,1,3,0
1083,6876,810,Headphones,Appliances,3,530.26,1/5/2024 18:31,8,"New York, NY",230,124,141,192,4,21,Female,27949.85,Bronze,Cash,True,Percentage Discount,Sunny,False,Friday,False,128,145,2024-01-05 18:31:00,2024,1,1,0
1084,1992,341,Camera,Appliances,5,1297.18,6/6/2024 14:20,17,"Miami, FL",103,87,249,451,6,56,Female,70060.95,Platinum,Cash,False,0,Rainy,True,Saturday,True,368,390,2024-06-06 14:20:00,2024,6,23,0
1085,7523,277,Fridge,Appliances,5,168.13,7/3/2024 11:31,10,"Los Angeles, CA",307,90,208,125,2,24,Male,104069.36,Silver,Credit Card,False,0,Cloudy,False,Thursday,True,110,382,2024-07-03 11:31:00,2024,7,27,0
1086,5520,778,Smartphone,Appliances,2,1836.44,8/28/2024 23:43,19,"Los Angeles, CA",124,109,266,396,9,42,Female,33945.94,Gold,Credit Card,True,0,Cloudy,False,Friday,False,151,236,2024-08-28 23:43:00,2024,8,35,0
1087,4109,785,Headphones,Appliances,2,862.15,8/28/2024 8:29,14,"Chicago, IL",38,144,269,234,6,31,Male,112037.59,Silver,Debit Card,False,Percentage Discount,Cloudy,True,Saturday,True,335,506,2024-08-28 08:29:00,2024,8,35,0
1088,3001,179,Tablet,Appliances,1,255.19,8/15/2024 20:31,11,"Los Angeles, CA",200,82,190,324,3,33,Other,58566.32,Bronze,Cash,True,0,Rainy,True,Wednesday,True,259,480,2024-08-15 20:31:00,2024,8,33,0
1089,8450,857,Washing Machine,Appliances,1,971.83,4/4/2024 6:12,12,"Miami, FL",128,55,211,117,3,54,Other,44100.55,Silver,Debit Card,True,0,Cloudy,True,Sunday,True,363,340,2024-04-04 06:12:00,2024,4,14,0
1090,2501,828,Washing Machine,Electronics,2,1985.61,3/18/2024 0:04,6,"Chicago, IL",371,92,127,269,10,61,Female,113402.11,Bronze,Digital Wallet,True,0,Rainy,True,Thursday,False,206,260,2024-03-18 00:04:00,2024,3,12,0
1091,4475,687,Smartphone,Appliances,2,477.39,1/13/2024 8:36,8,"Los Angeles, CA",305,147,134,231,2,65,Female,69408.71,Gold,Cash,False,0,Sunny,True,Friday,True,368,495,2024-01-13 08:36:00,2024,1,2,0
1092,1349,956,Smartphone,Appliances,1,838.42,1/14/2024 4:45,19,"Miami, FL",2,64,115,233,7,27,Other,83665.8,Bronze,Credit Card,False,Percentage Discount,Cloudy,True,Sunday,True,211,313,2024-01-14 04:45:00,2024,1,2,0
1093,1828,598,Camera,Electronics,2,1184.13,2/3/2024 3:11,4,"Miami, FL",302,127,300,353,6,60,Female,81243.48,Bronze,Credit Card,True,0,Sunny,True,Friday,True,317,207,2024-02-03 03:11:00,2024,2,5,0
1094,6464,217,Fridge,Appliances,1,773.2,4/22/2024 7:02,16,"New York, NY",484,135,197,303,7,33,Female,67724.35,Bronze,Credit Card,False,0,Rainy,True,Thursday,True,145,453,2024-04-22 07:02:00,2024,4,17,0
1095,4990,706,Laptop,Appliances,3,612.66,8/31/2024 18:00,1,"Los Angeles, CA",380,131,172,283,2,70,Other,47318.52,Bronze,Debit Card,True,0,Cloudy,False,Wednesday,False,179,211,2024-08-31 18:00:00,2024,8,35,0
1096,3063,710,Camera,Electronics,3,910.99,1/25/2024 3:42,7,"Dallas, TX",174,123,198,358,4,69,Female,66757.72,Silver,Cash,True,0,Cloudy,True,Tuesday,True,455,353,2024-01-25 03:42:00,2024,1,4,0
1097,4362,574,TV,Appliances,5,1985.24,8/31/2024 23:30,8,"Chicago, IL",138,96,171,462,1,43,Male,109463.6,Silver,Digital Wallet,False,0,Sunny,True,Saturday,True,364,317,2024-08-31 23:30:00,2024,8,35,0
1098,2124,433,Tablet,Appliances,1,578.05,7/5/2024 3:15,12,"New York, NY",217,53,284,457,8,26,Other,66058.23,Gold,Credit Card,False,BOGO,Rainy,False,Friday,True,161,391,2024-07-05 03:15:00,2024,7,27,0
1099,4394,668,TV,Appliances,3,1541.13,3/9/2024 17:46,8,"Dallas, TX",457,120,204,202,4,38,Male,61857.77,Platinum,Credit Card,True,0,Stormy,False,Sunday,False,212,206,2024-03-09 17:46:00,2024,3,10,0
1100,4538,199,Headphones,Appliances,5,896.89,4/13/2024 13:25,1,"Los Angeles, CA",281,59,222,412,10,55,Other,57868.64,Bronze,Cash,False,0,Cloudy,True,Saturday,False,171,510,2024-04-13 13:25:00,2024,4,15,0
1101,4817,941,Laptop,Electronics,2,669.67,6/14/2024 8:04,2,"Miami, FL",334,126,196,438,9,32,Female,62207.51,Silver,Cash,False,0,Sunny,True,Thursday,True,335,200,2024-06-14 08:04:00,2024,6,24,0
1102,6383,555,Smartphone,Appliances,4,504.98,7/9/2024 17:23,10,"Miami, FL",272,140,166,492,8,26,Female,57713.06,Bronze,Digital Wallet,True,BOGO,Sunny,True,Saturday,False,429,183,2024-07-09 17:23:00,2024,7,28,0
1103,3417,280,Fridge,Appliances,5,456.34,6/13/2024 3:51,20,"Chicago, IL",253,51,218,462,2,53,Female,113550.6,Bronze,Debit Card,False,0,Rainy,True,Tuesday,True,246,205,2024-06-13 03:51:00,2024,6,24,0
1104,1046,415,Fridge,Electronics,4,1182.09,4/5/2024 5:55,19,"New York, NY",382,50,242,105,5,45,Male,100440.91,Bronze,Credit Card,False,BOGO,Stormy,False,Thursday,False,420,267,2024-04-05 05:55:00,2024,4,14,0
1105,5542,515,Camera,Electronics,5,1394.33,2/14/2024 4:24,19,"New York, NY",495,146,191,134,9,41,Female,116421.53,Silver,Digital Wallet,False,0,Cloudy,False,Sunday,False,444,297,2024-02-14 04:24:00,2024,2,7,0
1106,3370,171,Laptop,Appliances,4,1855.57,2/26/2024 1:43,6,"Los Angeles, CA",123,92,197,387,5,49,Female,91442.39,Gold,Digital Wallet,True,Percentage Discount,Cloudy,True,Wednesday,False,366,405,2024-02-26 01:43:00,2024,2,9,0
1107,3129,712,Smartphone,Appliances,4,298.2,6/24/2024 9:15,13,"Dallas, TX",367,102,143,473,6,65,Other,41974.07,Bronze,Credit Card,False,0,Stormy,True,Sunday,True,130,387,2024-06-24 09:15:00,2024,6,26,0
1108,9850,211,TV,Electronics,3,1285.89,4/19/2024 20:55,13,"Los Angeles, CA",338,148,184,435,5,68,Other,90261.89,Platinum,Digital Wallet,True,0,Sunny,False,Wednesday,True,353,138,2024-04-19 20:55:00,2024,4,16,0
1109,5106,801,Washing Machine,Appliances,1,1543.45,6/29/2024 17:29,12,"Miami, FL",25,106,112,339,5,25,Female,30318.94,Platinum,Cash,True,0,Stormy,True,Sunday,False,211,464,2024-06-29 17:29:00,2024,6,26,0
1110,3858,933,Headphones,Appliances,1,1125.32,3/7/2024 1:39,7,"Dallas, TX",386,79,242,297,4,25,Other,111689.1,Bronze,Cash,True,BOGO,Stormy,False,Sunday,True,480,476,2024-03-07 01:39:00,2024,3,10,0
1111,2801,710,Tablet,Appliances,5,711.21,3/28/2024 16:02,13,"New York, NY",181,131,166,495,1,62,Male,96440.77,Bronze,Digital Wallet,True,0,Stormy,True,Sunday,False,449,116,2024-03-28 16:02:00,2024,3,13,0
1112,1422,889,Fridge,Appliances,1,537.19,5/8/2024 4:23,4,"Los Angeles, CA",264,95,190,453,1,56,Other,98457.31,Bronze,Cash,False,0,Cloudy,True,Saturday,True,101,322,2024-05-08 04:23:00,2024,5,19,0
1113,3159,939,Washing Machine,Appliances,5,614.79,7/20/2024 13:18,20,"New York, NY",495,70,114,410,8,28,Other,115521.9,Silver,Credit Card,False,0,Rainy,False,Tuesday,True,245,143,2024-07-20 13:18:00,2024,7,29,0
1114,1243,488,Washing Machine,Electronics,3,1760.99,9/11/2024 20:58,16,"Chicago, IL",257,103,290,184,5,63,Female,110954.01,Bronze,Cash,False,0,Sunny,False,Wednesday,False,312,108,2024-09-11 20:58:00,2024,9,37,0
1115,6869,435,Smartphone,Electronics,3,1428.79,8/2/2024 2:19,15,"Chicago, IL",219,78,274,328,6,36,Female,41250.56,Gold,Digital Wallet,False,Percentage Discount,Stormy,True,Friday,False,463,344,2024-08-02 02:19:00,2024,8,31,0
1116,4898,606,Camera,Appliances,5,1980.28,8/9/2024 11:38,8,"Los Angeles, CA",273,96,119,131,8,54,Other,50175.64,Gold,Digital Wallet,True,0,Stormy,True,Monday,True,212,167,2024-08-09 11:38:00,2024,8,32,0
1117,6304,760,Fridge,Electronics,5,1013.02,9/8/2024 6:34,4,"New York, NY",63,126,266,239,8,65,Male,34181.37,Silver,Digital Wallet,True,0,Rainy,True,Friday,True,345,411,2024-09-08 06:34:00,2024,9,36,0
1118,1258,776,Fridge,Appliances,1,1205.16,2/2/2024 7:42,15,"Dallas, TX",29,97,178,222,8,24,Male,31060.71,Platinum,Digital Wallet,False,0,Stormy,False,Monday,False,257,299,2024-02-02 07:42:00,2024,2,5,0
1119,3854,162,Smartphone,Appliances,4,630.73,4/1/2024 23:54,7,"New York, NY",435,61,163,361,5,26,Female,119369.94,Gold,Debit Card,False,Percentage Discount,Cloudy,False,Wednesday,True,334,219,2024-04-01 23:54:00,2024,4,14,0
1120,5347,192,Tablet,Electronics,3,710.57,5/13/2024 14:05,19,"Chicago, IL",82,110,246,376,2,50,Female,45585.23,Platinum,Cash,True,0,Sunny,False,Tuesday,True,277,281,2024-05-13 14:05:00,2024,5,20,0
1121,1858,322,Tablet,Appliances,3,209.5,1/3/2024 11:31,10,"New York, NY",169,105,248,269,5,67,Other,55314.3,Silver,Cash,True,BOGO,Rainy,True,Thursday,True,199,283,2024-01-03 11:31:00,2024,1,1,0
1122,3076,936,Laptop,Electronics,2,1299.86,1/19/2024 17:32,14,"New York, NY",108,80,244,470,7,65,Female,90174.16,Gold,Debit Card,False,0,Stormy,True,Monday,False,235,184,2024-01-19 17:32:00,2024,1,3,0
1123,7897,242,Smartphone,Electronics,1,1733.65,5/21/2024 17:01,5,"Miami, FL",48,96,139,175,6,67,Other,107224.53,Gold,Digital Wallet,False,Percentage Discount,Stormy,True,Tuesday,True,443,394,2024-05-21 17:01:00,2024,5,21,0
1124,9619,694,Smartphone,Appliances,1,1410.79,1/17/2024 3:04,9,"Dallas, TX",69,73,191,365,2,31,Female,48369.45,Silver,Cash,True,0,Rainy,False,Tuesday,True,203,175,2024-01-17 03:04:00,2024,1,3,0
1125,2862,873,Camera,Electronics,4,865.78,8/27/2024 21:49,17,"Dallas, TX",495,83,219,330,9,18,Female,119799.0,Gold,Debit Card,True,0,Stormy,True,Wednesday,False,264,477,2024-08-27 21:49:00,2024,8,35,0
1126,2041,751,Laptop,Electronics,2,433.21,5/10/2024 1:59,16,"New York, NY",301,64,103,132,4,19,Female,89118.24,Gold,Credit Card,False,Percentage Discount,Rainy,True,Friday,False,355,139,2024-05-10 01:59:00,2024,5,19,0
1127,8802,929,TV,Appliances,5,1269.33,2/20/2024 10:24,5,"Chicago, IL",410,80,248,280,2,45,Other,33320.59,Platinum,Digital Wallet,True,0,Sunny,True,Friday,True,310,160,2024-02-20 10:24:00,2024,2,8,0
1128,8344,100,Laptop,Electronics,5,1865.88,4/5/2024 10:57,7,"Miami, FL",90,133,248,493,7,29,Other,50616.43,Bronze,Digital Wallet,True,BOGO,Cloudy,True,Sunday,False,103,160,2024-04-05 10:57:00,2024,4,14,0
1129,6931,875,Camera,Appliances,4,681.76,1/28/2024 9:20,18,"Miami, FL",216,53,143,453,4,33,Female,29508.51,Platinum,Credit Card,True,0,Sunny,True,Sunday,False,290,131,2024-01-28 09:20:00,2024,1,4,0
1130,9408,250,Fridge,Appliances,4,464.38,1/15/2024 9:00,12,"Chicago, IL",429,69,231,365,4,66,Male,21632.22,Platinum,Cash,True,0,Stormy,True,Thursday,True,233,119,2024-01-15 09:00:00,2024,1,3,0
1131,2786,776,Laptop,Electronics,5,1335.73,3/16/2024 1:06,17,"Los Angeles, CA",451,140,210,219,3,52,Other,77219.41,Silver,Debit Card,False,0,Stormy,False,Sunday,True,128,291,2024-03-16 01:06:00,2024,3,11,0
1132,8405,252,Fridge,Appliances,4,851.11,3/2/2024 20:53,13,"Los Angeles, CA",214,73,130,238,6,25,Male,39164.9,Silver,Cash,False,0,Cloudy,True,Thursday,True,499,406,2024-03-02 20:53:00,2024,3,9,0
1133,9254,563,Washing Machine,Appliances,2,690.62,9/9/2024 3:46,11,"Dallas, TX",65,117,102,433,4,50,Female,114434.16,Bronze,Digital Wallet,True,Percentage Discount,Cloudy,True,Tuesday,False,144,241,2024-09-09 03:46:00,2024,9,37,0
1134,4629,644,Headphones,Appliances,3,1510.71,5/30/2024 15:23,8,"Chicago, IL",161,150,136,432,4,31,Other,24290.27,Bronze,Credit Card,True,Percentage Discount,Cloudy,True,Sunday,True,290,195,2024-05-30 15:23:00,2024,5,22,0
1135,1710,398,Headphones,Appliances,5,530.38,7/28/2024 14:57,20,"New York, NY",139,146,233,498,7,59,Female,25277.88,Silver,Digital Wallet,False,0,Cloudy,True,Sunday,False,110,326,2024-07-28 14:57:00,2024,7,30,0
1136,9543,499,Washing Machine,Appliances,3,1176.61,2/23/2024 10:37,5,"Los Angeles, CA",253,98,188,236,4,57,Female,104278.78,Platinum,Cash,True,0,Sunny,True,Friday,False,204,403,2024-02-23 10:37:00,2024,2,8,0
1137,5941,730,Tablet,Electronics,4,855.27,2/3/2024 7:21,16,"Chicago, IL",398,111,260,215,1,28,Male,30024.19,Silver,Digital Wallet,False,0,Sunny,False,Sunday,False,287,483,2024-02-03 07:21:00,2024,2,5,0
1138,8504,691,Fridge,Appliances,4,247.47,8/8/2024 16:22,13,"Dallas, TX",260,62,185,112,6,35,Other,81814.91,Platinum,Cash,False,0,Stormy,False,Friday,True,226,482,2024-08-08 16:22:00,2024,8,32,0
1139,1510,557,TV,Electronics,3,1474.92,9/6/2024 21:47,18,"Dallas, TX",458,56,295,167,8,41,Male,76054.82,Silver,Digital Wallet,True,0,Stormy,False,Monday,True,405,284,2024-09-06 21:47:00,2024,9,36,0
1140,1996,300,Smartphone,Appliances,4,336.87,6/8/2024 3:20,15,"New York, NY",24,100,127,398,6,25,Male,62246.84,Platinum,Digital Wallet,True,0,Sunny,True,Sunday,True,228,161,2024-06-08 03:20:00,2024,6,23,0
1141,8847,310,Smartphone,Electronics,3,1152.74,4/7/2024 18:51,3,"Los Angeles, CA",351,103,164,417,8,44,Male,27554.79,Gold,Debit Card,False,0,Stormy,True,Wednesday,True,453,314,2024-04-07 18:51:00,2024,4,14,0
1142,7580,797,TV,Appliances,1,1200.96,8/12/2024 23:23,9,"Dallas, TX",16,91,161,452,9,49,Other,49282.75,Platinum,Credit Card,True,0,Rainy,False,Tuesday,False,482,116,2024-08-12 23:23:00,2024,8,33,0
1143,7984,998,Headphones,Appliances,5,510.91,5/23/2024 9:50,3,"New York, NY",288,145,235,439,7,54,Female,78125.63,Bronze,Debit Card,True,BOGO,Cloudy,True,Thursday,False,197,218,2024-05-23 09:50:00,2024,5,21,0
1144,2768,424,Tablet,Electronics,4,1236.42,6/28/2024 7:40,8,"Miami, FL",167,104,273,338,7,23,Male,52268.29,Bronze,Cash,True,0,Stormy,True,Saturday,False,496,299,2024-06-28 07:40:00,2024,6,26,0
1145,9032,406,Headphones,Electronics,2,1784.37,5/6/2024 19:19,9,"Dallas, TX",264,52,139,467,1,49,Other,86610.76,Gold,Credit Card,True,0,Cloudy,True,Thursday,True,199,228,2024-05-06 19:19:00,2024,5,19,0
1146,8267,683,TV,Electronics,2,1115.44,3/25/2024 23:32,19,"Chicago, IL",26,71,182,222,8,46,Other,73693.0,Bronze,Debit Card,False,0,Rainy,False,Sunday,True,366,356,2024-03-25 23:32:00,2024,3,13,0
1147,2204,913,Fridge,Appliances,3,1331.68,2/26/2024 5:16,7,"Los Angeles, CA",156,87,274,381,1,43,Other,42689.98,Bronze,Credit Card,False,0,Rainy,False,Wednesday,True,493,340,2024-02-26 05:16:00,2024,2,9,0
1148,2323,795,TV,Appliances,2,859.8,6/28/2024 2:50,4,"Dallas, TX",7,124,185,262,3,25,Male,61273.82,Platinum,Cash,False,0,Sunny,False,Wednesday,False,443,354,2024-06-28 02:50:00,2024,6,26,0
1149,6277,411,Washing Machine,Appliances,1,741.25,8/1/2024 17:27,16,"New York, NY",434,71,136,259,6,61,Male,40450.52,Platinum,Debit Card,True,Percentage Discount,Sunny,True,Monday,False,490,503,2024-08-01 17:27:00,2024,8,31,0
1150,3430,545,Tablet,Appliances,5,487.98,9/16/2024 20:22,20,"Dallas, TX",46,74,102,238,1,63,Female,65728.27,Silver,Debit Card,True,0,Cloudy,False,Tuesday,False,242,161,2024-09-16 20:22:00,2024,9,38,0
1151,2076,835,Smartphone,Appliances,2,1895.36,9/7/2024 6:52,13,"Chicago, IL",399,96,163,190,8,54,Other,95174.31,Silver,Cash,False,BOGO,Rainy,True,Monday,True,160,325,2024-09-07 06:52:00,2024,9,36,0
1152,3067,452,TV,Electronics,4,212.44,3/7/2024 3:04,15,"Chicago, IL",150,107,147,243,7,45,Male,23636.64,Platinum,Debit Card,False,0,Sunny,False,Tuesday,False,484,425,2024-03-07 03:04:00,2024,3,10,0
1153,5505,191,Smartphone,Appliances,2,817.62,5/8/2024 3:49,2,"Chicago, IL",197,106,272,131,7,18,Male,65882.75,Silver,Cash,True,0,Cloudy,True,Tuesday,True,398,352,2024-05-08 03:49:00,2024,5,19,0
1154,9984,696,TV,Electronics,2,1574.14,7/15/2024 10:55,14,"Los Angeles, CA",62,106,285,179,7,49,Other,73890.86,Platinum,Debit Card,True,0,Sunny,False,Friday,False,254,318,2024-07-15 10:55:00,2024,7,29,0
1155,6327,108,Tablet,Appliances,1,1328.77,8/29/2024 11:57,1,"Chicago, IL",425,86,238,415,1,57,Other,96560.72,Bronze,Cash,False,0,Stormy,False,Saturday,True,397,208,2024-08-29 11:57:00,2024,8,35,0
1156,7240,726,Smartphone,Appliances,2,1404.54,7/17/2024 18:27,12,"New York, NY",161,60,294,493,7,69,Other,29123.81,Gold,Credit Card,True,0,Sunny,True,Wednesday,True,264,255,2024-07-17 18:27:00,2024,7,29,0
1157,9692,622,Fridge,Electronics,2,222.35,2/28/2024 0:34,12,"Dallas, TX",311,135,204,232,10,23,Female,74292.38,Gold,Credit Card,True,0,Stormy,True,Saturday,True,311,504,2024-02-28 00:34:00,2024,2,9,0
1158,5831,513,Laptop,Appliances,1,527.44,1/10/2024 8:37,18,"Dallas, TX",403,88,186,374,6,24,Male,69793.8,Platinum,Digital Wallet,True,BOGO,Sunny,False,Saturday,True,210,367,2024-01-10 08:37:00,2024,1,2,0
1159,8433,967,Headphones,Appliances,3,1019.35,7/11/2024 20:09,4,"Dallas, TX",239,124,244,491,1,48,Other,23588.23,Gold,Cash,True,0,Sunny,False,Tuesday,False,485,438,2024-07-11 20:09:00,2024,7,28,0
1160,9282,230,TV,Appliances,1,456.03,8/26/2024 3:50,16,"Chicago, IL",393,55,130,103,9,27,Female,110178.38,Gold,Debit Card,False,BOGO,Rainy,False,Sunday,False,350,305,2024-08-26 03:50:00,2024,8,35,0
1161,8048,972,Smartphone,Appliances,1,305.06,1/6/2024 0:01,8,"New York, NY",375,97,237,254,6,57,Other,53190.16,Gold,Debit Card,True,0,Sunny,False,Friday,True,380,272,2024-01-06 00:01:00,2024,1,1,0
1162,2624,401,Fridge,Electronics,3,164.91,5/29/2024 17:09,11,"Chicago, IL",6,110,295,457,3,27,Female,85787.48,Platinum,Cash,False,0,Rainy,False,Monday,True,129,447,2024-05-29 17:09:00,2024,5,22,0
1163,2874,163,Laptop,Electronics,2,1397.71,4/15/2024 18:08,15,"Los Angeles, CA",20,60,131,317,7,33,Other,115791.42,Gold,Debit Card,False,0,Rainy,False,Monday,True,335,373,2024-04-15 18:08:00,2024,4,16,0
1164,4522,478,TV,Electronics,5,1561.28,2/24/2024 6:00,20,"Los Angeles, CA",13,113,244,363,2,32,Female,119894.98,Silver,Digital Wallet,False,Percentage Discount,Cloudy,False,Thursday,False,244,182,2024-02-24 06:00:00,2024,2,8,0
1165,8046,662,Tablet,Electronics,3,1557.87,8/11/2024 18:54,5,"Miami, FL",36,93,235,368,1,63,Male,47238.6,Bronze,Credit Card,False,Percentage Discount,Rainy,True,Saturday,False,286,197,2024-08-11 18:54:00,2024,8,32,0
1166,8398,154,Laptop,Appliances,5,1888.82,3/8/2024 23:16,4,"New York, NY",469,74,109,297,7,38,Other,116234.09,Bronze,Credit Card,True,0,Cloudy,True,Friday,False,134,444,2024-03-08 23:16:00,2024,3,10,0
1167,4743,100,Fridge,Electronics,2,584.05,2/22/2024 16:18,4,"Chicago, IL",296,69,299,459,9,54,Male,31226.03,Bronze,Digital Wallet,True,0,Sunny,False,Tuesday,False,276,282,2024-02-22 16:18:00,2024,2,8,0
1168,7779,820,Fridge,Electronics,1,1246.41,4/12/2024 4:09,13,"Dallas, TX",343,66,189,470,10,25,Female,111075.47,Silver,Digital Wallet,False,Percentage Discount,Stormy,True,Saturday,False,423,187,2024-04-12 04:09:00,2024,4,15,0
1169,6553,673,Headphones,Electronics,3,1638.31,9/11/2024 8:29,5,"Los Angeles, CA",28,141,147,421,7,33,Other,117711.53,Platinum,Debit Card,True,0,Sunny,False,Sunday,False,417,509,2024-09-11 08:29:00,2024,9,37,0
1170,8430,940,TV,Appliances,4,1919.91,3/8/2024 8:35,11,"Chicago, IL",494,113,235,417,6,64,Male,23736.66,Platinum,Credit Card,False,Percentage Discount,Rainy,False,Monday,False,387,107,2024-03-08 08:35:00,2024,3,10,0
1171,7532,467,TV,Electronics,5,1812.48,4/1/2024 20:51,1,"Los Angeles, CA",455,137,152,464,6,31,Female,92527.49,Platinum,Digital Wallet,False,0,Sunny,True,Thursday,False,304,302,2024-04-01 20:51:00,2024,4,14,0
1172,7815,212,Camera,Appliances,5,87.24,2/20/2024 2:34,13,"Los Angeles, CA",473,129,254,385,4,41,Other,80761.38,Gold,Cash,True,0,Rainy,False,Wednesday,True,440,156,2024-02-20 02:34:00,2024,2,8,0
1173,2557,981,Fridge,Electronics,1,1797.66,3/28/2024 1:56,19,"Los Angeles, CA",17,129,297,425,3,31,Other,49833.86,Silver,Credit Card,False,BOGO,Stormy,True,Saturday,True,269,321,2024-03-28 01:56:00,2024,3,13,0
1174,6120,388,Washing Machine,Electronics,1,803.87,7/24/2024 17:51,18,"Dallas, TX",230,113,110,418,7,23,Male,116865.67,Platinum,Digital Wallet,True,0,Rainy,True,Monday,True,495,322,2024-07-24 17:51:00,2024,7,30,0
1175,7992,986,Laptop,Appliances,4,586.44,8/17/2024 11:29,20,"Chicago, IL",107,138,186,123,5,41,Other,34927.32,Gold,Digital Wallet,True,Percentage Discount,Sunny,False,Thursday,False,437,322,2024-08-17 11:29:00,2024,8,33,0
1176,6120,131,Fridge,Electronics,5,455.61,1/1/2024 22:23,7,"Chicago, IL",265,136,149,376,8,33,Male,101801.21,Platinum,Credit Card,False,BOGO,Rainy,False,Tuesday,True,327,413,2024-01-01 22:23:00,2024,1,1,0
1177,5176,340,Laptop,Electronics,4,307.04,4/5/2024 3:38,12,"Dallas, TX",259,148,103,464,5,40,Female,86526.85,Bronze,Credit Card,False,Percentage Discount,Rainy,True,Thursday,True,218,350,2024-04-05 03:38:00,2024,4,14,0
1178,7132,542,Headphones,Electronics,2,288.85,4/1/2024 2:39,9,"New York, NY",480,94,210,331,2,45,Male,76093.83,Gold,Credit Card,False,Percentage Discount,Cloudy,False,Wednesday,False,141,396,2024-04-01 02:39:00,2024,4,14,0
1179,3500,819,Tablet,Electronics,4,606.68,7/5/2024 17:41,13,"Dallas, TX",163,70,225,305,5,28,Female,78570.4,Bronze,Cash,False,Percentage Discount,Sunny,False,Tuesday,True,337,182,2024-07-05 17:41:00,2024,7,27,0
1180,8770,704,Headphones,Electronics,5,1578.32,8/25/2024 18:31,10,"Chicago, IL",131,100,156,202,2,63,Male,20257.97,Silver,Digital Wallet,True,0,Sunny,True,Monday,True,400,370,2024-08-25 18:31:00,2024,8,34,0
1181,2099,503,Camera,Appliances,5,1204.7,5/5/2024 3:57,13,"Chicago, IL",200,65,103,230,3,66,Other,39120.34,Gold,Digital Wallet,True,0,Stormy,True,Thursday,False,388,190,2024-05-05 03:57:00,2024,5,18,0
1182,2494,740,Headphones,Appliances,5,630.81,2/24/2024 10:16,7,"New York, NY",225,90,287,436,5,52,Female,99107.61,Gold,Debit Card,False,0,Rainy,False,Friday,False,376,377,2024-02-24 10:16:00,2024,2,8,0
1183,2398,425,Camera,Appliances,5,1557.86,7/10/2024 17:01,19,"Dallas, TX",469,117,271,189,1,47,Female,34490.55,Silver,Cash,True,0,Stormy,False,Wednesday,True,475,367,2024-07-10 17:01:00,2024,7,28,0
1184,2527,828,Fridge,Appliances,3,823.88,4/6/2024 17:45,18,"Chicago, IL",388,109,238,349,5,64,Other,95728.94,Bronze,Digital Wallet,False,0,Rainy,False,Friday,True,285,140,2024-04-06 17:45:00,2024,4,14,0
1185,8075,491,TV,Electronics,5,680.46,4/2/2024 11:56,20,"Los Angeles, CA",363,116,157,184,4,26,Other,103636.84,Platinum,Debit Card,False,0,Sunny,False,Wednesday,False,488,168,2024-04-02 11:56:00,2024,4,14,0
1186,2582,515,Camera,Electronics,5,592.04,6/19/2024 3:58,15,"New York, NY",118,129,113,257,10,63,Male,55987.66,Gold,Cash,False,Percentage Discount,Rainy,False,Monday,True,151,394,2024-06-19 03:58:00,2024,6,25,0
1187,7105,490,Laptop,Electronics,1,331.09,6/25/2024 18:29,1,"New York, NY",322,140,158,324,7,37,Female,111042.63,Silver,Credit Card,True,Percentage Discount,Rainy,False,Wednesday,False,251,364,2024-06-25 18:29:00,2024,6,26,0
1188,3131,545,Smartphone,Appliances,2,1177.4,5/14/2024 7:42,4,"New York, NY",158,117,243,338,9,40,Female,55678.59,Platinum,Cash,False,0,Cloudy,False,Friday,True,324,251,2024-05-14 07:42:00,2024,5,20,0
1189,1982,658,Laptop,Appliances,5,1671.13,5/31/2024 1:51,10,"Los Angeles, CA",372,126,234,153,5,62,Female,81421.58,Gold,Credit Card,True,0,Sunny,True,Thursday,False,316,288,2024-05-31 01:51:00,2024,5,22,0
1190,6400,316,Laptop,Electronics,2,370.67,8/11/2024 9:39,11,"Chicago, IL",254,141,174,157,9,58,Male,111317.92,Gold,Cash,True,Percentage Discount,Sunny,False,Thursday,False,175,161,2024-08-11 09:39:00,2024,8,32,0
1191,3002,778,Laptop,Electronics,1,1692.77,4/19/2024 14:37,12,"Miami, FL",144,64,104,279,4,19,Other,56837.65,Platinum,Cash,False,0,Sunny,False,Saturday,True,151,212,2024-04-19 14:37:00,2024,4,16,0
1192,7730,277,Camera,Electronics,5,628.25,7/22/2024 10:43,16,"Chicago, IL",124,101,126,328,6,67,Male,97534.65,Gold,Credit Card,False,0,Sunny,True,Friday,True,187,140,2024-07-22 10:43:00,2024,7,30,0
1193,6793,586,TV,Appliances,1,1513.77,4/5/2024 22:16,1,"New York, NY",432,143,288,381,10,35,Male,111301.04,Bronze,Cash,False,0,Rainy,False,Sunday,True,191,464,2024-04-05 22:16:00,2024,4,14,0
1194,7929,242,Headphones,Electronics,1,449.97,8/24/2024 9:02,8,"Chicago, IL",205,120,210,333,7,63,Female,27010.86,Bronze,Debit Card,True,0,Rainy,False,Monday,True,385,131,2024-08-24 09:02:00,2024,8,34,0
1195,1842,292,Washing Machine,Electronics,2,1641.09,8/26/2024 8:23,20,"Miami, FL",385,81,263,199,1,62,Female,89450.44,Gold,Cash,False,0,Cloudy,True,Sunday,True,298,282,2024-08-26 08:23:00,2024,8,35,0
1196,5712,668,Headphones,Appliances,4,1215.8,7/31/2024 2:42,8,"New York, NY",293,62,221,345,1,19,Female,31121.02,Platinum,Digital Wallet,True,0,Sunny,True,Wednesday,False,307,280,2024-07-31 02:42:00,2024,7,31,0
1197,6119,493,Tablet,Electronics,4,947.02,5/26/2024 14:26,9,"Los Angeles, CA",118,111,218,500,1,54,Female,59142.2,Platinum,Digital Wallet,True,0,Stormy,False,Monday,False,274,310,2024-05-26 14:26:00,2024,5,21,0
1198,6761,963,Fridge,Electronics,4,1508.7,2/23/2024 23:41,5,"Chicago, IL",419,63,202,374,2,34,Female,52265.31,Gold,Credit Card,False,0,Rainy,False,Monday,False,138,395,2024-02-23 23:41:00,2024,2,8,0
1199,2697,468,Smartphone,Electronics,1,1190.9,6/21/2024 6:45,16,"New York, NY",293,90,251,143,9,24,Female,100163.83,Silver,Digital Wallet,False,Percentage Discount,Rainy,True,Monday,True,321,278,2024-06-21 06:45:00,2024,6,25,0
1200,9313,960,Headphones,Electronics,2,1622.73,6/30/2024 14:34,4,"New York, NY",325,64,136,274,3,35,Female,57907.85,Platinum,Cash,True,BOGO,Cloudy,True,Monday,False,148,118,2024-06-30 14:34:00,2024,6,26,0
1201,4485,527,Washing Machine,Appliances,1,1279.69,5/6/2024 7:09,18,"Dallas, TX",496,61,278,308,1,68,Female,24606.98,Silver,Cash,True,0,Cloudy,True,Wednesday,False,310,155,2024-05-06 07:09:00,2024,5,19,0
1202,3535,257,Camera,Appliances,1,636.12,8/17/2024 10:24,13,"New York, NY",16,58,276,162,9,46,Female,74588.27,Gold,Digital Wallet,False,Percentage Discount,Rainy,False,Friday,True,310,156,2024-08-17 10:24:00,2024,8,33,0
1203,8900,395,Camera,Electronics,1,469.7,1/28/2024 7:30,13,"Miami, FL",283,83,116,306,8,60,Male,30917.48,Gold,Credit Card,False,Percentage Discount,Cloudy,True,Tuesday,True,129,298,2024-01-28 07:30:00,2024,1,4,0
1204,4674,993,Headphones,Electronics,3,1650.29,9/14/2024 18:06,19,"New York, NY",309,70,248,180,2,49,Other,67039.5,Gold,Credit Card,True,BOGO,Rainy,True,Tuesday,True,145,339,2024-09-14 18:06:00,2024,9,37,0
1205,2773,786,Tablet,Electronics,2,561.42,4/12/2024 6:19,5,"Chicago, IL",141,142,265,133,7,23,Female,20028.81,Silver,Debit Card,False,0,Sunny,True,Tuesday,True,427,379,2024-04-12 06:19:00,2024,4,15,0
1206,6736,228,Tablet,Appliances,2,1700.64,5/4/2024 4:25,12,"Chicago, IL",53,83,131,479,4,66,Other,32983.52,Silver,Digital Wallet,True,BOGO,Sunny,False,Wednesday,True,407,296,2024-05-04 04:25:00,2024,5,18,0
1207,7022,237,Laptop,Electronics,5,205.85,8/7/2024 9:23,11,"Miami, FL",107,64,288,350,9,45,Male,24422.99,Silver,Debit Card,False,0,Cloudy,True,Sunday,True,457,495,2024-08-07 09:23:00,2024,8,32,0
1208,2882,111,Smartphone,Electronics,3,1352.15,7/12/2024 6:32,5,"Dallas, TX",54,70,104,208,9,53,Female,44887.08,Gold,Digital Wallet,True,0,Cloudy,True,Tuesday,True,198,411,2024-07-12 06:32:00,2024,7,28,0
1209,5564,173,Camera,Appliances,2,403.97,1/16/2024 12:41,20,"Dallas, TX",294,87,184,293,2,28,Male,89386.93,Bronze,Credit Card,False,0,Sunny,False,Monday,False,131,423,2024-01-16 12:41:00,2024,1,3,0
1210,4705,763,Camera,Electronics,5,856.54,7/5/2024 22:18,2,"Dallas, TX",271,139,103,342,10,52,Other,40109.3,Silver,Debit Card,True,0,Sunny,False,Wednesday,True,456,390,2024-07-05 22:18:00,2024,7,27,0
1211,8030,116,Camera,Electronics,4,1826.53,1/10/2024 9:45,11,"Los Angeles, CA",162,114,225,143,4,60,Other,39976.9,Silver,Credit Card,True,BOGO,Rainy,True,Friday,True,298,381,2024-01-10 09:45:00,2024,1,2,0
1212,1430,247,Camera,Electronics,2,1451.28,5/12/2024 4:05,1,"Dallas, TX",484,89,125,220,10,57,Other,27080.15,Bronze,Cash,False,0,Sunny,False,Sunday,False,220,493,2024-05-12 04:05:00,2024,5,19,0
1213,5381,838,TV,Appliances,1,1155.96,4/25/2024 17:45,20,"Miami, FL",294,96,248,479,3,52,Male,48694.49,Bronze,Cash,False,0,Sunny,True,Friday,False,300,125,2024-04-25 17:45:00,2024,4,17,0
1214,1474,598,Headphones,Electronics,1,222.44,7/6/2024 0:28,6,"Dallas, TX",193,89,217,370,8,29,Male,117534.01,Silver,Debit Card,True,0,Rainy,True,Friday,True,108,320,2024-07-06 00:28:00,2024,7,27,0
1215,3955,773,TV,Electronics,3,849.5,1/18/2024 6:16,13,"Dallas, TX",254,103,108,469,2,22,Other,89541.51,Silver,Credit Card,False,0,Sunny,False,Monday,True,197,380,2024-01-18 06:16:00,2024,1,3,0
1216,5477,547,Fridge,Electronics,1,1979.67,3/9/2024 14:50,2,"New York, NY",34,106,254,353,10,52,Male,82232.71,Gold,Debit Card,True,BOGO,Cloudy,True,Friday,True,125,126,2024-03-09 14:50:00,2024,3,10,0
1217,6062,239,Tablet,Appliances,3,99.87,7/3/2024 4:38,1,"Los Angeles, CA",268,77,190,201,2,59,Other,66974.33,Silver,Digital Wallet,True,0,Rainy,False,Sunday,True,241,489,2024-07-03 04:38:00,2024,7,27,0
1218,6567,186,Tablet,Appliances,2,1379.76,3/27/2024 2:30,2,"Los Angeles, CA",112,59,224,132,9,26,Male,35606.06,Platinum,Digital Wallet,False,0,Stormy,True,Wednesday,True,368,287,2024-03-27 02:30:00,2024,3,13,0
1219,6751,240,Smartphone,Appliances,3,1123.87,6/10/2024 6:05,3,"Miami, FL",73,136,175,249,10,36,Male,27059.65,Bronze,Credit Card,True,0,Sunny,True,Sunday,True,164,465,2024-06-10 06:05:00,2024,6,24,0
1220,1100,757,Tablet,Appliances,2,475.98,8/30/2024 6:11,4,"Los Angeles, CA",55,76,294,110,10,36,Male,61842.0,Gold,Credit Card,False,BOGO,Rainy,True,Thursday,False,133,224,2024-08-30 06:11:00,2024,8,35,0
1221,3972,925,Laptop,Electronics,5,480.31,7/23/2024 11:27,2,"Miami, FL",102,106,178,457,4,42,Male,27325.84,Bronze,Cash,True,0,Cloudy,True,Tuesday,False,104,296,2024-07-23 11:27:00,2024,7,30,0
1222,3347,525,TV,Electronics,2,266.33,4/23/2024 12:02,3,"Los Angeles, CA",491,59,189,427,9,53,Female,103436.07,Bronze,Credit Card,True,0,Cloudy,False,Tuesday,True,170,398,2024-04-23 12:02:00,2024,4,17,0
1223,7566,980,TV,Electronics,5,254.51,7/31/2024 10:18,11,"New York, NY",6,144,280,210,2,28,Male,118709.11,Bronze,Digital Wallet,True,0,Sunny,True,Friday,True,212,239,2024-07-31 10:18:00,2024,7,31,0
1224,2140,566,Washing Machine,Electronics,1,809.78,6/24/2024 7:32,14,"Chicago, IL",179,110,171,138,10,70,Male,32065.64,Silver,Debit Card,True,BOGO,Cloudy,False,Monday,True,295,365,2024-06-24 07:32:00,2024,6,26,0
1225,3324,907,Tablet,Appliances,3,381.13,3/13/2024 14:01,3,"Los Angeles, CA",150,141,106,391,9,24,Male,26319.85,Silver,Digital Wallet,True,0,Cloudy,False,Wednesday,False,371,338,2024-03-13 14:01:00,2024,3,11,0
1226,1502,812,Tablet,Appliances,5,1581.27,4/17/2024 11:30,14,"Chicago, IL",64,83,211,453,8,43,Male,106438.47,Gold,Digital Wallet,True,BOGO,Sunny,False,Monday,False,425,138,2024-04-17 11:30:00,2024,4,16,0
1227,2503,718,Camera,Appliances,2,1163.88,6/22/2024 18:30,3,"New York, NY",477,61,251,160,10,30,Female,105958.23,Bronze,Credit Card,False,BOGO,Cloudy,True,Wednesday,True,402,134,2024-06-22 18:30:00,2024,6,25,0
1228,9691,535,Headphones,Electronics,4,271.5,2/20/2024 15:11,19,"Chicago, IL",338,123,129,303,3,42,Other,109750.85,Gold,Cash,True,Percentage Discount,Rainy,False,Friday,False,406,180,2024-02-20 15:11:00,2024,2,8,0
1229,4524,738,Washing Machine,Appliances,5,1563.34,7/16/2024 8:38,15,"Miami, FL",277,50,179,317,2,26,Other,60841.98,Silver,Cash,False,0,Sunny,False,Saturday,True,147,255,2024-07-16 08:38:00,2024,7,29,0
1230,7163,284,TV,Appliances,2,531.45,6/25/2024 5:51,7,"Los Angeles, CA",326,137,163,312,7,56,Other,69864.84,Bronze,Cash,True,0,Stormy,True,Wednesday,True,372,295,2024-06-25 05:51:00,2024,6,26,0
1231,7878,565,Smartphone,Electronics,5,1223.18,6/21/2024 1:32,18,"Dallas, TX",129,102,230,496,6,49,Other,37773.72,Bronze,Credit Card,False,0,Cloudy,False,Saturday,False,393,500,2024-06-21 01:32:00,2024,6,25,0
1232,8432,621,Laptop,Appliances,5,1476.19,3/14/2024 23:49,9,"Dallas, TX",335,101,216,467,1,18,Male,31550.56,Gold,Debit Card,False,0,Cloudy,False,Saturday,False,185,319,2024-03-14 23:49:00,2024,3,11,0
1233,6585,534,Smartphone,Electronics,1,116.08,4/16/2024 8:45,9,"New York, NY",405,126,211,161,2,31,Male,69362.37,Bronze,Credit Card,True,Percentage Discount,Cloudy,False,Wednesday,False,422,210,2024-04-16 08:45:00,2024,4,16,0
1234,3578,665,TV,Appliances,1,1520.98,5/6/2024 1:31,20,"Miami, FL",363,91,220,317,9,51,Female,67821.33,Bronze,Digital Wallet,False,0,Sunny,True,Sunday,True,340,421,2024-05-06 01:31:00,2024,5,19,0
1235,7062,939,Fridge,Appliances,4,429.64,2/14/2024 9:24,17,"Dallas, TX",89,89,153,186,2,45,Other,37300.69,Platinum,Cash,False,0,Cloudy,False,Monday,False,449,368,2024-02-14 09:24:00,2024,2,7,0
1236,6105,560,Headphones,Appliances,4,501.67,3/28/2024 10:22,3,"New York, NY",183,90,241,259,8,59,Other,57488.95,Platinum,Digital Wallet,False,0,Cloudy,False,Saturday,False,348,282,2024-03-28 10:22:00,2024,3,13,0
1237,6314,493,Camera,Appliances,5,1945.52,8/17/2024 10:58,5,"Dallas, TX",322,133,264,482,6,36,Female,74506.04,Gold,Credit Card,True,0,Cloudy,True,Tuesday,True,281,156,2024-08-17 10:58:00,2024,8,33,0
1238,2391,463,Camera,Electronics,4,470.12,1/28/2024 10:53,3,"Los Angeles, CA",34,56,178,445,8,59,Other,96400.43,Bronze,Credit Card,True,BOGO,Stormy,False,Tuesday,False,324,324,2024-01-28 10:53:00,2024,1,4,0
1239,1861,331,Washing Machine,Appliances,2,1839.4,8/23/2024 13:25,8,"Dallas, TX",53,119,162,438,7,62,Other,45742.39,Silver,Credit Card,True,0,Cloudy,True,Saturday,False,403,338,2024-08-23 13:25:00,2024,8,34,0
1240,3549,290,Tablet,Appliances,4,867.56,1/11/2024 17:06,1,"Chicago, IL",44,95,129,303,1,60,Other,24157.92,Silver,Debit Card,True,0,Cloudy,False,Sunday,True,106,242,2024-01-11 17:06:00,2024,1,2,0
1241,3579,534,Fridge,Appliances,4,989.96,1/9/2024 12:34,2,"Los Angeles, CA",494,110,297,416,2,58,Male,40410.44,Silver,Debit Card,True,0,Cloudy,True,Sunday,False,434,187,2024-01-09 12:34:00,2024,1,2,0
1242,1815,719,Tablet,Electronics,2,1610.21,3/30/2024 18:49,18,"Chicago, IL",462,144,277,470,9,59,Female,52576.34,Gold,Debit Card,True,0,Rainy,True,Friday,True,295,268,2024-03-30 18:49:00,2024,3,13,0
1243,2336,107,Washing Machine,Appliances,2,1916.15,2/4/2024 6:44,17,"Miami, FL",298,50,262,379,1,46,Other,78403.92,Gold,Digital Wallet,False,0,Stormy,False,Wednesday,False,103,322,2024-02-04 06:44:00,2024,2,5,0
1244,5458,691,Fridge,Electronics,2,583.58,9/13/2024 6:11,5,"Los Angeles, CA",335,74,181,367,9,32,Male,59727.24,Bronze,Credit Card,True,0,Cloudy,False,Tuesday,False,500,312,2024-09-13 06:11:00,2024,9,37,0
1245,8259,610,Laptop,Electronics,5,1599.4,4/10/2024 22:45,7,"Los Angeles, CA",21,82,290,470,7,27,Male,66136.68,Bronze,Digital Wallet,True,Percentage Discount,Stormy,False,Thursday,False,198,265,2024-04-10 22:45:00,2024,4,15,0
1246,7947,967,Smartphone,Appliances,2,598.82,6/8/2024 14:16,17,"New York, NY",100,50,195,395,8,63,Male,28800.68,Bronze,Debit Card,True,0,Cloudy,False,Thursday,True,471,405,2024-06-08 14:16:00,2024,6,23,0
1247,8957,848,Headphones,Electronics,5,1659.77,9/2/2024 20:02,10,"Miami, FL",386,65,205,429,6,28,Male,86418.97,Platinum,Credit Card,False,0,Sunny,True,Monday,True,174,203,2024-09-02 20:02:00,2024,9,36,0
1248,8242,342,Smartphone,Appliances,5,1113.72,7/22/2024 23:37,13,"New York, NY",180,133,226,474,3,31,Male,35181.76,Platinum,Credit Card,True,Percentage Discount,Stormy,False,Friday,True,109,380,2024-07-22 23:37:00,2024,7,30,0
1249,7785,829,Headphones,Electronics,4,1398.14,3/19/2024 1:25,19,"Dallas, TX",307,61,208,320,3,26,Female,40290.62,Bronze,Debit Card,False,0,Rainy,True,Wednesday,False,390,434,2024-03-19 01:25:00,2024,3,12,0
1250,5475,613,Laptop,Electronics,2,222.79,8/7/2024 18:34,20,"New York, NY",153,113,255,345,7,26,Female,106187.17,Silver,Cash,True,0,Rainy,True,Friday,True,410,414,2024-08-07 18:34:00,2024,8,32,0
1251,4531,375,Laptop,Appliances,2,171.05,4/24/2024 0:42,2,"Los Angeles, CA",440,101,180,301,3,34,Other,97843.13,Gold,Cash,False,BOGO,Sunny,False,Tuesday,False,145,300,2024-04-24 00:42:00,2024,4,17,0
1252,9394,520,TV,Appliances,4,188.76,7/14/2024 11:07,18,"New York, NY",382,61,253,188,5,28,Other,117025.76,Bronze,Digital Wallet,True,BOGO,Rainy,False,Monday,True,272,167,2024-07-14 11:07:00,2024,7,28,0
1253,2864,659,Fridge,Appliances,4,896.61,6/4/2024 10:04,13,"New York, NY",7,109,218,477,10,45,Other,109754.77,Bronze,Credit Card,False,0,Cloudy,True,Thursday,True,181,130,2024-06-04 10:04:00,2024,6,23,0
1254,6655,690,Washing Machine,Appliances,1,1220.97,7/29/2024 1:15,16,"Los Angeles, CA",295,53,259,138,2,30,Male,38465.66,Platinum,Credit Card,False,0,Sunny,True,Monday,True,140,352,2024-07-29 01:15:00,2024,7,31,0
1255,8043,475,Tablet,Electronics,5,123.51,7/6/2024 1:28,5,"Los Angeles, CA",150,99,141,357,6,46,Other,39787.35,Silver,Debit Card,True,0,Sunny,False,Saturday,False,269,205,2024-07-06 01:28:00,2024,7,27,0
1256,2816,134,Smartphone,Appliances,3,1988.25,4/9/2024 22:31,7,"Miami, FL",85,63,244,170,3,53,Female,90842.32,Gold,Debit Card,False,BOGO,Stormy,False,Monday,False,394,264,2024-04-09 22:31:00,2024,4,15,0
1257,5640,138,Washing Machine,Electronics,1,1821.98,1/5/2024 6:30,7,"Miami, FL",338,76,196,192,9,64,Other,58118.85,Platinum,Digital Wallet,True,BOGO,Rainy,False,Saturday,False,274,398,2024-01-05 06:30:00,2024,1,1,0
1258,8972,681,Fridge,Appliances,5,227.72,3/3/2024 18:58,3,"New York, NY",295,133,146,259,10,31,Female,89713.87,Platinum,Credit Card,False,0,Cloudy,False,Friday,False,292,163,2024-03-03 18:58:00,2024,3,9,0
1259,9633,594,Fridge,Appliances,4,830.89,5/14/2024 3:09,2,"Los Angeles, CA",144,54,288,337,4,43,Other,32813.74,Platinum,Debit Card,False,0,Cloudy,True,Saturday,True,235,468,2024-05-14 03:09:00,2024,5,20,0
1260,6053,821,Fridge,Electronics,2,1951.87,8/5/2024 7:47,9,"New York, NY",32,64,204,391,3,50,Other,80464.81,Platinum,Digital Wallet,False,0,Rainy,False,Friday,False,294,225,2024-08-05 07:47:00,2024,8,32,0
1261,1744,477,Headphones,Electronics,4,1177.77,6/24/2024 18:47,9,"New York, NY",422,63,158,422,9,65,Female,116001.59,Silver,Credit Card,False,0,Cloudy,True,Wednesday,False,118,386,2024-06-24 18:47:00,2024,6,26,0
1262,4612,215,TV,Electronics,4,1435.24,8/17/2024 13:49,17,"Miami, FL",92,136,142,422,2,23,Other,112207.96,Platinum,Cash,False,Percentage Discount,Stormy,True,Friday,False,450,129,2024-08-17 13:49:00,2024,8,33,0
1263,7475,694,Smartphone,Appliances,1,1342.69,9/4/2024 1:03,4,"Dallas, TX",160,66,283,192,7,28,Male,100545.2,Gold,Cash,True,Percentage Discount,Cloudy,True,Tuesday,False,399,284,2024-09-04 01:03:00,2024,9,36,0
1264,1897,593,Laptop,Electronics,2,211.92,6/23/2024 8:40,16,"Dallas, TX",289,107,221,164,7,39,Male,117290.31,Platinum,Cash,False,Percentage Discount,Rainy,True,Tuesday,True,172,441,2024-06-23 08:40:00,2024,6,25,0
1265,1125,807,Smartphone,Appliances,4,98.58,9/11/2024 10:29,15,"Los Angeles, CA",229,77,155,231,6,34,Male,27826.92,Platinum,Debit Card,False,0,Sunny,True,Wednesday,False,220,143,2024-09-11 10:29:00,2024,9,37,0
1266,4349,181,TV,Appliances,5,1704.42,4/19/2024 11:35,8,"Chicago, IL",318,118,142,352,2,24,Other,42699.19,Silver,Credit Card,False,0,Cloudy,True,Thursday,True,370,287,2024-04-19 11:35:00,2024,4,16,0
1267,5938,245,Laptop,Appliances,3,1329.51,2/20/2024 0:04,14,"Los Angeles, CA",319,78,167,307,8,36,Male,47598.35,Bronze,Digital Wallet,False,BOGO,Sunny,False,Friday,False,260,136,2024-02-20 00:04:00,2024,2,8,0
1268,4460,847,Washing Machine,Appliances,1,1849.27,7/19/2024 21:36,12,"Dallas, TX",378,61,158,433,8,39,Other,106005.42,Platinum,Digital Wallet,True,Percentage Discount,Sunny,True,Friday,False,280,448,2024-07-19 21:36:00,2024,7,29,0
1269,3248,848,Headphones,Electronics,1,1792.58,4/20/2024 6:19,11,"Dallas, TX",420,135,225,382,4,26,Other,21446.7,Silver,Debit Card,False,0,Sunny,True,Friday,True,198,185,2024-04-20 06:19:00,2024,4,16,0
1270,5186,639,Headphones,Appliances,1,125.37,3/26/2024 0:21,14,"Chicago, IL",301,116,293,316,2,51,Other,58402.42,Bronze,Credit Card,False,0,Rainy,False,Tuesday,False,192,509,2024-03-26 00:21:00,2024,3,13,0
1271,5742,979,TV,Appliances,2,1082.79,1/1/2024 15:51,3,"Dallas, TX",18,130,110,325,4,67,Male,27687.98,Platinum,Debit Card,False,0,Stormy,True,Monday,True,376,506,2024-01-01 15:51:00,2024,1,1,0
1272,6375,868,Headphones,Appliances,2,1670.05,4/2/2024 9:20,20,"Dallas, TX",373,133,148,121,2,49,Other,114708.31,Silver,Credit Card,True,0,Rainy,True,Monday,True,451,292,2024-04-02 09:20:00,2024,4,14,0
1273,2965,897,Headphones,Appliances,5,863.6,2/19/2024 23:01,5,"New York, NY",349,61,273,451,10,70,Male,61909.06,Bronze,Debit Card,True,0,Rainy,False,Monday,True,183,302,2024-02-19 23:01:00,2024,2,8,0
1274,1126,386,Tablet,Electronics,2,863.14,3/8/2024 10:28,5,"Los Angeles, CA",116,108,262,333,8,52,Male,31285.09,Silver,Debit Card,True,0,Rainy,False,Tuesday,True,192,356,2024-03-08 10:28:00,2024,3,10,0
1275,9149,576,Smartphone,Appliances,2,282.19,2/23/2024 13:12,3,"Chicago, IL",389,70,257,152,5,35,Male,33112.06,Platinum,Credit Card,True,0,Rainy,True,Monday,True,357,134,2024-02-23 13:12:00,2024,2,8,0
1276,8055,629,TV,Appliances,2,1836.16,5/22/2024 3:47,17,"Los Angeles, CA",395,53,120,300,10,48,Male,54320.97,Bronze,Digital Wallet,False,0,Rainy,False,Monday,True,295,354,2024-05-22 03:47:00,2024,5,21,0
1277,3878,180,Laptop,Appliances,5,1998.54,3/3/2024 14:15,18,"Los Angeles, CA",71,81,246,326,4,40,Male,118539.21,Bronze,Debit Card,False,0,Stormy,True,Monday,True,230,156,2024-03-03 14:15:00,2024,3,9,0
1278,3116,635,TV,Electronics,2,1508.58,1/8/2024 13:39,5,"Dallas, TX",126,90,270,147,2,57,Female,47522.37,Platinum,Debit Card,False,BOGO,Sunny,False,Friday,True,235,204,2024-01-08 13:39:00,2024,1,2,0
1279,7229,724,Headphones,Appliances,1,191.09,6/2/2024 18:09,5,"Chicago, IL",285,110,110,426,4,18,Male,75788.79,Gold,Digital Wallet,True,BOGO,Rainy,False,Sunday,True,463,402,2024-06-02 18:09:00,2024,6,22,0
1280,9725,190,Laptop,Appliances,5,1260.65,4/30/2024 8:51,1,"New York, NY",277,125,183,237,6,35,Other,45778.67,Platinum,Cash,True,0,Sunny,True,Monday,False,436,178,2024-04-30 08:51:00,2024,4,18,0
1281,4770,351,Smartphone,Appliances,5,127.13,3/24/2024 15:58,14,"New York, NY",363,98,204,365,3,34,Female,65175.0,Gold,Debit Card,True,0,Sunny,False,Wednesday,True,156,221,2024-03-24 15:58:00,2024,3,12,0
1282,9196,583,Headphones,Appliances,2,619.36,7/16/2024 21:48,7,"Miami, FL",229,95,203,440,8,47,Female,41986.48,Silver,Cash,True,0,Rainy,False,Thursday,False,233,271,2024-07-16 21:48:00,2024,7,29,0
1283,6802,745,Smartphone,Electronics,3,287.89,9/8/2024 5:39,3,"Miami, FL",347,104,295,392,7,36,Female,40009.14,Platinum,Cash,True,Percentage Discount,Sunny,True,Saturday,False,150,327,2024-09-08 05:39:00,2024,9,36,0
1284,2180,859,Headphones,Electronics,2,1698.98,5/27/2024 11:50,17,"Los Angeles, CA",214,83,182,283,3,62,Female,110752.28,Silver,Credit Card,True,0,Stormy,True,Wednesday,False,383,297,2024-05-27 11:50:00,2024,5,22,0
1285,7505,779,Laptop,Electronics,4,441.12,9/13/2024 2:39,13,"New York, NY",239,51,274,335,6,23,Other,22784.45,Gold,Credit Card,False,Percentage Discount,Sunny,False,Sunday,False,203,242,2024-09-13 02:39:00,2024,9,37,0
1286,1693,784,TV,Electronics,5,1028.79,7/18/2024 17:58,10,"Chicago, IL",199,53,127,412,6,46,Male,49622.94,Gold,Cash,True,0,Stormy,True,Thursday,True,390,486,2024-07-18 17:58:00,2024,7,29,0
1287,8147,179,TV,Electronics,1,1498.3,2/14/2024 3:08,4,"Los Angeles, CA",436,58,167,172,10,45,Other,30902.24,Platinum,Digital Wallet,False,BOGO,Cloudy,False,Monday,False,478,388,2024-02-14 03:08:00,2024,2,7,0
1288,1307,800,Tablet,Appliances,5,691.8,8/4/2024 9:49,16,"Dallas, TX",220,122,116,270,4,37,Other,40207.86,Platinum,Cash,False,Percentage Discount,Stormy,True,Tuesday,True,235,175,2024-08-04 09:49:00,2024,8,31,0
1289,8532,748,Laptop,Appliances,4,1129.36,5/28/2024 6:15,13,"Chicago, IL",18,58,275,333,8,31,Female,88523.83,Silver,Cash,False,0,Rainy,True,Friday,True,306,418,2024-05-28 06:15:00,2024,5,22,0
1290,2275,652,Camera,Electronics,3,1781.9,6/10/2024 4:56,3,"Chicago, IL",323,135,159,374,7,35,Male,56947.12,Gold,Credit Card,False,0,Cloudy,True,Monday,True,320,422,2024-06-10 04:56:00,2024,6,24,0
1291,6129,917,Camera,Electronics,1,1993.01,5/11/2024 8:54,8,"New York, NY",198,149,178,289,6,35,Other,41111.38,Platinum,Debit Card,False,0,Sunny,True,Sunday,False,394,412,2024-05-11 08:54:00,2024,5,19,0
1292,8033,693,Camera,Electronics,4,458.58,8/17/2024 0:26,1,"Dallas, TX",425,133,148,454,2,22,Female,89395.26,Silver,Credit Card,True,0,Sunny,True,Wednesday,False,271,183,2024-08-17 00:26:00,2024,8,33,0
1293,7626,419,Tablet,Electronics,4,435.09,7/21/2024 1:22,5,"New York, NY",84,144,105,188,2,18,Other,115216.97,Bronze,Credit Card,False,Percentage Discount,Sunny,False,Sunday,True,450,400,2024-07-21 01:22:00,2024,7,29,0
1294,7843,727,Headphones,Electronics,4,879.66,1/22/2024 7:01,7,"Chicago, IL",430,90,214,198,9,40,Female,110850.29,Bronze,Debit Card,False,0,Stormy,True,Tuesday,True,112,178,2024-01-22 07:01:00,2024,1,4,0
1295,5743,154,Smartphone,Electronics,4,1405.95,2/10/2024 23:45,14,"New York, NY",372,87,201,261,3,47,Other,47531.82,Bronze,Cash,False,0,Cloudy,True,Friday,True,359,111,2024-02-10 23:45:00,2024,2,6,0
1296,2887,451,Fridge,Appliances,1,1152.67,6/13/2024 7:20,9,"Los Angeles, CA",268,66,232,177,6,55,Other,107102.75,Silver,Digital Wallet,True,0,Cloudy,False,Sunday,True,245,287,2024-06-13 07:20:00,2024,6,24,0
1297,7636,647,Headphones,Electronics,1,1359.03,8/19/2024 13:21,4,"Chicago, IL",295,149,266,405,7,37,Male,55014.29,Gold,Digital Wallet,True,0,Sunny,True,Friday,True,155,316,2024-08-19 13:21:00,2024,8,34,0
1298,1341,897,Camera,Appliances,4,997.04,2/1/2024 23:05,14,"New York, NY",480,101,159,357,7,60,Male,70141.31,Gold,Digital Wallet,False,Percentage Discount,Sunny,False,Thursday,False,376,408,2024-02-01 23:05:00,2024,2,5,0
1299,6321,111,Laptop,Appliances,3,1881.46,4/20/2024 6:17,20,"New York, NY",163,142,138,128,6,64,Male,87363.69,Silver,Digital Wallet,False,Percentage Discount,Stormy,True,Thursday,True,256,477,2024-04-20 06:17:00,2024,4,16,0
1300,3815,580,Laptop,Electronics,5,1203.77,4/30/2024 21:18,8,"Dallas, TX",458,57,247,113,2,20,Other,64835.86,Gold,Credit Card,True,0,Sunny,True,Thursday,True,430,492,2024-04-30 21:18:00,2024,4,18,0
1301,8538,564,Camera,Appliances,2,450.55,6/11/2024 3:57,14,"Los Angeles, CA",428,140,299,417,7,42,Male,54983.64,Platinum,Debit Card,True,0,Stormy,False,Tuesday,False,215,216,2024-06-11 03:57:00,2024,6,24,0
1302,6928,624,TV,Electronics,1,1109.91,4/11/2024 17:22,17,"Miami, FL",36,106,229,196,4,62,Other,56752.04,Platinum,Debit Card,True,0,Rainy,True,Monday,True,296,369,2024-04-11 17:22:00,2024,4,15,0
1303,2443,580,Headphones,Appliances,5,164.58,8/17/2024 17:30,7,"Dallas, TX",457,120,213,249,10,38,Male,34195.73,Gold,Credit Card,False,Percentage Discount,Rainy,False,Wednesday,True,461,278,2024-08-17 17:30:00,2024,8,33,0
1304,8155,687,Smartphone,Appliances,5,681.65,1/4/2024 5:12,11,"Miami, FL",103,69,198,488,2,29,Male,115860.16,Gold,Cash,True,BOGO,Sunny,True,Sunday,False,123,345,2024-01-04 05:12:00,2024,1,1,0
1305,2734,851,Headphones,Electronics,1,987.08,9/7/2024 17:36,20,"Dallas, TX",399,87,277,135,8,66,Female,46091.01,Platinum,Debit Card,False,0,Cloudy,True,Tuesday,False,294,190,2024-09-07 17:36:00,2024,9,36,0
1306,4986,439,Laptop,Electronics,3,1717.66,1/4/2024 6:39,19,"Dallas, TX",485,59,240,214,3,40,Other,93794.84,Gold,Credit Card,False,0,Stormy,True,Friday,False,487,274,2024-01-04 06:39:00,2024,1,1,0
1307,8138,531,Tablet,Appliances,2,1773.33,4/28/2024 5:44,3,"Miami, FL",425,65,121,497,8,31,Female,70626.53,Gold,Cash,True,0,Stormy,True,Saturday,True,254,474,2024-04-28 05:44:00,2024,4,17,0
1308,7560,461,Fridge,Appliances,1,1591.9,4/30/2024 11:39,14,"Chicago, IL",158,103,264,326,2,29,Other,75857.96,Silver,Digital Wallet,True,0,Stormy,False,Monday,True,197,398,2024-04-30 11:39:00,2024,4,18,0
1309,9584,917,Headphones,Electronics,5,276.21,4/27/2024 22:16,15,"New York, NY",8,85,262,222,6,55,Female,117056.62,Bronze,Credit Card,False,0,Rainy,False,Monday,False,381,424,2024-04-27 22:16:00,2024,4,17,0
1310,2288,401,TV,Electronics,2,1759.96,6/4/2024 12:55,14,"Chicago, IL",331,76,291,228,5,33,Other,110754.3,Silver,Digital Wallet,False,0,Sunny,True,Sunday,True,117,474,2024-06-04 12:55:00,2024,6,23,0
1311,7484,396,Washing Machine,Electronics,4,1576.25,9/12/2024 11:28,9,"Miami, FL",108,84,210,274,9,58,Male,100927.79,Silver,Debit Card,False,0,Stormy,True,Sunday,True,405,242,2024-09-12 11:28:00,2024,9,37,0
1312,6083,271,TV,Electronics,5,240.63,1/20/2024 13:31,1,"Los Angeles, CA",288,147,108,237,4,26,Other,28821.96,Bronze,Digital Wallet,True,BOGO,Rainy,False,Monday,True,199,107,2024-01-20 13:31:00,2024,1,3,0
1313,6562,136,Camera,Electronics,4,1379.6,2/27/2024 11:28,8,"Chicago, IL",313,138,190,165,7,35,Male,39872.36,Gold,Cash,True,0,Cloudy,True,Friday,True,166,252,2024-02-27 11:28:00,2024,2,9,0
1314,4630,811,Headphones,Electronics,4,1856.13,1/16/2024 1:01,5,"Miami, FL",418,72,284,246,3,37,Female,119847.03,Platinum,Credit Card,False,Percentage Discount,Cloudy,False,Wednesday,False,324,203,2024-01-16 01:01:00,2024,1,3,0
1315,6456,711,TV,Appliances,1,1642.98,8/14/2024 22:06,8,"New York, NY",498,88,260,344,9,35,Other,54036.48,Bronze,Digital Wallet,True,0,Rainy,True,Sunday,True,259,378,2024-08-14 22:06:00,2024,8,33,0
1316,3754,867,Fridge,Appliances,4,1992.9,7/10/2024 0:41,19,"Chicago, IL",240,134,122,487,2,60,Male,72118.11,Silver,Credit Card,True,0,Cloudy,True,Friday,False,206,372,2024-07-10 00:41:00,2024,7,28,0
1317,2251,411,Smartphone,Appliances,5,641.74,7/7/2024 2:56,3,"Chicago, IL",281,140,249,149,4,52,Male,80977.73,Platinum,Cash,False,0,Sunny,True,Sunday,True,284,426,2024-07-07 02:56:00,2024,7,27,0
1318,9363,844,Washing Machine,Electronics,1,954.66,9/2/2024 14:37,19,"Miami, FL",111,58,126,133,5,66,Male,112250.91,Silver,Debit Card,True,0,Stormy,True,Tuesday,False,112,444,2024-09-02 14:37:00,2024,9,36,0
1319,2868,903,TV,Electronics,3,1741.49,4/14/2024 8:54,8,"Chicago, IL",273,65,220,277,2,32,Other,20453.19,Silver,Digital Wallet,True,0,Stormy,False,Thursday,False,378,308,2024-04-14 08:54:00,2024,4,15,0
1320,9693,677,Fridge,Electronics,5,365.07,4/10/2024 3:58,6,"Los Angeles, CA",236,82,101,261,4,35,Male,101200.8,Silver,Cash,False,Percentage Discount,Cloudy,True,Sunday,False,204,485,2024-04-10 03:58:00,2024,4,15,0
1321,9355,366,Camera,Electronics,4,1869.06,3/26/2024 18:26,11,"New York, NY",146,110,140,365,6,64,Other,24191.21,Silver,Cash,False,0,Sunny,True,Friday,True,249,259,2024-03-26 18:26:00,2024,3,13,0
1322,4176,162,Smartphone,Electronics,5,1133.51,4/17/2024 5:42,5,"Los Angeles, CA",148,90,274,195,1,41,Male,93764.33,Bronze,Credit Card,False,Percentage Discount,Rainy,True,Wednesday,True,110,273,2024-04-17 05:42:00,2024,4,16,0
1323,6724,744,Washing Machine,Electronics,5,1327.65,7/17/2024 4:05,18,"Miami, FL",342,87,168,192,4,25,Other,26183.64,Gold,Credit Card,True,0,Stormy,True,Monday,False,104,262,2024-07-17 04:05:00,2024,7,29,0
1324,6752,584,Tablet,Electronics,2,614.19,1/28/2024 5:15,5,"New York, NY",358,134,147,133,4,54,Other,106572.73,Platinum,Debit Card,False,0,Sunny,False,Thursday,False,489,150,2024-01-28 05:15:00,2024,1,4,0
1325,3419,692,Washing Machine,Appliances,5,282.5,5/14/2024 5:28,13,"Chicago, IL",334,100,160,385,5,55,Male,76562.16,Bronze,Digital Wallet,True,0,Rainy,False,Friday,False,216,97,2024-05-14 05:28:00,2024,5,20,0
1326,4871,273,Smartphone,Electronics,3,1688.75,1/5/2024 3:14,15,"Dallas, TX",99,105,209,157,7,41,Male,115572.02,Gold,Digital Wallet,True,Percentage Discount,Sunny,False,Monday,False,487,291,2024-01-05 03:14:00,2024,1,1,0
1327,2684,686,Washing Machine,Electronics,3,945.78,8/17/2024 2:35,4,"Miami, FL",10,68,291,389,1,38,Other,87283.03,Platinum,Digital Wallet,False,Percentage Discount,Rainy,False,Friday,True,112,138,2024-08-17 02:35:00,2024,8,33,0
1328,3399,152,Smartphone,Appliances,4,1282.4,8/5/2024 15:36,6,"Dallas, TX",270,85,161,270,8,18,Male,51375.89,Platinum,Digital Wallet,False,Percentage Discount,Sunny,False,Wednesday,False,377,127,2024-08-05 15:36:00,2024,8,32,0
1329,5193,772,Smartphone,Appliances,2,668.37,2/4/2024 23:07,13,"New York, NY",51,146,213,143,5,66,Male,117828.34,Gold,Credit Card,True,0,Cloudy,True,Thursday,False,227,311,2024-02-04 23:07:00,2024,2,5,0
1330,4232,398,TV,Electronics,1,1821.85,6/30/2024 4:36,20,"New York, NY",261,117,164,327,10,53,Female,44832.42,Bronze,Debit Card,True,0,Sunny,True,Tuesday,True,105,211,2024-06-30 04:36:00,2024,6,26,0
1331,3842,928,Washing Machine,Electronics,2,1871.08,4/24/2024 15:47,8,"New York, NY",100,68,286,147,7,59,Other,62607.91,Platinum,Cash,True,Percentage Discount,Rainy,False,Thursday,False,131,377,2024-04-24 15:47:00,2024,4,17,0
1332,3504,855,Smartphone,Electronics,4,196.41,9/10/2024 3:23,15,"Los Angeles, CA",208,66,269,500,9,62,Female,64198.02,Silver,Credit Card,False,0,Stormy,True,Thursday,True,492,383,2024-09-10 03:23:00,2024,9,37,0
1333,2234,739,Headphones,Electronics,4,1862.4,1/16/2024 10:33,19,"Los Angeles, CA",122,79,155,409,8,56,Other,29782.3,Gold,Digital Wallet,False,0,Sunny,True,Saturday,True,248,236,2024-01-16 10:33:00,2024,1,3,0
1334,3902,127,Laptop,Electronics,3,465.6,5/17/2024 1:30,9,"Miami, FL",82,57,218,100,6,46,Male,112252.91,Bronze,Cash,True,0,Sunny,True,Monday,True,474,439,2024-05-17 01:30:00,2024,5,20,0
1335,9095,393,Headphones,Appliances,4,900.47,5/29/2024 15:06,20,"New York, NY",353,132,163,330,8,48,Other,95637.93,Bronze,Debit Card,True,0,Sunny,False,Thursday,False,125,227,2024-05-29 15:06:00,2024,5,22,0
1336,8601,596,Smartphone,Electronics,5,1705.81,5/13/2024 11:07,20,"Chicago, IL",387,104,236,113,5,38,Female,94039.94,Platinum,Digital Wallet,True,0,Cloudy,True,Wednesday,False,408,386,2024-05-13 11:07:00,2024,5,20,0
1337,8354,184,Smartphone,Appliances,4,768.58,3/2/2024 18:16,19,"Miami, FL",291,87,111,322,5,69,Male,94861.68,Platinum,Debit Card,False,Percentage Discount,Cloudy,True,Tuesday,False,377,497,2024-03-02 18:16:00,2024,3,9,0
1338,6295,229,Fridge,Electronics,2,792.1,8/24/2024 11:16,11,"Miami, FL",340,66,117,333,7,34,Female,88984.92,Bronze,Credit Card,True,0,Stormy,True,Sunday,True,405,503,2024-08-24 11:16:00,2024,8,34,0
1339,6179,617,TV,Electronics,5,1727.36,2/10/2024 18:09,6,"Dallas, TX",104,145,155,341,6,49,Other,59652.67,Platinum,Debit Card,True,0,Cloudy,False,Wednesday,False,483,475,2024-02-10 18:09:00,2024,2,6,0
1340,3473,178,Tablet,Appliances,3,415.67,7/29/2024 0:57,6,"Dallas, TX",324,59,119,434,5,26,Male,40425.66,Bronze,Cash,True,0,Rainy,True,Saturday,False,275,247,2024-07-29 00:57:00,2024,7,31,0
1341,8205,971,Smartphone,Electronics,5,189.91,8/3/2024 22:00,11,"New York, NY",319,60,234,318,5,63,Female,77735.33,Gold,Digital Wallet,True,0,Cloudy,False,Saturday,True,317,149,2024-08-03 22:00:00,2024,8,31,0
1342,2118,902,Tablet,Electronics,1,1130.51,9/12/2024 13:19,6,"Chicago, IL",446,104,167,441,9,52,Female,53402.72,Bronze,Credit Card,True,Percentage Discount,Rainy,True,Sunday,True,168,215,2024-09-12 13:19:00,2024,9,37,0
1343,8682,384,Fridge,Electronics,2,1929.77,5/17/2024 21:58,20,"Miami, FL",350,115,149,410,3,68,Other,68938.73,Gold,Cash,False,0,Stormy,True,Saturday,True,270,422,2024-05-17 21:58:00,2024,5,20,0
1344,8245,358,TV,Appliances,3,123.14,1/22/2024 17:39,14,"Dallas, TX",419,83,173,201,2,25,Female,31793.61,Silver,Cash,False,0,Cloudy,True,Sunday,False,369,90,2024-01-22 17:39:00,2024,1,4,0
1345,5961,235,Washing Machine,Electronics,4,1292.45,6/25/2024 23:30,9,"Chicago, IL",229,101,119,159,9,65,Male,27944.92,Platinum,Cash,False,Percentage Discount,Rainy,False,Saturday,False,418,180,2024-06-25 23:30:00,2024,6,26,0
1346,5500,730,Fridge,Electronics,2,638.25,6/26/2024 10:09,9,"Los Angeles, CA",361,57,148,207,8,38,Other,28350.75,Platinum,Credit Card,True,0,Rainy,False,Thursday,True,229,237,2024-06-26 10:09:00,2024,6,26,0
1347,1920,387,Tablet,Electronics,3,1942.72,5/19/2024 13:33,10,"Chicago, IL",4,78,188,149,4,60,Female,39685.79,Bronze,Cash,True,0,Cloudy,False,Monday,True,235,398,2024-05-19 13:33:00,2024,5,20,0
1348,6766,381,Smartphone,Appliances,5,1332.36,1/21/2024 3:40,17,"New York, NY",92,116,272,300,10,46,Female,91064.78,Bronze,Credit Card,False,Percentage Discount,Rainy,False,Saturday,False,491,194,2024-01-21 03:40:00,2024,1,3,0
1349,9312,978,Laptop,Appliances,5,788.95,3/29/2024 17:45,9,"Miami, FL",197,126,223,252,9,19,Female,80789.62,Gold,Debit Card,False,Percentage Discount,Sunny,False,Sunday,False,253,326,2024-03-29 17:45:00,2024,3,13,0
1350,2215,363,Tablet,Appliances,5,1575.79,3/17/2024 5:44,8,"Miami, FL",385,94,283,260,3,45,Male,99856.83,Silver,Cash,True,Percentage Discount,Cloudy,False,Sunday,True,456,444,2024-03-17 05:44:00,2024,3,11,0
1351,6085,114,Fridge,Electronics,5,1997.57,2/20/2024 12:07,14,"Los Angeles, CA",195,62,130,224,2,45,Other,39080.77,Platinum,Cash,False,0,Sunny,False,Friday,False,272,159,2024-02-20 12:07:00,2024,2,8,0
1352,8565,859,Fridge,Appliances,2,380.17,4/6/2024 20:46,18,"Los Angeles, CA",124,130,211,383,3,29,Other,81799.66,Gold,Credit Card,True,0,Stormy,False,Friday,True,266,484,2024-04-06 20:46:00,2024,4,14,0
1353,8404,214,Laptop,Electronics,3,1300.76,4/28/2024 17:21,14,"New York, NY",261,139,291,200,6,40,Female,77003.53,Bronze,Digital Wallet,True,0,Rainy,False,Saturday,True,203,307,2024-04-28 17:21:00,2024,4,17,0
1354,1616,718,Tablet,Electronics,3,281.99,6/6/2024 5:55,17,"Chicago, IL",85,93,243,198,6,68,Other,36118.4,Platinum,Cash,True,BOGO,Rainy,False,Saturday,True,147,140,2024-06-06 05:55:00,2024,6,23,0
1355,1932,278,Laptop,Electronics,2,603.72,9/2/2024 0:10,4,"Los Angeles, CA",449,128,136,304,9,63,Male,64493.6,Silver,Digital Wallet,False,0,Cloudy,True,Thursday,False,417,185,2024-09-02 00:10:00,2024,9,36,0
1356,7041,705,Laptop,Electronics,5,143.38,1/8/2024 5:09,4,"Los Angeles, CA",2,69,205,251,9,18,Other,37018.16,Platinum,Digital Wallet,True,Percentage Discount,Rainy,False,Monday,True,123,419,2024-01-08 05:09:00,2024,1,2,0
1357,5703,856,Smartphone,Electronics,3,1434.47,8/9/2024 4:08,3,"Los Angeles, CA",241,80,131,182,8,24,Male,102663.87,Bronze,Cash,True,0,Cloudy,True,Friday,False,289,375,2024-08-09 04:08:00,2024,8,32,0
1358,2257,254,TV,Electronics,4,210.68,6/9/2024 5:31,10,"Dallas, TX",62,85,116,278,8,63,Other,97223.21,Silver,Credit Card,True,0,Stormy,False,Monday,True,278,457,2024-06-09 05:31:00,2024,6,23,0
1359,2479,774,Tablet,Appliances,1,704.26,7/23/2024 6:54,8,"Los Angeles, CA",178,138,127,265,5,45,Male,111080.81,Silver,Cash,True,0,Sunny,False,Thursday,False,413,430,2024-07-23 06:54:00,2024,7,30,0
1360,9307,557,Headphones,Electronics,4,696.42,6/2/2024 21:17,8,"Miami, FL",477,104,289,104,1,29,Male,73259.38,Bronze,Digital Wallet,False,BOGO,Sunny,False,Monday,True,450,359,2024-06-02 21:17:00,2024,6,22,0
1361,7299,478,Smartphone,Electronics,3,851.38,3/4/2024 22:40,2,"Dallas, TX",158,100,173,214,6,29,Female,71122.92,Gold,Debit Card,True,0,Rainy,True,Wednesday,True,417,161,2024-03-04 22:40:00,2024,3,10,0
1362,8581,927,Laptop,Appliances,2,1343.75,5/7/2024 6:59,14,"Los Angeles, CA",286,90,218,284,1,19,Other,96845.33,Bronze,Digital Wallet,False,0,Cloudy,False,Thursday,False,374,173,2024-05-07 06:59:00,2024,5,19,0
1363,1672,279,Laptop,Appliances,5,1933.33,1/4/2024 22:04,9,"Chicago, IL",40,68,197,225,4,37,Other,108430.59,Platinum,Debit Card,True,0,Rainy,False,Tuesday,False,142,337,2024-01-04 22:04:00,2024,1,1,0
1364,8368,367,Tablet,Appliances,5,411.81,5/22/2024 14:38,1,"New York, NY",282,58,143,224,2,30,Other,56795.1,Silver,Digital Wallet,False,0,Cloudy,False,Saturday,True,356,490,2024-05-22 14:38:00,2024,5,21,0
1365,4084,901,Camera,Appliances,1,179.54,5/8/2024 9:04,20,"Chicago, IL",166,146,106,455,6,60,Female,82492.13,Silver,Cash,False,0,Sunny,True,Saturday,True,358,255,2024-05-08 09:04:00,2024,5,19,0
1366,6267,817,Tablet,Appliances,4,1118.34,6/20/2024 5:48,17,"Chicago, IL",60,113,213,477,2,46,Other,100787.55,Silver,Cash,True,BOGO,Cloudy,False,Sunday,False,282,198,2024-06-20 05:48:00,2024,6,25,0
1367,8792,341,TV,Appliances,3,1637.59,8/5/2024 14:30,1,"Los Angeles, CA",113,86,152,482,4,46,Male,21373.89,Silver,Cash,True,0,Cloudy,False,Tuesday,True,226,174,2024-08-05 14:30:00,2024,8,32,0
1368,9214,596,Smartphone,Appliances,4,707.41,7/27/2024 13:03,11,"New York, NY",114,104,165,470,5,25,Other,25376.01,Platinum,Debit Card,False,0,Cloudy,True,Tuesday,False,466,452,2024-07-27 13:03:00,2024,7,30,0
1369,3471,285,Washing Machine,Appliances,2,1996.76,5/27/2024 2:08,18,"Miami, FL",422,82,218,189,7,34,Male,75526.27,Silver,Debit Card,True,0,Stormy,False,Thursday,False,258,430,2024-05-27 02:08:00,2024,5,22,0
1370,2013,918,Washing Machine,Appliances,5,392.23,9/16/2024 3:45,16,"Los Angeles, CA",443,91,237,475,6,57,Male,66465.67,Bronze,Credit Card,True,0,Cloudy,False,Thursday,False,230,301,2024-09-16 03:45:00,2024,9,38,0
1371,8381,640,Smartphone,Appliances,4,1329.18,5/6/2024 13:38,16,"Chicago, IL",53,74,223,145,1,36,Male,50502.91,Platinum,Credit Card,False,0,Sunny,False,Tuesday,True,470,451,2024-05-06 13:38:00,2024,5,19,0
1372,2695,982,Headphones,Electronics,4,1492.21,4/26/2024 10:22,3,"Dallas, TX",39,147,292,116,9,53,Male,66478.66,Bronze,Cash,False,0,Cloudy,False,Friday,False,249,172,2024-04-26 10:22:00,2024,4,17,0
1373,6626,133,Camera,Appliances,5,1792.17,9/7/2024 9:36,11,"New York, NY",416,79,158,151,7,48,Other,21864.43,Bronze,Cash,True,BOGO,Sunny,False,Sunday,False,387,291,2024-09-07 09:36:00,2024,9,36,0
1374,2381,451,Washing Machine,Electronics,3,53.93,8/27/2024 15:36,11,"Chicago, IL",240,62,287,182,6,28,Other,48058.09,Bronze,Credit Card,False,0,Sunny,False,Monday,False,486,122,2024-08-27 15:36:00,2024,8,35,0
1375,9266,186,Smartphone,Electronics,1,1284.34,2/4/2024 13:38,12,"Miami, FL",260,105,188,272,7,36,Female,27866.21,Silver,Credit Card,False,0,Rainy,True,Monday,False,290,185,2024-02-04 13:38:00,2024,2,5,0
1376,3827,248,TV,Electronics,4,601.84,5/27/2024 11:04,20,"Los Angeles, CA",212,146,179,253,10,51,Other,43974.49,Bronze,Debit Card,True,0,Sunny,True,Tuesday,False,497,106,2024-05-27 11:04:00,2024,5,22,0
1377,1641,709,Laptop,Electronics,5,1455.29,2/5/2024 5:58,2,"Chicago, IL",28,84,130,457,10,34,Other,69956.37,Platinum,Cash,True,0,Rainy,False,Thursday,False,409,493,2024-02-05 05:58:00,2024,2,6,0
1378,5059,941,Headphones,Appliances,5,176.76,6/5/2024 8:02,13,"Dallas, TX",174,124,171,306,7,55,Other,117563.26,Silver,Credit Card,False,0,Rainy,True,Sunday,False,112,256,2024-06-05 08:02:00,2024,6,23,0
1379,8172,257,Tablet,Appliances,4,1429.79,1/25/2024 19:26,6,"Dallas, TX",224,90,182,330,4,26,Other,35846.84,Platinum,Digital Wallet,True,Percentage Discount,Sunny,True,Sunday,True,113,312,2024-01-25 19:26:00,2024,1,4,0
1380,8199,957,Laptop,Electronics,4,1188.31,4/1/2024 17:55,16,"Chicago, IL",424,51,189,267,9,45,Female,104665.25,Platinum,Credit Card,False,0,Sunny,True,Wednesday,False,337,386,2024-04-01 17:55:00,2024,4,14,0
1381,9586,607,Laptop,Appliances,1,1214.56,8/1/2024 21:55,17,"New York, NY",229,105,206,493,8,25,Other,99394.61,Bronze,Cash,False,0,Stormy,False,Friday,True,164,114,2024-08-01 21:55:00,2024,8,31,0
1382,9564,870,Tablet,Appliances,5,1246.48,4/21/2024 23:13,16,"Miami, FL",207,54,178,405,5,40,Other,46813.78,Platinum,Digital Wallet,False,Percentage Discount,Rainy,True,Thursday,True,343,465,2024-04-21 23:13:00,2024,4,16,0
1383,3600,522,Headphones,Appliances,1,1065.16,8/7/2024 15:02,20,"Dallas, TX",431,149,215,135,5,29,Other,94606.93,Platinum,Digital Wallet,True,BOGO,Cloudy,True,Tuesday,True,425,464,2024-08-07 15:02:00,2024,8,32,0
1384,6962,888,Tablet,Appliances,5,1834.06,4/17/2024 6:10,2,"Chicago, IL",231,91,149,249,8,51,Other,112964.49,Bronze,Credit Card,True,0,Stormy,True,Friday,True,240,317,2024-04-17 06:10:00,2024,4,16,0
1385,7108,492,Fridge,Appliances,5,749.83,8/24/2024 19:00,6,"New York, NY",252,132,116,396,8,66,Male,43178.88,Platinum,Cash,True,0,Sunny,True,Tuesday,False,392,293,2024-08-24 19:00:00,2024,8,34,0
1386,5634,343,Smartphone,Electronics,4,811.33,2/13/2024 9:35,12,"Dallas, TX",36,86,266,401,2,61,Other,52510.99,Platinum,Credit Card,False,0,Sunny,True,Saturday,False,279,243,2024-02-13 09:35:00,2024,2,7,0
1387,7347,776,Laptop,Appliances,3,600.54,7/18/2024 16:03,19,"Chicago, IL",303,63,125,442,4,61,Other,24441.32,Platinum,Debit Card,False,0,Stormy,True,Wednesday,True,390,327,2024-07-18 16:03:00,2024,7,29,0
1388,7697,550,TV,Appliances,4,1161.92,6/20/2024 6:41,4,"New York, NY",69,62,299,409,5,33,Male,74630.1,Bronze,Cash,True,0,Cloudy,False,Friday,True,137,288,2024-06-20 06:41:00,2024,6,25,0
1389,6543,843,Laptop,Electronics,3,1901.79,6/16/2024 9:19,5,"New York, NY",360,138,201,283,2,18,Male,51227.24,Platinum,Digital Wallet,True,0,Cloudy,False,Sunday,True,309,429,2024-06-16 09:19:00,2024,6,24,0
1390,1857,752,TV,Electronics,5,480.77,1/10/2024 11:08,1,"Miami, FL",400,77,231,392,3,38,Male,95771.21,Silver,Cash,False,Percentage Discount,Sunny,False,Saturday,False,396,320,2024-01-10 11:08:00,2024,1,2,0
1391,6482,271,Fridge,Electronics,3,163.79,6/30/2024 13:49,9,"Chicago, IL",447,110,236,490,6,66,Male,44778.03,Platinum,Debit Card,False,0,Rainy,True,Monday,True,323,158,2024-06-30 13:49:00,2024,6,26,0
1392,2079,315,Fridge,Appliances,5,770.03,9/10/2024 16:24,13,"Miami, FL",416,133,183,487,4,45,Other,99942.45,Platinum,Digital Wallet,False,0,Cloudy,False,Friday,False,105,413,2024-09-10 16:24:00,2024,9,37,0
1393,6401,691,Smartphone,Electronics,5,1202.15,1/3/2024 17:03,8,"New York, NY",340,63,251,329,9,53,Other,86641.19,Platinum,Debit Card,True,Percentage Discount,Rainy,True,Tuesday,False,430,170,2024-01-03 17:03:00,2024,1,1,0
1394,2548,851,Camera,Appliances,3,1275.9,3/21/2024 4:13,15,"New York, NY",286,78,145,341,4,26,Other,101637.14,Bronze,Debit Card,False,Percentage Discount,Rainy,True,Thursday,True,359,246,2024-03-21 04:13:00,2024,3,12,0
1395,7333,962,Headphones,Electronics,4,1474.41,6/2/2024 1:11,6,"New York, NY",282,132,203,121,5,64,Other,99759.91,Gold,Credit Card,False,0,Stormy,False,Saturday,True,257,267,2024-06-02 01:11:00,2024,6,22,0
1396,5655,453,TV,Appliances,3,893.74,3/16/2024 23:28,4,"Miami, FL",310,136,203,219,2,21,Other,58937.76,Bronze,Debit Card,False,0,Rainy,False,Saturday,True,151,242,2024-03-16 23:28:00,2024,3,11,0
1397,5128,155,Fridge,Appliances,1,728.34,5/8/2024 8:34,14,"Dallas, TX",69,87,159,148,1,53,Male,59202.32,Platinum,Credit Card,True,0,Sunny,True,Saturday,True,137,356,2024-05-08 08:34:00,2024,5,19,0
1398,3463,757,Tablet,Electronics,5,1343.65,2/10/2024 1:55,6,"Chicago, IL",390,132,221,459,7,21,Male,34496.88,Silver,Cash,True,0,Stormy,True,Tuesday,False,152,249,2024-02-10 01:55:00,2024,2,6,0
1399,6461,370,Washing Machine,Electronics,2,833.69,4/27/2024 8:13,13,"New York, NY",17,104,263,345,6,50,Female,62227.57,Platinum,Digital Wallet,True,BOGO,Stormy,True,Wednesday,False,485,293,2024-04-27 08:13:00,2024,4,17,0
1400,2335,873,Smartphone,Electronics,5,762.96,3/22/2024 20:48,13,"Miami, FL",447,145,285,100,8,29,Male,74279.11,Gold,Digital Wallet,True,0,Sunny,True,Saturday,False,252,307,2024-03-22 20:48:00,2024,3,12,0
1401,3317,939,Tablet,Electronics,5,1567.68,2/25/2024 14:09,1,"New York, NY",116,80,104,284,3,19,Male,34761.39,Platinum,Debit Card,False,0,Stormy,True,Friday,True,242,188,2024-02-25 14:09:00,2024,2,8,0
1402,6731,218,TV,Appliances,3,627.68,3/12/2024 5:55,7,"Miami, FL",30,130,103,319,10,64,Male,82018.61,Bronze,Cash,False,Percentage Discount,Rainy,True,Thursday,True,435,101,2024-03-12 05:55:00,2024,3,11,0
1403,6082,153,Tablet,Appliances,1,334.01,8/28/2024 19:25,5,"Los Angeles, CA",471,63,239,372,10,48,Other,79956.67,Bronze,Credit Card,True,0,Sunny,False,Friday,True,482,366,2024-08-28 19:25:00,2024,8,35,0
1404,7421,271,Headphones,Appliances,4,1981.52,5/18/2024 15:04,7,"Miami, FL",79,146,265,436,8,59,Male,78527.19,Platinum,Digital Wallet,True,BOGO,Sunny,False,Saturday,True,127,246,2024-05-18 15:04:00,2024,5,20,0
1405,3112,575,Camera,Appliances,4,924.1,4/30/2024 16:56,11,"New York, NY",271,137,233,471,7,50,Other,67025.72,Silver,Digital Wallet,False,0,Cloudy,True,Thursday,True,450,346,2024-04-30 16:56:00,2024,4,18,0
1406,2388,508,Tablet,Appliances,2,1462.6,6/30/2024 18:47,17,"Miami, FL",496,51,254,164,7,18,Other,89830.71,Silver,Digital Wallet,True,0,Sunny,False,Sunday,True,343,204,2024-06-30 18:47:00,2024,6,26,0
1407,6072,587,Camera,Appliances,3,938.59,5/11/2024 21:02,10,"New York, NY",227,113,168,289,6,56,Female,70229.62,Bronze,Cash,False,0,Sunny,True,Friday,True,259,109,2024-05-11 21:02:00,2024,5,19,0
1408,7171,408,Tablet,Appliances,4,809.95,8/25/2024 6:13,3,"Chicago, IL",163,119,157,382,7,50,Female,85724.15,Silver,Debit Card,False,0,Sunny,False,Sunday,True,115,434,2024-08-25 06:13:00,2024,8,34,0
1409,6381,587,Camera,Electronics,5,309.87,7/12/2024 1:16,18,"New York, NY",411,126,240,200,3,50,Other,47861.03,Platinum,Digital Wallet,True,0,Sunny,False,Sunday,True,269,446,2024-07-12 01:16:00,2024,7,28,0
1410,3093,864,Tablet,Appliances,3,1324.15,1/23/2024 13:37,1,"New York, NY",224,137,149,195,1,29,Female,99031.74,Bronze,Cash,False,Percentage Discount,Cloudy,True,Friday,True,188,136,2024-01-23 13:37:00,2024,1,4,0
1411,9624,870,Laptop,Electronics,2,839.93,5/15/2024 17:53,6,"Dallas, TX",138,55,111,121,7,28,Other,100468.17,Silver,Credit Card,True,0,Sunny,False,Sunday,False,176,190,2024-05-15 17:53:00,2024,5,20,0
1412,2531,645,Smartphone,Appliances,4,100.49,4/11/2024 11:24,20,"Dallas, TX",17,131,131,134,8,20,Male,61962.84,Bronze,Debit Card,False,0,Cloudy,True,Monday,True,282,165,2024-04-11 11:24:00,2024,4,15,0
1413,7937,339,Smartphone,Electronics,5,796.42,8/29/2024 13:49,11,"Chicago, IL",183,111,176,236,1,55,Male,87987.34,Gold,Credit Card,False,0,Stormy,True,Thursday,False,325,130,2024-08-29 13:49:00,2024,8,35,0
1414,9331,488,Fridge,Electronics,5,65.59,2/29/2024 18:23,12,"Chicago, IL",257,118,240,210,4,70,Male,100566.94,Bronze,Digital Wallet,True,0,Stormy,True,Sunday,True,166,227,2024-02-29 18:23:00,2024,2,9,0
1415,6928,799,Camera,Electronics,5,93.98,2/16/2024 18:06,20,"Dallas, TX",319,104,270,268,10,26,Other,105994.84,Platinum,Debit Card,False,BOGO,Cloudy,False,Sunday,True,283,164,2024-02-16 18:06:00,2024,2,7,0
1416,1298,822,Smartphone,Electronics,1,133.53,2/19/2024 0:39,19,"Miami, FL",385,123,193,256,4,40,Female,86376.28,Bronze,Digital Wallet,False,BOGO,Stormy,False,Sunday,False,401,432,2024-02-19 00:39:00,2024,2,8,0
1417,6940,499,Fridge,Appliances,4,623.42,2/14/2024 9:36,19,"New York, NY",464,137,221,289,4,29,Female,84903.41,Platinum,Digital Wallet,False,0,Cloudy,False,Saturday,True,138,186,2024-02-14 09:36:00,2024,2,7,0
1418,6060,585,Smartphone,Appliances,3,1997.92,8/30/2024 23:05,16,"Los Angeles, CA",95,145,229,298,7,58,Male,103887.99,Silver,Credit Card,False,0,Sunny,True,Wednesday,True,479,211,2024-08-30 23:05:00,2024,8,35,0
1419,3953,368,Headphones,Electronics,5,1845.91,4/21/2024 13:00,15,"Miami, FL",121,91,288,198,8,25,Male,74248.81,Platinum,Credit Card,True,0,Stormy,True,Thursday,True,222,225,2024-04-21 13:00:00,2024,4,16,0
1420,4509,248,Headphones,Appliances,5,266.9,8/23/2024 0:49,8,"Chicago, IL",347,107,126,302,8,18,Other,70438.98,Silver,Digital Wallet,False,0,Stormy,False,Thursday,True,500,500,2024-08-23 00:49:00,2024,8,34,0
1421,6598,643,Camera,Appliances,1,483.84,2/5/2024 22:57,15,"Chicago, IL",428,145,203,341,8,59,Other,102546.92,Bronze,Digital Wallet,True,BOGO,Sunny,False,Sunday,True,109,262,2024-02-05 22:57:00,2024,2,6,0
1422,8967,991,Tablet,Appliances,3,1974.32,3/6/2024 0:48,19,"Chicago, IL",6,98,195,415,5,63,Male,56059.41,Platinum,Digital Wallet,False,0,Cloudy,False,Saturday,True,491,433,2024-03-06 00:48:00,2024,3,10,0
1423,4145,545,Headphones,Appliances,3,787.24,9/13/2024 19:08,7,"Chicago, IL",107,56,210,361,5,69,Female,38297.35,Platinum,Credit Card,True,0,Sunny,True,Monday,True,105,491,2024-09-13 19:08:00,2024,9,37,0
1424,4711,112,Washing Machine,Electronics,3,1314.15,7/29/2024 15:00,20,"New York, NY",213,64,102,363,2,55,Female,79743.54,Silver,Debit Card,True,0,Cloudy,False,Thursday,True,108,214,2024-07-29 15:00:00,2024,7,31,0
1425,3253,395,Camera,Appliances,1,1923.99,4/25/2024 18:32,12,"New York, NY",6,121,232,451,1,35,Female,79712.47,Gold,Digital Wallet,False,0,Rainy,True,Sunday,True,478,446,2024-04-25 18:32:00,2024,4,17,0
1426,3538,916,Headphones,Appliances,5,1729.23,8/6/2024 0:08,16,"Los Angeles, CA",193,148,235,217,9,67,Male,51057.03,Silver,Digital Wallet,False,0,Sunny,False,Tuesday,False,207,338,2024-08-06 00:08:00,2024,8,32,0
1427,2264,559,Tablet,Appliances,2,558.32,1/28/2024 2:47,19,"Miami, FL",224,117,112,323,5,27,Female,71623.02,Gold,Debit Card,True,0,Sunny,False,Friday,True,436,496,2024-01-28 02:47:00,2024,1,4,0
1428,5846,491,Laptop,Electronics,5,1585.53,6/11/2024 0:21,11,"Chicago, IL",250,79,273,356,4,30,Male,101973.38,Silver,Cash,False,0,Stormy,False,Tuesday,True,466,277,2024-06-11 00:21:00,2024,6,24,0
1429,2657,794,Smartphone,Appliances,4,1048.31,8/28/2024 16:26,12,"Dallas, TX",271,51,167,321,10,58,Female,37658.24,Platinum,Cash,False,BOGO,Rainy,True,Saturday,True,338,96,2024-08-28 16:26:00,2024,8,35,0
1430,9317,423,Smartphone,Electronics,1,1567.16,1/2/2024 5:48,3,"Chicago, IL",246,85,117,220,8,40,Female,84074.3,Platinum,Digital Wallet,False,0,Rainy,True,Sunday,True,270,166,2024-01-02 05:48:00,2024,1,1,0
1431,9843,642,Camera,Appliances,3,250.08,4/6/2024 17:16,19,"Miami, FL",56,63,230,314,2,61,Male,49483.93,Platinum,Credit Card,False,0,Cloudy,False,Friday,True,190,457,2024-04-06 17:16:00,2024,4,14,0
1432,9626,799,Smartphone,Appliances,2,60.04,8/23/2024 9:53,5,"Dallas, TX",304,139,275,423,2,34,Female,117104.96,Bronze,Debit Card,False,Percentage Discount,Sunny,False,Monday,False,458,141,2024-08-23 09:53:00,2024,8,34,0
1433,1618,142,Fridge,Electronics,1,1938.41,7/1/2024 12:46,9,"New York, NY",446,136,258,253,9,49,Other,48461.67,Platinum,Debit Card,True,0,Sunny,False,Saturday,False,394,408,2024-07-01 12:46:00,2024,7,27,0
1434,6517,199,Washing Machine,Appliances,1,1961.91,4/1/2024 8:15,15,"New York, NY",329,91,109,442,3,54,Female,103421.1,Gold,Debit Card,False,BOGO,Stormy,True,Monday,True,408,90,2024-04-01 08:15:00,2024,4,14,0
1435,3147,644,Washing Machine,Electronics,2,853.11,5/8/2024 20:04,9,"Miami, FL",86,131,292,259,1,23,Male,109308.47,Bronze,Credit Card,False,0,Stormy,True,Tuesday,False,248,210,2024-05-08 20:04:00,2024,5,19,0
1436,7172,752,Tablet,Electronics,4,1105.92,5/26/2024 15:23,3,"Los Angeles, CA",136,85,271,468,1,31,Female,66060.61,Gold,Credit Card,False,BOGO,Rainy,False,Tuesday,True,492,165,2024-05-26 15:23:00,2024,5,21,0
1437,3527,462,Tablet,Electronics,2,165.04,8/9/2024 17:14,3,"Chicago, IL",388,131,133,258,4,21,Other,32493.55,Gold,Debit Card,True,0,Rainy,True,Sunday,True,264,225,2024-08-09 17:14:00,2024,8,32,0
1438,3658,964,Fridge,Electronics,4,580.29,9/9/2024 3:42,3,"Miami, FL",305,86,172,396,5,64,Female,93315.44,Gold,Credit Card,True,0,Sunny,True,Saturday,True,270,218,2024-09-09 03:42:00,2024,9,37,0
1439,3962,542,Headphones,Appliances,1,1945.39,1/1/2024 11:02,16,"Chicago, IL",241,112,172,359,1,28,Other,54761.89,Bronze,Credit Card,False,0,Rainy,True,Monday,True,368,139,2024-01-01 11:02:00,2024,1,1,0
1440,3712,725,Smartphone,Electronics,4,1531.41,1/13/2024 1:08,7,"Los Angeles, CA",339,89,202,159,10,49,Female,28065.84,Silver,Debit Card,False,BOGO,Rainy,False,Sunday,False,175,211,2024-01-13 01:08:00,2024,1,2,0
1441,8170,767,Tablet,Electronics,4,997.43,9/15/2024 0:04,13,"Chicago, IL",475,113,283,115,4,67,Female,83405.65,Bronze,Digital Wallet,True,0,Rainy,True,Sunday,True,330,207,2024-09-15 00:04:00,2024,9,37,0
1442,1715,978,Camera,Electronics,3,1095.78,5/10/2024 18:28,15,"New York, NY",89,80,147,438,6,55,Other,82372.62,Platinum,Credit Card,True,BOGO,Stormy,False,Thursday,True,265,165,2024-05-10 18:28:00,2024,5,19,0
1443,7731,379,Smartphone,Appliances,5,65.03,4/6/2024 22:22,1,"Chicago, IL",193,80,242,306,9,26,Female,78735.48,Bronze,Credit Card,True,0,Rainy,True,Friday,True,217,496,2024-04-06 22:22:00,2024,4,14,0
1444,6968,443,Smartphone,Electronics,5,844.91,8/21/2024 8:58,7,"Chicago, IL",165,84,234,199,3,55,Male,31065.43,Silver,Debit Card,True,BOGO,Stormy,False,Monday,False,174,413,2024-08-21 08:58:00,2024,8,34,0
1445,4891,376,Fridge,Appliances,1,424.74,2/5/2024 9:33,17,"Dallas, TX",174,139,300,484,8,55,Male,92357.68,Platinum,Credit Card,True,0,Sunny,False,Thursday,True,493,181,2024-02-05 09:33:00,2024,2,6,0
1446,8277,373,Camera,Appliances,1,1454.22,1/30/2024 21:15,14,"Los Angeles, CA",384,78,143,167,2,18,Male,59926.36,Platinum,Credit Card,True,0,Stormy,True,Saturday,False,318,224,2024-01-30 21:15:00,2024,1,5,0
1447,5668,921,Camera,Appliances,5,287.34,3/29/2024 5:21,5,"Miami, FL",450,97,210,311,8,28,Other,51021.52,Silver,Cash,True,Percentage Discount,Cloudy,True,Tuesday,True,495,475,2024-03-29 05:21:00,2024,3,13,0
1448,8355,200,Washing Machine,Appliances,2,1746.85,4/9/2024 21:51,12,"Los Angeles, CA",238,133,116,329,4,38,Male,64542.26,Platinum,Credit Card,False,0,Cloudy,True,Sunday,True,180,500,2024-04-09 21:51:00,2024,4,15,0
1449,4833,361,Fridge,Appliances,3,1336.22,3/1/2024 15:11,13,"Chicago, IL",32,133,219,489,3,23,Other,36078.88,Bronze,Cash,True,Percentage Discount,Rainy,False,Monday,True,214,446,2024-03-01 15:11:00,2024,3,9,0
1450,9749,770,Washing Machine,Appliances,5,323.01,2/2/2024 10:58,15,"Miami, FL",96,127,152,198,1,19,Other,29646.55,Bronze,Credit Card,False,BOGO,Cloudy,False,Tuesday,False,478,257,2024-02-02 10:58:00,2024,2,5,0
1451,4918,698,Fridge,Appliances,3,328.51,5/5/2024 3:31,14,"New York, NY",472,110,167,389,4,18,Other,74238.06,Gold,Digital Wallet,True,0,Stormy,True,Friday,False,425,331,2024-05-05 03:31:00,2024,5,18,0
1452,6070,500,Camera,Appliances,3,338.76,9/11/2024 18:19,4,"Miami, FL",207,81,277,171,2,68,Male,119739.94,Gold,Digital Wallet,True,0,Cloudy,False,Saturday,False,334,337,2024-09-11 18:19:00,2024,9,37,0
1453,8684,572,Smartphone,Electronics,5,391.23,8/16/2024 1:25,4,"Dallas, TX",144,105,196,424,1,61,Male,106284.27,Platinum,Debit Card,False,0,Cloudy,True,Tuesday,False,467,374,2024-08-16 01:25:00,2024,8,33,0
1454,4178,891,TV,Electronics,1,352.3,2/13/2024 3:08,6,"Dallas, TX",295,147,108,113,7,28,Male,24337.01,Platinum,Debit Card,False,0,Cloudy,False,Thursday,False,133,198,2024-02-13 03:08:00,2024,2,7,0
1455,7026,791,Fridge,Appliances,2,75.68,8/3/2024 4:15,12,"New York, NY",430,127,239,293,7,28,Other,97341.42,Bronze,Debit Card,True,0,Rainy,True,Tuesday,False,193,198,2024-08-03 04:15:00,2024,8,31,0
1456,8218,867,Fridge,Appliances,1,591.55,5/20/2024 7:42,18,"Los Angeles, CA",212,111,217,463,7,48,Male,99734.87,Gold,Digital Wallet,True,0,Sunny,True,Monday,True,337,338,2024-05-20 07:42:00,2024,5,21,0
1457,8564,347,Washing Machine,Appliances,5,687.15,7/2/2024 16:54,10,"New York, NY",244,54,155,111,5,56,Female,64718.23,Silver,Cash,False,Percentage Discount,Rainy,True,Thursday,True,469,393,2024-07-02 16:54:00,2024,7,27,0
1458,5616,851,Washing Machine,Electronics,5,353.31,6/30/2024 21:25,6,"Dallas, TX",485,62,295,240,7,53,Female,89692.56,Platinum,Credit Card,False,0,Cloudy,True,Sunday,False,263,216,2024-06-30 21:25:00,2024,6,26,0
1459,7256,788,TV,Electronics,5,425.58,8/6/2024 9:06,7,"Los Angeles, CA",132,135,211,171,6,69,Male,75659.11,Bronze,Debit Card,False,0,Sunny,True,Tuesday,True,160,334,2024-08-06 09:06:00,2024,8,32,0
1460,9239,702,Fridge,Electronics,5,1999.85,9/10/2024 4:21,7,"Chicago, IL",357,104,151,397,2,26,Other,116792.59,Silver,Cash,True,0,Stormy,False,Tuesday,False,408,91,2024-09-10 04:21:00,2024,9,37,0
1461,9641,888,Tablet,Appliances,2,1202.56,6/28/2024 12:04,1,"Dallas, TX",186,114,120,250,9,41,Male,28802.8,Gold,Digital Wallet,True,0,Cloudy,True,Monday,True,477,363,2024-06-28 12:04:00,2024,6,26,0
1462,7859,299,Fridge,Appliances,1,629.46,5/12/2024 11:52,1,"Miami, FL",48,148,167,175,5,47,Male,79152.28,Silver,Cash,False,BOGO,Sunny,False,Sunday,False,398,293,2024-05-12 11:52:00,2024,5,19,0
1463,3655,632,TV,Appliances,3,52.51,7/3/2024 5:53,18,"Chicago, IL",355,96,244,415,8,54,Female,57700.75,Silver,Digital Wallet,False,0,Stormy,False,Monday,True,418,191,2024-07-03 05:53:00,2024,7,27,0
1464,4271,445,Tablet,Appliances,4,229.93,7/15/2024 3:41,2,"Los Angeles, CA",381,69,149,412,9,68,Other,67178.08,Bronze,Digital Wallet,False,Percentage Discount,Cloudy,True,Saturday,True,448,352,2024-07-15 03:41:00,2024,7,29,0
1465,3267,793,TV,Electronics,3,1466.27,4/13/2024 23:11,12,"Miami, FL",158,96,276,171,9,54,Male,34316.76,Platinum,Digital Wallet,True,0,Stormy,False,Saturday,True,221,469,2024-04-13 23:11:00,2024,4,15,0
1466,5096,806,Camera,Electronics,5,1130.78,1/29/2024 1:41,13,"Miami, FL",161,80,123,487,8,50,Other,71200.24,Silver,Digital Wallet,True,0,Sunny,True,Wednesday,True,320,162,2024-01-29 01:41:00,2024,1,5,0
1467,1854,284,Laptop,Electronics,5,932.12,2/5/2024 5:40,8,"Dallas, TX",117,59,232,139,10,51,Other,74603.13,Platinum,Credit Card,False,0,Cloudy,False,Saturday,False,413,389,2024-02-05 05:40:00,2024,2,6,0
1468,8873,420,TV,Electronics,2,1614.94,4/3/2024 9:07,2,"Los Angeles, CA",231,135,121,145,8,33,Female,88270.15,Platinum,Debit Card,True,0,Stormy,True,Wednesday,False,283,367,2024-04-03 09:07:00,2024,4,14,0
1469,7081,660,Laptop,Appliances,5,494.94,6/4/2024 6:07,17,"New York, NY",182,139,148,414,9,39,Other,71614.41,Gold,Debit Card,True,BOGO,Cloudy,True,Wednesday,True,358,369,2024-06-04 06:07:00,2024,6,23,0
1470,2680,110,Camera,Appliances,5,1785.32,4/9/2024 3:44,5,"New York, NY",391,111,215,189,9,68,Other,88760.15,Silver,Digital Wallet,False,0,Sunny,True,Monday,False,454,269,2024-04-09 03:44:00,2024,4,15,0
1471,9452,788,Washing Machine,Appliances,4,248.47,6/5/2024 11:12,19,"Chicago, IL",90,90,134,236,9,57,Male,111513.83,Bronze,Digital Wallet,True,0,Sunny,False,Tuesday,True,246,158,2024-06-05 11:12:00,2024,6,23,0
1472,3042,108,Smartphone,Electronics,3,275.15,7/24/2024 12:22,6,"Los Angeles, CA",181,56,295,328,5,62,Male,37060.91,Gold,Debit Card,False,0,Sunny,False,Monday,True,151,234,2024-07-24 12:22:00,2024,7,30,0
1473,5670,951,Tablet,Electronics,1,530.24,4/23/2024 1:55,9,"New York, NY",227,82,138,234,6,69,Female,64217.07,Bronze,Credit Card,False,0,Cloudy,False,Tuesday,False,316,421,2024-04-23 01:55:00,2024,4,17,0
1474,2374,169,Laptop,Electronics,5,1350.68,5/7/2024 23:00,18,"Chicago, IL",368,50,250,208,9,65,Male,31724.99,Bronze,Digital Wallet,True,BOGO,Sunny,False,Monday,False,499,383,2024-05-07 23:00:00,2024,5,19,0
1475,3626,112,Camera,Appliances,3,1660.78,3/25/2024 9:01,5,"Chicago, IL",153,122,288,428,8,60,Male,100661.66,Silver,Digital Wallet,True,BOGO,Rainy,False,Sunday,True,206,293,2024-03-25 09:01:00,2024,3,13,0
1476,5469,521,Camera,Electronics,4,1894.1,6/20/2024 11:40,17,"Los Angeles, CA",497,77,151,489,10,34,Other,104615.57,Platinum,Cash,False,0,Rainy,True,Tuesday,True,262,322,2024-06-20 11:40:00,2024,6,25,0
1477,8361,200,Smartphone,Electronics,2,663.12,1/26/2024 4:39,15,"Miami, FL",413,110,233,422,6,31,Other,46463.25,Bronze,Debit Card,False,0,Stormy,True,Sunday,False,395,464,2024-01-26 04:39:00,2024,1,4,0
1478,9410,637,Headphones,Electronics,1,671.43,7/1/2024 12:14,8,"Chicago, IL",152,52,290,274,8,28,Male,52596.94,Bronze,Debit Card,True,0,Sunny,False,Saturday,False,311,180,2024-07-01 12:14:00,2024,7,27,0
1479,3414,206,Washing Machine,Appliances,2,1570.55,7/7/2024 2:20,6,"Chicago, IL",347,60,101,125,10,45,Female,113515.28,Bronze,Digital Wallet,True,0,Cloudy,True,Monday,False,345,135,2024-07-07 02:20:00,2024,7,27,0
1480,8167,801,Smartphone,Electronics,4,913.84,7/25/2024 10:46,4,"Dallas, TX",415,145,178,320,8,68,Male,117636.02,Silver,Credit Card,True,0,Stormy,False,Friday,False,399,131,2024-07-25 10:46:00,2024,7,30,0
1481,2502,556,Fridge,Appliances,3,333.96,3/29/2024 14:25,2,"Los Angeles, CA",485,64,186,408,2,20,Female,112626.92,Silver,Digital Wallet,True,0,Rainy,False,Tuesday,False,291,138,2024-03-29 14:25:00,2024,3,13,0
1482,4637,459,TV,Electronics,1,1543.98,6/9/2024 9:40,16,"Miami, FL",421,116,101,439,2,32,Male,106704.37,Platinum,Cash,False,Percentage Discount,Stormy,False,Saturday,False,306,193,2024-06-09 09:40:00,2024,6,23,0
1483,8391,324,TV,Appliances,1,1084.69,1/18/2024 5:38,17,"New York, NY",265,91,266,347,5,29,Female,80784.93,Platinum,Digital Wallet,False,0,Rainy,True,Thursday,True,138,179,2024-01-18 05:38:00,2024,1,3,0
1484,6727,842,TV,Appliances,1,305.94,1/19/2024 13:12,17,"Miami, FL",272,129,158,377,10,28,Other,57257.27,Gold,Credit Card,True,0,Sunny,True,Monday,False,277,90,2024-01-19 13:12:00,2024,1,3,0
1485,1436,390,Laptop,Electronics,2,1660.0,6/7/2024 13:02,7,"Dallas, TX",74,100,100,186,2,37,Other,36117.95,Platinum,Debit Card,True,0,Stormy,True,Sunday,False,140,371,2024-06-07 13:02:00,2024,6,23,0
1486,7797,357,Smartphone,Electronics,1,1593.51,6/6/2024 0:46,3,"New York, NY",438,121,298,130,8,21,Female,83599.2,Gold,Digital Wallet,True,0,Rainy,False,Friday,True,122,143,2024-06-06 00:46:00,2024,6,23,0
1487,1872,297,Tablet,Electronics,3,901.53,8/22/2024 8:25,6,"Chicago, IL",165,123,264,394,10,53,Male,87429.94,Silver,Cash,False,0,Sunny,True,Monday,True,411,255,2024-08-22 08:25:00,2024,8,34,0
1488,7495,134,Smartphone,Electronics,4,279.44,7/28/2024 19:13,15,"Chicago, IL",71,139,234,396,5,18,Male,67740.06,Silver,Cash,True,0,Cloudy,False,Sunday,True,106,219,2024-07-28 19:13:00,2024,7,30,0
1489,9224,124,Fridge,Electronics,4,1415.41,8/4/2024 7:59,8,"Los Angeles, CA",368,107,289,477,7,59,Male,50580.22,Platinum,Credit Card,False,0,Stormy,True,Saturday,False,134,168,2024-08-04 07:59:00,2024,8,31,0
1490,7126,734,Laptop,Appliances,1,1346.56,8/10/2024 17:33,14,"Miami, FL",214,84,158,206,2,47,Female,111298.13,Platinum,Cash,True,0,Stormy,True,Tuesday,False,118,295,2024-08-10 17:33:00,2024,8,32,0
1491,4862,194,Fridge,Appliances,5,1915.18,2/1/2024 16:44,12,"Chicago, IL",335,132,170,357,10,48,Male,111169.34,Platinum,Credit Card,True,0,Stormy,True,Monday,False,175,386,2024-02-01 16:44:00,2024,2,5,0
1492,7326,158,Camera,Electronics,5,1135.22,3/9/2024 10:48,10,"Los Angeles, CA",431,52,245,345,1,59,Female,101079.71,Silver,Cash,False,Percentage Discount,Sunny,False,Wednesday,False,171,476,2024-03-09 10:48:00,2024,3,10,0
1493,2337,708,Laptop,Electronics,3,129.82,6/18/2024 18:11,18,"Chicago, IL",485,144,128,168,7,20,Other,112972.89,Silver,Debit Card,True,Percentage Discount,Cloudy,True,Wednesday,True,494,271,2024-06-18 18:11:00,2024,6,25,0
1494,7142,772,Tablet,Appliances,2,1530.38,6/17/2024 3:00,12,"Chicago, IL",309,129,267,160,10,18,Female,115789.41,Platinum,Cash,True,0,Stormy,False,Saturday,False,386,100,2024-06-17 03:00:00,2024,6,25,0
1495,4678,955,Tablet,Electronics,1,1072.17,1/1/2024 0:54,5,"Miami, FL",293,95,120,148,3,32,Female,95047.76,Gold,Debit Card,False,BOGO,Cloudy,False,Sunday,True,231,97,2024-01-01 00:54:00,2024,1,1,0
1496,1461,322,Washing Machine,Appliances,3,106.96,1/29/2024 7:10,6,"Dallas, TX",495,71,202,170,4,48,Male,94367.75,Silver,Credit Card,True,Percentage Discount,Rainy,False,Friday,False,384,127,2024-01-29 07:10:00,2024,1,5,0
1497,6221,713,Smartphone,Electronics,4,1856.94,1/27/2024 21:03,1,"Los Angeles, CA",24,122,173,109,10,67,Other,59153.64,Platinum,Credit Card,True,0,Cloudy,True,Monday,True,325,499,2024-01-27 21:03:00,2024,1,4,0
1498,2623,753,Laptop,Electronics,3,83.53,5/9/2024 6:13,16,"Miami, FL",362,52,225,210,6,52,Female,32413.7,Platinum,Credit Card,False,0,Cloudy,True,Tuesday,True,414,409,2024-05-09 06:13:00,2024,5,19,0
1499,6493,224,Smartphone,Appliances,1,191.94,5/14/2024 4:08,5,"Miami, FL",57,91,205,361,2,24,Female,70370.71,Platinum,Digital Wallet,True,0,Sunny,True,Tuesday,False,222,443,2024-05-14 04:08:00,2024,5,20,0
1500,3392,825,Camera,Appliances,5,1795.16,8/16/2024 18:01,1,"Los Angeles, CA",417,142,165,177,1,49,Female,98355.71,Platinum,Digital Wallet,False,0,Rainy,False,Thursday,True,112,310,2024-08-16 18:01:00,2024,8,33,0
1501,3254,222,Smartphone,Appliances,3,249.54,6/3/2024 14:20,3,"Miami, FL",266,150,248,470,9,24,Other,66929.92,Silver,Cash,True,0,Stormy,True,Saturday,False,346,353,2024-06-03 14:20:00,2024,6,23,0
1502,1627,188,Tablet,Appliances,5,611.01,5/9/2024 7:02,20,"Los Angeles, CA",187,134,147,403,4,68,Other,50306.23,Bronze,Cash,True,BOGO,Cloudy,True,Monday,False,241,245,2024-05-09 07:02:00,2024,5,19,0
1503,5700,976,TV,Appliances,2,1740.11,5/16/2024 14:25,15,"Dallas, TX",485,95,285,414,3,40,Other,24222.42,Bronze,Cash,True,BOGO,Rainy,True,Monday,True,374,308,2024-05-16 14:25:00,2024,5,20,0
1504,8740,719,Tablet,Appliances,4,1889.28,4/13/2024 3:47,1,"Miami, FL",53,54,222,358,8,21,Female,36403.71,Gold,Cash,True,Percentage Discount,Sunny,True,Thursday,True,209,366,2024-04-13 03:47:00,2024,4,15,0
1505,3273,233,Laptop,Appliances,5,523.04,1/24/2024 13:40,18,"Dallas, TX",390,126,150,198,9,42,Male,106338.57,Silver,Cash,True,0,Sunny,True,Thursday,True,344,334,2024-01-24 13:40:00,2024,1,4,0
1506,8685,484,Fridge,Electronics,3,200.54,2/18/2024 4:50,10,"Los Angeles, CA",473,94,243,400,7,52,Other,96366.51,Silver,Credit Card,False,BOGO,Stormy,False,Monday,True,442,209,2024-02-18 04:50:00,2024,2,7,0
1507,8349,772,Smartphone,Appliances,4,699.19,7/3/2024 15:38,5,"Chicago, IL",52,111,276,487,7,38,Female,85591.15,Gold,Digital Wallet,False,Percentage Discount,Cloudy,False,Thursday,False,498,316,2024-07-03 15:38:00,2024,7,27,0
1508,1086,882,Smartphone,Electronics,4,1530.16,7/5/2024 7:08,18,"Miami, FL",419,123,204,405,9,27,Female,36308.37,Silver,Cash,True,0,Cloudy,True,Wednesday,False,332,474,2024-07-05 07:08:00,2024,7,27,0
1509,2298,763,Washing Machine,Electronics,5,1583.95,7/4/2024 18:45,16,"Miami, FL",57,69,242,120,7,36,Other,22262.17,Platinum,Credit Card,False,0,Rainy,False,Saturday,False,296,260,2024-07-04 18:45:00,2024,7,27,0
1510,1311,679,Smartphone,Electronics,1,1045.55,1/3/2024 1:11,9,"Miami, FL",161,114,124,153,9,42,Other,98611.93,Gold,Digital Wallet,True,0,Stormy,False,Monday,True,380,309,2024-01-03 01:11:00,2024,1,1,0
1511,5193,922,Headphones,Appliances,5,1817.46,3/27/2024 0:07,3,"Chicago, IL",376,58,152,288,10,18,Female,38520.98,Silver,Credit Card,True,0,Stormy,True,Thursday,False,158,135,2024-03-27 00:07:00,2024,3,13,0
1512,4533,289,Washing Machine,Appliances,4,1863.18,7/30/2024 21:20,14,"New York, NY",221,117,159,101,10,50,Other,93272.35,Gold,Debit Card,True,0,Rainy,False,Saturday,False,116,304,2024-07-30 21:20:00,2024,7,31,0
1513,3449,213,Fridge,Appliances,1,562.14,4/28/2024 5:14,6,"Dallas, TX",243,84,286,499,9,50,Male,33730.06,Bronze,Cash,False,0,Cloudy,True,Saturday,True,223,375,2024-04-28 05:14:00,2024,4,17,0
1514,9991,812,Camera,Appliances,1,965.59,3/16/2024 16:24,16,"Los Angeles, CA",457,107,221,441,5,53,Other,112780.26,Platinum,Digital Wallet,False,0,Rainy,False,Wednesday,True,195,475,2024-03-16 16:24:00,2024,3,11,0
1515,9647,288,Washing Machine,Appliances,5,849.48,3/30/2024 18:54,20,"Dallas, TX",127,143,266,499,3,68,Female,41899.53,Bronze,Cash,False,BOGO,Cloudy,False,Wednesday,True,243,152,2024-03-30 18:54:00,2024,3,13,0
1516,7934,359,Laptop,Appliances,4,935.56,8/11/2024 3:46,14,"New York, NY",403,69,133,446,1,55,Male,105708.1,Platinum,Digital Wallet,True,BOGO,Stormy,True,Thursday,True,344,248,2024-08-11 03:46:00,2024,8,32,0
1517,2821,401,Headphones,Appliances,2,1478.89,5/1/2024 12:41,7,"New York, NY",118,99,278,288,1,41,Other,56812.89,Silver,Cash,False,BOGO,Sunny,True,Thursday,False,146,448,2024-05-01 12:41:00,2024,5,18,0
1518,5720,578,Tablet,Electronics,4,1276.18,2/18/2024 11:52,13,"Miami, FL",278,100,141,418,4,70,Male,31982.21,Platinum,Credit Card,True,0,Sunny,True,Saturday,False,331,189,2024-02-18 11:52:00,2024,2,7,0
1519,4893,776,Smartphone,Appliances,1,1123.68,4/1/2024 7:20,11,"Dallas, TX",442,114,262,278,3,54,Female,44023.9,Platinum,Debit Card,True,0,Cloudy,True,Monday,True,212,456,2024-04-01 07:20:00,2024,4,14,0
1520,5934,177,Laptop,Appliances,1,391.81,7/7/2024 1:06,3,"New York, NY",176,56,224,252,7,28,Male,97054.6,Platinum,Credit Card,True,0,Rainy,False,Saturday,True,263,414,2024-07-07 01:06:00,2024,7,27,0
1521,2996,754,Laptop,Electronics,1,1301.04,5/17/2024 0:47,6,"Chicago, IL",38,100,278,350,6,61,Other,81712.36,Gold,Digital Wallet,False,0,Stormy,True,Sunday,True,305,327,2024-05-17 00:47:00,2024,5,20,0
1522,1782,564,Smartphone,Electronics,2,1364.56,4/13/2024 4:32,20,"Los Angeles, CA",163,76,299,318,1,21,Female,85846.5,Platinum,Debit Card,True,0,Sunny,True,Thursday,True,266,424,2024-04-13 04:32:00,2024,4,15,0
1523,4906,383,Smartphone,Electronics,4,1856.36,1/20/2024 1:29,11,"Chicago, IL",235,144,242,140,4,52,Female,118650.72,Gold,Debit Card,True,0,Sunny,False,Tuesday,False,374,268,2024-01-20 01:29:00,2024,1,3,0
1524,7878,887,Laptop,Electronics,3,485.38,8/5/2024 15:05,12,"Miami, FL",219,127,126,322,1,38,Other,81914.72,Platinum,Credit Card,False,0,Rainy,True,Tuesday,True,315,219,2024-08-05 15:05:00,2024,8,32,0
1525,8489,537,Fridge,Electronics,1,801.78,4/24/2024 0:50,11,"New York, NY",146,127,242,386,6,25,Other,53104.94,Bronze,Credit Card,False,Percentage Discount,Stormy,False,Sunday,False,117,479,2024-04-24 00:50:00,2024,4,17,0
1526,2029,808,Fridge,Appliances,1,1524.22,2/24/2024 3:25,3,"Dallas, TX",376,131,119,485,3,40,Other,82244.67,Gold,Cash,False,0,Stormy,True,Wednesday,True,365,327,2024-02-24 03:25:00,2024,2,8,0
1527,2816,783,Washing Machine,Electronics,2,1020.56,3/10/2024 16:31,1,"Chicago, IL",215,72,193,131,5,23,Male,105742.85,Platinum,Digital Wallet,False,0,Cloudy,False,Saturday,False,469,230,2024-03-10 16:31:00,2024,3,10,0
1528,9189,888,Headphones,Electronics,3,1829.82,8/6/2024 12:19,1,"Chicago, IL",253,86,188,470,2,67,Male,110024.0,Gold,Credit Card,True,0,Rainy,False,Monday,True,382,92,2024-08-06 12:19:00,2024,8,32,0
1529,9782,888,Headphones,Appliances,3,1302.83,5/27/2024 17:30,12,"New York, NY",18,59,153,421,2,29,Male,115869.57,Bronze,Digital Wallet,True,0,Sunny,False,Sunday,False,193,153,2024-05-27 17:30:00,2024,5,22,0
1530,1269,431,TV,Appliances,3,1937.73,2/13/2024 0:22,3,"Miami, FL",332,104,268,298,5,26,Other,83399.01,Silver,Credit Card,True,0,Stormy,False,Friday,False,174,452,2024-02-13 00:22:00,2024,2,7,0
1531,9443,363,Fridge,Appliances,3,1363.69,7/31/2024 4:00,2,"New York, NY",188,131,248,362,3,59,Female,90214.92,Bronze,Cash,True,0,Stormy,True,Tuesday,True,209,246,2024-07-31 04:00:00,2024,7,31,0
1532,4963,265,Smartphone,Appliances,2,493.32,5/24/2024 20:30,17,"Miami, FL",30,62,147,117,1,50,Male,57432.63,Bronze,Cash,True,0,Sunny,False,Wednesday,False,271,114,2024-05-24 20:30:00,2024,5,21,0
1533,3352,899,Headphones,Appliances,5,1138.71,8/9/2024 0:27,4,"Chicago, IL",338,61,193,221,8,44,Male,46463.46,Platinum,Cash,False,0,Cloudy,True,Monday,True,158,280,2024-08-09 00:27:00,2024,8,32,0
1534,5772,175,Tablet,Appliances,5,1557.56,2/9/2024 19:56,20,"Miami, FL",211,126,276,119,7,42,Other,56602.58,Platinum,Credit Card,False,0,Stormy,True,Thursday,True,308,421,2024-02-09 19:56:00,2024,2,6,0
1535,8032,383,Fridge,Electronics,1,1351.89,7/5/2024 0:49,10,"Miami, FL",384,94,228,258,6,20,Male,70642.48,Platinum,Cash,True,0,Rainy,True,Friday,False,352,438,2024-07-05 00:49:00,2024,7,27,0
1536,1025,895,Smartphone,Electronics,4,239.83,1/4/2024 12:35,18,"Dallas, TX",443,84,236,472,2,19,Other,66590.06,Bronze,Cash,True,BOGO,Stormy,False,Monday,False,125,158,2024-01-04 12:35:00,2024,1,1,0
1537,6780,163,TV,Electronics,4,1656.62,2/9/2024 11:06,9,"Dallas, TX",433,54,163,115,4,54,Other,43296.51,Silver,Debit Card,True,BOGO,Cloudy,True,Wednesday,True,402,263,2024-02-09 11:06:00,2024,2,6,0
1538,4941,491,Fridge,Appliances,3,1260.1,3/12/2024 18:09,5,"Los Angeles, CA",272,138,108,103,4,55,Male,96539.24,Platinum,Credit Card,True,Percentage Discount,Rainy,False,Wednesday,True,183,224,2024-03-12 18:09:00,2024,3,11,0
1539,7825,497,Laptop,Electronics,3,1814.56,3/19/2024 20:49,5,"Dallas, TX",4,142,144,267,6,57,Female,79535.21,Silver,Digital Wallet,True,0,Sunny,True,Thursday,True,283,203,2024-03-19 20:49:00,2024,3,12,0
1540,4068,440,TV,Appliances,4,917.03,1/19/2024 6:05,14,"New York, NY",496,142,122,449,3,63,Other,99009.14,Gold,Debit Card,False,0,Cloudy,True,Saturday,True,430,169,2024-01-19 06:05:00,2024,1,3,0
1541,2402,161,Fridge,Electronics,5,1865.77,7/15/2024 22:00,6,"Dallas, TX",311,131,151,456,10,47,Other,76830.29,Gold,Cash,False,0,Cloudy,False,Saturday,False,324,291,2024-07-15 22:00:00,2024,7,29,0
1542,9576,364,Smartphone,Appliances,4,1812.53,7/11/2024 1:53,7,"New York, NY",278,98,201,238,5,62,Male,86661.22,Bronze,Credit Card,True,Percentage Discount,Stormy,True,Saturday,True,327,209,2024-07-11 01:53:00,2024,7,28,0
1543,6908,932,Tablet,Appliances,3,1652.94,3/18/2024 11:02,2,"Dallas, TX",103,72,224,315,10,36,Male,71282.9,Silver,Debit Card,False,BOGO,Stormy,False,Saturday,False,217,277,2024-03-18 11:02:00,2024,3,12,0
1544,2108,371,Washing Machine,Appliances,2,834.87,7/22/2024 11:07,1,"Miami, FL",258,144,116,366,6,54,Male,71742.77,Gold,Cash,True,0,Stormy,False,Friday,True,256,116,2024-07-22 11:07:00,2024,7,30,0
1545,9618,282,Washing Machine,Electronics,3,1172.63,4/11/2024 17:48,7,"Chicago, IL",376,112,204,108,8,35,Female,51436.62,Platinum,Credit Card,False,0,Stormy,False,Wednesday,True,355,475,2024-04-11 17:48:00,2024,4,15,0
1546,9914,551,Camera,Appliances,1,671.93,8/5/2024 8:32,14,"Miami, FL",107,115,113,140,7,25,Female,113090.01,Bronze,Credit Card,True,0,Sunny,False,Monday,False,263,403,2024-08-05 08:32:00,2024,8,32,0
1547,9312,171,Fridge,Appliances,4,697.27,4/8/2024 3:48,1,"Dallas, TX",34,132,266,458,1,24,Male,35656.04,Bronze,Digital Wallet,True,0,Cloudy,False,Saturday,False,370,178,2024-04-08 03:48:00,2024,4,15,0
1548,9316,603,Fridge,Electronics,2,680.17,9/14/2024 5:26,15,"New York, NY",440,128,161,493,4,67,Male,36950.02,Bronze,Debit Card,True,0,Stormy,True,Monday,False,407,310,2024-09-14 05:26:00,2024,9,37,0
1549,1333,305,Smartphone,Appliances,2,721.74,2/2/2024 7:31,5,"Los Angeles, CA",298,53,162,202,10,46,Female,35586.01,Gold,Debit Card,False,BOGO,Stormy,False,Monday,False,146,195,2024-02-02 07:31:00,2024,2,5,0
1550,7397,724,Laptop,Appliances,1,1011.32,4/18/2024 5:10,5,"Chicago, IL",114,115,228,160,7,25,Female,63887.64,Bronze,Debit Card,False,0,Sunny,True,Saturday,True,303,296,2024-04-18 05:10:00,2024,4,16,0
1551,8702,502,Camera,Electronics,3,775.56,5/24/2024 8:18,8,"Miami, FL",132,118,179,240,2,41,Other,98670.89,Platinum,Cash,True,0,Stormy,False,Monday,False,163,392,2024-05-24 08:18:00,2024,5,21,0
1552,1713,282,Fridge,Appliances,3,1165.72,1/25/2024 14:12,11,"Dallas, TX",222,144,118,208,1,55,Male,38204.25,Bronze,Cash,True,0,Stormy,True,Saturday,False,475,120,2024-01-25 14:12:00,2024,1,4,0
1553,7338,760,TV,Electronics,5,1410.85,5/17/2024 18:42,2,"Miami, FL",165,145,285,223,9,21,Female,83069.72,Bronze,Debit Card,True,0,Sunny,False,Tuesday,True,408,212,2024-05-17 18:42:00,2024,5,20,0
1554,7116,603,Headphones,Appliances,5,90.67,8/11/2024 22:18,5,"Chicago, IL",359,133,221,313,5,33,Male,99322.55,Platinum,Digital Wallet,False,0,Sunny,True,Sunday,False,352,284,2024-08-11 22:18:00,2024,8,32,0
1555,5155,211,Tablet,Appliances,4,1531.14,5/22/2024 1:49,17,"Los Angeles, CA",30,56,294,100,10,43,Female,48347.27,Gold,Cash,False,0,Sunny,True,Wednesday,False,183,370,2024-05-22 01:49:00,2024,5,21,0
1556,1266,247,Tablet,Appliances,4,413.82,3/4/2024 16:48,8,"Dallas, TX",90,100,233,283,3,36,Male,76030.34,Gold,Debit Card,True,0,Rainy,False,Tuesday,True,201,114,2024-03-04 16:48:00,2024,3,10,0
1557,6850,653,Tablet,Electronics,2,1794.85,1/24/2024 14:46,1,"Dallas, TX",388,114,216,352,10,50,Other,51966.4,Bronze,Cash,True,BOGO,Sunny,True,Sunday,True,428,497,2024-01-24 14:46:00,2024,1,4,0
1558,2106,887,Camera,Appliances,3,51.29,2/18/2024 4:14,7,"Los Angeles, CA",248,75,203,234,8,64,Other,51434.6,Silver,Credit Card,False,0,Sunny,False,Friday,True,355,323,2024-02-18 04:14:00,2024,2,7,0
1559,6649,541,Camera,Appliances,4,867.25,2/12/2024 12:52,9,"Los Angeles, CA",163,61,103,200,1,49,Male,48488.46,Platinum,Credit Card,True,0,Rainy,True,Saturday,True,140,334,2024-02-12 12:52:00,2024,2,7,0
1560,4950,323,Laptop,Electronics,2,1931.26,5/26/2024 9:03,5,"Dallas, TX",260,147,139,195,5,33,Male,35774.67,Silver,Debit Card,False,0,Cloudy,False,Thursday,False,360,474,2024-05-26 09:03:00,2024,5,21,0
1561,2698,728,TV,Appliances,2,1154.56,7/23/2024 0:37,9,"Chicago, IL",487,65,230,152,6,48,Female,23803.98,Silver,Credit Card,False,BOGO,Rainy,False,Friday,True,213,475,2024-07-23 00:37:00,2024,7,30,0
1562,6447,758,Headphones,Electronics,2,145.24,3/3/2024 16:55,7,"Dallas, TX",219,69,226,476,4,26,Other,49442.95,Platinum,Credit Card,True,0,Sunny,True,Thursday,False,205,286,2024-03-03 16:55:00,2024,3,9,0
1563,3185,208,Smartphone,Electronics,1,631.17,8/25/2024 17:28,15,"New York, NY",26,135,179,155,9,62,Female,117726.71,Silver,Cash,True,0,Sunny,True,Tuesday,True,261,210,2024-08-25 17:28:00,2024,8,34,0
1564,1726,552,Tablet,Appliances,5,1793.03,9/16/2024 8:20,11,"Dallas, TX",127,65,253,161,7,40,Male,92510.55,Silver,Credit Card,False,0,Sunny,False,Wednesday,False,195,103,2024-09-16 08:20:00,2024,9,38,0
1565,6772,832,Tablet,Electronics,1,1063.65,5/24/2024 3:41,7,"Miami, FL",471,108,103,276,9,57,Female,65217.61,Platinum,Cash,True,0,Sunny,False,Tuesday,False,369,481,2024-05-24 03:41:00,2024,5,21,0
1566,9945,365,TV,Appliances,3,1611.96,8/13/2024 16:42,19,"Los Angeles, CA",320,124,220,236,8,61,Female,37778.95,Gold,Debit Card,False,0,Rainy,False,Saturday,True,110,447,2024-08-13 16:42:00,2024,8,33,0
1567,6546,205,Laptop,Appliances,2,886.84,4/30/2024 23:26,4,"Miami, FL",153,92,140,394,7,69,Female,98456.31,Bronze,Digital Wallet,False,0,Cloudy,True,Sunday,True,391,205,2024-04-30 23:26:00,2024,4,18,0
1568,3868,135,Headphones,Electronics,2,785.66,4/19/2024 15:11,14,"Chicago, IL",382,127,205,270,2,60,Other,99653.72,Gold,Cash,True,BOGO,Rainy,False,Thursday,True,373,180,2024-04-19 15:11:00,2024,4,16,0
1569,8612,174,TV,Electronics,3,1469.38,8/9/2024 0:43,19,"Los Angeles, CA",381,67,276,417,3,67,Male,31063.57,Gold,Debit Card,False,0,Rainy,False,Friday,False,340,342,2024-08-09 00:43:00,2024,8,32,0
1570,8840,172,TV,Electronics,4,807.59,7/29/2024 20:58,5,"Chicago, IL",460,120,275,423,10,19,Female,80040.38,Silver,Cash,False,0,Cloudy,True,Thursday,True,312,150,2024-07-29 20:58:00,2024,7,31,0
1571,3986,685,Laptop,Electronics,1,869.74,5/17/2024 14:04,18,"Miami, FL",176,69,164,478,8,66,Male,85684.88,Silver,Digital Wallet,True,BOGO,Rainy,True,Monday,True,401,358,2024-05-17 14:04:00,2024,5,20,0
1572,3209,845,TV,Electronics,3,519.16,3/18/2024 9:22,1,"New York, NY",192,149,235,435,7,24,Other,108037.43,Silver,Credit Card,True,0,Stormy,False,Friday,False,163,450,2024-03-18 09:22:00,2024,3,12,0
1573,2033,356,Headphones,Electronics,4,932.08,5/12/2024 19:08,20,"New York, NY",103,70,230,431,8,27,Female,76322.87,Platinum,Digital Wallet,True,BOGO,Cloudy,False,Saturday,True,324,219,2024-05-12 19:08:00,2024,5,19,0
1574,8498,895,Tablet,Appliances,3,583.07,8/3/2024 19:49,4,"Dallas, TX",352,76,118,419,7,38,Other,64793.24,Bronze,Digital Wallet,False,Percentage Discount,Cloudy,False,Friday,True,233,198,2024-08-03 19:49:00,2024,8,31,0
1575,1605,556,Laptop,Appliances,4,915.9,5/2/2024 6:11,14,"Miami, FL",123,80,100,166,3,56,Other,44846.93,Silver,Debit Card,False,BOGO,Stormy,False,Saturday,False,407,368,2024-05-02 06:11:00,2024,5,18,0
1576,5807,119,Washing Machine,Electronics,4,134.3,8/25/2024 9:40,13,"Dallas, TX",437,60,186,395,2,54,Other,56606.25,Platinum,Digital Wallet,False,Percentage Discount,Sunny,True,Wednesday,True,329,460,2024-08-25 09:40:00,2024,8,34,0
1577,4302,609,Laptop,Electronics,3,828.19,6/10/2024 16:42,8,"Chicago, IL",105,73,277,141,4,45,Other,106518.88,Gold,Digital Wallet,True,0,Rainy,True,Monday,True,104,214,2024-06-10 16:42:00,2024,6,24,0
1578,1717,252,Laptop,Electronics,5,330.61,4/3/2024 0:18,4,"Miami, FL",398,92,107,488,6,50,Female,43570.24,Platinum,Credit Card,False,0,Sunny,True,Monday,True,297,166,2024-04-03 00:18:00,2024,4,14,0
1579,4268,768,Camera,Electronics,3,858.03,1/31/2024 1:21,14,"Miami, FL",276,99,163,449,5,35,Other,22860.09,Silver,Digital Wallet,True,BOGO,Stormy,False,Saturday,True,288,323,2024-01-31 01:21:00,2024,1,5,0
1580,1686,755,Tablet,Appliances,3,1856.56,1/27/2024 21:01,14,"Dallas, TX",295,112,250,342,6,51,Male,83187.55,Gold,Debit Card,False,BOGO,Rainy,True,Monday,False,189,267,2024-01-27 21:01:00,2024,1,4,0
1581,6170,100,Headphones,Electronics,3,865.6,9/2/2024 0:15,20,"Los Angeles, CA",77,113,122,404,7,62,Female,94637.31,Bronze,Cash,True,Percentage Discount,Rainy,False,Tuesday,False,325,444,2024-09-02 00:15:00,2024,9,36,0
1582,6080,138,Laptop,Electronics,5,1142.27,2/7/2024 5:06,13,"Los Angeles, CA",125,67,206,476,2,31,Other,34611.88,Platinum,Cash,False,0,Stormy,True,Monday,False,407,94,2024-02-07 05:06:00,2024,2,6,0
1583,9444,780,Camera,Electronics,2,632.74,4/29/2024 0:27,18,"New York, NY",153,94,223,155,5,35,Male,25116.12,Silver,Cash,False,0,Cloudy,False,Monday,False,322,440,2024-04-29 00:27:00,2024,4,18,0
1584,7524,499,Headphones,Appliances,5,1802.89,5/27/2024 8:21,16,"Chicago, IL",319,50,237,405,4,66,Female,82641.34,Platinum,Credit Card,False,BOGO,Cloudy,True,Monday,True,153,316,2024-05-27 08:21:00,2024,5,22,0
1585,9897,372,Fridge,Appliances,4,164.24,1/19/2024 13:10,10,"Dallas, TX",497,138,119,294,2,32,Male,64043.45,Gold,Credit Card,True,0,Stormy,False,Friday,True,178,422,2024-01-19 13:10:00,2024,1,3,0
1586,8756,255,TV,Appliances,3,747.54,8/12/2024 3:42,1,"Miami, FL",453,140,144,418,6,62,Male,80841.65,Gold,Cash,False,BOGO,Stormy,True,Tuesday,False,228,111,2024-08-12 03:42:00,2024,8,33,0
1587,5150,816,Camera,Electronics,2,1288.29,9/13/2024 5:46,8,"Dallas, TX",184,77,235,436,4,26,Female,105949.73,Gold,Credit Card,False,0,Stormy,True,Tuesday,True,424,371,2024-09-13 05:46:00,2024,9,37,0
1588,1599,437,Fridge,Electronics,1,1048.46,1/8/2024 19:28,7,"Dallas, TX",70,116,230,124,9,54,Female,55384.81,Platinum,Credit Card,False,0,Sunny,False,Monday,True,484,504,2024-01-08 19:28:00,2024,1,2,0
1589,4131,500,Camera,Electronics,2,429.18,1/15/2024 11:02,1,"Dallas, TX",142,94,271,408,4,61,Male,119097.36,Bronze,Credit Card,False,0,Cloudy,False,Monday,True,437,300,2024-01-15 11:02:00,2024,1,3,0
1590,5687,688,Smartphone,Appliances,5,1459.63,2/20/2024 15:18,9,"Miami, FL",393,146,162,134,5,62,Male,107529.85,Silver,Debit Card,True,Percentage Discount,Stormy,False,Saturday,True,186,98,2024-02-20 15:18:00,2024,2,8,0
1591,6848,103,Tablet,Appliances,2,1251.13,8/21/2024 6:59,12,"Dallas, TX",164,104,213,220,9,46,Other,67699.68,Silver,Debit Card,False,0,Cloudy,True,Wednesday,False,175,238,2024-08-21 06:59:00,2024,8,34,0
1592,1783,627,Camera,Electronics,3,363.42,4/26/2024 11:05,9,"New York, NY",231,65,256,294,10,52,Female,63017.13,Bronze,Credit Card,True,0,Stormy,False,Wednesday,True,466,236,2024-04-26 11:05:00,2024,4,17,0
1593,6438,824,Fridge,Electronics,1,1245.1,3/4/2024 17:34,9,"Chicago, IL",27,104,262,249,10,60,Other,33256.97,Platinum,Credit Card,False,0,Cloudy,False,Sunday,False,104,174,2024-03-04 17:34:00,2024,3,10,0
1594,5476,889,Tablet,Electronics,4,825.65,3/18/2024 16:00,3,"Chicago, IL",173,72,156,133,6,45,Other,108388.0,Bronze,Cash,True,0,Cloudy,False,Sunday,False,201,408,2024-03-18 16:00:00,2024,3,12,0
1595,3039,602,Smartphone,Electronics,1,575.24,8/21/2024 9:40,1,"Miami, FL",39,138,254,350,4,58,Female,84913.06,Bronze,Debit Card,True,Percentage Discount,Cloudy,False,Friday,True,464,326,2024-08-21 09:40:00,2024,8,34,0
1596,7029,589,Laptop,Electronics,2,946.67,3/11/2024 8:47,13,"Chicago, IL",162,108,265,429,2,49,Female,31940.01,Gold,Debit Card,False,0,Rainy,True,Tuesday,True,408,296,2024-03-11 08:47:00,2024,3,11,0
1597,8159,546,Fridge,Electronics,3,1682.86,4/21/2024 20:20,4,"Los Angeles, CA",442,139,238,313,3,22,Male,105366.25,Platinum,Credit Card,True,Percentage Discount,Rainy,True,Wednesday,True,171,92,2024-04-21 20:20:00,2024,4,16,0
1598,7553,513,Washing Machine,Electronics,3,1726.38,3/11/2024 20:33,14,"New York, NY",450,64,184,262,1,39,Female,32626.13,Gold,Debit Card,False,BOGO,Cloudy,False,Thursday,False,147,199,2024-03-11 20:33:00,2024,3,11,0
1599,8204,964,Laptop,Appliances,3,401.68,5/22/2024 10:16,13,"Dallas, TX",447,83,262,458,1,37,Male,107560.39,Bronze,Digital Wallet,False,0,Sunny,True,Wednesday,True,128,220,2024-05-22 10:16:00,2024,5,21,0
1600,7334,845,Headphones,Appliances,2,1615.28,3/3/2024 18:11,9,"Miami, FL",172,61,245,391,9,60,Male,89072.52,Bronze,Debit Card,True,0,Rainy,True,Sunday,True,151,306,2024-03-03 18:11:00,2024,3,9,0
1601,6554,899,Smartphone,Electronics,1,1632.6,4/13/2024 20:35,19,"Los Angeles, CA",369,74,157,165,6,29,Male,83530.66,Platinum,Debit Card,True,Percentage Discount,Rainy,True,Monday,False,443,141,2024-04-13 20:35:00,2024,4,15,0
1602,4060,931,Smartphone,Appliances,2,1086.43,7/26/2024 8:33,15,"Chicago, IL",240,85,293,109,10,69,Other,103779.48,Platinum,Digital Wallet,True,0,Stormy,False,Tuesday,True,293,428,2024-07-26 08:33:00,2024,7,30,0
1603,9129,904,Washing Machine,Appliances,5,1366.86,4/29/2024 3:46,1,"Los Angeles, CA",436,72,114,288,1,70,Other,46994.89,Gold,Debit Card,True,0,Stormy,True,Sunday,True,144,127,2024-04-29 03:46:00,2024,4,18,0
1604,9151,171,Tablet,Electronics,1,518.76,4/23/2024 19:05,1,"New York, NY",271,113,298,393,5,64,Female,75750.43,Bronze,Debit Card,False,0,Sunny,True,Saturday,False,258,345,2024-04-23 19:05:00,2024,4,17,0
1605,7018,653,Tablet,Appliances,1,324.64,1/20/2024 23:26,18,"Los Angeles, CA",480,133,242,254,1,70,Female,57643.77,Gold,Debit Card,True,0,Rainy,True,Friday,True,356,493,2024-01-20 23:26:00,2024,1,3,0
1606,9507,331,TV,Electronics,2,538.54,5/11/2024 18:44,10,"Los Angeles, CA",487,140,139,377,1,54,Male,69682.22,Platinum,Credit Card,True,0,Rainy,False,Monday,False,484,214,2024-05-11 18:44:00,2024,5,19,0
1607,5369,103,TV,Electronics,4,464.55,7/15/2024 7:01,10,"Chicago, IL",326,113,147,424,3,62,Male,101657.74,Platinum,Cash,True,0,Stormy,False,Saturday,False,143,368,2024-07-15 07:01:00,2024,7,29,0
1608,2353,493,Smartphone,Appliances,2,1048.95,7/31/2024 19:31,11,"Chicago, IL",68,74,214,204,5,66,Male,25090.61,Gold,Credit Card,False,0,Rainy,True,Tuesday,False,163,295,2024-07-31 19:31:00,2024,7,31,0
1609,7955,805,Smartphone,Appliances,2,1545.25,1/21/2024 0:12,18,"Chicago, IL",206,68,265,303,2,39,Other,84294.83,Silver,Debit Card,False,0,Cloudy,False,Thursday,True,341,194,2024-01-21 00:12:00,2024,1,3,0
1610,2293,937,Camera,Electronics,1,584.12,6/17/2024 22:14,1,"Miami, FL",98,75,232,112,8,61,Male,41259.32,Gold,Debit Card,False,0,Cloudy,False,Saturday,True,304,457,2024-06-17 22:14:00,2024,6,25,0
1611,8055,898,Washing Machine,Electronics,1,936.02,1/21/2024 15:11,4,"New York, NY",274,90,124,391,1,57,Female,59317.32,Bronze,Digital Wallet,True,Percentage Discount,Stormy,False,Saturday,True,389,460,2024-01-21 15:11:00,2024,1,3,0
1612,3956,593,Smartphone,Appliances,4,295.74,6/25/2024 14:29,11,"Chicago, IL",278,133,170,113,4,56,Other,115578.48,Platinum,Digital Wallet,True,Percentage Discount,Stormy,False,Wednesday,True,232,269,2024-06-25 14:29:00,2024,6,26,0
1613,9937,224,Camera,Electronics,2,265.69,7/27/2024 6:44,4,"Los Angeles, CA",3,112,208,138,7,66,Other,71651.44,Gold,Digital Wallet,True,0,Stormy,False,Tuesday,False,261,262,2024-07-27 06:44:00,2024,7,30,0
1614,5813,680,Headphones,Appliances,2,695.44,4/3/2024 15:23,16,"Dallas, TX",421,79,246,315,5,38,Male,86782.53,Bronze,Credit Card,False,0,Rainy,True,Wednesday,True,440,423,2024-04-03 15:23:00,2024,4,14,0
1615,6262,648,Camera,Electronics,4,530.87,1/15/2024 18:24,14,"New York, NY",327,139,189,366,3,69,Male,25390.34,Gold,Digital Wallet,False,0,Stormy,False,Thursday,True,184,304,2024-01-15 18:24:00,2024,1,3,0
1616,2680,467,Fridge,Appliances,4,1752.56,1/29/2024 2:16,10,"Dallas, TX",103,112,163,106,4,49,Other,58597.96,Gold,Debit Card,True,0,Rainy,False,Sunday,True,353,193,2024-01-29 02:16:00,2024,1,5,0
1617,2311,441,Laptop,Appliances,2,1220.69,6/18/2024 10:56,5,"Los Angeles, CA",411,82,251,154,8,23,Male,71135.97,Bronze,Digital Wallet,True,Percentage Discount,Cloudy,False,Wednesday,False,304,138,2024-06-18 10:56:00,2024,6,25,0
1618,6372,798,Fridge,Electronics,4,688.87,2/16/2024 20:37,19,"Dallas, TX",85,73,181,487,4,68,Male,102780.8,Platinum,Debit Card,False,Percentage Discount,Stormy,True,Saturday,True,439,271,2024-02-16 20:37:00,2024,2,7,0
1619,5843,410,TV,Appliances,3,709.17,7/7/2024 17:58,14,"Los Angeles, CA",492,150,162,142,4,55,Male,88083.48,Gold,Digital Wallet,False,0,Rainy,True,Tuesday,True,203,252,2024-07-07 17:58:00,2024,7,27,0
1620,6021,510,TV,Appliances,5,944.14,6/15/2024 17:04,6,"Los Angeles, CA",137,62,298,274,2,37,Female,53357.19,Platinum,Cash,True,BOGO,Stormy,True,Saturday,True,107,413,2024-06-15 17:04:00,2024,6,24,0
1621,8305,156,Tablet,Appliances,5,1699.4,8/16/2024 10:19,17,"Dallas, TX",346,136,207,438,4,46,Other,70264.35,Platinum,Debit Card,True,0,Cloudy,True,Tuesday,False,412,403,2024-08-16 10:19:00,2024,8,33,0
1622,7981,747,Smartphone,Appliances,2,1190.67,5/14/2024 4:53,1,"Los Angeles, CA",378,89,251,210,5,60,Female,110786.61,Gold,Digital Wallet,False,Percentage Discount,Stormy,False,Tuesday,False,315,187,2024-05-14 04:53:00,2024,5,20,0
1623,3730,762,Washing Machine,Appliances,5,106.15,8/31/2024 11:46,19,"Dallas, TX",447,142,232,479,3,59,Male,21985.94,Gold,Cash,False,0,Stormy,True,Saturday,True,290,103,2024-08-31 11:46:00,2024,8,35,0
1624,8272,192,Tablet,Appliances,3,389.53,5/21/2024 4:12,5,"Miami, FL",464,69,286,313,5,49,Male,42638.0,Platinum,Digital Wallet,True,0,Rainy,True,Saturday,True,120,243,2024-05-21 04:12:00,2024,5,21,0
1625,6759,474,Laptop,Appliances,5,1023.03,1/31/2024 15:30,10,"New York, NY",74,51,138,109,2,21,Male,96491.34,Silver,Credit Card,True,0,Cloudy,True,Monday,True,118,129,2024-01-31 15:30:00,2024,1,5,0
1626,8325,647,Smartphone,Electronics,3,1627.54,7/22/2024 13:24,4,"New York, NY",237,127,162,419,5,20,Male,73142.86,Silver,Cash,False,0,Sunny,False,Wednesday,False,254,489,2024-07-22 13:24:00,2024,7,30,0
1627,1693,973,Headphones,Appliances,3,79.15,6/19/2024 20:37,4,"Los Angeles, CA",45,82,298,297,8,47,Male,75167.7,Bronze,Cash,True,0,Cloudy,True,Sunday,True,493,356,2024-06-19 20:37:00,2024,6,25,0
1628,6776,448,Tablet,Appliances,5,591.22,2/11/2024 16:28,12,"Chicago, IL",193,73,144,249,2,23,Female,53200.05,Gold,Credit Card,False,0,Cloudy,False,Thursday,True,117,286,2024-02-11 16:28:00,2024,2,6,0
1629,8126,182,Washing Machine,Electronics,3,769.4,6/9/2024 18:37,1,"Los Angeles, CA",56,54,110,207,9,56,Other,52576.67,Bronze,Credit Card,False,BOGO,Rainy,False,Sunday,True,154,136,2024-06-09 18:37:00,2024,6,23,0
1630,5498,961,Tablet,Electronics,2,169.8,3/30/2024 18:00,11,"New York, NY",340,106,212,411,10,69,Male,38638.88,Platinum,Credit Card,True,0,Stormy,True,Tuesday,False,143,487,2024-03-30 18:00:00,2024,3,13,0
1631,1939,570,Washing Machine,Appliances,2,1993.66,4/10/2024 22:40,1,"Miami, FL",268,126,142,253,8,23,Male,71423.81,Gold,Cash,True,BOGO,Rainy,True,Sunday,False,322,104,2024-04-10 22:40:00,2024,4,15,0
1632,2229,878,Camera,Electronics,5,465.15,8/2/2024 0:37,20,"Dallas, TX",382,80,261,286,7,65,Female,66907.75,Silver,Digital Wallet,True,0,Cloudy,False,Sunday,True,251,506,2024-08-02 00:37:00,2024,8,31,0
1633,7655,884,Smartphone,Electronics,3,1331.46,4/2/2024 10:59,14,"Chicago, IL",343,111,176,423,3,59,Male,93382.1,Gold,Digital Wallet,True,0,Rainy,False,Saturday,False,279,336,2024-04-02 10:59:00,2024,4,14,0
1634,6952,396,Headphones,Electronics,2,1260.14,1/15/2024 19:36,20,"Dallas, TX",199,83,230,200,2,63,Female,64611.79,Bronze,Digital Wallet,True,0,Rainy,True,Monday,False,368,425,2024-01-15 19:36:00,2024,1,3,0
1635,9406,763,Smartphone,Electronics,3,708.98,4/6/2024 20:14,19,"New York, NY",395,64,206,435,8,65,Male,66214.08,Gold,Digital Wallet,True,BOGO,Sunny,False,Sunday,False,149,419,2024-04-06 20:14:00,2024,4,14,0
1636,3621,307,Tablet,Electronics,2,1219.58,6/27/2024 16:18,14,"Miami, FL",82,97,125,236,8,21,Female,108663.48,Silver,Digital Wallet,False,0,Rainy,False,Saturday,True,330,486,2024-06-27 16:18:00,2024,6,26,0
1637,1510,280,Headphones,Electronics,3,749.73,3/3/2024 5:54,4,"Los Angeles, CA",366,133,273,411,10,32,Female,25795.05,Platinum,Debit Card,False,BOGO,Cloudy,True,Tuesday,False,423,284,2024-03-03 05:54:00,2024,3,9,0
1638,3339,667,Camera,Electronics,1,1865.29,3/21/2024 19:28,7,"Miami, FL",475,115,121,352,5,41,Other,44590.56,Gold,Cash,False,Percentage Discount,Sunny,True,Friday,False,473,326,2024-03-21 19:28:00,2024,3,12,0
1639,8179,140,Camera,Electronics,4,1704.23,8/8/2024 18:07,4,"New York, NY",352,108,187,206,3,30,Male,49411.48,Gold,Digital Wallet,False,0,Rainy,True,Tuesday,True,417,181,2024-08-08 18:07:00,2024,8,32,0
1640,1570,493,Tablet,Appliances,1,678.21,2/22/2024 14:34,11,"Dallas, TX",261,58,210,164,10,32,Other,20005.34,Gold,Cash,True,0,Stormy,False,Tuesday,False,331,350,2024-02-22 14:34:00,2024,2,8,0
1641,3068,776,Tablet,Electronics,5,1098.75,2/27/2024 20:42,6,"Chicago, IL",465,129,272,130,3,43,Female,57368.43,Bronze,Debit Card,True,0,Sunny,True,Monday,False,496,121,2024-02-27 20:42:00,2024,2,9,0
1642,2101,295,Smartphone,Electronics,3,1630.34,7/19/2024 18:22,11,"Miami, FL",323,140,299,101,2,70,Female,76087.64,Bronze,Digital Wallet,True,0,Stormy,True,Friday,True,366,403,2024-07-19 18:22:00,2024,7,29,0
1643,4866,406,Washing Machine,Electronics,4,1074.45,4/26/2024 3:13,12,"Los Angeles, CA",193,128,292,398,1,32,Male,99598.51,Platinum,Credit Card,True,0,Rainy,True,Friday,False,166,420,2024-04-26 03:13:00,2024,4,17,0
1644,7001,812,Headphones,Appliances,3,491.4,1/4/2024 8:57,6,"Chicago, IL",296,86,140,311,2,40,Other,37258.08,Bronze,Debit Card,True,0,Stormy,False,Monday,True,165,261,2024-01-04 08:57:00,2024,1,1,0
1645,6933,499,Washing Machine,Appliances,5,595.09,4/17/2024 11:53,8,"Los Angeles, CA",478,68,159,117,8,57,Other,72813.79,Bronze,Credit Card,True,BOGO,Stormy,False,Tuesday,True,400,115,2024-04-17 11:53:00,2024,4,16,0
1646,7272,209,Headphones,Appliances,1,1827.71,6/29/2024 7:32,6,"Chicago, IL",236,93,113,159,3,27,Male,22805.24,Silver,Digital Wallet,False,0,Sunny,False,Monday,False,239,233,2024-06-29 07:32:00,2024,6,26,0
1647,1530,745,Washing Machine,Electronics,4,322.65,3/4/2024 22:10,5,"Dallas, TX",490,56,277,290,8,25,Male,43560.38,Silver,Credit Card,True,0,Cloudy,False,Tuesday,False,463,499,2024-03-04 22:10:00,2024,3,10,0
1648,3513,805,Smartphone,Appliances,1,898.41,3/15/2024 18:07,18,"Miami, FL",376,134,199,200,5,58,Other,28874.5,Silver,Cash,True,BOGO,Sunny,False,Thursday,True,162,509,2024-03-15 18:07:00,2024,3,11,0
1649,8371,467,Tablet,Appliances,1,408.45,4/7/2024 0:38,2,"Los Angeles, CA",128,92,227,271,9,48,Female,28641.39,Platinum,Credit Card,True,0,Stormy,True,Monday,True,240,374,2024-04-07 00:38:00,2024,4,14,0
1650,7077,598,Washing Machine,Appliances,3,1769.41,3/30/2024 8:40,11,"Dallas, TX",246,122,241,203,3,29,Male,78826.01,Gold,Credit Card,False,Percentage Discount,Sunny,False,Sunday,False,109,476,2024-03-30 08:40:00,2024,3,13,0
1651,7095,186,Laptop,Electronics,1,1253.61,6/20/2024 3:54,17,"Dallas, TX",213,67,107,422,2,30,Female,87152.61,Platinum,Digital Wallet,True,0,Rainy,True,Monday,True,316,207,2024-06-20 03:54:00,2024,6,25,0
1652,8273,747,Camera,Appliances,5,226.76,8/13/2024 21:50,18,"Miami, FL",370,134,116,114,6,35,Male,89254.15,Platinum,Debit Card,False,0,Sunny,False,Wednesday,False,143,321,2024-08-13 21:50:00,2024,8,33,0
1653,2259,548,Headphones,Electronics,1,357.97,4/29/2024 0:05,7,"New York, NY",412,92,273,283,2,18,Female,64490.06,Silver,Digital Wallet,True,0,Stormy,False,Tuesday,True,500,125,2024-04-29 00:05:00,2024,4,18,0
1654,3255,852,Fridge,Appliances,3,996.48,7/4/2024 12:45,15,"Chicago, IL",92,78,247,212,8,39,Male,53869.54,Platinum,Cash,True,0,Cloudy,True,Sunday,True,178,125,2024-07-04 12:45:00,2024,7,27,0
1655,9674,294,Fridge,Electronics,3,1904.99,1/5/2024 23:00,15,"Miami, FL",487,132,171,191,6,66,Female,104496.07,Platinum,Debit Card,True,0,Sunny,False,Wednesday,True,467,437,2024-01-05 23:00:00,2024,1,1,0
1656,7012,243,Smartphone,Appliances,5,1220.47,2/14/2024 23:19,10,"Chicago, IL",456,50,198,494,1,58,Male,118839.56,Silver,Digital Wallet,False,Percentage Discount,Sunny,True,Sunday,True,451,164,2024-02-14 23:19:00,2024,2,7,0
1657,7521,136,Washing Machine,Electronics,1,1666.98,8/25/2024 18:37,8,"Chicago, IL",110,148,225,276,8,23,Female,80382.42,Gold,Credit Card,True,0,Rainy,True,Saturday,True,204,393,2024-08-25 18:37:00,2024,8,34,0
1658,6150,297,Camera,Appliances,3,101.56,3/7/2024 9:10,12,"New York, NY",323,123,109,321,10,41,Female,24972.97,Silver,Digital Wallet,True,0,Sunny,True,Monday,False,422,106,2024-03-07 09:10:00,2024,3,10,0
1659,5566,125,Camera,Electronics,4,219.68,1/3/2024 13:16,9,"Miami, FL",240,96,121,481,7,38,Male,46734.96,Gold,Digital Wallet,False,0,Stormy,False,Wednesday,False,142,451,2024-01-03 13:16:00,2024,1,1,0
1660,5089,837,Camera,Appliances,4,954.82,2/14/2024 2:54,2,"Miami, FL",12,95,170,188,4,52,Other,86098.25,Bronze,Debit Card,True,0,Rainy,False,Sunday,False,238,282,2024-02-14 02:54:00,2024,2,7,0
1661,2858,707,Tablet,Electronics,3,1858.84,8/18/2024 16:03,10,"Los Angeles, CA",107,138,280,257,2,64,Female,45789.62,Platinum,Digital Wallet,False,0,Rainy,False,Monday,True,462,211,2024-08-18 16:03:00,2024,8,33,0
1662,1424,344,Fridge,Electronics,3,394.83,5/2/2024 18:39,16,"Los Angeles, CA",350,144,119,446,4,52,Other,100184.73,Bronze,Digital Wallet,False,BOGO,Rainy,False,Monday,True,177,153,2024-05-02 18:39:00,2024,5,18,0
1663,4048,600,Washing Machine,Electronics,4,282.49,1/5/2024 22:33,13,"New York, NY",284,137,138,387,3,59,Male,89215.56,Gold,Digital Wallet,False,0,Sunny,True,Thursday,True,232,226,2024-01-05 22:33:00,2024,1,1,0
1664,9176,498,Headphones,Appliances,2,1384.77,3/13/2024 23:11,6,"Chicago, IL",176,120,243,379,5,45,Other,86000.93,Bronze,Cash,True,0,Cloudy,False,Monday,False,145,418,2024-03-13 23:11:00,2024,3,11,0
1665,9482,164,Laptop,Appliances,3,1201.16,7/6/2024 2:13,11,"Miami, FL",333,112,100,479,1,44,Other,27179.06,Platinum,Credit Card,False,0,Sunny,False,Tuesday,False,463,325,2024-07-06 02:13:00,2024,7,27,0
1666,7340,911,Laptop,Electronics,2,1804.7,5/11/2024 19:37,7,"Los Angeles, CA",142,113,165,387,5,33,Other,37363.05,Gold,Cash,True,0,Cloudy,False,Friday,True,220,379,2024-05-11 19:37:00,2024,5,19,0
1667,2929,653,TV,Appliances,3,795.78,8/20/2024 11:29,20,"Dallas, TX",240,127,175,431,10,70,Other,52035.22,Platinum,Credit Card,False,Percentage Discount,Stormy,True,Friday,False,111,124,2024-08-20 11:29:00,2024,8,34,0
1668,5288,758,Laptop,Appliances,2,459.34,5/22/2024 20:33,12,"Miami, FL",286,140,212,452,7,25,Other,99981.59,Bronze,Cash,False,0,Cloudy,False,Tuesday,True,222,248,2024-05-22 20:33:00,2024,5,21,0
1669,5264,415,Smartphone,Appliances,3,1723.95,7/12/2024 14:09,2,"Los Angeles, CA",387,127,126,376,2,60,Male,116814.44,Gold,Cash,True,0,Sunny,True,Tuesday,False,364,207,2024-07-12 14:09:00,2024,7,28,0
1670,8311,611,Tablet,Appliances,4,1676.71,9/11/2024 4:44,4,"Los Angeles, CA",227,78,140,108,10,59,Female,30637.71,Platinum,Debit Card,False,0,Stormy,False,Friday,False,397,386,2024-09-11 04:44:00,2024,9,37,0
1671,4515,646,Headphones,Appliances,5,822.62,1/8/2024 9:08,3,"New York, NY",385,100,109,253,7,35,Female,52485.78,Silver,Digital Wallet,True,BOGO,Sunny,False,Tuesday,True,344,224,2024-01-08 09:08:00,2024,1,2,0
1672,5678,954,Fridge,Electronics,3,1973.09,5/16/2024 3:24,4,"New York, NY",445,87,243,405,6,60,Other,104639.8,Bronze,Credit Card,True,0,Rainy,True,Tuesday,True,327,163,2024-05-16 03:24:00,2024,5,20,0
1673,9047,931,Smartphone,Appliances,1,1647.84,4/26/2024 4:06,11,"New York, NY",355,135,151,353,2,32,Female,82594.87,Bronze,Cash,False,0,Rainy,False,Saturday,True,215,260,2024-04-26 04:06:00,2024,4,17,0
1674,4279,560,Fridge,Appliances,4,1515.47,1/26/2024 1:22,6,"New York, NY",94,150,293,122,10,52,Female,38238.24,Silver,Digital Wallet,True,0,Stormy,False,Wednesday,True,500,467,2024-01-26 01:22:00,2024,1,4,0
1675,3009,116,Tablet,Appliances,1,1943.79,9/1/2024 0:36,11,"Los Angeles, CA",211,73,207,235,7,47,Other,107984.29,Platinum,Debit Card,False,BOGO,Cloudy,True,Sunday,False,155,337,2024-09-01 00:36:00,2024,9,35,0
1676,3223,137,TV,Electronics,3,286.16,9/9/2024 13:58,11,"Dallas, TX",269,112,132,310,7,21,Female,82946.86,Platinum,Cash,False,0,Rainy,False,Thursday,False,182,344,2024-09-09 13:58:00,2024,9,37,0
1677,2213,447,Fridge,Electronics,5,499.72,7/3/2024 4:49,17,"Chicago, IL",49,76,172,241,3,42,Other,99108.36,Gold,Cash,True,BOGO,Rainy,True,Saturday,False,297,425,2024-07-03 04:49:00,2024,7,27,0
1678,8406,157,Washing Machine,Electronics,3,355.94,8/11/2024 7:15,14,"Miami, FL",292,108,240,382,8,25,Female,114761.84,Platinum,Debit Card,False,0,Rainy,True,Sunday,True,278,269,2024-08-11 07:15:00,2024,8,32,0
1679,3828,445,Tablet,Appliances,5,138.06,6/19/2024 10:21,6,"Chicago, IL",444,124,214,458,2,22,Other,76014.07,Gold,Cash,True,0,Rainy,True,Sunday,True,112,134,2024-06-19 10:21:00,2024,6,25,0
1680,8292,906,Camera,Appliances,4,1086.7,7/16/2024 9:59,15,"Los Angeles, CA",96,94,178,269,5,39,Female,87956.75,Bronze,Cash,False,BOGO,Cloudy,True,Wednesday,False,128,201,2024-07-16 09:59:00,2024,7,29,0
1681,2438,838,Washing Machine,Electronics,2,1878.36,7/23/2024 4:51,15,"Miami, FL",470,108,228,265,6,37,Other,38450.52,Silver,Debit Card,True,0,Stormy,True,Saturday,False,331,356,2024-07-23 04:51:00,2024,7,30,0
1682,6236,143,Washing Machine,Appliances,3,748.67,6/1/2024 13:37,18,"Dallas, TX",62,69,184,282,8,27,Male,31354.75,Silver,Credit Card,True,BOGO,Cloudy,False,Saturday,True,455,417,2024-06-01 13:37:00,2024,6,22,0
1683,6692,515,Washing Machine,Appliances,3,410.65,4/5/2024 11:43,18,"Los Angeles, CA",407,78,203,149,1,25,Male,75246.3,Platinum,Credit Card,True,0,Stormy,False,Friday,False,268,457,2024-04-05 11:43:00,2024,4,14,0
1684,2063,221,Tablet,Electronics,5,137.91,2/27/2024 23:21,18,"Los Angeles, CA",312,116,147,449,7,25,Male,31452.15,Platinum,Digital Wallet,False,0,Cloudy,True,Tuesday,False,250,181,2024-02-27 23:21:00,2024,2,9,0
1685,9882,316,Tablet,Electronics,2,235.68,5/3/2024 21:19,6,"Miami, FL",79,142,154,307,6,62,Male,112461.22,Platinum,Credit Card,False,BOGO,Cloudy,False,Friday,False,121,435,2024-05-03 21:19:00,2024,5,18,0
1686,5757,926,Smartphone,Electronics,1,1190.83,1/4/2024 10:51,13,"Dallas, TX",91,130,214,391,9,51,Female,109379.69,Bronze,Credit Card,False,0,Cloudy,True,Monday,False,313,495,2024-01-04 10:51:00,2024,1,1,0
1687,5914,769,Tablet,Electronics,3,257.17,1/20/2024 13:50,2,"New York, NY",370,62,239,474,7,66,Male,117436.52,Gold,Cash,True,BOGO,Rainy,True,Thursday,True,469,237,2024-01-20 13:50:00,2024,1,3,0
1688,3580,783,Fridge,Appliances,2,516.75,4/4/2024 16:21,8,"New York, NY",292,104,265,207,9,50,Male,109431.24,Gold,Credit Card,True,0,Cloudy,True,Sunday,True,217,236,2024-04-04 16:21:00,2024,4,14,0
1689,3852,635,Fridge,Appliances,4,524.86,5/27/2024 8:11,3,"New York, NY",487,137,242,183,7,57,Male,79451.31,Gold,Cash,False,0,Stormy,True,Thursday,False,155,244,2024-05-27 08:11:00,2024,5,22,0
1690,6922,569,TV,Electronics,5,778.66,7/7/2024 0:56,15,"Miami, FL",143,150,208,467,3,69,Other,39057.14,Platinum,Cash,True,0,Cloudy,False,Friday,False,165,172,2024-07-07 00:56:00,2024,7,27,0
1691,9335,794,Fridge,Electronics,5,490.1,1/7/2024 11:50,9,"New York, NY",46,59,279,244,4,39,Other,27456.46,Bronze,Cash,True,0,Rainy,False,Thursday,True,178,409,2024-01-07 11:50:00,2024,1,1,0
1692,4673,991,Camera,Appliances,1,1228.18,5/18/2024 15:08,18,"Miami, FL",395,66,117,116,8,57,Other,63361.03,Platinum,Debit Card,True,0,Rainy,True,Monday,False,267,209,2024-05-18 15:08:00,2024,5,20,0
1693,2988,995,Tablet,Electronics,2,215.27,4/3/2024 9:07,19,"Miami, FL",406,124,222,270,9,34,Female,82050.92,Gold,Debit Card,False,0,Stormy,True,Thursday,True,276,218,2024-04-03 09:07:00,2024,4,14,0
1694,4292,649,Camera,Electronics,2,170.5,2/4/2024 1:16,1,"Miami, FL",364,69,156,491,6,56,Other,83554.29,Bronze,Credit Card,True,Percentage Discount,Stormy,False,Friday,False,421,501,2024-02-04 01:16:00,2024,2,5,0
1695,3275,252,Camera,Appliances,1,163.36,2/27/2024 13:19,8,"Chicago, IL",493,60,133,426,8,63,Male,103910.27,Silver,Digital Wallet,True,0,Rainy,False,Sunday,True,270,506,2024-02-27 13:19:00,2024,2,9,0
1696,4878,858,Washing Machine,Appliances,5,92.27,3/8/2024 3:08,1,"Miami, FL",89,80,215,330,8,25,Other,32338.66,Bronze,Digital Wallet,False,Percentage Discount,Sunny,False,Saturday,False,149,256,2024-03-08 03:08:00,2024,3,10,0
1697,9094,693,TV,Appliances,2,1432.03,9/2/2024 15:08,9,"Miami, FL",477,91,217,487,2,57,Male,100382.15,Gold,Cash,True,0,Cloudy,False,Monday,False,162,224,2024-09-02 15:08:00,2024,9,36,0
1698,1430,338,Washing Machine,Appliances,4,1313.66,2/21/2024 19:32,12,"New York, NY",492,63,204,444,8,27,Female,34688.35,Bronze,Digital Wallet,True,0,Rainy,True,Thursday,False,394,498,2024-02-21 19:32:00,2024,2,8,0
1699,6912,173,Tablet,Electronics,1,889.06,7/15/2024 17:08,18,"Dallas, TX",359,63,106,500,2,64,Other,95561.62,Bronze,Credit Card,False,0,Rainy,True,Wednesday,False,337,298,2024-07-15 17:08:00,2024,7,29,0
1700,7044,137,Headphones,Electronics,1,784.73,9/7/2024 11:27,17,"Dallas, TX",114,134,280,248,3,63,Other,106664.78,Platinum,Credit Card,False,Percentage Discount,Cloudy,False,Tuesday,True,187,173,2024-09-07 11:27:00,2024,9,36,0
1701,8657,853,Washing Machine,Appliances,2,409.2,6/23/2024 8:21,1,"Miami, FL",71,131,206,151,2,42,Female,46289.48,Silver,Debit Card,False,0,Cloudy,False,Friday,True,312,483,2024-06-23 08:21:00,2024,6,25,0
1702,3126,244,Laptop,Electronics,2,714.0,6/15/2024 0:45,19,"Dallas, TX",261,59,294,141,10,38,Male,99213.56,Silver,Digital Wallet,True,BOGO,Rainy,False,Saturday,True,209,302,2024-06-15 00:45:00,2024,6,24,0
1703,2412,600,Smartphone,Electronics,5,1445.31,7/12/2024 19:46,16,"Los Angeles, CA",385,80,148,427,10,60,Female,25477.35,Gold,Cash,False,0,Sunny,True,Monday,True,150,436,2024-07-12 19:46:00,2024,7,28,0
1704,2077,769,Washing Machine,Electronics,5,1370.18,9/11/2024 0:42,4,"Chicago, IL",356,133,256,389,10,55,Male,101466.31,Gold,Cash,False,0,Rainy,False,Monday,True,325,481,2024-09-11 00:42:00,2024,9,37,0
1705,6067,119,Smartphone,Appliances,2,1415.03,5/11/2024 3:06,18,"Los Angeles, CA",0,76,266,204,4,39,Female,76474.88,Platinum,Cash,False,0,Cloudy,True,Tuesday,True,441,298,2024-05-11 03:06:00,2024,5,19,0
1706,7523,582,TV,Appliances,4,174.78,3/20/2024 21:56,14,"Dallas, TX",443,56,275,289,10,25,Male,22915.34,Bronze,Credit Card,True,Percentage Discount,Sunny,False,Tuesday,True,188,280,2024-03-20 21:56:00,2024,3,12,0
1707,8842,733,Camera,Appliances,1,1492.93,2/8/2024 7:16,3,"Miami, FL",480,63,184,201,2,48,Other,99761.3,Gold,Digital Wallet,True,0,Cloudy,False,Tuesday,False,456,494,2024-02-08 07:16:00,2024,2,6,0
1708,9612,146,Laptop,Electronics,5,740.1,6/24/2024 0:56,10,"Los Angeles, CA",391,53,263,390,8,31,Male,68023.82,Silver,Cash,False,0,Stormy,True,Tuesday,False,326,330,2024-06-24 00:56:00,2024,6,26,0
1709,7730,348,Fridge,Appliances,4,1219.42,7/7/2024 17:45,5,"Miami, FL",437,110,116,150,7,32,Female,27495.91,Platinum,Credit Card,True,Percentage Discount,Stormy,False,Tuesday,True,170,252,2024-07-07 17:45:00,2024,7,27,0
1710,7708,818,Laptop,Electronics,5,54.79,2/23/2024 5:44,6,"New York, NY",200,92,280,420,8,43,Other,94175.6,Bronze,Cash,False,0,Stormy,False,Friday,True,107,235,2024-02-23 05:44:00,2024,2,8,0
1711,2208,764,Camera,Appliances,5,926.52,1/13/2024 2:30,20,"New York, NY",94,74,161,100,1,59,Other,41685.51,Silver,Cash,False,0,Sunny,False,Friday,True,298,95,2024-01-13 02:30:00,2024,1,2,0
1712,3053,233,Fridge,Appliances,2,1995.13,3/16/2024 6:00,8,"New York, NY",178,97,204,220,8,42,Male,105785.7,Bronze,Debit Card,True,0,Rainy,True,Friday,False,287,136,2024-03-16 06:00:00,2024,3,11,0
1713,6194,114,Washing Machine,Appliances,5,1633.2,5/28/2024 6:54,12,"Los Angeles, CA",123,147,242,362,1,45,Other,96727.71,Bronze,Digital Wallet,True,Percentage Discount,Cloudy,False,Monday,True,428,327,2024-05-28 06:54:00,2024,5,22,0
1714,2215,276,TV,Electronics,1,328.12,8/19/2024 11:26,11,"Chicago, IL",350,136,245,429,1,37,Other,58313.85,Silver,Debit Card,True,0,Sunny,True,Saturday,True,279,174,2024-08-19 11:26:00,2024,8,34,0
1715,8372,747,Laptop,Appliances,3,50.92,4/22/2024 6:53,10,"New York, NY",296,55,249,497,3,53,Other,66753.56,Bronze,Credit Card,False,0,Rainy,True,Monday,False,161,112,2024-04-22 06:53:00,2024,4,17,0
1716,8632,151,TV,Appliances,2,1598.15,5/1/2024 5:30,12,"Dallas, TX",128,72,112,396,3,25,Other,85727.66,Silver,Cash,False,0,Cloudy,True,Saturday,True,473,400,2024-05-01 05:30:00,2024,5,18,0
1717,9476,414,Laptop,Electronics,4,721.05,3/14/2024 0:18,20,"Los Angeles, CA",444,83,209,137,8,35,Female,76067.34,Gold,Digital Wallet,True,Percentage Discount,Cloudy,True,Wednesday,True,419,248,2024-03-14 00:18:00,2024,3,11,0
1718,6644,940,Fridge,Appliances,5,1617.41,7/24/2024 3:22,6,"Chicago, IL",374,101,192,455,10,32,Other,26153.55,Gold,Credit Card,True,0,Rainy,False,Monday,False,251,235,2024-07-24 03:22:00,2024,7,30,0
1719,3102,912,Headphones,Electronics,4,473.53,7/27/2024 8:10,2,"Los Angeles, CA",48,123,297,302,7,23,Male,96262.66,Silver,Debit Card,False,0,Rainy,True,Thursday,False,397,92,2024-07-27 08:10:00,2024,7,30,0
1720,3981,199,Headphones,Appliances,2,1498.65,3/8/2024 9:04,11,"Chicago, IL",466,85,221,493,3,31,Other,62799.21,Gold,Credit Card,True,0,Stormy,False,Monday,True,353,210,2024-03-08 09:04:00,2024,3,10,0
1721,3114,567,Smartphone,Appliances,1,211.55,5/10/2024 8:14,12,"New York, NY",256,117,174,304,5,68,Other,112956.53,Silver,Credit Card,True,0,Stormy,False,Monday,False,207,114,2024-05-10 08:14:00,2024,5,19,0
1722,8088,725,Tablet,Appliances,3,800.89,1/26/2024 0:52,19,"New York, NY",184,149,119,354,5,46,Female,91690.26,Silver,Digital Wallet,True,BOGO,Cloudy,False,Wednesday,True,358,166,2024-01-26 00:52:00,2024,1,4,0
1723,9238,274,Smartphone,Electronics,5,1273.67,2/18/2024 13:31,14,"Chicago, IL",140,86,278,325,6,34,Male,25991.34,Gold,Digital Wallet,True,0,Sunny,True,Friday,False,309,101,2024-02-18 13:31:00,2024,2,7,0
1724,1907,955,Tablet,Appliances,4,957.67,8/6/2024 18:25,15,"Los Angeles, CA",174,141,205,451,3,19,Female,61977.67,Bronze,Digital Wallet,False,BOGO,Rainy,False,Tuesday,False,199,255,2024-08-06 18:25:00,2024,8,32,0
1725,3034,705,Headphones,Electronics,2,1574.59,8/9/2024 14:47,11,"Dallas, TX",188,143,251,113,8,66,Male,22797.7,Silver,Cash,True,0,Rainy,True,Saturday,True,317,271,2024-08-09 14:47:00,2024,8,32,0
1726,9488,165,Fridge,Appliances,3,1548.34,4/26/2024 5:19,15,"Chicago, IL",142,63,240,419,9,65,Male,29549.08,Platinum,Debit Card,False,0,Sunny,False,Saturday,True,173,398,2024-04-26 05:19:00,2024,4,17,0
1727,3507,937,Tablet,Appliances,1,605.48,2/10/2024 16:39,16,"Dallas, TX",32,71,164,447,5,18,Male,74039.41,Platinum,Cash,False,0,Stormy,False,Sunday,False,461,235,2024-02-10 16:39:00,2024,2,6,0
1728,5982,937,Headphones,Appliances,3,784.85,7/15/2024 22:13,20,"Los Angeles, CA",431,77,264,284,4,62,Male,37799.55,Platinum,Debit Card,True,0,Stormy,False,Tuesday,False,127,160,2024-07-15 22:13:00,2024,7,29,0
1729,3697,208,Washing Machine,Electronics,2,910.13,8/13/2024 14:11,20,"Los Angeles, CA",276,67,156,179,1,23,Male,93002.77,Silver,Digital Wallet,True,0,Stormy,True,Tuesday,True,181,146,2024-08-13 14:11:00,2024,8,33,0
1730,3653,216,Fridge,Electronics,1,611.48,5/31/2024 11:39,3,"Los Angeles, CA",313,143,206,137,1,54,Other,22199.63,Bronze,Credit Card,False,0,Rainy,True,Sunday,False,320,249,2024-05-31 11:39:00,2024,5,22,0
1731,6286,609,TV,Appliances,4,527.87,1/8/2024 11:41,4,"Los Angeles, CA",84,66,203,359,4,52,Male,89774.37,Platinum,Debit Card,False,0,Sunny,False,Sunday,False,148,144,2024-01-08 11:41:00,2024,1,2,0
1732,4694,709,Headphones,Appliances,3,75.05,9/3/2024 7:01,7,"Chicago, IL",162,73,281,270,10,21,Other,29725.57,Gold,Cash,True,0,Stormy,False,Monday,True,202,95,2024-09-03 07:01:00,2024,9,36,0
1733,6669,918,Smartphone,Appliances,4,1493.18,8/27/2024 13:10,15,"Dallas, TX",275,79,162,446,9,25,Other,49391.79,Platinum,Credit Card,True,0,Rainy,False,Sunday,True,385,302,2024-08-27 13:10:00,2024,8,35,0
1734,9501,730,Laptop,Electronics,3,1249.13,1/3/2024 4:48,19,"New York, NY",459,71,272,358,8,70,Female,48045.13,Platinum,Debit Card,False,BOGO,Cloudy,True,Friday,False,304,330,2024-01-03 04:48:00,2024,1,1,0
1735,5653,325,Tablet,Electronics,2,1892.71,3/2/2024 10:19,18,"Dallas, TX",271,54,163,293,9,24,Other,65433.68,Bronze,Digital Wallet,False,0,Stormy,False,Wednesday,False,343,441,2024-03-02 10:19:00,2024,3,9,0
1736,2292,164,Fridge,Electronics,3,737.85,8/18/2024 21:34,8,"New York, NY",454,121,221,371,1,18,Female,22028.01,Bronze,Cash,True,0,Cloudy,False,Saturday,True,435,464,2024-08-18 21:34:00,2024,8,33,0
1737,5105,923,Camera,Electronics,2,1371.47,6/21/2024 20:43,1,"Dallas, TX",472,111,289,466,7,44,Female,40214.12,Silver,Debit Card,True,0,Stormy,True,Monday,True,456,387,2024-06-21 20:43:00,2024,6,25,0
1738,4216,307,Headphones,Appliances,4,1413.63,4/4/2024 15:16,10,"Los Angeles, CA",469,150,195,121,5,33,Female,71615.75,Gold,Debit Card,False,BOGO,Cloudy,True,Wednesday,False,174,221,2024-04-04 15:16:00,2024,4,14,0
1739,5496,536,Smartphone,Electronics,5,253.6,2/11/2024 11:58,11,"Los Angeles, CA",122,81,206,233,7,53,Other,76515.47,Gold,Digital Wallet,True,0,Rainy,True,Sunday,False,265,205,2024-02-11 11:58:00,2024,2,6,0
1740,3050,445,TV,Appliances,1,206.54,4/19/2024 19:48,15,"Chicago, IL",43,117,299,455,6,28,Female,95471.01,Bronze,Cash,True,BOGO,Cloudy,True,Thursday,True,192,188,2024-04-19 19:48:00,2024,4,16,0
1741,5961,930,Camera,Electronics,1,930.15,9/1/2024 1:14,14,"Miami, FL",133,146,121,196,10,29,Other,39183.94,Bronze,Digital Wallet,True,0,Stormy,True,Monday,False,437,159,2024-09-01 01:14:00,2024,9,35,0
1742,9740,955,Fridge,Appliances,5,1022.96,5/19/2024 10:52,5,"Dallas, TX",392,91,229,410,5,35,Male,42512.13,Bronze,Debit Card,True,BOGO,Cloudy,True,Wednesday,True,379,119,2024-05-19 10:52:00,2024,5,20,0
1743,2530,855,Washing Machine,Electronics,5,1939.93,2/15/2024 21:20,15,"Dallas, TX",1,140,169,233,10,35,Male,65451.59,Bronze,Digital Wallet,True,0,Cloudy,False,Saturday,True,197,203,2024-02-15 21:20:00,2024,2,7,0
1744,9234,794,Washing Machine,Electronics,1,1437.42,1/26/2024 6:45,9,"Dallas, TX",26,110,190,173,2,33,Male,93867.67,Silver,Credit Card,True,BOGO,Sunny,True,Friday,True,157,152,2024-01-26 06:45:00,2024,1,4,0
1745,3762,511,Smartphone,Appliances,3,712.96,8/5/2024 0:35,11,"Miami, FL",455,57,156,402,9,28,Male,106420.54,Bronze,Cash,True,Percentage Discount,Sunny,False,Monday,False,474,411,2024-08-05 00:35:00,2024,8,32,0
1746,3526,432,Fridge,Appliances,4,721.97,5/27/2024 9:03,4,"Los Angeles, CA",118,148,187,107,7,42,Other,63324.71,Bronze,Debit Card,True,0,Stormy,True,Friday,True,383,94,2024-05-27 09:03:00,2024,5,22,0
1747,3804,223,Camera,Electronics,4,1334.73,3/28/2024 0:27,3,"New York, NY",177,146,223,116,9,40,Other,55091.22,Gold,Credit Card,False,0,Sunny,True,Tuesday,True,327,489,2024-03-28 00:27:00,2024,3,13,0
1748,6531,800,Fridge,Appliances,2,1313.8,1/6/2024 15:27,13,"Chicago, IL",205,147,215,363,5,67,Male,86954.88,Bronze,Debit Card,False,Percentage Discount,Sunny,False,Thursday,True,489,98,2024-01-06 15:27:00,2024,1,1,0
1749,1674,689,Laptop,Electronics,3,1531.35,7/24/2024 10:58,1,"New York, NY",115,142,223,446,10,34,Female,35630.36,Silver,Digital Wallet,False,0,Cloudy,False,Friday,False,455,462,2024-07-24 10:58:00,2024,7,30,0
1750,1464,658,TV,Appliances,3,180.45,1/9/2024 6:12,18,"Chicago, IL",14,123,282,438,9,54,Male,49030.57,Platinum,Debit Card,True,BOGO,Stormy,True,Wednesday,False,116,291,2024-01-09 06:12:00,2024,1,2,0
1751,2330,240,Tablet,Electronics,4,101.68,5/5/2024 7:49,19,"Dallas, TX",103,88,226,371,8,70,Other,90937.07,Bronze,Cash,True,0,Rainy,True,Friday,False,465,419,2024-05-05 07:49:00,2024,5,18,0
1752,1744,429,Smartphone,Appliances,4,1172.22,5/20/2024 14:06,12,"Los Angeles, CA",463,76,234,400,5,64,Other,26672.16,Gold,Debit Card,False,0,Stormy,False,Tuesday,True,246,257,2024-05-20 14:06:00,2024,5,21,0
1753,5336,956,Camera,Electronics,1,1129.86,5/18/2024 9:40,17,"Dallas, TX",468,124,192,173,10,38,Female,113154.68,Gold,Digital Wallet,False,Percentage Discount,Cloudy,False,Saturday,False,290,169,2024-05-18 09:40:00,2024,5,20,0
1754,4453,912,Camera,Electronics,4,1651.67,3/9/2024 5:16,19,"Los Angeles, CA",81,63,244,267,4,23,Female,27892.24,Gold,Cash,False,0,Rainy,False,Sunday,False,129,188,2024-03-09 05:16:00,2024,3,10,0
1755,7825,318,Laptop,Appliances,4,1313.61,5/7/2024 19:24,15,"Chicago, IL",258,81,135,496,3,60,Other,107848.4,Silver,Credit Card,True,0,Cloudy,True,Friday,True,463,168,2024-05-07 19:24:00,2024,5,19,0
1756,1496,882,Smartphone,Appliances,4,979.74,3/19/2024 9:40,2,"Chicago, IL",77,111,276,376,1,50,Other,102363.95,Platinum,Credit Card,False,0,Stormy,True,Thursday,False,200,123,2024-03-19 09:40:00,2024,3,12,0
1757,9159,146,Washing Machine,Electronics,2,157.14,8/10/2024 21:18,4,"New York, NY",220,51,256,424,4,56,Other,30398.4,Platinum,Cash,True,0,Sunny,False,Tuesday,True,354,139,2024-08-10 21:18:00,2024,8,32,0
1758,9938,707,Smartphone,Electronics,5,1341.25,5/25/2024 5:11,12,"Miami, FL",243,117,170,266,10,58,Other,61480.76,Bronze,Credit Card,True,Percentage Discount,Cloudy,True,Sunday,False,459,207,2024-05-25 05:11:00,2024,5,21,0
1759,5745,277,Washing Machine,Electronics,4,1604.45,1/23/2024 4:04,6,"Los Angeles, CA",97,95,186,347,3,60,Male,74916.44,Gold,Debit Card,True,BOGO,Stormy,True,Tuesday,True,249,173,2024-01-23 04:04:00,2024,1,4,0
1760,5949,443,Camera,Appliances,5,1268.65,7/3/2024 1:38,6,"Los Angeles, CA",167,121,229,363,3,50,Female,33324.46,Bronze,Credit Card,False,0,Cloudy,True,Monday,False,496,216,2024-07-03 01:38:00,2024,7,27,0
1761,8912,164,Tablet,Electronics,1,353.97,3/1/2024 13:22,4,"Chicago, IL",341,106,159,202,7,25,Other,102193.95,Bronze,Credit Card,True,0,Cloudy,False,Wednesday,True,127,97,2024-03-01 13:22:00,2024,3,9,0
1762,5012,223,Fridge,Appliances,3,529.52,2/24/2024 19:55,7,"New York, NY",155,116,205,411,9,59,Female,56991.78,Gold,Cash,True,0,Rainy,False,Wednesday,True,216,235,2024-02-24 19:55:00,2024,2,8,0
1763,7653,380,Headphones,Electronics,2,1366.59,7/15/2024 0:50,7,"New York, NY",445,76,118,466,7,55,Male,89563.3,Gold,Credit Card,True,0,Sunny,False,Tuesday,True,498,469,2024-07-15 00:50:00,2024,7,29,0
1764,5873,244,Laptop,Appliances,2,812.04,7/30/2024 14:10,13,"Chicago, IL",313,111,237,378,9,49,Male,52794.29,Silver,Credit Card,False,0,Sunny,True,Wednesday,False,229,175,2024-07-30 14:10:00,2024,7,31,0
1765,8430,875,Washing Machine,Electronics,4,1270.82,8/5/2024 21:21,17,"New York, NY",4,129,274,123,8,50,Male,83604.23,Platinum,Credit Card,False,0,Cloudy,True,Wednesday,False,344,246,2024-08-05 21:21:00,2024,8,32,0
1766,2195,525,Smartphone,Electronics,2,1375.52,1/29/2024 14:38,20,"Dallas, TX",157,71,231,198,1,59,Other,67172.17,Platinum,Credit Card,True,0,Sunny,True,Monday,True,293,247,2024-01-29 14:38:00,2024,1,5,0
1767,1981,272,Washing Machine,Electronics,5,911.51,1/20/2024 23:22,13,"Miami, FL",228,65,278,344,4,60,Female,73679.23,Gold,Debit Card,True,0,Sunny,True,Wednesday,False,212,458,2024-01-20 23:22:00,2024,1,3,0
1768,3589,813,Tablet,Appliances,5,803.44,1/13/2024 4:27,2,"Miami, FL",296,78,149,112,8,39,Female,104954.22,Platinum,Credit Card,False,Percentage Discount,Stormy,True,Thursday,False,199,126,2024-01-13 04:27:00,2024,1,2,0
1769,8202,478,Laptop,Electronics,5,1660.52,7/2/2024 6:47,1,"New York, NY",416,64,212,209,6,38,Female,92610.17,Bronze,Digital Wallet,False,BOGO,Cloudy,True,Thursday,True,481,232,2024-07-02 06:47:00,2024,7,27,0
1770,7809,666,TV,Appliances,3,1283.59,7/11/2024 15:00,17,"New York, NY",386,104,174,331,6,22,Male,115045.1,Bronze,Credit Card,True,Percentage Discount,Stormy,True,Friday,False,254,383,2024-07-11 15:00:00,2024,7,28,0
1771,8933,268,TV,Appliances,4,448.77,4/30/2024 10:21,7,"Chicago, IL",279,144,179,341,8,46,Other,60997.84,Gold,Digital Wallet,True,0,Stormy,False,Friday,False,332,142,2024-04-30 10:21:00,2024,4,18,0
1772,8609,549,Fridge,Appliances,4,529.85,1/9/2024 8:51,9,"Miami, FL",487,120,238,205,9,56,Male,70060.18,Gold,Debit Card,False,0,Stormy,True,Tuesday,True,279,321,2024-01-09 08:51:00,2024,1,2,0
1773,4342,349,Smartphone,Electronics,3,344.78,2/21/2024 11:44,15,"Los Angeles, CA",194,73,244,484,6,25,Other,52385.41,Silver,Debit Card,True,0,Rainy,True,Thursday,True,460,147,2024-02-21 11:44:00,2024,2,8,0
1774,6573,695,Fridge,Appliances,3,1383.71,8/24/2024 5:37,14,"New York, NY",184,67,142,142,5,40,Female,22689.85,Platinum,Cash,False,0,Rainy,True,Saturday,True,405,343,2024-08-24 05:37:00,2024,8,34,0
1775,3353,141,TV,Electronics,1,290.05,8/25/2024 11:59,3,"Chicago, IL",226,98,148,178,6,36,Other,112591.09,Bronze,Debit Card,False,Percentage Discount,Rainy,True,Tuesday,False,437,387,2024-08-25 11:59:00,2024,8,34,0
1776,6121,236,Camera,Electronics,5,743.68,9/15/2024 23:13,5,"Dallas, TX",51,133,294,126,8,33,Male,116927.16,Gold,Digital Wallet,True,0,Stormy,False,Wednesday,False,252,185,2024-09-15 23:13:00,2024,9,37,0
1777,6231,202,TV,Appliances,5,352.86,8/22/2024 18:16,17,"Los Angeles, CA",218,56,258,288,7,43,Female,119323.13,Bronze,Credit Card,False,BOGO,Cloudy,True,Wednesday,True,460,413,2024-08-22 18:16:00,2024,8,34,0
1778,6658,910,TV,Electronics,5,1744.56,6/5/2024 14:52,19,"Dallas, TX",424,116,196,382,6,55,Female,46837.66,Gold,Digital Wallet,True,Percentage Discount,Cloudy,False,Friday,True,405,193,2024-06-05 14:52:00,2024,6,23,0
1779,7532,967,Laptop,Appliances,5,788.17,5/25/2024 9:26,17,"New York, NY",406,50,109,384,4,53,Male,95540.86,Gold,Cash,True,Percentage Discount,Rainy,True,Wednesday,True,206,213,2024-05-25 09:26:00,2024,5,21,0
1780,3142,747,Camera,Appliances,1,1289.73,8/17/2024 20:00,19,"Los Angeles, CA",257,129,172,309,1,68,Other,71072.75,Platinum,Credit Card,True,0,Rainy,True,Tuesday,False,206,423,2024-08-17 20:00:00,2024,8,33,0
1781,7070,727,Camera,Electronics,1,1454.9,4/11/2024 5:51,20,"New York, NY",299,126,133,390,10,20,Male,104786.51,Gold,Debit Card,False,0,Sunny,True,Monday,True,213,394,2024-04-11 05:51:00,2024,4,15,0
1782,9437,485,Laptop,Electronics,1,1311.89,8/3/2024 15:40,8,"Dallas, TX",365,76,168,428,3,59,Male,63907.63,Bronze,Credit Card,False,0,Rainy,True,Saturday,False,134,455,2024-08-03 15:40:00,2024,8,31,0
1783,2739,896,Headphones,Electronics,1,766.89,5/7/2024 1:53,1,"New York, NY",223,107,168,452,5,31,Male,116081.65,Silver,Cash,True,0,Rainy,True,Monday,False,322,205,2024-05-07 01:53:00,2024,5,19,0
1784,6228,261,Headphones,Electronics,5,480.31,4/28/2024 10:43,16,"Dallas, TX",334,58,183,256,7,35,Other,105207.03,Platinum,Credit Card,False,BOGO,Sunny,True,Tuesday,False,408,404,2024-04-28 10:43:00,2024,4,17,0
1785,4960,116,Tablet,Electronics,5,1021.06,7/30/2024 21:53,9,"Dallas, TX",71,97,101,365,5,41,Female,107815.95,Silver,Debit Card,True,0,Cloudy,False,Tuesday,False,309,390,2024-07-30 21:53:00,2024,7,31,0
1786,8642,598,Washing Machine,Electronics,5,212.1,3/7/2024 8:22,13,"Los Angeles, CA",47,63,146,281,4,56,Male,81950.92,Bronze,Cash,False,0,Rainy,True,Tuesday,True,287,157,2024-03-07 08:22:00,2024,3,10,0
1787,3007,182,Washing Machine,Electronics,3,1699.32,7/9/2024 5:59,4,"New York, NY",99,129,189,205,1,63,Other,69164.62,Bronze,Debit Card,True,0,Rainy,False,Wednesday,True,112,458,2024-07-09 05:59:00,2024,7,28,0
1788,5382,106,Fridge,Appliances,4,1232.23,2/26/2024 20:56,4,"Chicago, IL",75,79,199,454,9,34,Female,86588.7,Silver,Credit Card,True,Percentage Discount,Sunny,True,Saturday,False,499,495,2024-02-26 20:56:00,2024,2,9,0
1789,8366,107,Fridge,Electronics,2,425.5,5/30/2024 8:04,8,"Los Angeles, CA",399,59,227,131,2,52,Other,62895.27,Silver,Credit Card,True,0,Sunny,True,Thursday,False,217,279,2024-05-30 08:04:00,2024,5,22,0
1790,5061,283,Camera,Electronics,5,128.08,7/16/2024 19:37,19,"Chicago, IL",378,107,263,333,4,56,Other,76519.54,Silver,Debit Card,False,0,Cloudy,False,Saturday,True,386,192,2024-07-16 19:37:00,2024,7,29,0
1791,3308,191,Camera,Appliances,1,1880.97,8/19/2024 15:07,20,"New York, NY",406,119,115,229,3,31,Male,38042.74,Bronze,Cash,False,0,Sunny,False,Friday,False,189,278,2024-08-19 15:07:00,2024,8,34,0
1792,2586,823,Fridge,Appliances,5,527.44,5/8/2024 15:01,16,"Chicago, IL",187,88,139,366,3,19,Female,83213.95,Gold,Credit Card,False,0,Stormy,True,Thursday,False,438,477,2024-05-08 15:01:00,2024,5,19,0
1793,1829,767,Camera,Electronics,2,1668.85,7/4/2024 12:16,19,"Miami, FL",30,84,130,334,3,36,Male,79437.74,Gold,Debit Card,False,Percentage Discount,Stormy,True,Sunday,False,109,371,2024-07-04 12:16:00,2024,7,27,0
1794,5754,707,Tablet,Appliances,3,1557.17,5/17/2024 1:52,20,"New York, NY",268,141,222,382,6,57,Male,45289.5,Platinum,Cash,True,BOGO,Cloudy,False,Sunday,True,262,143,2024-05-17 01:52:00,2024,5,20,0
1795,7293,390,Smartphone,Electronics,2,529.03,1/6/2024 16:07,5,"Miami, FL",213,126,232,139,8,35,Female,45677.17,Silver,Digital Wallet,False,0,Rainy,True,Sunday,False,179,291,2024-01-06 16:07:00,2024,1,1,0
1796,7850,526,Washing Machine,Appliances,1,1517.07,3/19/2024 7:16,15,"Los Angeles, CA",88,119,144,196,6,21,Female,100419.28,Platinum,Credit Card,False,BOGO,Rainy,True,Thursday,False,354,139,2024-03-19 07:16:00,2024,3,12,0
1797,5067,810,Fridge,Appliances,1,1150.97,3/16/2024 10:42,4,"Chicago, IL",435,121,258,231,1,51,Male,84826.54,Platinum,Credit Card,True,0,Cloudy,True,Thursday,True,129,507,2024-03-16 10:42:00,2024,3,11,0
1798,3616,926,Camera,Electronics,5,1408.94,3/21/2024 19:47,11,"Los Angeles, CA",276,150,185,111,5,20,Other,117639.61,Bronze,Debit Card,False,0,Rainy,False,Monday,False,104,391,2024-03-21 19:47:00,2024,3,12,0
1799,6364,911,Smartphone,Appliances,5,1753.72,3/30/2024 10:48,13,"New York, NY",208,148,250,470,2,56,Other,45500.15,Silver,Debit Card,True,Percentage Discount,Sunny,False,Thursday,True,442,483,2024-03-30 10:48:00,2024,3,13,0
1800,6123,891,Smartphone,Electronics,4,1420.93,2/9/2024 21:00,2,"Miami, FL",464,81,242,403,3,22,Female,41766.64,Gold,Credit Card,False,0,Cloudy,False,Thursday,False,122,175,2024-02-09 21:00:00,2024,2,6,0
1801,4110,587,Fridge,Appliances,5,192.64,2/4/2024 22:02,8,"Los Angeles, CA",274,119,239,278,3,20,Other,66289.5,Gold,Debit Card,True,0,Stormy,True,Tuesday,True,377,98,2024-02-04 22:02:00,2024,2,5,0
1802,3610,808,Fridge,Electronics,3,329.24,3/25/2024 13:24,7,"Los Angeles, CA",160,50,118,453,7,18,Male,89485.35,Gold,Debit Card,True,0,Cloudy,False,Thursday,False,303,495,2024-03-25 13:24:00,2024,3,13,0
1803,9163,229,Headphones,Appliances,3,902.84,1/23/2024 16:11,17,"New York, NY",197,75,201,434,7,44,Male,50893.83,Gold,Debit Card,True,Percentage Discount,Stormy,True,Thursday,True,337,188,2024-01-23 16:11:00,2024,1,4,0
1804,9433,311,Fridge,Electronics,2,1218.9,7/7/2024 22:28,16,"Dallas, TX",149,106,294,160,5,55,Other,65457.13,Platinum,Debit Card,False,0,Cloudy,True,Wednesday,True,306,304,2024-07-07 22:28:00,2024,7,27,0
1805,8648,246,Headphones,Appliances,3,1271.42,7/7/2024 8:22,18,"Dallas, TX",491,131,127,240,4,38,Male,103079.12,Gold,Digital Wallet,True,0,Sunny,False,Friday,False,456,274,2024-07-07 08:22:00,2024,7,27,0
1806,9171,755,Tablet,Electronics,4,1710.34,4/12/2024 21:40,17,"Dallas, TX",320,85,285,107,6,43,Other,46223.18,Silver,Credit Card,False,0,Stormy,True,Thursday,False,258,375,2024-04-12 21:40:00,2024,4,15,0
1807,6055,377,Tablet,Electronics,3,790.98,4/15/2024 1:34,12,"Chicago, IL",107,133,100,263,1,57,Other,79608.79,Platinum,Debit Card,False,0,Cloudy,True,Saturday,True,221,230,2024-04-15 01:34:00,2024,4,16,0
1808,9148,635,Tablet,Electronics,5,456.95,3/21/2024 5:07,5,"Chicago, IL",152,106,159,129,10,52,Other,91950.23,Gold,Debit Card,False,Percentage Discount,Cloudy,True,Tuesday,True,311,148,2024-03-21 05:07:00,2024,3,12,0
1809,1379,561,Tablet,Electronics,5,1943.25,7/2/2024 13:55,17,"Los Angeles, CA",224,144,212,480,5,23,Male,93515.39,Platinum,Credit Card,False,BOGO,Stormy,True,Monday,True,418,469,2024-07-02 13:55:00,2024,7,27,0
1810,2475,521,Laptop,Electronics,3,1522.18,1/10/2024 20:52,12,"New York, NY",197,79,284,136,6,56,Male,36863.64,Bronze,Debit Card,False,0,Rainy,True,Tuesday,False,461,118,2024-01-10 20:52:00,2024,1,2,0
1811,7442,344,Fridge,Appliances,5,1093.98,2/8/2024 5:36,18,"Dallas, TX",25,119,205,383,6,52,Female,95031.95,Bronze,Digital Wallet,False,BOGO,Cloudy,False,Saturday,False,472,324,2024-02-08 05:36:00,2024,2,6,0
1812,9281,278,Tablet,Electronics,5,552.82,3/9/2024 18:31,20,"Miami, FL",350,65,153,151,8,62,Male,25835.14,Gold,Digital Wallet,True,0,Rainy,True,Friday,False,241,272,2024-03-09 18:31:00,2024,3,10,0
1813,8491,725,Washing Machine,Electronics,4,1007.23,1/17/2024 8:40,17,"Los Angeles, CA",348,62,295,224,4,31,Female,101655.01,Platinum,Digital Wallet,True,BOGO,Sunny,False,Sunday,False,472,156,2024-01-17 08:40:00,2024,1,3,0
1814,4944,808,Tablet,Appliances,5,1129.8,4/11/2024 0:50,13,"Miami, FL",268,78,141,463,2,30,Other,67429.42,Silver,Digital Wallet,False,0,Cloudy,True,Saturday,True,476,357,2024-04-11 00:50:00,2024,4,15,0
1815,4524,138,Washing Machine,Appliances,3,1612.82,8/21/2024 5:28,17,"New York, NY",421,76,250,463,5,30,Other,107845.13,Gold,Digital Wallet,False,BOGO,Rainy,True,Saturday,True,443,409,2024-08-21 05:28:00,2024,8,34,0
1816,6781,710,Laptop,Electronics,4,1019.02,3/12/2024 16:27,4,"Los Angeles, CA",447,107,174,297,10,23,Other,98433.91,Gold,Cash,False,0,Cloudy,False,Wednesday,True,482,132,2024-03-12 16:27:00,2024,3,11,0
1817,1797,284,Headphones,Appliances,2,717.87,3/8/2024 12:29,18,"Chicago, IL",482,57,100,138,3,43,Female,85562.33,Silver,Digital Wallet,True,0,Stormy,False,Saturday,False,364,465,2024-03-08 12:29:00,2024,3,10,0
1818,1828,834,Fridge,Appliances,5,189.58,1/23/2024 2:18,9,"Los Angeles, CA",275,135,157,353,7,48,Male,102417.8,Silver,Digital Wallet,False,0,Sunny,True,Thursday,False,490,429,2024-01-23 02:18:00,2024,1,4,0
1819,5609,611,TV,Appliances,3,1971.59,8/12/2024 20:08,8,"Miami, FL",89,82,230,117,7,55,Male,112066.37,Bronze,Credit Card,False,0,Rainy,True,Thursday,False,495,123,2024-08-12 20:08:00,2024,8,33,0
1820,9108,726,TV,Electronics,4,1796.26,7/28/2024 9:45,19,"New York, NY",107,123,285,101,3,66,Male,23161.77,Bronze,Digital Wallet,True,BOGO,Cloudy,False,Saturday,True,371,418,2024-07-28 09:45:00,2024,7,30,0
1821,8710,190,Washing Machine,Appliances,3,1842.73,7/4/2024 4:12,15,"Chicago, IL",10,84,107,119,3,28,Female,119886.9,Bronze,Debit Card,False,Percentage Discount,Sunny,True,Tuesday,True,194,310,2024-07-04 04:12:00,2024,7,27,0
1822,5681,742,Fridge,Electronics,5,321.95,6/28/2024 19:26,13,"Miami, FL",295,100,177,241,5,42,Female,113049.45,Platinum,Digital Wallet,False,0,Sunny,True,Monday,False,260,488,2024-06-28 19:26:00,2024,6,26,0
1823,9793,946,Tablet,Electronics,3,233.78,3/6/2024 1:39,8,"New York, NY",87,71,154,363,8,69,Male,75615.91,Bronze,Digital Wallet,True,BOGO,Cloudy,False,Tuesday,True,390,481,2024-03-06 01:39:00,2024,3,10,0
1824,1133,901,TV,Electronics,5,1568.94,3/16/2024 6:04,2,"Los Angeles, CA",435,89,225,283,8,42,Other,21309.34,Platinum,Cash,False,0,Stormy,False,Tuesday,True,277,165,2024-03-16 06:04:00,2024,3,11,0
1825,2761,408,Washing Machine,Appliances,2,1351.23,4/1/2024 12:23,19,"Chicago, IL",185,96,165,255,7,36,Male,27506.2,Silver,Debit Card,True,Percentage Discount,Rainy,True,Tuesday,False,161,296,2024-04-01 12:23:00,2024,4,14,0
1826,8060,456,Tablet,Electronics,5,109.15,6/2/2024 23:14,1,"Miami, FL",278,90,123,472,1,19,Other,27625.62,Silver,Digital Wallet,True,Percentage Discount,Cloudy,True,Wednesday,False,391,148,2024-06-02 23:14:00,2024,6,22,0
1827,3194,528,Camera,Electronics,1,806.28,2/9/2024 4:24,1,"Dallas, TX",224,89,260,436,4,66,Female,44992.81,Gold,Digital Wallet,True,0,Cloudy,True,Wednesday,True,154,506,2024-02-09 04:24:00,2024,2,6,0
1828,5333,104,Washing Machine,Appliances,5,738.54,5/8/2024 15:11,16,"Miami, FL",90,53,140,155,9,62,Female,60858.8,Platinum,Credit Card,False,Percentage Discount,Cloudy,True,Friday,True,450,146,2024-05-08 15:11:00,2024,5,19,0
1829,6992,671,Fridge,Appliances,1,1415.64,9/4/2024 8:54,8,"New York, NY",266,106,211,470,3,33,Male,81613.12,Bronze,Cash,True,0,Sunny,False,Sunday,True,139,336,2024-09-04 08:54:00,2024,9,36,0
1830,7606,341,Fridge,Appliances,2,816.19,4/15/2024 6:23,16,"Los Angeles, CA",306,112,256,494,9,63,Male,26733.29,Silver,Debit Card,False,0,Rainy,True,Thursday,True,107,134,2024-04-15 06:23:00,2024,4,16,0
1831,6995,296,Laptop,Appliances,2,408.78,5/13/2024 13:30,19,"Dallas, TX",405,51,240,479,1,21,Female,71068.34,Platinum,Digital Wallet,False,0,Sunny,False,Saturday,True,306,433,2024-05-13 13:30:00,2024,5,20,0
1832,1741,220,Camera,Appliances,1,917.98,7/19/2024 10:58,10,"Los Angeles, CA",333,51,102,169,8,46,Female,98509.16,Bronze,Cash,True,0,Cloudy,False,Saturday,False,374,202,2024-07-19 10:58:00,2024,7,29,0
1833,7563,642,TV,Electronics,4,1596.38,4/8/2024 15:10,20,"Miami, FL",327,91,231,449,2,40,Male,109519.01,Gold,Debit Card,True,0,Rainy,False,Friday,False,435,161,2024-04-08 15:10:00,2024,4,15,0
1834,1838,197,Headphones,Electronics,5,479.64,7/11/2024 7:34,19,"Dallas, TX",148,79,287,198,1,18,Other,91184.5,Bronze,Debit Card,True,0,Sunny,True,Monday,True,392,174,2024-07-11 07:34:00,2024,7,28,0
1835,4189,733,Headphones,Electronics,4,1780.6,5/24/2024 14:00,20,"Dallas, TX",202,95,196,440,1,39,Female,73968.21,Bronze,Debit Card,True,Percentage Discount,Cloudy,False,Wednesday,False,468,451,2024-05-24 14:00:00,2024,5,21,0
1836,6939,470,Headphones,Appliances,5,174.05,8/8/2024 18:37,10,"New York, NY",239,91,181,228,3,54,Male,89507.31,Bronze,Debit Card,False,0,Cloudy,False,Saturday,True,163,189,2024-08-08 18:37:00,2024,8,32,0
1837,5728,983,Headphones,Electronics,5,331.77,5/11/2024 1:35,9,"Miami, FL",477,133,181,359,5,70,Male,95571.12,Silver,Cash,False,0,Rainy,True,Sunday,False,158,193,2024-05-11 01:35:00,2024,5,19,0
1838,2204,879,Fridge,Electronics,1,407.0,3/29/2024 12:33,11,"New York, NY",448,114,130,153,6,54,Other,67277.49,Platinum,Credit Card,False,0,Cloudy,False,Sunday,False,121,457,2024-03-29 12:33:00,2024,3,13,0
1839,7329,652,TV,Appliances,2,595.32,5/6/2024 7:38,15,"New York, NY",340,116,103,104,9,54,Male,25502.48,Gold,Digital Wallet,True,0,Sunny,True,Monday,False,447,130,2024-05-06 07:38:00,2024,5,19,0
1840,9261,619,Laptop,Electronics,3,1888.98,3/24/2024 16:05,9,"Los Angeles, CA",109,66,234,471,9,19,Female,31081.14,Silver,Digital Wallet,False,0,Sunny,False,Saturday,False,268,308,2024-03-24 16:05:00,2024,3,12,0
1841,8378,324,Fridge,Appliances,5,480.18,7/4/2024 4:11,10,"Dallas, TX",201,76,205,398,7,59,Male,48488.57,Bronze,Cash,True,0,Cloudy,True,Thursday,False,393,347,2024-07-04 04:11:00,2024,7,27,0
1842,5582,575,Laptop,Appliances,5,1625.21,6/8/2024 2:18,9,"Miami, FL",107,83,298,245,5,45,Other,20326.81,Silver,Digital Wallet,False,0,Stormy,True,Monday,False,226,368,2024-06-08 02:18:00,2024,6,23,0
1843,2946,888,Laptop,Appliances,2,535.37,5/6/2024 16:58,4,"Miami, FL",39,120,126,447,2,35,Other,85464.07,Bronze,Digital Wallet,False,0,Stormy,False,Wednesday,False,124,357,2024-05-06 16:58:00,2024,5,19,0
1844,3108,741,Laptop,Electronics,5,1902.86,1/26/2024 10:35,2,"Miami, FL",203,142,257,266,8,19,Male,46768.88,Platinum,Credit Card,True,Percentage Discount,Cloudy,False,Wednesday,True,340,277,2024-01-26 10:35:00,2024,1,4,0
1845,2584,775,Smartphone,Appliances,4,762.59,5/3/2024 11:02,15,"Los Angeles, CA",103,62,251,184,10,51,Male,89797.58,Platinum,Debit Card,False,Percentage Discount,Sunny,False,Saturday,True,360,151,2024-05-03 11:02:00,2024,5,18,0
1846,7453,313,Camera,Appliances,1,814.89,6/19/2024 4:32,13,"Miami, FL",124,135,218,262,4,25,Male,45301.86,Bronze,Cash,False,Percentage Discount,Cloudy,True,Saturday,True,218,436,2024-06-19 04:32:00,2024,6,25,0
1847,7114,383,Camera,Electronics,4,1864.19,2/4/2024 3:20,19,"New York, NY",8,65,100,267,10,21,Female,51592.52,Bronze,Cash,False,BOGO,Sunny,True,Wednesday,True,456,151,2024-02-04 03:20:00,2024,2,5,0
1848,6555,154,Camera,Electronics,1,802.51,7/30/2024 7:43,6,"Los Angeles, CA",436,149,226,227,10,42,Other,107711.05,Platinum,Credit Card,False,0,Sunny,True,Wednesday,True,113,295,2024-07-30 07:43:00,2024,7,31,0
1849,6990,298,Smartphone,Electronics,3,965.06,5/13/2024 0:30,14,"New York, NY",283,115,285,458,7,46,Male,97468.08,Platinum,Credit Card,False,BOGO,Cloudy,True,Tuesday,False,155,193,2024-05-13 00:30:00,2024,5,20,0
1850,3363,215,Fridge,Electronics,5,850.93,1/13/2024 17:54,5,"Los Angeles, CA",150,53,291,392,10,25,Female,104306.51,Gold,Cash,True,0,Cloudy,True,Sunday,True,307,165,2024-01-13 17:54:00,2024,1,2,0
1851,4261,915,TV,Electronics,5,1081.42,4/30/2024 16:01,13,"New York, NY",198,135,228,297,8,21,Other,33414.45,Platinum,Debit Card,False,0,Stormy,True,Friday,False,189,328,2024-04-30 16:01:00,2024,4,18,0
1852,9341,252,Fridge,Appliances,3,1047.05,8/3/2024 14:20,11,"New York, NY",21,121,152,174,10,54,Female,60594.02,Bronze,Credit Card,True,Percentage Discount,Cloudy,True,Friday,True,404,140,2024-08-03 14:20:00,2024,8,31,0
1853,7576,801,TV,Appliances,3,1197.93,2/2/2024 13:11,10,"Dallas, TX",52,72,259,265,4,24,Other,33387.3,Gold,Debit Card,False,BOGO,Rainy,False,Monday,True,361,277,2024-02-02 13:11:00,2024,2,5,0
1854,9193,964,Fridge,Appliances,3,361.5,6/14/2024 1:13,8,"Miami, FL",240,122,152,284,4,46,Male,117323.52,Gold,Digital Wallet,False,Percentage Discount,Rainy,True,Wednesday,True,365,245,2024-06-14 01:13:00,2024,6,24,0
1855,1659,585,Laptop,Electronics,1,593.43,7/6/2024 1:09,10,"Los Angeles, CA",80,133,273,320,10,57,Other,111037.98,Gold,Credit Card,False,0,Cloudy,False,Tuesday,False,267,434,2024-07-06 01:09:00,2024,7,27,0
1856,1742,609,Fridge,Electronics,3,1614.23,8/6/2024 13:18,15,"Chicago, IL",381,145,120,140,4,42,Male,26430.0,Platinum,Debit Card,True,0,Sunny,False,Tuesday,False,480,407,2024-08-06 13:18:00,2024,8,32,0
1857,1637,280,Smartphone,Appliances,2,611.56,7/17/2024 12:36,12,"Miami, FL",201,79,160,239,4,41,Female,88029.12,Silver,Cash,True,0,Cloudy,False,Tuesday,True,333,159,2024-07-17 12:36:00,2024,7,29,0
1858,3245,263,Fridge,Electronics,4,766.84,6/12/2024 22:08,19,"Miami, FL",495,116,132,237,9,24,Male,53181.72,Silver,Digital Wallet,True,0,Stormy,True,Tuesday,False,345,334,2024-06-12 22:08:00,2024,6,24,0
1859,6456,786,Smartphone,Appliances,4,284.61,9/15/2024 14:07,4,"Dallas, TX",456,91,259,151,4,19,Other,115816.62,Gold,Digital Wallet,True,Percentage Discount,Cloudy,False,Saturday,True,240,298,2024-09-15 14:07:00,2024,9,37,0
1860,8761,144,Fridge,Appliances,2,648.31,1/13/2024 13:14,13,"Miami, FL",77,57,177,179,4,69,Male,28650.35,Platinum,Digital Wallet,True,BOGO,Stormy,False,Friday,False,255,410,2024-01-13 13:14:00,2024,1,2,0
1861,9508,155,Camera,Appliances,5,1269.67,7/1/2024 3:34,1,"New York, NY",263,67,108,439,9,69,Male,76826.52,Platinum,Debit Card,False,0,Sunny,False,Sunday,False,374,250,2024-07-01 03:34:00,2024,7,27,0
1862,8487,760,Smartphone,Electronics,4,664.06,6/19/2024 18:49,9,"Los Angeles, CA",393,143,142,466,8,38,Male,56226.48,Gold,Debit Card,True,0,Stormy,False,Thursday,False,471,148,2024-06-19 18:49:00,2024,6,25,0
1863,3440,472,Fridge,Electronics,5,1919.22,6/3/2024 20:59,8,"Dallas, TX",7,118,273,490,7,56,Other,88626.79,Platinum,Debit Card,False,0,Stormy,True,Monday,False,209,290,2024-06-03 20:59:00,2024,6,23,0
1864,9446,391,TV,Electronics,1,1178.26,9/11/2024 16:41,11,"Chicago, IL",120,85,220,454,9,28,Female,98619.59,Bronze,Credit Card,False,0,Sunny,True,Monday,True,109,486,2024-09-11 16:41:00,2024,9,37,0
1865,3290,314,Tablet,Appliances,1,1942.85,2/18/2024 5:04,19,"Los Angeles, CA",483,112,193,499,9,19,Other,60201.08,Gold,Credit Card,True,Percentage Discount,Rainy,True,Saturday,True,475,110,2024-02-18 05:04:00,2024,2,7,0
1866,6373,545,Smartphone,Electronics,2,866.67,8/18/2024 13:16,17,"Dallas, TX",106,111,250,475,4,52,Female,109839.27,Gold,Digital Wallet,False,BOGO,Sunny,True,Tuesday,True,336,198,2024-08-18 13:16:00,2024,8,33,0
1867,6218,357,Tablet,Appliances,2,797.0,7/10/2024 8:34,7,"New York, NY",358,125,174,388,9,42,Male,72533.8,Platinum,Digital Wallet,False,BOGO,Rainy,False,Wednesday,False,280,272,2024-07-10 08:34:00,2024,7,28,0
1868,3662,442,Fridge,Appliances,1,1861.18,3/3/2024 5:52,20,"New York, NY",455,120,146,377,7,39,Other,113585.88,Gold,Debit Card,True,0,Cloudy,True,Saturday,True,452,104,2024-03-03 05:52:00,2024,3,9,0
1869,7438,731,Headphones,Electronics,2,1724.56,6/24/2024 2:55,17,"Dallas, TX",207,147,191,328,9,31,Other,27085.57,Bronze,Cash,True,0,Stormy,False,Thursday,True,283,119,2024-06-24 02:55:00,2024,6,26,0
1870,5902,924,Smartphone,Appliances,5,328.84,7/24/2024 7:24,11,"New York, NY",159,71,110,131,10,64,Other,54143.21,Gold,Debit Card,False,0,Cloudy,False,Monday,False,371,353,2024-07-24 07:24:00,2024,7,30,0
1871,6511,876,Camera,Appliances,5,1360.73,8/21/2024 1:48,19,"New York, NY",311,93,116,132,9,49,Female,28850.81,Bronze,Cash,True,0,Rainy,False,Saturday,False,456,476,2024-08-21 01:48:00,2024,8,34,0
1872,9311,564,TV,Appliances,3,1739.42,5/25/2024 15:28,2,"Chicago, IL",25,115,203,129,3,36,Female,100553.04,Bronze,Digital Wallet,False,0,Sunny,False,Wednesday,False,258,450,2024-05-25 15:28:00,2024,5,21,0
1873,9351,144,Tablet,Electronics,4,1543.54,7/3/2024 6:34,15,"Los Angeles, CA",263,112,195,413,6,55,Other,37262.33,Gold,Cash,True,0,Stormy,True,Saturday,True,438,295,2024-07-03 06:34:00,2024,7,27,0
1874,9721,206,Tablet,Appliances,5,1513.85,4/28/2024 14:15,20,"New York, NY",422,144,214,197,9,35,Female,107794.84,Bronze,Digital Wallet,False,BOGO,Rainy,False,Wednesday,False,357,385,2024-04-28 14:15:00,2024,4,17,0
1875,9025,858,Laptop,Electronics,1,1757.84,8/8/2024 21:30,19,"Dallas, TX",414,95,193,438,2,40,Other,21094.88,Gold,Cash,True,0,Rainy,False,Tuesday,True,498,333,2024-08-08 21:30:00,2024,8,32,0
1876,5911,153,Fridge,Appliances,1,1436.38,1/28/2024 7:10,14,"New York, NY",145,78,193,166,8,62,Other,20015.78,Platinum,Cash,True,0,Cloudy,False,Tuesday,False,274,246,2024-01-28 07:10:00,2024,1,4,0
1877,8780,650,Laptop,Appliances,5,399.68,9/14/2024 22:38,12,"Miami, FL",400,109,181,162,4,40,Other,73311.68,Bronze,Digital Wallet,False,Percentage Discount,Cloudy,True,Wednesday,False,388,242,2024-09-14 22:38:00,2024,9,37,0
1878,1272,280,Smartphone,Appliances,2,1892.08,5/15/2024 12:53,17,"Miami, FL",453,58,221,270,9,63,Female,71238.43,Silver,Cash,True,Percentage Discount,Rainy,False,Friday,True,195,312,2024-05-15 12:53:00,2024,5,20,0
1879,7035,261,Laptop,Appliances,5,1492.41,2/23/2024 15:08,11,"Los Angeles, CA",341,97,177,174,7,52,Male,94867.84,Silver,Debit Card,False,0,Sunny,True,Saturday,True,473,159,2024-02-23 15:08:00,2024,2,8,0
1880,6427,904,Tablet,Electronics,4,1419.2,3/2/2024 10:20,15,"Los Angeles, CA",255,104,233,401,9,30,Male,85274.51,Platinum,Credit Card,True,Percentage Discount,Cloudy,True,Saturday,True,211,279,2024-03-02 10:20:00,2024,3,9,0
1881,2795,129,Fridge,Electronics,5,1247.08,7/15/2024 0:00,17,"Chicago, IL",144,148,196,230,2,56,Female,111878.36,Platinum,Credit Card,True,0,Stormy,False,Sunday,True,161,312,2024-07-15 00:00:00,2024,7,29,0
1882,7824,596,Laptop,Appliances,1,1189.4,7/31/2024 1:28,8,"Miami, FL",292,87,154,155,7,30,Male,84215.3,Silver,Digital Wallet,True,0,Rainy,True,Wednesday,False,222,257,2024-07-31 01:28:00,2024,7,31,0
1883,6040,627,Smartphone,Appliances,3,470.25,5/30/2024 3:12,16,"Miami, FL",41,62,262,354,6,23,Other,49837.56,Gold,Cash,True,0,Rainy,True,Sunday,False,382,187,2024-05-30 03:12:00,2024,5,22,0
1884,1436,218,Washing Machine,Electronics,3,1385.39,7/12/2024 12:35,11,"Miami, FL",323,91,138,320,3,51,Other,98723.2,Bronze,Digital Wallet,True,Percentage Discount,Sunny,True,Wednesday,False,338,158,2024-07-12 12:35:00,2024,7,28,0
1885,8775,172,Camera,Electronics,5,575.12,2/14/2024 16:56,14,"Miami, FL",46,80,242,156,3,41,Other,50830.1,Bronze,Credit Card,True,0,Cloudy,True,Saturday,True,109,449,2024-02-14 16:56:00,2024,2,7,0
1886,5350,340,Smartphone,Electronics,1,320.04,3/17/2024 14:47,18,"Chicago, IL",221,77,118,156,4,64,Male,65785.16,Silver,Cash,True,0,Stormy,False,Saturday,True,232,106,2024-03-17 14:47:00,2024,3,11,0
1887,4728,838,TV,Electronics,1,305.43,9/1/2024 12:09,3,"Chicago, IL",413,145,102,149,6,45,Other,64529.85,Bronze,Debit Card,True,0,Cloudy,True,Thursday,True,425,201,2024-09-01 12:09:00,2024,9,35,0
1888,1841,555,TV,Appliances,5,264.98,8/24/2024 16:01,13,"Los Angeles, CA",122,54,275,257,1,42,Male,36010.21,Gold,Cash,True,Percentage Discount,Cloudy,True,Wednesday,False,193,354,2024-08-24 16:01:00,2024,8,34,0
1889,8871,706,Headphones,Electronics,5,902.32,8/15/2024 16:48,16,"Miami, FL",130,107,270,363,8,64,Female,70707.27,Silver,Debit Card,True,0,Cloudy,False,Saturday,True,290,233,2024-08-15 16:48:00,2024,8,33,0
1890,3793,693,TV,Electronics,2,1576.03,3/16/2024 14:34,17,"Los Angeles, CA",436,148,226,219,10,63,Female,52593.3,Bronze,Cash,True,0,Stormy,True,Saturday,False,163,200,2024-03-16 14:34:00,2024,3,11,0
1891,9589,433,TV,Appliances,1,773.93,4/27/2024 9:27,10,"Miami, FL",333,52,271,180,10,39,Male,115141.06,Platinum,Digital Wallet,True,0,Cloudy,False,Monday,True,483,430,2024-04-27 09:27:00,2024,4,17,0
1892,7229,529,Fridge,Appliances,4,58.52,3/22/2024 12:27,7,"New York, NY",362,98,291,228,4,34,Male,98903.91,Bronze,Debit Card,False,Percentage Discount,Sunny,True,Thursday,False,267,265,2024-03-22 12:27:00,2024,3,12,0
1893,3421,303,Headphones,Appliances,4,337.32,5/6/2024 20:16,10,"Miami, FL",113,102,293,484,8,54,Other,116461.42,Silver,Credit Card,True,BOGO,Rainy,False,Saturday,True,375,227,2024-05-06 20:16:00,2024,5,19,0
1894,4968,865,Laptop,Electronics,5,431.97,9/6/2024 14:14,2,"Dallas, TX",439,103,100,460,9,33,Female,88485.48,Silver,Cash,True,0,Rainy,False,Wednesday,False,350,99,2024-09-06 14:14:00,2024,9,36,0
1895,1517,793,Headphones,Electronics,1,1791.31,3/1/2024 23:25,16,"Chicago, IL",348,137,300,119,8,34,Other,27818.29,Bronze,Credit Card,False,Percentage Discount,Stormy,True,Saturday,True,118,379,2024-03-01 23:25:00,2024,3,9,0
1896,2800,433,Tablet,Electronics,3,949.86,8/26/2024 1:26,7,"Dallas, TX",17,113,187,406,4,47,Male,95539.99,Silver,Credit Card,False,0,Cloudy,True,Monday,True,464,315,2024-08-26 01:26:00,2024,8,35,0
1897,4125,335,Smartphone,Electronics,3,1968.73,6/15/2024 17:20,2,"Miami, FL",117,57,200,307,6,50,Other,76369.02,Gold,Digital Wallet,False,BOGO,Stormy,False,Tuesday,False,407,229,2024-06-15 17:20:00,2024,6,24,0
1898,1310,897,Laptop,Electronics,2,1394.67,2/14/2024 21:31,15,"New York, NY",482,132,115,483,3,24,Other,55501.39,Platinum,Credit Card,False,0,Sunny,True,Saturday,False,327,507,2024-02-14 21:31:00,2024,2,7,0
1899,8225,212,Tablet,Electronics,5,1716.47,3/12/2024 6:53,4,"Dallas, TX",48,134,186,275,2,68,Other,73629.23,Platinum,Digital Wallet,False,0,Cloudy,True,Friday,True,366,210,2024-03-12 06:53:00,2024,3,11,0
1900,6139,433,Tablet,Appliances,4,1352.85,5/1/2024 2:07,15,"Chicago, IL",31,139,180,487,10,27,Female,27184.97,Platinum,Debit Card,False,Percentage Discount,Stormy,True,Friday,True,326,235,2024-05-01 02:07:00,2024,5,18,0
1901,7861,333,Washing Machine,Appliances,4,1413.11,6/24/2024 16:59,15,"Chicago, IL",365,101,222,169,10,67,Male,24490.47,Platinum,Digital Wallet,False,0,Rainy,True,Tuesday,True,167,245,2024-06-24 16:59:00,2024,6,26,0
1902,3481,200,Tablet,Electronics,5,609.41,7/7/2024 20:04,13,"Los Angeles, CA",486,77,153,446,9,44,Female,113132.47,Platinum,Cash,True,BOGO,Sunny,False,Saturday,False,446,135,2024-07-07 20:04:00,2024,7,27,0
1903,7765,342,Tablet,Appliances,2,722.53,2/15/2024 9:43,4,"Miami, FL",353,147,233,310,1,51,Other,40081.96,Platinum,Debit Card,False,Percentage Discount,Rainy,True,Friday,False,179,325,2024-02-15 09:43:00,2024,2,7,0
1904,4340,855,Smartphone,Appliances,2,1010.86,8/22/2024 0:19,7,"New York, NY",50,79,283,139,7,53,Male,66343.97,Bronze,Credit Card,True,0,Rainy,True,Wednesday,False,209,369,2024-08-22 00:19:00,2024,8,34,0
1905,7723,522,Headphones,Electronics,3,1156.11,7/21/2024 5:48,11,"Chicago, IL",198,61,260,167,9,50,Other,106167.98,Platinum,Digital Wallet,False,0,Cloudy,True,Thursday,False,266,349,2024-07-21 05:48:00,2024,7,29,0
1906,9221,990,Headphones,Appliances,1,1723.04,3/21/2024 16:01,1,"Los Angeles, CA",210,62,295,163,5,64,Female,114199.32,Gold,Digital Wallet,True,0,Rainy,True,Sunday,True,359,472,2024-03-21 16:01:00,2024,3,12,0
1907,8726,304,Smartphone,Electronics,3,317.03,1/23/2024 2:03,1,"Los Angeles, CA",120,123,172,298,10,25,Female,105114.21,Bronze,Debit Card,True,0,Stormy,True,Sunday,False,390,422,2024-01-23 02:03:00,2024,1,4,0
1908,2020,484,Tablet,Appliances,5,276.62,1/9/2024 8:07,16,"Miami, FL",393,150,129,311,7,18,Female,79086.58,Bronze,Credit Card,True,0,Stormy,True,Saturday,True,162,97,2024-01-09 08:07:00,2024,1,2,0
1909,3262,325,Tablet,Appliances,5,1063.52,9/11/2024 16:10,17,"New York, NY",192,58,113,465,1,48,Female,118091.83,Bronze,Cash,True,Percentage Discount,Stormy,False,Monday,False,248,114,2024-09-11 16:10:00,2024,9,37,0
1910,9498,175,Washing Machine,Electronics,1,1411.32,7/30/2024 13:39,18,"Los Angeles, CA",220,141,246,388,4,58,Other,92226.02,Bronze,Credit Card,True,Percentage Discount,Cloudy,True,Tuesday,False,450,338,2024-07-30 13:39:00,2024,7,31,0
1911,4397,582,Camera,Appliances,4,151.28,7/13/2024 18:08,7,"Dallas, TX",91,105,203,252,4,69,Other,43684.45,Bronze,Debit Card,True,0,Stormy,True,Monday,False,123,125,2024-07-13 18:08:00,2024,7,28,0
1912,6325,699,TV,Appliances,1,97.24,7/14/2024 2:54,13,"Dallas, TX",384,139,101,364,5,58,Male,115742.91,Platinum,Cash,False,0,Stormy,True,Wednesday,True,417,459,2024-07-14 02:54:00,2024,7,28,0
1913,8837,596,Fridge,Electronics,3,498.85,5/4/2024 1:08,19,"New York, NY",497,61,299,145,3,65,Female,65130.69,Silver,Debit Card,True,0,Stormy,False,Tuesday,True,182,401,2024-05-04 01:08:00,2024,5,18,0
1914,9609,155,Tablet,Electronics,2,1241.38,4/27/2024 11:28,6,"Miami, FL",73,63,107,459,10,53,Other,28840.43,Platinum,Digital Wallet,False,BOGO,Rainy,True,Tuesday,True,470,184,2024-04-27 11:28:00,2024,4,17,0
1915,7173,546,Washing Machine,Electronics,2,311.21,3/30/2024 5:16,5,"New York, NY",268,125,291,426,10,42,Other,20935.32,Platinum,Debit Card,True,0,Sunny,True,Wednesday,False,421,125,2024-03-30 05:16:00,2024,3,13,0
1916,6140,248,Laptop,Electronics,4,620.58,6/17/2024 18:16,7,"New York, NY",140,92,210,130,6,63,Female,37000.15,Silver,Cash,False,0,Cloudy,True,Friday,True,308,101,2024-06-17 18:16:00,2024,6,25,0
1917,3837,321,Fridge,Electronics,1,1133.23,3/5/2024 9:54,7,"New York, NY",185,93,197,100,1,58,Other,103336.34,Silver,Cash,False,0,Cloudy,True,Monday,True,276,321,2024-03-05 09:54:00,2024,3,10,0
1918,8531,724,Tablet,Electronics,1,1689.71,7/20/2024 22:51,17,"Dallas, TX",428,145,129,139,9,60,Other,89035.05,Gold,Cash,True,0,Sunny,False,Sunday,True,140,142,2024-07-20 22:51:00,2024,7,29,0
1919,9734,565,Washing Machine,Appliances,1,1890.3,3/13/2024 3:56,11,"New York, NY",162,78,204,132,7,33,Male,39319.84,Gold,Credit Card,False,0,Stormy,True,Wednesday,True,138,219,2024-03-13 03:56:00,2024,3,11,0
1920,6608,282,Tablet,Electronics,5,1897.62,9/3/2024 7:21,10,"Miami, FL",156,53,272,184,8,29,Other,65459.63,Gold,Credit Card,True,0,Sunny,True,Wednesday,False,461,408,2024-09-03 07:21:00,2024,9,36,0
1921,9950,496,TV,Appliances,2,1559.63,6/16/2024 16:55,1,"Los Angeles, CA",37,126,117,463,3,21,Other,85930.72,Bronze,Debit Card,False,0,Cloudy,False,Thursday,True,414,129,2024-06-16 16:55:00,2024,6,24,0
1922,6804,482,Fridge,Appliances,5,426.48,1/31/2024 1:39,8,"Dallas, TX",148,81,268,206,3,23,Male,105804.34,Gold,Credit Card,False,BOGO,Stormy,False,Monday,False,170,480,2024-01-31 01:39:00,2024,1,5,0
1923,5331,239,Fridge,Appliances,1,1307.96,5/26/2024 7:09,7,"Dallas, TX",384,112,187,212,7,56,Male,78052.98,Platinum,Credit Card,False,Percentage Discount,Stormy,True,Monday,False,112,472,2024-05-26 07:09:00,2024,5,21,0
1924,8932,568,Camera,Electronics,1,1767.62,7/25/2024 0:36,14,"New York, NY",1,76,149,456,7,47,Female,40842.23,Bronze,Cash,False,0,Cloudy,False,Tuesday,True,258,368,2024-07-25 00:36:00,2024,7,30,0
1925,4150,837,Washing Machine,Appliances,2,1402.16,8/16/2024 20:47,19,"Los Angeles, CA",273,142,120,111,3,20,Female,113935.72,Silver,Debit Card,False,Percentage Discount,Sunny,True,Thursday,True,284,166,2024-08-16 20:47:00,2024,8,33,0
1926,5038,298,Smartphone,Electronics,5,1856.61,7/2/2024 21:49,19,"Chicago, IL",325,64,212,162,9,58,Male,51368.55,Gold,Digital Wallet,False,0,Sunny,True,Monday,True,210,458,2024-07-02 21:49:00,2024,7,27,0
1927,5571,747,Smartphone,Electronics,2,1412.5,4/26/2024 18:06,20,"Miami, FL",169,74,196,314,2,70,Female,89462.67,Silver,Cash,False,0,Stormy,True,Friday,True,147,195,2024-04-26 18:06:00,2024,4,17,0
1928,5890,467,Headphones,Electronics,5,575.97,9/5/2024 18:55,11,"Dallas, TX",232,82,203,332,1,31,Other,54695.1,Gold,Debit Card,True,0,Stormy,True,Tuesday,True,275,363,2024-09-05 18:55:00,2024,9,36,0
1929,4684,376,Laptop,Appliances,4,174.86,1/21/2024 19:57,5,"Dallas, TX",315,137,105,396,8,19,Other,26802.48,Bronze,Digital Wallet,True,BOGO,Cloudy,False,Thursday,False,466,302,2024-01-21 19:57:00,2024,1,3,0
1930,5876,307,Smartphone,Electronics,3,1848.93,3/10/2024 14:43,18,"Los Angeles, CA",467,57,277,295,7,49,Female,49564.78,Platinum,Credit Card,True,0,Sunny,True,Tuesday,False,337,426,2024-03-10 14:43:00,2024,3,10,0
1931,5735,443,Laptop,Electronics,2,1002.06,7/18/2024 14:07,11,"Dallas, TX",474,79,142,272,8,58,Male,47408.2,Bronze,Cash,True,0,Cloudy,True,Monday,False,428,110,2024-07-18 14:07:00,2024,7,29,0
1932,4396,230,Tablet,Electronics,3,1543.58,4/20/2024 13:10,2,"Miami, FL",437,112,175,288,8,67,Female,86431.49,Bronze,Cash,False,Percentage Discount,Rainy,False,Tuesday,False,490,460,2024-04-20 13:10:00,2024,4,16,0
1933,9011,132,Camera,Electronics,3,918.27,6/28/2024 21:04,6,"Los Angeles, CA",487,113,174,420,8,51,Female,69488.05,Bronze,Cash,False,Percentage Discount,Sunny,False,Saturday,False,115,224,2024-06-28 21:04:00,2024,6,26,0
1934,6194,808,Camera,Appliances,1,821.08,9/2/2024 5:16,8,"New York, NY",193,129,277,299,9,25,Other,112276.2,Silver,Digital Wallet,True,0,Rainy,True,Friday,True,197,169,2024-09-02 05:16:00,2024,9,36,0
1935,8861,682,Washing Machine,Electronics,2,843.64,3/12/2024 1:48,3,"Dallas, TX",77,59,195,433,7,47,Male,63158.09,Gold,Cash,True,0,Cloudy,False,Saturday,True,492,438,2024-03-12 01:48:00,2024,3,11,0
1936,6714,161,Laptop,Electronics,4,478.43,5/20/2024 10:26,5,"Dallas, TX",83,109,196,337,8,65,Other,105054.92,Platinum,Cash,False,BOGO,Sunny,True,Saturday,False,219,119,2024-05-20 10:26:00,2024,5,21,0
1937,5480,387,Smartphone,Electronics,1,324.22,8/15/2024 21:28,13,"Los Angeles, CA",458,51,253,225,4,45,Other,33434.87,Bronze,Digital Wallet,True,0,Rainy,False,Tuesday,True,397,125,2024-08-15 21:28:00,2024,8,33,0
1938,5715,239,Headphones,Electronics,5,1732.64,2/23/2024 14:24,11,"Chicago, IL",294,149,218,195,10,26,Male,78764.2,Gold,Digital Wallet,True,0,Stormy,True,Friday,True,455,458,2024-02-23 14:24:00,2024,2,8,0
1939,2996,213,Tablet,Appliances,1,1960.09,1/3/2024 11:14,7,"Dallas, TX",180,77,279,213,8,33,Male,97258.48,Silver,Digital Wallet,True,BOGO,Stormy,False,Monday,True,108,382,2024-01-03 11:14:00,2024,1,1,0
1940,9899,972,TV,Electronics,5,1064.43,4/19/2024 20:41,6,"Chicago, IL",38,112,251,380,2,63,Female,101252.86,Silver,Debit Card,True,0,Sunny,True,Monday,False,127,117,2024-04-19 20:41:00,2024,4,16,0
1941,7220,576,Laptop,Appliances,3,440.9,7/13/2024 15:45,15,"Chicago, IL",391,123,123,472,9,29,Male,113628.86,Gold,Cash,False,0,Stormy,True,Monday,True,237,101,2024-07-13 15:45:00,2024,7,28,0
1942,7464,569,Laptop,Electronics,5,270.01,7/11/2024 12:33,8,"New York, NY",428,130,230,431,2,38,Female,72172.87,Gold,Cash,True,0,Stormy,False,Saturday,True,305,302,2024-07-11 12:33:00,2024,7,28,0
1943,6654,528,Smartphone,Appliances,1,1977.46,1/30/2024 17:35,11,"Dallas, TX",53,133,121,198,10,39,Other,117279.63,Silver,Digital Wallet,False,0,Cloudy,True,Sunday,False,469,487,2024-01-30 17:35:00,2024,1,5,0
1944,3399,275,TV,Electronics,5,1772.4,8/16/2024 8:51,11,"Dallas, TX",324,77,175,298,1,51,Female,30410.09,Platinum,Debit Card,True,Percentage Discount,Cloudy,False,Tuesday,True,231,484,2024-08-16 08:51:00,2024,8,33,0
1945,5758,878,Camera,Electronics,1,1659.61,3/31/2024 15:05,4,"New York, NY",0,53,154,358,6,52,Other,116839.82,Gold,Credit Card,False,BOGO,Stormy,False,Saturday,False,272,401,2024-03-31 15:05:00,2024,3,13,0
1946,1689,451,Tablet,Appliances,1,102.78,2/9/2024 3:58,10,"Dallas, TX",261,103,158,257,10,25,Male,34445.04,Platinum,Debit Card,True,0,Cloudy,True,Friday,True,321,255,2024-02-09 03:58:00,2024,2,6,0
1947,5712,325,TV,Electronics,3,1900.84,2/18/2024 4:58,20,"Los Angeles, CA",159,62,294,150,8,23,Female,95655.51,Gold,Digital Wallet,True,0,Sunny,True,Thursday,False,498,472,2024-02-18 04:58:00,2024,2,7,0
1948,2294,402,Laptop,Appliances,3,145.57,6/10/2024 11:28,15,"Dallas, TX",269,118,276,250,5,59,Other,94845.62,Bronze,Credit Card,False,BOGO,Sunny,False,Saturday,False,344,244,2024-06-10 11:28:00,2024,6,24,0
1949,6674,718,Camera,Electronics,1,1781.82,5/22/2024 23:36,5,"Los Angeles, CA",218,124,199,223,7,65,Other,24697.08,Platinum,Debit Card,True,0,Rainy,False,Tuesday,False,382,343,2024-05-22 23:36:00,2024,5,21,0
1950,8247,260,Smartphone,Appliances,2,1367.98,4/17/2024 2:21,9,"Dallas, TX",40,67,258,257,9,63,Other,57778.14,Silver,Credit Card,False,Percentage Discount,Cloudy,True,Wednesday,True,419,491,2024-04-17 02:21:00,2024,4,16,0
1951,5201,908,TV,Appliances,3,619.75,8/23/2024 10:29,20,"Dallas, TX",18,56,215,244,10,57,Male,97257.43,Platinum,Digital Wallet,False,0,Rainy,True,Wednesday,True,493,496,2024-08-23 10:29:00,2024,8,34,0
1952,8849,913,Tablet,Electronics,2,1840.31,1/1/2024 16:24,2,"Miami, FL",195,51,184,301,10,59,Other,88166.43,Gold,Digital Wallet,False,0,Stormy,False,Thursday,True,353,499,2024-01-01 16:24:00,2024,1,1,0
1953,4505,753,Smartphone,Appliances,4,296.68,8/14/2024 22:48,7,"Chicago, IL",374,86,217,186,4,25,Female,52416.16,Silver,Digital Wallet,False,Percentage Discount,Sunny,False,Thursday,True,280,210,2024-08-14 22:48:00,2024,8,33,0
1954,4310,726,Headphones,Appliances,2,1643.36,3/4/2024 18:51,5,"Chicago, IL",396,97,185,189,4,28,Other,117952.25,Silver,Debit Card,False,0,Sunny,False,Friday,True,249,395,2024-03-04 18:51:00,2024,3,10,0
1955,9824,274,Headphones,Appliances,4,1557.81,4/18/2024 15:41,5,"New York, NY",212,116,192,358,1,65,Female,77791.94,Platinum,Credit Card,True,0,Stormy,False,Monday,False,302,246,2024-04-18 15:41:00,2024,4,16,0
1956,5442,691,Washing Machine,Appliances,1,1745.87,1/20/2024 23:04,8,"Chicago, IL",382,66,167,111,6,46,Female,56348.11,Silver,Cash,True,BOGO,Rainy,True,Thursday,True,252,120,2024-01-20 23:04:00,2024,1,3,0
1957,5450,666,TV,Electronics,3,446.9,5/10/2024 18:23,9,"Chicago, IL",22,55,200,483,4,47,Female,51812.62,Platinum,Debit Card,True,Percentage Discount,Sunny,False,Saturday,True,105,284,2024-05-10 18:23:00,2024,5,19,0
1958,3249,975,Tablet,Electronics,5,1986.06,4/2/2024 23:48,16,"Chicago, IL",378,111,104,349,8,44,Male,85828.08,Silver,Credit Card,False,BOGO,Rainy,True,Thursday,True,210,134,2024-04-02 23:48:00,2024,4,14,0
1959,2789,335,Camera,Appliances,4,464.41,1/11/2024 13:26,16,"New York, NY",337,68,198,235,5,24,Male,88689.42,Gold,Digital Wallet,True,0,Sunny,False,Tuesday,True,436,312,2024-01-11 13:26:00,2024,1,2,0
1960,4920,188,Headphones,Appliances,2,1705.77,9/12/2024 2:29,3,"Los Angeles, CA",404,62,242,439,1,41,Other,66315.69,Bronze,Debit Card,True,0,Rainy,False,Thursday,True,111,244,2024-09-12 02:29:00,2024,9,37,0
1961,4972,521,Washing Machine,Appliances,4,1367.61,8/12/2024 22:27,10,"Dallas, TX",30,100,148,408,7,24,Female,97031.57,Bronze,Digital Wallet,False,Percentage Discount,Cloudy,True,Tuesday,True,225,357,2024-08-12 22:27:00,2024,8,33,0
1962,1831,977,Washing Machine,Electronics,4,793.0,3/20/2024 10:17,14,"Miami, FL",93,73,168,429,3,52,Male,45175.2,Gold,Credit Card,False,BOGO,Cloudy,True,Monday,True,337,147,2024-03-20 10:17:00,2024,3,12,0
1963,9700,634,Fridge,Electronics,2,1896.64,1/30/2024 18:04,20,"Dallas, TX",443,84,298,128,5,19,Male,56854.56,Silver,Credit Card,False,0,Sunny,False,Sunday,True,463,352,2024-01-30 18:04:00,2024,1,5,0
1964,4697,600,Fridge,Appliances,4,1043.54,6/17/2024 7:03,11,"Miami, FL",199,107,146,260,3,46,Female,89228.94,Gold,Digital Wallet,True,0,Stormy,False,Wednesday,True,189,351,2024-06-17 07:03:00,2024,6,25,0
1965,4814,982,TV,Electronics,1,1880.08,3/7/2024 6:31,2,"Miami, FL",456,138,206,202,7,50,Other,110893.62,Platinum,Cash,False,BOGO,Stormy,False,Tuesday,True,324,389,2024-03-07 06:31:00,2024,3,10,0
1966,1860,321,Headphones,Appliances,2,1398.11,5/28/2024 8:28,19,"Chicago, IL",3,88,105,362,2,35,Male,60628.88,Gold,Digital Wallet,False,0,Rainy,True,Monday,True,311,346,2024-05-28 08:28:00,2024,5,22,0
1967,2641,705,Smartphone,Electronics,3,1230.24,2/4/2024 17:20,8,"Chicago, IL",151,66,195,445,1,37,Male,91613.92,Bronze,Cash,True,0,Cloudy,True,Wednesday,False,294,471,2024-02-04 17:20:00,2024,2,5,0
1968,7771,584,TV,Electronics,5,1022.59,3/4/2024 12:50,12,"Chicago, IL",214,88,149,473,4,26,Other,60647.19,Platinum,Digital Wallet,False,BOGO,Stormy,True,Sunday,False,211,324,2024-03-04 12:50:00,2024,3,10,0
1969,6411,957,Headphones,Electronics,5,1493.13,2/13/2024 15:43,11,"Chicago, IL",302,105,160,392,4,34,Male,91526.42,Gold,Digital Wallet,True,0,Cloudy,False,Monday,True,396,230,2024-02-13 15:43:00,2024,2,7,0
1970,8739,573,Fridge,Electronics,4,217.3,1/4/2024 18:49,12,"Los Angeles, CA",9,121,234,498,3,42,Male,33097.97,Bronze,Debit Card,False,BOGO,Cloudy,True,Monday,False,330,205,2024-01-04 18:49:00,2024,1,1,0
1971,2647,385,Tablet,Electronics,5,453.35,1/20/2024 21:09,12,"New York, NY",326,84,239,428,5,47,Male,57324.23,Platinum,Digital Wallet,False,BOGO,Sunny,False,Tuesday,False,275,142,2024-01-20 21:09:00,2024,1,3,0
1972,3252,114,Headphones,Electronics,2,67.02,2/2/2024 20:03,15,"Miami, FL",53,111,140,106,9,45,Male,47122.09,Gold,Cash,True,BOGO,Cloudy,False,Tuesday,True,414,250,2024-02-02 20:03:00,2024,2,5,0
1973,1084,847,Smartphone,Electronics,2,704.36,7/9/2024 4:14,2,"Chicago, IL",226,81,261,275,8,68,Other,59234.14,Silver,Cash,False,0,Cloudy,False,Saturday,False,398,331,2024-07-09 04:14:00,2024,7,28,0
1974,3587,538,TV,Electronics,3,1370.5,6/11/2024 17:22,5,"Chicago, IL",134,68,179,473,8,62,Male,23010.36,Silver,Cash,True,0,Sunny,False,Monday,False,375,322,2024-06-11 17:22:00,2024,6,24,0
1975,7666,853,Washing Machine,Electronics,2,1232.85,3/17/2024 17:56,2,"Dallas, TX",313,96,255,414,4,68,Other,101870.34,Bronze,Digital Wallet,True,Percentage Discount,Stormy,False,Saturday,False,256,428,2024-03-17 17:56:00,2024,3,11,0
1976,8793,993,Fridge,Electronics,5,607.78,3/27/2024 7:30,2,"New York, NY",337,91,280,288,7,19,Male,68585.39,Gold,Debit Card,True,0,Stormy,False,Tuesday,False,225,416,2024-03-27 07:30:00,2024,3,13,0
1977,8822,352,Washing Machine,Appliances,1,897.99,7/4/2024 16:58,14,"New York, NY",171,57,250,103,6,21,Male,20757.96,Gold,Credit Card,False,0,Cloudy,False,Saturday,True,192,171,2024-07-04 16:58:00,2024,7,27,0
1978,4267,353,Fridge,Electronics,1,1836.16,9/12/2024 7:09,4,"Chicago, IL",102,148,211,414,2,34,Other,74783.33,Bronze,Debit Card,False,BOGO,Rainy,True,Tuesday,False,451,193,2024-09-12 07:09:00,2024,9,37,0
1979,5706,435,Headphones,Electronics,3,309.51,6/19/2024 15:58,16,"Los Angeles, CA",261,104,250,490,9,60,Male,66955.02,Platinum,Debit Card,True,0,Cloudy,False,Tuesday,True,429,372,2024-06-19 15:58:00,2024,6,25,0
1980,6262,544,Camera,Appliances,5,1146.47,7/8/2024 12:06,9,"Dallas, TX",424,92,202,473,9,26,Male,115286.39,Platinum,Digital Wallet,True,0,Sunny,False,Thursday,True,131,273,2024-07-08 12:06:00,2024,7,28,0
1981,5676,693,Tablet,Electronics,3,772.42,8/25/2024 0:38,3,"Los Angeles, CA",324,67,196,238,5,69,Male,99564.87,Gold,Cash,False,0,Rainy,True,Thursday,True,312,161,2024-08-25 00:38:00,2024,8,34,0
1982,1969,327,Fridge,Electronics,4,867.65,7/9/2024 21:32,7,"New York, NY",319,123,285,182,10,40,Other,103914.15,Bronze,Digital Wallet,True,0,Sunny,True,Sunday,True,383,475,2024-07-09 21:32:00,2024,7,28,0
1983,2465,705,Fridge,Electronics,1,1158.11,4/1/2024 10:09,14,"New York, NY",54,134,112,368,2,56,Female,40929.25,Gold,Digital Wallet,True,0,Stormy,False,Thursday,True,395,132,2024-04-01 10:09:00,2024,4,14,0
1984,4804,252,TV,Electronics,3,1676.19,2/13/2024 8:19,10,"Dallas, TX",465,127,239,428,10,46,Male,22845.49,Silver,Credit Card,False,0,Sunny,False,Monday,False,247,191,2024-02-13 08:19:00,2024,2,7,0
1985,9767,687,Camera,Electronics,3,271.76,8/1/2024 13:33,9,"Dallas, TX",421,53,280,135,9,44,Female,65572.78,Platinum,Digital Wallet,True,BOGO,Rainy,False,Sunday,True,330,180,2024-08-01 13:33:00,2024,8,31,0
1986,1611,105,Camera,Appliances,4,416.2,3/3/2024 3:28,12,"New York, NY",368,92,300,323,7,38,Female,117582.91,Silver,Debit Card,True,0,Sunny,True,Wednesday,True,404,397,2024-03-03 03:28:00,2024,3,9,0
1987,3868,527,Tablet,Electronics,2,560.02,5/16/2024 23:16,19,"Los Angeles, CA",194,141,285,378,7,49,Female,31586.85,Platinum,Debit Card,True,BOGO,Stormy,True,Friday,True,120,125,2024-05-16 23:16:00,2024,5,20,0
1988,7846,145,Washing Machine,Appliances,1,770.7,8/26/2024 9:08,9,"New York, NY",456,78,275,218,2,23,Other,105237.92,Silver,Cash,False,Percentage Discount,Rainy,True,Friday,False,371,109,2024-08-26 09:08:00,2024,8,35,0
1989,3880,141,Smartphone,Electronics,3,1740.97,6/1/2024 0:02,16,"New York, NY",420,99,129,303,4,29,Female,94014.17,Gold,Debit Card,True,0,Cloudy,True,Saturday,True,450,296,2024-06-01 00:02:00,2024,6,22,0
1990,1595,581,Laptop,Appliances,4,1820.79,8/29/2024 2:19,13,"Miami, FL",68,106,231,178,3,39,Other,101623.58,Platinum,Debit Card,False,BOGO,Rainy,False,Saturday,True,249,294,2024-08-29 02:19:00,2024,8,35,0
1991,7504,851,Headphones,Electronics,4,1864.53,2/12/2024 12:28,4,"Chicago, IL",461,129,219,269,10,34,Female,101588.36,Silver,Cash,False,0,Rainy,False,Friday,False,105,404,2024-02-12 12:28:00,2024,2,7,0
1992,9116,887,Fridge,Electronics,2,779.69,5/9/2024 2:20,6,"Dallas, TX",159,131,293,328,5,37,Male,37988.41,Silver,Credit Card,False,0,Rainy,False,Friday,True,261,394,2024-05-09 02:20:00,2024,5,19,0
1993,4052,616,Headphones,Electronics,5,1658.5,8/18/2024 21:36,4,"Los Angeles, CA",142,65,181,351,1,40,Male,58444.08,Bronze,Cash,True,BOGO,Cloudy,True,Sunday,True,374,244,2024-08-18 21:36:00,2024,8,33,0
1994,5742,134,Camera,Appliances,4,1939.79,4/26/2024 14:27,18,"Chicago, IL",37,66,232,191,7,52,Female,109692.23,Bronze,Debit Card,False,0,Stormy,True,Tuesday,True,432,333,2024-04-26 14:27:00,2024,4,17,0
1995,1613,535,Fridge,Appliances,5,1755.51,6/27/2024 18:37,19,"Dallas, TX",493,53,242,143,4,37,Male,72245.85,Silver,Debit Card,True,0,Rainy,False,Sunday,True,346,260,2024-06-27 18:37:00,2024,6,26,0
1996,1151,643,Laptop,Appliances,2,201.02,1/17/2024 21:13,8,"Los Angeles, CA",12,107,109,113,6,69,Female,96831.36,Silver,Credit Card,True,0,Cloudy,False,Sunday,False,336,408,2024-01-17 21:13:00,2024,1,3,0
1997,5888,503,Tablet,Appliances,3,1802.9,8/15/2024 14:30,20,"Los Angeles, CA",213,70,173,458,8,46,Other,38131.53,Gold,Digital Wallet,True,0,Sunny,True,Wednesday,True,206,215,2024-08-15 14:30:00,2024,8,33,0
1998,2758,590,Smartphone,Appliances,3,618.96,6/29/2024 21:11,3,"Dallas, TX",199,145,127,356,3,54,Female,42885.27,Bronze,Credit Card,True,0,Cloudy,False,Saturday,True,333,466,2024-06-29 21:11:00,2024,6,26,0
1999,6489,929,Camera,Appliances,1,263.96,1/28/2024 13:02,5,"Chicago, IL",320,143,174,351,5,60,Other,36910.89,Bronze,Credit Card,True,0,Rainy,True,Tuesday,False,259,478,2024-01-28 13:02:00,2024,1,4,0
2000,5662,917,Fridge,Electronics,1,722.71,1/24/2024 9:16,16,"Los Angeles, CA",251,54,263,194,8,69,Other,76377.68,Platinum,Digital Wallet,True,0,Sunny,True,Friday,False,441,503,2024-01-24 09:16:00,2024,1,4,0
2001,8444,813,Smartphone,Electronics,4,1804.28,2/12/2024 17:21,1,"Los Angeles, CA",279,129,105,339,7,40,Female,25873.16,Platinum,Debit Card,False,0,Rainy,True,Saturday,True,424,321,2024-02-12 17:21:00,2024,2,7,0
2002,9901,941,Camera,Electronics,3,1445.02,3/8/2024 3:11,14,"New York, NY",278,94,149,246,4,23,Male,100801.74,Bronze,Digital Wallet,False,0,Stormy,False,Thursday,False,270,331,2024-03-08 03:11:00,2024,3,10,0
2003,9590,200,TV,Appliances,2,1794.42,3/28/2024 6:29,11,"Chicago, IL",147,111,207,162,10,56,Male,37013.25,Gold,Credit Card,True,0,Stormy,True,Wednesday,True,500,422,2024-03-28 06:29:00,2024,3,13,0
2004,9092,563,Tablet,Appliances,4,1302.45,7/8/2024 22:16,1,"Miami, FL",163,120,157,125,9,43,Female,74216.72,Gold,Debit Card,True,Percentage Discount,Cloudy,False,Sunday,False,418,331,2024-07-08 22:16:00,2024,7,28,0
2005,3198,607,TV,Electronics,5,1104.74,7/4/2024 21:04,15,"Miami, FL",240,134,178,290,6,22,Male,93830.06,Silver,Credit Card,True,BOGO,Sunny,True,Thursday,False,159,267,2024-07-04 21:04:00,2024,7,27,0
2006,9261,346,Camera,Electronics,1,145.14,7/8/2024 8:08,13,"Dallas, TX",447,127,234,398,8,34,Female,49123.4,Platinum,Debit Card,True,0,Stormy,True,Monday,True,189,323,2024-07-08 08:08:00,2024,7,28,0
2007,8668,185,Camera,Appliances,2,1905.73,2/12/2024 11:01,4,"Miami, FL",476,52,213,140,3,54,Female,59413.07,Platinum,Cash,True,BOGO,Sunny,True,Wednesday,False,116,187,2024-02-12 11:01:00,2024,2,7,0
2008,5470,671,Smartphone,Appliances,5,1480.81,7/5/2024 8:28,5,"Dallas, TX",113,79,166,279,7,57,Other,20298.93,Silver,Debit Card,True,Percentage Discount,Cloudy,False,Saturday,False,437,119,2024-07-05 08:28:00,2024,7,27,0
2009,4159,871,Camera,Appliances,2,1175.3,6/25/2024 16:38,6,"Chicago, IL",434,90,185,479,9,19,Female,85434.62,Bronze,Credit Card,False,BOGO,Cloudy,False,Friday,False,175,275,2024-06-25 16:38:00,2024,6,26,0
2010,2845,112,Tablet,Appliances,4,1526.8,3/6/2024 1:29,5,"Chicago, IL",423,139,126,335,6,22,Female,91570.95,Platinum,Digital Wallet,True,0,Cloudy,False,Friday,True,145,386,2024-03-06 01:29:00,2024,3,10,0
2011,6417,809,Laptop,Electronics,4,1483.83,1/17/2024 18:49,18,"Dallas, TX",75,139,135,393,1,60,Female,86086.37,Gold,Debit Card,False,BOGO,Sunny,True,Wednesday,True,101,288,2024-01-17 18:49:00,2024,1,3,0
2012,3662,849,Camera,Appliances,2,607.39,4/21/2024 11:01,8,"Miami, FL",465,91,290,360,1,63,Male,119736.2,Silver,Digital Wallet,False,BOGO,Stormy,True,Sunday,False,398,484,2024-04-21 11:01:00,2024,4,16,0
2013,8518,516,Laptop,Electronics,4,1294.21,3/28/2024 8:24,1,"Miami, FL",38,51,199,482,8,34,Other,72709.55,Bronze,Cash,False,0,Sunny,False,Sunday,True,161,162,2024-03-28 08:24:00,2024,3,13,0
2014,5215,323,Camera,Appliances,1,169.44,4/30/2024 12:49,12,"Los Angeles, CA",220,118,130,483,3,19,Male,53181.2,Bronze,Digital Wallet,False,BOGO,Rainy,True,Saturday,True,242,128,2024-04-30 12:49:00,2024,4,18,0
2015,4050,235,TV,Appliances,2,169.8,6/11/2024 19:23,13,"Dallas, TX",178,62,244,143,9,62,Male,70636.41,Gold,Digital Wallet,True,0,Cloudy,True,Monday,True,408,443,2024-06-11 19:23:00,2024,6,24,0
2016,1230,467,Washing Machine,Electronics,5,521.88,6/8/2024 15:24,10,"Dallas, TX",28,122,161,291,5,55,Other,80538.29,Silver,Cash,True,BOGO,Cloudy,False,Wednesday,False,136,475,2024-06-08 15:24:00,2024,6,23,0
2017,6523,402,Camera,Electronics,5,729.71,7/15/2024 11:42,10,"Miami, FL",447,127,215,273,4,19,Male,98334.47,Bronze,Credit Card,True,0,Stormy,False,Saturday,True,307,95,2024-07-15 11:42:00,2024,7,29,0
2018,5833,344,TV,Electronics,4,800.68,3/31/2024 22:28,14,"New York, NY",90,146,256,272,9,39,Other,43921.87,Silver,Debit Card,False,0,Cloudy,True,Wednesday,True,465,219,2024-03-31 22:28:00,2024,3,13,0
2019,4164,763,Tablet,Appliances,4,1042.49,5/26/2024 3:23,18,"Miami, FL",466,103,114,146,6,37,Other,34555.42,Platinum,Digital Wallet,True,0,Cloudy,False,Thursday,True,430,336,2024-05-26 03:23:00,2024,5,21,0
2020,3875,192,Fridge,Appliances,4,197.9,8/22/2024 3:16,12,"Dallas, TX",349,119,142,382,9,59,Other,82349.25,Silver,Cash,True,0,Stormy,False,Sunday,True,496,335,2024-08-22 03:16:00,2024,8,34,0
2021,7643,116,Headphones,Electronics,1,466.47,7/28/2024 7:12,8,"Miami, FL",140,145,140,259,1,37,Other,87124.43,Platinum,Credit Card,True,0,Sunny,True,Saturday,False,376,143,2024-07-28 07:12:00,2024,7,30,0
2022,8007,591,TV,Appliances,3,693.84,5/6/2024 7:35,1,"Miami, FL",78,83,267,403,1,37,Male,101270.79,Bronze,Credit Card,True,0,Stormy,False,Friday,False,494,309,2024-05-06 07:35:00,2024,5,19,0
2023,9442,785,TV,Electronics,2,1068.76,6/8/2024 13:50,9,"Dallas, TX",459,85,290,282,10,54,Female,42944.6,Platinum,Credit Card,False,BOGO,Rainy,True,Monday,False,355,435,2024-06-08 13:50:00,2024,6,23,0
2024,6372,412,Tablet,Appliances,3,1326.33,3/28/2024 6:38,12,"Chicago, IL",108,91,255,467,10,45,Male,93376.39,Bronze,Credit Card,True,Percentage Discount,Cloudy,False,Tuesday,True,264,339,2024-03-28 06:38:00,2024,3,13,0
2025,2421,265,Headphones,Electronics,2,585.16,5/22/2024 6:57,12,"Dallas, TX",396,105,153,288,10,28,Male,112115.99,Platinum,Cash,False,0,Cloudy,True,Saturday,True,420,175,2024-05-22 06:57:00,2024,5,21,0
2026,7567,820,Tablet,Appliances,5,1309.17,6/1/2024 11:35,11,"Dallas, TX",268,91,105,185,9,59,Female,49734.2,Silver,Digital Wallet,True,Percentage Discount,Rainy,True,Thursday,False,482,299,2024-06-01 11:35:00,2024,6,22,0
2027,2562,570,Fridge,Appliances,1,980.76,1/1/2024 9:04,11,"Chicago, IL",292,140,253,418,7,65,Other,29495.13,Gold,Digital Wallet,False,BOGO,Rainy,True,Friday,True,326,460,2024-01-01 09:04:00,2024,1,1,0
2028,4027,978,Fridge,Electronics,4,943.26,5/16/2024 7:17,19,"Miami, FL",99,107,265,317,7,41,Male,80499.67,Gold,Digital Wallet,True,0,Rainy,True,Friday,True,235,207,2024-05-16 07:17:00,2024,5,20,0
2029,3303,684,Camera,Appliances,3,736.91,7/28/2024 16:51,11,"Chicago, IL",177,145,276,231,10,27,Other,119561.19,Bronze,Cash,False,Percentage Discount,Sunny,False,Thursday,True,475,213,2024-07-28 16:51:00,2024,7,30,0
2030,8822,865,Camera,Electronics,3,147.38,2/27/2024 21:47,2,"Miami, FL",136,139,174,226,3,25,Female,49964.98,Silver,Credit Card,True,0,Cloudy,True,Tuesday,False,467,160,2024-02-27 21:47:00,2024,2,9,0
2031,6301,697,TV,Appliances,1,132.02,3/26/2024 2:45,5,"New York, NY",380,142,175,420,5,44,Other,89112.02,Bronze,Credit Card,True,0,Cloudy,False,Monday,True,399,486,2024-03-26 02:45:00,2024,3,13,0
2032,5064,124,TV,Electronics,4,1296.37,4/16/2024 9:06,14,"Chicago, IL",130,118,155,262,6,40,Other,97894.42,Bronze,Cash,False,BOGO,Sunny,False,Monday,False,185,243,2024-04-16 09:06:00,2024,4,16,0
2033,1111,565,Laptop,Appliances,1,251.06,9/15/2024 1:47,7,"New York, NY",433,149,117,171,1,33,Other,61629.92,Silver,Credit Card,False,0,Cloudy,True,Wednesday,True,176,367,2024-09-15 01:47:00,2024,9,37,0
2034,5272,574,Washing Machine,Appliances,1,836.47,2/23/2024 19:56,11,"Los Angeles, CA",427,60,275,170,6,53,Male,107001.43,Platinum,Digital Wallet,True,0,Sunny,True,Wednesday,True,167,172,2024-02-23 19:56:00,2024,2,8,0
2035,7284,890,Washing Machine,Appliances,1,1866.22,8/9/2024 19:48,14,"Dallas, TX",7,143,141,149,2,70,Female,94807.17,Platinum,Digital Wallet,False,0,Rainy,False,Sunday,False,121,338,2024-08-09 19:48:00,2024,8,32,0
2036,4858,241,Laptop,Electronics,5,793.79,9/12/2024 17:38,1,"Dallas, TX",235,107,121,347,5,57,Male,48321.41,Silver,Debit Card,False,0,Rainy,True,Saturday,True,103,156,2024-09-12 17:38:00,2024,9,37,0
2037,8319,995,Headphones,Appliances,4,922.39,1/26/2024 21:47,16,"Los Angeles, CA",39,83,150,201,10,47,Male,61469.38,Gold,Cash,False,0,Stormy,False,Saturday,True,428,151,2024-01-26 21:47:00,2024,1,4,0
2038,5374,820,Fridge,Electronics,3,999.76,6/11/2024 2:07,16,"Chicago, IL",409,87,170,165,1,70,Female,45820.75,Gold,Cash,False,0,Stormy,True,Saturday,True,379,107,2024-06-11 02:07:00,2024,6,24,0
2039,6400,515,Tablet,Appliances,2,1640.5,3/28/2024 17:19,16,"Dallas, TX",34,73,282,382,5,67,Male,105648.31,Bronze,Cash,True,0,Rainy,True,Tuesday,True,234,260,2024-03-28 17:19:00,2024,3,13,0
2040,5947,289,Tablet,Appliances,3,1120.38,8/26/2024 20:28,18,"New York, NY",328,54,182,256,9,69,Female,50922.81,Silver,Credit Card,True,BOGO,Stormy,False,Saturday,True,232,357,2024-08-26 20:28:00,2024,8,35,0
2041,1187,908,Washing Machine,Appliances,5,120.38,2/2/2024 22:26,20,"Miami, FL",473,90,184,172,8,65,Female,96587.76,Silver,Debit Card,False,Percentage Discount,Stormy,False,Tuesday,True,149,291,2024-02-02 22:26:00,2024,2,5,0
2042,5285,992,Smartphone,Appliances,3,1926.03,2/7/2024 23:57,10,"Miami, FL",7,83,212,235,4,31,Male,114356.28,Bronze,Digital Wallet,True,BOGO,Sunny,False,Thursday,True,295,366,2024-02-07 23:57:00,2024,2,6,0
2043,6890,479,Camera,Electronics,4,1235.99,8/6/2024 17:01,7,"Miami, FL",351,57,255,497,6,68,Female,49119.05,Platinum,Cash,True,Percentage Discount,Sunny,True,Monday,False,387,189,2024-08-06 17:01:00,2024,8,32,0
2044,4871,741,Fridge,Appliances,3,351.8,4/19/2024 0:34,8,"Los Angeles, CA",237,131,256,368,10,55,Female,109871.37,Gold,Debit Card,False,0,Stormy,True,Sunday,False,455,115,2024-04-19 00:34:00,2024,4,16,0
2045,2017,575,TV,Electronics,1,952.05,1/8/2024 3:03,5,"Miami, FL",387,96,252,345,8,68,Female,60472.51,Platinum,Debit Card,True,0,Sunny,False,Tuesday,True,318,346,2024-01-08 03:03:00,2024,1,2,0
2046,2936,820,Laptop,Appliances,3,1828.2,8/17/2024 22:53,16,"Dallas, TX",87,60,107,429,6,61,Male,41572.86,Platinum,Credit Card,False,0,Stormy,False,Friday,False,238,155,2024-08-17 22:53:00,2024,8,33,0
2047,8625,748,Headphones,Electronics,1,250.28,1/15/2024 1:15,14,"New York, NY",315,97,110,443,5,21,Other,62479.24,Gold,Credit Card,False,0,Sunny,False,Monday,True,291,292,2024-01-15 01:15:00,2024,1,3,0
2048,6026,101,Laptop,Electronics,1,1800.04,5/9/2024 12:29,7,"New York, NY",264,138,221,187,4,47,Female,86015.2,Gold,Debit Card,True,0,Cloudy,True,Saturday,False,337,452,2024-05-09 12:29:00,2024,5,19,0
2049,3616,981,Laptop,Electronics,2,1077.87,9/12/2024 5:46,19,"Chicago, IL",191,135,147,390,5,43,Female,92019.26,Silver,Debit Card,True,BOGO,Sunny,False,Thursday,True,233,108,2024-09-12 05:46:00,2024,9,37,0
2050,7642,742,Washing Machine,Appliances,5,1139.57,1/26/2024 5:32,20,"Miami, FL",12,91,187,373,6,42,Other,58658.78,Platinum,Credit Card,False,0,Rainy,True,Sunday,False,435,140,2024-01-26 05:32:00,2024,1,4,0
2051,9233,172,Headphones,Appliances,5,1421.4,3/7/2024 17:31,2,"Miami, FL",86,103,202,130,4,65,Female,95381.36,Platinum,Debit Card,False,Percentage Discount,Rainy,True,Tuesday,False,295,266,2024-03-07 17:31:00,2024,3,10,0
2052,6095,494,Smartphone,Electronics,1,993.28,6/1/2024 0:59,9,"Dallas, TX",124,111,199,439,7,43,Male,104332.73,Bronze,Credit Card,False,0,Rainy,False,Friday,False,315,269,2024-06-01 00:59:00,2024,6,22,0
2053,2923,807,Fridge,Electronics,2,250.52,7/22/2024 20:13,14,"New York, NY",338,85,300,182,5,49,Other,68691.06,Platinum,Digital Wallet,True,0,Stormy,False,Thursday,True,342,274,2024-07-22 20:13:00,2024,7,30,0
2054,5833,440,Laptop,Electronics,4,232.15,8/5/2024 5:13,2,"Dallas, TX",337,51,293,111,10,40,Other,25314.12,Gold,Cash,True,0,Rainy,False,Sunday,False,182,107,2024-08-05 05:13:00,2024,8,32,0
2055,7021,643,Laptop,Appliances,2,763.34,5/2/2024 11:52,1,"Los Angeles, CA",13,122,242,179,10,62,Other,42075.41,Silver,Cash,False,Percentage Discount,Sunny,False,Thursday,False,391,135,2024-05-02 11:52:00,2024,5,18,0
2056,4618,133,Camera,Appliances,1,1859.29,5/29/2024 20:45,17,"Dallas, TX",177,150,224,416,7,27,Female,64063.24,Silver,Debit Card,True,0,Rainy,False,Wednesday,True,133,275,2024-05-29 20:45:00,2024,5,22,0
2057,4590,403,Laptop,Appliances,3,877.37,9/6/2024 10:24,6,"Los Angeles, CA",327,72,133,138,2,34,Male,21586.94,Gold,Credit Card,False,0,Cloudy,False,Tuesday,False,484,447,2024-09-06 10:24:00,2024,9,36,0
2058,3188,536,Tablet,Electronics,2,1607.72,8/16/2024 5:44,8,"Chicago, IL",476,56,163,429,1,59,Male,117645.84,Platinum,Credit Card,True,0,Sunny,True,Saturday,False,264,504,2024-08-16 05:44:00,2024,8,33,0
2059,8834,870,Washing Machine,Appliances,4,1956.64,3/18/2024 18:02,13,"New York, NY",383,64,114,334,8,37,Male,108269.47,Silver,Cash,False,BOGO,Stormy,True,Friday,False,285,255,2024-03-18 18:02:00,2024,3,12,0
2060,3509,376,Tablet,Appliances,4,270.0,7/9/2024 1:29,19,"Los Angeles, CA",15,143,197,188,8,29,Male,46576.12,Gold,Debit Card,False,0,Stormy,False,Wednesday,True,243,480,2024-07-09 01:29:00,2024,7,28,0
2061,8454,814,Fridge,Appliances,2,1159.06,7/18/2024 17:19,13,"New York, NY",430,100,264,296,10,18,Male,32502.07,Bronze,Cash,True,0,Stormy,True,Friday,True,361,198,2024-07-18 17:19:00,2024,7,29,0
2062,7121,727,Headphones,Electronics,4,966.54,1/13/2024 3:32,5,"Chicago, IL",217,132,153,260,10,33,Other,33268.29,Platinum,Debit Card,True,0,Rainy,False,Sunday,True,344,351,2024-01-13 03:32:00,2024,1,2,0
2063,7813,655,Headphones,Electronics,2,1671.63,5/28/2024 10:53,14,"New York, NY",222,113,207,496,8,24,Male,110974.43,Bronze,Digital Wallet,False,0,Stormy,False,Monday,True,168,250,2024-05-28 10:53:00,2024,5,22,0
2064,9998,689,Camera,Electronics,5,905.15,8/13/2024 2:24,19,"Chicago, IL",227,90,189,154,8,67,Male,62568.63,Silver,Credit Card,False,BOGO,Stormy,True,Thursday,True,470,196,2024-08-13 02:24:00,2024,8,33,0
2065,8714,913,Camera,Electronics,1,1179.33,5/13/2024 14:01,1,"Chicago, IL",48,126,214,434,3,38,Male,107363.08,Bronze,Digital Wallet,True,0,Sunny,True,Monday,True,371,146,2024-05-13 14:01:00,2024,5,20,0
2066,9806,312,Fridge,Appliances,3,1439.97,7/19/2024 17:04,6,"Los Angeles, CA",129,144,234,431,3,48,Female,59465.57,Silver,Cash,False,0,Rainy,True,Thursday,False,411,411,2024-07-19 17:04:00,2024,7,29,0
2067,4578,906,Tablet,Appliances,3,443.83,3/27/2024 1:40,6,"New York, NY",276,126,150,224,3,55,Male,57490.57,Bronze,Debit Card,False,0,Sunny,True,Tuesday,False,190,405,2024-03-27 01:40:00,2024,3,13,0
2068,5054,801,Camera,Electronics,3,438.45,7/17/2024 21:22,5,"Miami, FL",173,136,213,468,3,55,Female,87423.21,Bronze,Digital Wallet,False,BOGO,Cloudy,False,Wednesday,False,250,188,2024-07-17 21:22:00,2024,7,29,0
2069,2341,182,Washing Machine,Electronics,4,856.96,2/2/2024 3:25,2,"Miami, FL",119,81,278,234,7,49,Other,70061.51,Gold,Debit Card,False,Percentage Discount,Sunny,False,Wednesday,True,441,245,2024-02-02 03:25:00,2024,2,5,0
2070,9609,735,Laptop,Appliances,1,979.16,3/25/2024 8:26,19,"Los Angeles, CA",476,54,118,174,5,18,Female,89368.11,Gold,Cash,False,BOGO,Cloudy,True,Thursday,True,319,351,2024-03-25 08:26:00,2024,3,13,0
2071,8319,443,Fridge,Electronics,5,131.28,9/14/2024 4:26,15,"Miami, FL",113,53,265,116,7,43,Male,73535.82,Silver,Debit Card,False,0,Cloudy,False,Friday,False,347,283,2024-09-14 04:26:00,2024,9,37,0
2072,9653,853,Headphones,Electronics,5,675.65,1/31/2024 4:32,12,"Los Angeles, CA",336,59,274,259,2,40,Male,52596.56,Silver,Credit Card,True,Percentage Discount,Rainy,False,Friday,True,215,426,2024-01-31 04:32:00,2024,1,5,0
2073,6927,156,Washing Machine,Electronics,2,104.76,2/12/2024 21:35,11,"Miami, FL",101,78,194,420,6,68,Female,79349.19,Bronze,Digital Wallet,False,0,Cloudy,False,Saturday,False,471,247,2024-02-12 21:35:00,2024,2,7,0
2074,2279,627,Washing Machine,Appliances,5,1940.81,5/26/2024 16:24,1,"Miami, FL",397,82,127,271,4,53,Other,20643.52,Gold,Digital Wallet,False,Percentage Discount,Sunny,True,Sunday,True,330,457,2024-05-26 16:24:00,2024,5,21,0
2075,2838,790,Tablet,Appliances,3,1095.8,5/13/2024 8:15,13,"Miami, FL",62,130,113,351,4,22,Female,33176.85,Gold,Digital Wallet,True,0,Sunny,True,Wednesday,True,280,341,2024-05-13 08:15:00,2024,5,20,0
2076,2011,472,Camera,Appliances,2,781.1,6/8/2024 14:19,4,"Chicago, IL",255,60,172,364,1,24,Male,75916.41,Gold,Cash,True,0,Rainy,True,Thursday,True,483,431,2024-06-08 14:19:00,2024,6,23,0
2077,9972,152,Tablet,Electronics,1,548.39,1/11/2024 12:54,15,"Dallas, TX",391,88,125,485,1,26,Male,78150.22,Bronze,Credit Card,False,0,Rainy,False,Sunday,False,488,283,2024-01-11 12:54:00,2024,1,2,0
2078,9281,213,Laptop,Appliances,5,1305.07,1/9/2024 17:43,20,"Los Angeles, CA",41,54,160,156,3,35,Female,82732.52,Silver,Credit Card,False,0,Stormy,False,Saturday,True,308,461,2024-01-09 17:43:00,2024,1,2,0
2079,4312,492,TV,Electronics,4,180.6,5/29/2024 9:45,2,"Chicago, IL",130,94,202,225,8,41,Female,25213.07,Silver,Cash,True,BOGO,Rainy,False,Tuesday,False,333,406,2024-05-29 09:45:00,2024,5,22,0
2080,9792,474,Laptop,Electronics,5,728.17,8/24/2024 6:03,14,"Chicago, IL",233,144,224,154,1,66,Female,108022.75,Platinum,Debit Card,True,0,Sunny,False,Friday,False,405,297,2024-08-24 06:03:00,2024,8,34,0
2081,3455,576,Laptop,Electronics,1,687.94,7/2/2024 23:33,15,"Miami, FL",294,130,216,248,3,21,Other,70206.81,Gold,Debit Card,False,0,Cloudy,False,Wednesday,False,486,440,2024-07-02 23:33:00,2024,7,27,0
2082,3695,733,Smartphone,Appliances,4,1425.9,6/18/2024 14:39,1,"Chicago, IL",389,118,223,285,8,68,Female,63893.78,Bronze,Credit Card,True,0,Cloudy,False,Friday,True,387,214,2024-06-18 14:39:00,2024,6,25,0
2083,6375,141,Tablet,Appliances,4,1113.59,7/9/2024 13:24,3,"Chicago, IL",162,56,197,490,6,48,Other,34072.9,Gold,Cash,False,0,Rainy,False,Thursday,False,239,230,2024-07-09 13:24:00,2024,7,28,0
2084,9525,474,Camera,Appliances,4,531.48,9/4/2024 1:44,11,"Dallas, TX",182,99,224,294,1,46,Male,35036.64,Gold,Digital Wallet,True,Percentage Discount,Sunny,True,Sunday,True,353,450,2024-09-04 01:44:00,2024,9,36,0
2085,8239,475,Fridge,Appliances,3,1906.12,2/9/2024 1:24,4,"New York, NY",130,130,255,170,8,53,Female,26202.23,Platinum,Digital Wallet,False,0,Rainy,False,Friday,True,456,152,2024-02-09 01:24:00,2024,2,6,0
2086,2904,279,TV,Electronics,5,1975.41,5/4/2024 21:03,6,"Dallas, TX",376,111,192,469,7,32,Female,52950.54,Gold,Credit Card,True,Percentage Discount,Cloudy,True,Tuesday,False,269,316,2024-05-04 21:03:00,2024,5,18,0
2087,4365,763,Smartphone,Appliances,1,1178.08,2/25/2024 22:38,2,"Miami, FL",414,52,248,290,10,45,Other,21782.53,Silver,Digital Wallet,False,BOGO,Stormy,False,Monday,False,112,184,2024-02-25 22:38:00,2024,2,8,0
2088,9008,672,Tablet,Appliances,5,1206.87,3/9/2024 22:59,2,"New York, NY",33,123,268,216,8,32,Male,95506.51,Silver,Debit Card,True,0,Sunny,False,Tuesday,False,356,144,2024-03-09 22:59:00,2024,3,10,0
2089,2489,821,TV,Electronics,2,1534.11,5/15/2024 6:58,7,"Los Angeles, CA",87,59,277,131,7,38,Male,114047.41,Gold,Debit Card,False,0,Stormy,True,Tuesday,True,364,398,2024-05-15 06:58:00,2024,5,20,0
2090,9361,168,Camera,Appliances,2,368.03,8/20/2024 1:17,19,"Miami, FL",288,82,264,211,10,20,Male,64467.6,Gold,Credit Card,False,0,Cloudy,False,Sunday,False,168,127,2024-08-20 01:17:00,2024,8,34,0
2091,8298,674,Laptop,Appliances,5,360.48,4/12/2024 21:20,7,"Los Angeles, CA",470,150,151,130,4,61,Other,66193.3,Silver,Cash,False,BOGO,Stormy,True,Monday,False,236,261,2024-04-12 21:20:00,2024,4,15,0
2092,1911,826,Laptop,Electronics,5,830.35,8/9/2024 7:54,9,"New York, NY",409,150,290,170,9,69,Other,35152.24,Silver,Credit Card,False,0,Sunny,False,Saturday,True,293,483,2024-08-09 07:54:00,2024,8,32,0
2093,8429,892,Headphones,Electronics,3,326.95,2/14/2024 7:40,10,"Miami, FL",443,84,132,243,1,57,Male,103459.29,Platinum,Debit Card,False,0,Rainy,True,Saturday,False,195,363,2024-02-14 07:40:00,2024,2,7,0
2094,3161,309,Laptop,Appliances,5,962.84,4/22/2024 3:33,20,"Los Angeles, CA",282,105,284,133,6,44,Male,62370.0,Bronze,Cash,False,0,Cloudy,False,Friday,True,156,316,2024-04-22 03:33:00,2024,4,17,0
2095,9409,241,Tablet,Electronics,5,1564.71,6/6/2024 10:44,2,"Miami, FL",355,95,133,212,2,65,Male,119322.48,Silver,Digital Wallet,True,0,Cloudy,False,Wednesday,True,322,448,2024-06-06 10:44:00,2024,6,23,0
2096,7806,442,Laptop,Appliances,4,989.86,8/16/2024 16:12,15,"Los Angeles, CA",84,89,169,108,5,50,Other,59152.56,Bronze,Digital Wallet,True,Percentage Discount,Cloudy,True,Wednesday,False,270,400,2024-08-16 16:12:00,2024,8,33,0
2097,8484,344,Headphones,Appliances,3,1141.14,6/10/2024 22:18,14,"Los Angeles, CA",149,116,253,107,6,21,Male,64499.34,Platinum,Debit Card,False,BOGO,Rainy,False,Wednesday,False,422,182,2024-06-10 22:18:00,2024,6,24,0
2098,1945,652,Tablet,Appliances,3,179.74,3/6/2024 13:00,20,"Los Angeles, CA",385,82,198,159,4,24,Other,47888.04,Gold,Credit Card,True,0,Sunny,False,Thursday,True,341,495,2024-03-06 13:00:00,2024,3,10,0
2099,8575,216,Headphones,Electronics,3,693.99,5/24/2024 15:04,16,"Dallas, TX",388,50,222,157,9,54,Female,51510.47,Gold,Credit Card,True,0,Sunny,True,Wednesday,False,116,92,2024-05-24 15:04:00,2024,5,21,0
2100,6049,764,Camera,Appliances,1,1638.05,5/5/2024 19:08,6,"Dallas, TX",296,56,155,207,7,26,Other,106080.55,Bronze,Debit Card,False,0,Cloudy,True,Sunday,False,126,97,2024-05-05 19:08:00,2024,5,18,0
2101,1356,589,Fridge,Appliances,2,1861.61,3/21/2024 9:22,4,"Los Angeles, CA",91,51,219,133,10,27,Female,89642.06,Bronze,Debit Card,True,Percentage Discount,Sunny,True,Saturday,True,423,373,2024-03-21 09:22:00,2024,3,12,0
2102,7487,855,Headphones,Electronics,3,884.13,8/29/2024 5:44,13,"Miami, FL",80,55,120,244,1,47,Other,98665.91,Gold,Digital Wallet,False,Percentage Discount,Cloudy,True,Tuesday,True,374,510,2024-08-29 05:44:00,2024,8,35,0
2103,5169,870,Smartphone,Appliances,5,995.51,8/15/2024 12:56,6,"Los Angeles, CA",2,87,250,317,2,25,Other,117379.03,Platinum,Credit Card,True,0,Cloudy,True,Friday,False,206,312,2024-08-15 12:56:00,2024,8,33,0
2104,1049,694,Smartphone,Electronics,4,1744.56,8/26/2024 2:35,3,"Los Angeles, CA",420,54,207,254,7,66,Other,28932.64,Silver,Debit Card,True,0,Sunny,True,Tuesday,False,149,346,2024-08-26 02:35:00,2024,8,35,0
2105,4570,992,Washing Machine,Electronics,2,58.39,4/28/2024 23:52,18,"New York, NY",400,52,220,257,9,67,Male,52474.3,Platinum,Debit Card,False,Percentage Discount,Cloudy,False,Monday,True,132,320,2024-04-28 23:52:00,2024,4,17,0
2106,2196,819,Tablet,Electronics,4,1756.2,5/28/2024 10:20,7,"Dallas, TX",92,87,180,194,2,44,Female,23580.21,Silver,Digital Wallet,False,Percentage Discount,Sunny,True,Sunday,False,380,173,2024-05-28 10:20:00,2024,5,22,0
2107,1742,314,Smartphone,Electronics,1,444.67,3/4/2024 14:19,8,"Dallas, TX",259,141,184,142,3,44,Other,72921.94,Silver,Debit Card,False,BOGO,Sunny,False,Monday,False,481,292,2024-03-04 14:19:00,2024,3,10,0
2108,7941,871,Camera,Electronics,4,345.67,7/19/2024 23:15,8,"New York, NY",490,102,299,244,1,28,Other,98862.68,Gold,Digital Wallet,True,0,Cloudy,False,Wednesday,True,217,218,2024-07-19 23:15:00,2024,7,29,0
2109,6644,862,Smartphone,Appliances,3,1055.1,9/4/2024 21:47,19,"Los Angeles, CA",343,82,215,227,8,31,Male,52260.91,Gold,Digital Wallet,False,Percentage Discount,Sunny,False,Tuesday,False,193,153,2024-09-04 21:47:00,2024,9,36,0
2110,2044,879,Fridge,Electronics,2,448.79,6/21/2024 22:15,3,"Miami, FL",461,95,249,338,6,56,Female,47103.34,Silver,Cash,False,BOGO,Stormy,True,Friday,True,342,397,2024-06-21 22:15:00,2024,6,25,0
2111,9866,330,Washing Machine,Electronics,1,1806.85,8/18/2024 13:39,20,"New York, NY",281,82,130,428,1,59,Male,26740.74,Bronze,Digital Wallet,True,Percentage Discount,Cloudy,False,Monday,True,187,473,2024-08-18 13:39:00,2024,8,33,0
2112,1987,428,Tablet,Appliances,4,950.95,9/6/2024 22:01,6,"Los Angeles, CA",36,129,133,344,1,32,Other,49121.03,Silver,Digital Wallet,True,0,Sunny,True,Wednesday,True,195,223,2024-09-06 22:01:00,2024,9,36,0
2113,2130,461,TV,Appliances,5,984.03,2/13/2024 16:12,19,"Los Angeles, CA",182,109,107,357,1,40,Other,58887.86,Bronze,Cash,True,Percentage Discount,Cloudy,False,Monday,False,223,151,2024-02-13 16:12:00,2024,2,7,0
2114,8734,373,Washing Machine,Electronics,5,799.28,1/4/2024 11:09,13,"New York, NY",402,99,254,447,7,29,Other,26752.74,Platinum,Cash,False,Percentage Discount,Rainy,True,Saturday,True,135,386,2024-01-04 11:09:00,2024,1,1,0
2115,1519,615,Washing Machine,Electronics,1,1205.43,2/9/2024 23:53,20,"Miami, FL",334,117,178,446,10,44,Other,109653.13,Platinum,Digital Wallet,True,BOGO,Rainy,False,Tuesday,True,462,325,2024-02-09 23:53:00,2024,2,6,0
2116,5703,796,Headphones,Appliances,1,1631.68,4/2/2024 2:03,5,"Chicago, IL",92,77,185,114,10,18,Male,98771.79,Bronze,Debit Card,True,Percentage Discount,Cloudy,False,Tuesday,True,341,453,2024-04-02 02:03:00,2024,4,14,0
2117,7698,533,Camera,Electronics,4,482.86,1/15/2024 15:13,4,"Dallas, TX",24,87,167,290,2,23,Female,78454.94,Gold,Digital Wallet,True,0,Cloudy,False,Monday,True,271,247,2024-01-15 15:13:00,2024,1,3,0
2118,3948,383,Washing Machine,Electronics,3,667.48,4/1/2024 0:40,1,"Los Angeles, CA",260,143,271,271,6,47,Male,115913.29,Bronze,Digital Wallet,True,0,Sunny,False,Monday,False,275,200,2024-04-01 00:40:00,2024,4,14,0
2119,3218,155,TV,Electronics,1,1294.04,7/27/2024 19:04,11,"New York, NY",300,118,106,439,6,58,Female,34298.22,Bronze,Debit Card,True,Percentage Discount,Sunny,False,Monday,True,489,313,2024-07-27 19:04:00,2024,7,30,0
2120,7887,164,Tablet,Electronics,2,1631.46,8/21/2024 9:22,8,"New York, NY",440,106,141,415,9,46,Other,26516.26,Silver,Credit Card,True,BOGO,Stormy,False,Thursday,False,429,426,2024-08-21 09:22:00,2024,8,34,0
2121,7135,481,Headphones,Appliances,3,1434.73,4/16/2024 2:31,1,"New York, NY",348,94,237,170,6,29,Female,80282.47,Platinum,Credit Card,False,0,Rainy,True,Thursday,True,460,179,2024-04-16 02:31:00,2024,4,16,0
2122,7266,453,Headphones,Electronics,2,370.98,5/17/2024 13:51,16,"Miami, FL",181,71,280,478,10,44,Other,105238.35,Platinum,Cash,False,0,Stormy,False,Wednesday,True,157,321,2024-05-17 13:51:00,2024,5,20,0
2123,8348,563,Tablet,Electronics,5,295.27,2/2/2024 17:53,3,"Chicago, IL",71,96,259,168,4,39,Male,34176.19,Bronze,Cash,False,0,Rainy,False,Sunday,False,215,491,2024-02-02 17:53:00,2024,2,5,0
2124,7184,597,Camera,Appliances,5,1059.82,5/21/2024 1:57,6,"Chicago, IL",56,102,276,344,10,39,Other,29274.07,Bronze,Credit Card,False,0,Sunny,True,Monday,False,244,132,2024-05-21 01:57:00,2024,5,21,0
2125,7154,613,TV,Electronics,5,1889.61,2/17/2024 21:21,6,"Los Angeles, CA",432,52,171,342,3,50,Other,32258.88,Platinum,Debit Card,True,0,Rainy,False,Friday,True,383,474,2024-02-17 21:21:00,2024,2,7,0
2126,2314,639,TV,Appliances,1,881.61,2/23/2024 23:03,14,"Los Angeles, CA",225,86,176,112,3,22,Female,61895.09,Silver,Debit Card,True,0,Rainy,False,Friday,False,187,167,2024-02-23 23:03:00,2024,2,8,0
2127,9835,949,Tablet,Electronics,5,1938.15,2/19/2024 12:29,2,"New York, NY",446,120,152,438,5,31,Other,26012.67,Bronze,Digital Wallet,True,0,Cloudy,True,Friday,False,353,126,2024-02-19 12:29:00,2024,2,8,0
2128,3178,225,Tablet,Appliances,4,58.62,6/6/2024 5:03,2,"Dallas, TX",200,124,243,164,5,26,Female,78503.73,Gold,Debit Card,True,0,Stormy,True,Sunday,False,305,211,2024-06-06 05:03:00,2024,6,23,0
2129,6697,581,Washing Machine,Appliances,2,1111.52,5/5/2024 4:04,18,"Chicago, IL",280,127,288,318,6,68,Female,70514.2,Bronze,Digital Wallet,False,0,Cloudy,False,Friday,False,494,332,2024-05-05 04:04:00,2024,5,18,0
2130,2943,826,Laptop,Electronics,5,1645.46,9/13/2024 11:05,5,"Dallas, TX",1,68,235,127,6,45,Male,105808.85,Gold,Cash,False,0,Stormy,True,Friday,True,462,142,2024-09-13 11:05:00,2024,9,37,0
2131,3924,644,TV,Electronics,4,1885.68,8/4/2024 20:37,5,"Chicago, IL",61,86,135,479,7,24,Other,91335.42,Platinum,Credit Card,True,0,Cloudy,True,Saturday,True,326,242,2024-08-04 20:37:00,2024,8,31,0
2132,9802,794,Laptop,Appliances,4,64.93,8/3/2024 11:06,17,"Los Angeles, CA",497,100,196,256,6,30,Other,100014.66,Gold,Debit Card,True,0,Cloudy,False,Monday,False,438,281,2024-08-03 11:06:00,2024,8,31,0
2133,7439,945,TV,Electronics,3,1836.39,8/24/2024 5:04,8,"Miami, FL",417,104,250,388,3,39,Male,34031.77,Gold,Digital Wallet,False,Percentage Discount,Cloudy,True,Friday,True,322,396,2024-08-24 05:04:00,2024,8,34,0
2134,9664,645,Washing Machine,Electronics,5,1851.52,7/4/2024 20:13,15,"New York, NY",80,67,214,338,4,59,Other,22709.8,Bronze,Digital Wallet,False,0,Sunny,False,Friday,True,500,457,2024-07-04 20:13:00,2024,7,27,0
2135,3086,399,Fridge,Electronics,2,293.87,9/5/2024 2:05,15,"Los Angeles, CA",213,90,203,304,3,68,Male,26769.83,Bronze,Debit Card,False,0,Stormy,False,Thursday,False,394,135,2024-09-05 02:05:00,2024,9,36,0
2136,4648,562,TV,Appliances,2,1458.02,2/27/2024 3:56,9,"New York, NY",310,106,246,418,3,34,Male,63702.85,Bronze,Cash,True,0,Rainy,True,Saturday,True,427,403,2024-02-27 03:56:00,2024,2,9,0
2137,1056,735,Washing Machine,Electronics,2,65.55,2/11/2024 19:08,6,"Los Angeles, CA",220,104,171,433,2,26,Female,74127.57,Gold,Debit Card,False,0,Cloudy,False,Monday,False,399,192,2024-02-11 19:08:00,2024,2,6,0
2138,1372,476,Tablet,Electronics,4,940.53,7/28/2024 13:54,15,"New York, NY",85,57,130,342,5,70,Male,107648.77,Gold,Digital Wallet,True,0,Cloudy,True,Tuesday,True,252,162,2024-07-28 13:54:00,2024,7,30,0
2139,5888,919,Camera,Appliances,3,1665.87,4/3/2024 0:57,2,"Chicago, IL",171,60,160,413,9,46,Female,114085.52,Silver,Cash,True,0,Stormy,True,Friday,False,146,184,2024-04-03 00:57:00,2024,4,14,0
2140,8585,789,TV,Appliances,4,1133.36,8/19/2024 8:23,11,"Dallas, TX",494,74,272,398,10,18,Male,66260.37,Bronze,Cash,True,BOGO,Sunny,True,Sunday,False,493,324,2024-08-19 08:23:00,2024,8,34,0
2141,9920,809,Camera,Electronics,4,1444.3,6/27/2024 22:09,10,"Chicago, IL",23,117,199,476,5,23,Male,44644.89,Silver,Cash,True,0,Rainy,False,Saturday,True,344,386,2024-06-27 22:09:00,2024,6,26,0
2142,7948,928,Headphones,Electronics,1,375.49,7/9/2024 2:32,20,"Dallas, TX",435,55,199,365,5,60,Other,33407.46,Silver,Digital Wallet,True,0,Rainy,False,Tuesday,False,104,347,2024-07-09 02:32:00,2024,7,28,0
2143,9715,167,Washing Machine,Appliances,3,993.37,6/26/2024 11:41,18,"Dallas, TX",167,139,224,330,2,53,Female,52614.56,Silver,Credit Card,True,Percentage Discount,Cloudy,True,Sunday,False,345,250,2024-06-26 11:41:00,2024,6,26,0
2144,7214,292,Smartphone,Electronics,1,976.48,8/8/2024 20:22,11,"Dallas, TX",388,110,169,456,4,26,Female,29159.98,Platinum,Cash,True,0,Sunny,False,Saturday,False,126,389,2024-08-08 20:22:00,2024,8,32,0
2145,4762,568,Tablet,Appliances,2,938.97,3/8/2024 3:54,16,"Los Angeles, CA",29,127,296,194,10,31,Male,78502.22,Gold,Cash,True,BOGO,Stormy,True,Tuesday,False,406,235,2024-03-08 03:54:00,2024,3,10,0
2146,5055,189,Smartphone,Appliances,1,1506.45,8/24/2024 22:20,18,"Dallas, TX",244,92,239,279,10,30,Male,60804.35,Silver,Digital Wallet,True,0,Sunny,True,Tuesday,True,318,127,2024-08-24 22:20:00,2024,8,34,0
2147,8546,182,TV,Electronics,5,1523.55,8/15/2024 21:06,18,"Chicago, IL",377,144,233,306,10,59,Male,45365.65,Silver,Cash,True,Percentage Discount,Rainy,False,Saturday,True,210,297,2024-08-15 21:06:00,2024,8,33,0
2148,6671,500,Camera,Electronics,1,285.7,1/25/2024 4:18,15,"Chicago, IL",116,60,209,443,6,67,Female,108133.56,Silver,Debit Card,False,0,Stormy,True,Tuesday,False,403,296,2024-01-25 04:18:00,2024,1,4,0
2149,3541,283,Fridge,Electronics,5,1531.91,1/10/2024 4:28,6,"Miami, FL",364,61,229,402,2,26,Female,42811.85,Platinum,Credit Card,False,0,Stormy,True,Sunday,False,330,423,2024-01-10 04:28:00,2024,1,2,0
2150,5516,395,Washing Machine,Appliances,1,620.35,8/12/2024 8:14,18,"Chicago, IL",69,114,254,323,8,59,Female,104310.57,Silver,Cash,True,0,Rainy,False,Sunday,False,312,122,2024-08-12 08:14:00,2024,8,33,0
2151,4088,178,TV,Electronics,3,672.13,3/24/2024 12:50,5,"New York, NY",142,64,249,431,7,58,Male,50370.19,Gold,Debit Card,True,0,Stormy,False,Wednesday,True,242,176,2024-03-24 12:50:00,2024,3,12,0
2152,2848,211,Fridge,Appliances,2,1401.92,2/9/2024 4:07,2,"Dallas, TX",383,71,200,499,10,21,Other,116833.34,Gold,Digital Wallet,False,0,Sunny,False,Tuesday,True,104,482,2024-02-09 04:07:00,2024,2,6,0
2153,1527,268,TV,Appliances,5,987.43,5/15/2024 10:32,13,"Dallas, TX",470,135,254,256,10,21,Male,44177.42,Gold,Cash,False,0,Sunny,False,Wednesday,False,350,124,2024-05-15 10:32:00,2024,5,20,0
2154,7868,382,Tablet,Appliances,4,1032.71,7/23/2024 2:21,7,"Dallas, TX",307,63,102,139,4,28,Female,58392.88,Bronze,Debit Card,True,Percentage Discount,Sunny,True,Tuesday,True,356,452,2024-07-23 02:21:00,2024,7,30,0
2155,1256,214,Headphones,Appliances,1,810.38,1/27/2024 11:54,5,"Miami, FL",32,99,232,132,4,38,Male,34360.67,Silver,Debit Card,True,0,Rainy,False,Wednesday,False,168,260,2024-01-27 11:54:00,2024,1,4,0
2156,4943,813,Fridge,Electronics,2,52.14,9/11/2024 0:19,6,"New York, NY",118,95,296,208,1,61,Male,57199.42,Silver,Digital Wallet,True,BOGO,Sunny,True,Saturday,True,445,431,2024-09-11 00:19:00,2024,9,37,0
2157,4376,251,Smartphone,Electronics,5,1224.95,8/9/2024 19:20,17,"Dallas, TX",454,72,222,278,4,32,Female,112010.94,Gold,Debit Card,False,0,Cloudy,False,Sunday,False,390,300,2024-08-09 19:20:00,2024,8,32,0
2158,2102,608,Headphones,Electronics,2,66.81,3/21/2024 23:36,1,"Miami, FL",307,137,232,107,9,20,Female,76710.89,Platinum,Digital Wallet,False,BOGO,Cloudy,True,Tuesday,False,403,390,2024-03-21 23:36:00,2024,3,12,0
2159,2653,254,Tablet,Electronics,4,1819.43,6/26/2024 12:17,3,"New York, NY",151,134,208,329,2,35,Female,86820.32,Platinum,Cash,False,0,Sunny,True,Tuesday,True,223,474,2024-06-26 12:17:00,2024,6,26,0
2160,1550,995,Smartphone,Appliances,2,335.53,2/2/2024 11:05,6,"Chicago, IL",122,97,159,453,6,64,Other,44575.07,Gold,Credit Card,True,0,Stormy,False,Tuesday,False,300,145,2024-02-02 11:05:00,2024,2,5,0
2161,8314,309,Washing Machine,Electronics,3,143.7,4/9/2024 3:34,14,"New York, NY",27,57,244,322,7,43,Female,94748.67,Gold,Debit Card,False,BOGO,Sunny,False,Friday,False,304,112,2024-04-09 03:34:00,2024,4,15,0
2162,1797,633,Tablet,Electronics,3,326.03,2/20/2024 16:12,19,"Miami, FL",126,121,120,248,10,48,Male,92749.87,Silver,Credit Card,True,BOGO,Stormy,False,Thursday,True,337,410,2024-02-20 16:12:00,2024,2,8,0
2163,5009,742,Tablet,Electronics,2,1722.22,4/12/2024 6:19,18,"Miami, FL",418,136,176,416,6,64,Female,106327.84,Silver,Cash,True,BOGO,Rainy,True,Sunday,False,132,375,2024-04-12 06:19:00,2024,4,15,0
2164,1724,123,TV,Electronics,1,324.58,7/14/2024 3:21,2,"Miami, FL",493,65,131,418,10,37,Other,43956.98,Silver,Digital Wallet,True,BOGO,Cloudy,False,Monday,True,221,261,2024-07-14 03:21:00,2024,7,28,0
2165,7590,400,Laptop,Electronics,3,625.65,3/3/2024 7:28,10,"Dallas, TX",352,97,238,294,1,19,Other,54359.93,Gold,Debit Card,False,0,Sunny,True,Monday,True,426,141,2024-03-03 07:28:00,2024,3,9,0
2166,8191,526,Washing Machine,Electronics,1,616.02,6/17/2024 20:01,9,"Los Angeles, CA",384,122,277,331,8,67,Male,98807.68,Silver,Cash,False,0,Cloudy,False,Saturday,False,259,438,2024-06-17 20:01:00,2024,6,25,0
2167,4839,798,Smartphone,Electronics,2,472.38,7/14/2024 12:06,14,"Los Angeles, CA",86,92,161,185,1,47,Female,28027.85,Platinum,Cash,False,0,Cloudy,False,Sunday,True,121,132,2024-07-14 12:06:00,2024,7,28,0
2168,9843,654,Headphones,Electronics,2,1371.73,2/29/2024 5:06,14,"Chicago, IL",187,127,182,458,6,24,Male,73902.12,Platinum,Cash,True,Percentage Discount,Cloudy,False,Saturday,True,418,406,2024-02-29 05:06:00,2024,2,9,0
2169,4559,235,Laptop,Electronics,1,151.07,7/12/2024 15:27,12,"Los Angeles, CA",23,52,249,328,7,52,Other,89288.74,Gold,Debit Card,False,0,Sunny,True,Saturday,False,288,316,2024-07-12 15:27:00,2024,7,28,0
2170,1924,585,Washing Machine,Electronics,5,1490.78,4/5/2024 21:22,17,"Dallas, TX",379,89,109,461,10,67,Female,36528.85,Silver,Debit Card,True,BOGO,Sunny,True,Monday,True,122,500,2024-04-05 21:22:00,2024,4,14,0
2171,3295,455,Washing Machine,Appliances,1,992.69,5/7/2024 5:23,19,"New York, NY",386,80,290,306,6,63,Female,48212.75,Silver,Debit Card,False,BOGO,Sunny,True,Wednesday,False,173,306,2024-05-07 05:23:00,2024,5,19,0
2172,9255,530,Camera,Appliances,3,1652.22,8/14/2024 14:51,11,"New York, NY",86,63,285,197,2,68,Female,48075.03,Platinum,Credit Card,False,0,Stormy,True,Saturday,False,312,422,2024-08-14 14:51:00,2024,8,33,0
2173,5739,554,Headphones,Electronics,4,1341.32,6/21/2024 12:09,5,"Dallas, TX",249,93,259,211,1,41,Other,62852.77,Platinum,Debit Card,False,BOGO,Cloudy,False,Friday,True,242,300,2024-06-21 12:09:00,2024,6,25,0
2174,4836,855,Tablet,Appliances,4,1971.64,2/22/2024 3:43,9,"Chicago, IL",128,52,173,389,7,32,Male,29235.1,Bronze,Cash,True,BOGO,Stormy,False,Friday,True,450,444,2024-02-22 03:43:00,2024,2,8,0
2175,6224,760,Tablet,Electronics,2,233.17,9/12/2024 20:18,16,"Los Angeles, CA",307,106,256,310,4,32,Other,103933.06,Platinum,Digital Wallet,False,0,Cloudy,False,Saturday,False,139,233,2024-09-12 20:18:00,2024,9,37,0
2176,6253,121,Camera,Electronics,1,1257.13,2/23/2024 19:06,14,"Miami, FL",203,59,113,359,7,25,Male,23492.5,Gold,Credit Card,False,0,Cloudy,False,Monday,True,495,403,2024-02-23 19:06:00,2024,2,8,0
2177,4881,398,Fridge,Electronics,3,1859.44,9/3/2024 20:24,1,"Chicago, IL",416,149,275,113,2,66,Other,116888.12,Gold,Credit Card,True,Percentage Discount,Stormy,True,Sunday,False,376,295,2024-09-03 20:24:00,2024,9,36,0
2178,5944,293,TV,Electronics,3,1438.04,8/26/2024 10:47,19,"Dallas, TX",77,113,172,120,2,22,Female,111139.32,Silver,Debit Card,False,0,Sunny,False,Monday,False,326,335,2024-08-26 10:47:00,2024,8,35,0
2179,3347,164,Smartphone,Electronics,1,883.03,4/16/2024 10:49,14,"Chicago, IL",403,82,174,326,3,39,Female,90302.59,Gold,Cash,False,0,Stormy,True,Friday,False,195,151,2024-04-16 10:49:00,2024,4,16,0
2180,9540,122,Fridge,Appliances,1,284.6,4/2/2024 0:27,1,"Dallas, TX",498,59,166,157,9,43,Other,77268.67,Bronze,Cash,False,0,Cloudy,False,Saturday,False,212,477,2024-04-02 00:27:00,2024,4,14,0
2181,4621,992,Fridge,Appliances,1,1180.27,5/26/2024 20:24,14,"New York, NY",122,130,219,154,8,36,Male,94330.29,Gold,Digital Wallet,False,0,Stormy,False,Monday,True,373,132,2024-05-26 20:24:00,2024,5,21,0
2182,7775,921,Camera,Appliances,4,1280.25,7/26/2024 11:00,9,"New York, NY",287,105,171,415,5,62,Male,105712.11,Gold,Credit Card,False,0,Cloudy,False,Monday,True,405,384,2024-07-26 11:00:00,2024,7,30,0
2183,5923,337,Laptop,Electronics,5,261.26,8/29/2024 4:02,15,"Los Angeles, CA",117,137,147,244,1,50,Other,99296.46,Gold,Cash,True,0,Cloudy,True,Friday,True,295,303,2024-08-29 04:02:00,2024,8,35,0
2184,5508,954,Washing Machine,Electronics,3,761.29,5/11/2024 20:52,5,"Miami, FL",258,85,217,355,9,32,Other,29156.49,Platinum,Digital Wallet,True,0,Cloudy,False,Sunday,False,457,128,2024-05-11 20:52:00,2024,5,19,0
2185,1998,632,Headphones,Electronics,1,1239.33,2/12/2024 5:16,9,"Dallas, TX",491,111,113,260,2,38,Male,81236.86,Silver,Debit Card,False,BOGO,Sunny,True,Monday,True,392,240,2024-02-12 05:16:00,2024,2,7,0
2186,3869,760,Camera,Appliances,5,732.24,2/24/2024 22:50,11,"Dallas, TX",144,111,215,124,2,44,Other,91565.8,Platinum,Digital Wallet,True,0,Sunny,True,Wednesday,True,318,109,2024-02-24 22:50:00,2024,2,8,0
2187,7999,443,Tablet,Appliances,2,827.58,6/4/2024 20:43,6,"New York, NY",151,148,135,436,8,29,Female,77392.77,Bronze,Credit Card,False,0,Sunny,False,Wednesday,True,442,454,2024-06-04 20:43:00,2024,6,23,0
2188,9120,521,Laptop,Electronics,2,1550.85,3/19/2024 5:00,12,"New York, NY",24,142,192,499,4,65,Female,74196.35,Gold,Digital Wallet,False,0,Sunny,False,Thursday,True,368,115,2024-03-19 05:00:00,2024,3,12,0
2189,1768,692,Fridge,Electronics,3,843.1,5/18/2024 20:32,15,"Miami, FL",388,134,176,282,1,53,Female,52422.93,Gold,Cash,True,0,Stormy,False,Saturday,True,309,245,2024-05-18 20:32:00,2024,5,20,0
2190,6642,451,Fridge,Appliances,3,129.35,1/10/2024 19:08,7,"Miami, FL",467,99,169,425,7,47,Male,119745.46,Silver,Cash,False,0,Rainy,True,Saturday,True,136,253,2024-01-10 19:08:00,2024,1,2,0
2191,7244,771,TV,Electronics,2,1238.33,2/28/2024 2:46,15,"Chicago, IL",476,74,187,194,10,39,Other,119088.84,Gold,Digital Wallet,False,0,Cloudy,False,Thursday,False,276,285,2024-02-28 02:46:00,2024,2,9,0
2192,9592,761,Headphones,Electronics,5,1378.46,7/16/2024 13:52,18,"Dallas, TX",485,148,285,165,10,30,Other,97357.34,Gold,Debit Card,False,0,Sunny,True,Friday,False,407,349,2024-07-16 13:52:00,2024,7,29,0
2193,6222,905,TV,Appliances,1,1071.83,2/16/2024 3:55,15,"Dallas, TX",498,62,138,123,4,61,Female,49893.93,Gold,Credit Card,False,BOGO,Sunny,False,Friday,False,186,494,2024-02-16 03:55:00,2024,2,7,0
2194,7821,434,Fridge,Electronics,1,507.33,4/16/2024 18:29,9,"New York, NY",496,130,222,148,9,24,Other,21733.16,Gold,Debit Card,False,BOGO,Cloudy,True,Thursday,True,114,136,2024-04-16 18:29:00,2024,4,16,0
2195,7688,597,Smartphone,Electronics,5,610.77,8/16/2024 10:34,16,"Chicago, IL",347,55,243,133,3,67,Male,27685.09,Bronze,Cash,True,0,Rainy,True,Monday,False,311,262,2024-08-16 10:34:00,2024,8,33,0
2196,3444,707,Headphones,Electronics,4,568.73,5/29/2024 14:26,16,"Los Angeles, CA",429,138,205,173,2,50,Other,27172.18,Bronze,Credit Card,False,0,Cloudy,True,Friday,True,470,316,2024-05-29 14:26:00,2024,5,22,0
2197,5913,781,Washing Machine,Electronics,5,84.06,5/10/2024 4:08,18,"Miami, FL",118,79,116,347,5,34,Female,67958.09,Silver,Credit Card,False,Percentage Discount,Cloudy,True,Saturday,True,258,417,2024-05-10 04:08:00,2024,5,19,0
2198,7167,813,Fridge,Electronics,3,1441.13,3/11/2024 22:40,18,"Los Angeles, CA",246,149,115,104,6,52,Male,56308.6,Gold,Digital Wallet,True,0,Rainy,True,Saturday,True,186,242,2024-03-11 22:40:00,2024,3,11,0
2199,4012,642,Tablet,Electronics,1,347.06,6/7/2024 11:45,9,"New York, NY",328,70,254,474,3,33,Other,25692.21,Platinum,Digital Wallet,True,BOGO,Sunny,False,Friday,True,199,475,2024-06-07 11:45:00,2024,6,23,0
2200,9813,962,Laptop,Appliances,2,1875.53,2/5/2024 14:07,1,"New York, NY",201,139,185,244,9,33,Male,42720.29,Platinum,Digital Wallet,False,0,Cloudy,True,Wednesday,False,181,207,2024-02-05 14:07:00,2024,2,6,0
2201,8758,661,TV,Electronics,2,1687.27,3/11/2024 16:23,15,"Dallas, TX",181,81,164,172,8,42,Other,66388.86,Gold,Cash,True,BOGO,Stormy,False,Sunday,False,160,419,2024-03-11 16:23:00,2024,3,11,0
2202,4948,555,Tablet,Appliances,3,1892.7,1/31/2024 2:27,1,"Miami, FL",131,65,217,165,9,36,Male,95228.15,Gold,Credit Card,True,0,Rainy,False,Friday,False,385,291,2024-01-31 02:27:00,2024,1,5,0
2203,4692,568,TV,Electronics,5,1973.51,7/18/2024 11:02,20,"New York, NY",107,124,266,458,10,54,Female,40280.08,Gold,Debit Card,False,0,Sunny,False,Sunday,False,126,322,2024-07-18 11:02:00,2024,7,29,0
2204,5927,411,Tablet,Electronics,4,790.73,6/21/2024 5:54,9,"Miami, FL",305,108,141,289,10,27,Female,84614.95,Gold,Credit Card,False,0,Sunny,False,Friday,False,382,458,2024-06-21 05:54:00,2024,6,25,0
2205,3365,680,Laptop,Appliances,1,1439.66,5/27/2024 8:43,14,"New York, NY",299,101,240,391,10,25,Female,37680.36,Silver,Cash,True,0,Sunny,False,Thursday,True,156,426,2024-05-27 08:43:00,2024,5,22,0
2206,8586,235,Laptop,Appliances,5,432.74,8/7/2024 10:09,11,"Dallas, TX",303,110,221,471,10,40,Other,26560.24,Bronze,Debit Card,False,BOGO,Stormy,False,Monday,False,431,147,2024-08-07 10:09:00,2024,8,32,0
2207,1944,908,Headphones,Appliances,5,944.84,5/9/2024 9:36,16,"Chicago, IL",136,57,170,214,7,27,Female,36605.96,Bronze,Credit Card,True,Percentage Discount,Sunny,False,Monday,False,471,259,2024-05-09 09:36:00,2024,5,19,0
2208,7761,413,TV,Electronics,4,440.57,3/8/2024 16:42,15,"Los Angeles, CA",79,70,114,220,3,70,Female,86063.15,Bronze,Credit Card,False,0,Stormy,False,Thursday,False,159,159,2024-03-08 16:42:00,2024,3,10,0
2209,7824,275,Tablet,Electronics,2,1404.39,8/6/2024 14:16,15,"Miami, FL",431,96,216,432,9,63,Female,102713.65,Silver,Debit Card,True,0,Sunny,True,Wednesday,False,305,354,2024-08-06 14:16:00,2024,8,32,0
2210,9683,908,Tablet,Appliances,4,298.01,7/1/2024 9:02,2,"Los Angeles, CA",374,89,181,467,10,55,Female,58719.43,Bronze,Digital Wallet,True,0,Rainy,True,Sunday,True,317,467,2024-07-01 09:02:00,2024,7,27,0
2211,3196,366,Headphones,Appliances,3,222.07,9/11/2024 10:36,14,"New York, NY",287,98,123,170,4,44,Female,29750.68,Silver,Cash,True,0,Sunny,False,Wednesday,True,375,195,2024-09-11 10:36:00,2024,9,37,0
2212,7363,332,TV,Electronics,5,198.08,3/11/2024 4:46,3,"New York, NY",387,62,257,207,1,34,Other,114312.63,Silver,Digital Wallet,False,0,Rainy,True,Tuesday,False,114,418,2024-03-11 04:46:00,2024,3,11,0
2213,4978,595,Fridge,Appliances,4,553.83,4/19/2024 1:05,5,"New York, NY",182,102,162,491,3,41,Other,72559.47,Bronze,Credit Card,True,BOGO,Sunny,True,Saturday,True,414,166,2024-04-19 01:05:00,2024,4,16,0
2214,5177,480,Fridge,Appliances,2,1968.94,2/2/2024 4:32,20,"Dallas, TX",377,115,256,382,9,51,Other,80299.65,Silver,Debit Card,True,BOGO,Sunny,False,Tuesday,False,322,308,2024-02-02 04:32:00,2024,2,5,0
2215,4331,395,Fridge,Appliances,2,1421.67,7/2/2024 2:54,17,"New York, NY",268,82,131,143,5,47,Male,27953.76,Bronze,Credit Card,True,0,Rainy,False,Monday,False,431,235,2024-07-02 02:54:00,2024,7,27,0
2216,6411,888,Tablet,Appliances,2,944.38,5/4/2024 5:07,17,"Miami, FL",9,87,164,255,1,66,Female,51154.39,Platinum,Debit Card,False,0,Rainy,False,Thursday,False,258,457,2024-05-04 05:07:00,2024,5,18,0
2217,2295,965,TV,Electronics,3,755.6,5/29/2024 16:13,20,"Dallas, TX",97,85,197,218,6,22,Male,52787.04,Bronze,Debit Card,True,BOGO,Rainy,False,Wednesday,False,446,170,2024-05-29 16:13:00,2024,5,22,0
2218,8369,148,Headphones,Electronics,1,604.8,9/3/2024 18:21,15,"Los Angeles, CA",115,98,101,208,3,42,Female,91397.59,Platinum,Cash,False,0,Stormy,False,Tuesday,True,366,311,2024-09-03 18:21:00,2024,9,36,0
2219,7079,251,Washing Machine,Electronics,4,1359.94,4/11/2024 4:38,5,"New York, NY",13,125,161,157,2,42,Female,26676.3,Platinum,Cash,True,Percentage Discount,Sunny,True,Wednesday,False,307,489,2024-04-11 04:38:00,2024,4,15,0
2220,2514,461,TV,Appliances,3,871.6,5/23/2024 21:20,18,"Los Angeles, CA",267,103,214,308,9,30,Male,28072.36,Silver,Cash,True,0,Sunny,True,Wednesday,False,105,403,2024-05-23 21:20:00,2024,5,21,0
2221,9775,391,Smartphone,Appliances,2,1536.41,2/2/2024 11:43,10,"New York, NY",210,86,239,138,6,59,Male,85245.93,Gold,Credit Card,True,BOGO,Sunny,True,Thursday,True,480,168,2024-02-02 11:43:00,2024,2,5,0
2222,4120,566,TV,Appliances,2,702.42,5/25/2024 3:02,5,"Miami, FL",327,96,143,320,1,57,Female,82507.57,Bronze,Debit Card,False,0,Sunny,True,Wednesday,False,223,183,2024-05-25 03:02:00,2024,5,21,0
2223,1844,270,Camera,Appliances,3,1587.75,2/1/2024 12:05,13,"New York, NY",130,147,243,307,6,31,Other,44013.32,Platinum,Digital Wallet,False,BOGO,Cloudy,False,Saturday,False,484,285,2024-02-01 12:05:00,2024,2,5,0
2224,5398,733,Headphones,Electronics,1,1194.15,4/26/2024 0:47,17,"Chicago, IL",420,132,107,478,7,63,Male,100496.23,Silver,Credit Card,True,0,Rainy,False,Thursday,True,415,303,2024-04-26 00:47:00,2024,4,17,0
2225,7179,264,Headphones,Electronics,3,211.1,3/4/2024 7:56,2,"New York, NY",49,114,158,418,1,21,Female,74631.56,Bronze,Credit Card,False,BOGO,Stormy,True,Tuesday,False,444,242,2024-03-04 07:56:00,2024,3,10,0
2226,1647,828,Laptop,Electronics,2,1892.13,4/21/2024 5:35,20,"Dallas, TX",147,127,180,440,9,31,Female,40681.97,Bronze,Cash,False,0,Stormy,True,Wednesday,False,211,92,2024-04-21 05:35:00,2024,4,16,0
2227,2192,648,Tablet,Electronics,2,122.43,5/15/2024 21:06,5,"Miami, FL",284,147,205,341,4,26,Male,24511.51,Silver,Digital Wallet,True,0,Rainy,False,Monday,True,177,106,2024-05-15 21:06:00,2024,5,20,0
2228,4082,392,Smartphone,Electronics,4,1419.09,3/13/2024 16:17,17,"Los Angeles, CA",210,73,233,257,2,28,Female,58630.8,Silver,Debit Card,True,BOGO,Cloudy,True,Thursday,True,177,394,2024-03-13 16:17:00,2024,3,11,0
2229,4555,286,Washing Machine,Electronics,1,135.52,7/31/2024 9:49,5,"Chicago, IL",335,82,253,447,10,24,Male,99648.02,Silver,Digital Wallet,False,0,Stormy,True,Wednesday,False,199,125,2024-07-31 09:49:00,2024,7,31,0
2230,8854,279,Headphones,Appliances,1,824.08,6/29/2024 14:43,13,"New York, NY",125,137,255,257,2,45,Female,84988.23,Bronze,Debit Card,True,0,Stormy,False,Monday,False,254,223,2024-06-29 14:43:00,2024,6,26,0
2231,4422,959,TV,Appliances,5,1666.17,3/3/2024 12:45,3,"Chicago, IL",424,89,276,311,3,66,Male,101676.02,Silver,Debit Card,True,0,Sunny,False,Tuesday,True,392,142,2024-03-03 12:45:00,2024,3,9,0
2232,6455,825,Smartphone,Electronics,5,345.21,7/18/2024 12:08,13,"Miami, FL",65,60,129,398,7,53,Male,99919.19,Platinum,Credit Card,False,0,Cloudy,False,Friday,True,499,335,2024-07-18 12:08:00,2024,7,29,0
2233,5967,809,Camera,Electronics,1,67.38,6/13/2024 21:24,9,"Chicago, IL",302,135,273,349,1,63,Male,78938.4,Gold,Credit Card,False,0,Cloudy,True,Monday,False,331,296,2024-06-13 21:24:00,2024,6,24,0
2234,1251,782,Tablet,Electronics,1,1032.64,5/9/2024 0:36,4,"Miami, FL",332,119,104,120,5,68,Female,80207.65,Silver,Cash,True,0,Cloudy,False,Monday,False,460,179,2024-05-09 00:36:00,2024,5,19,0
2235,4470,913,Smartphone,Electronics,2,312.37,9/1/2024 0:15,15,"Chicago, IL",23,79,243,349,9,50,Female,116429.88,Bronze,Cash,False,0,Stormy,True,Thursday,True,185,268,2024-09-01 00:15:00,2024,9,35,0
2236,4113,257,Smartphone,Electronics,3,729.87,3/7/2024 18:13,1,"Dallas, TX",263,73,266,158,6,20,Male,55867.78,Bronze,Credit Card,True,Percentage Discount,Rainy,True,Friday,True,330,311,2024-03-07 18:13:00,2024,3,10,0
2237,2922,265,Camera,Electronics,4,1165.05,2/14/2024 16:44,1,"Dallas, TX",163,115,265,157,9,47,Male,66106.93,Bronze,Cash,True,Percentage Discount,Sunny,False,Wednesday,False,392,454,2024-02-14 16:44:00,2024,2,7,0
2238,8846,343,Washing Machine,Electronics,5,457.42,4/12/2024 18:55,11,"New York, NY",415,148,195,409,10,18,Female,66803.8,Platinum,Cash,True,Percentage Discount,Sunny,False,Saturday,False,106,188,2024-04-12 18:55:00,2024,4,15,0
2239,4974,219,Smartphone,Electronics,4,560.23,4/12/2024 16:24,7,"Los Angeles, CA",10,58,236,369,7,24,Male,116934.84,Gold,Digital Wallet,True,Percentage Discount,Stormy,True,Tuesday,False,361,169,2024-04-12 16:24:00,2024,4,15,0
2240,4350,142,Laptop,Electronics,1,964.02,2/29/2024 23:21,16,"Miami, FL",170,61,226,467,6,50,Other,56749.81,Platinum,Credit Card,True,0,Sunny,False,Monday,False,497,91,2024-02-29 23:21:00,2024,2,9,0
2241,7498,424,Washing Machine,Electronics,4,705.72,3/1/2024 9:51,3,"Miami, FL",498,80,222,396,5,27,Male,114998.21,Bronze,Credit Card,False,BOGO,Cloudy,True,Thursday,False,467,136,2024-03-01 09:51:00,2024,3,9,0
2242,4921,688,Fridge,Appliances,2,938.64,7/14/2024 5:00,17,"Miami, FL",29,106,217,269,10,23,Other,94381.42,Bronze,Debit Card,True,Percentage Discount,Sunny,True,Thursday,True,227,390,2024-07-14 05:00:00,2024,7,28,0
2243,6269,229,Camera,Electronics,1,1134.8,3/24/2024 14:01,14,"Chicago, IL",386,130,100,134,9,62,Female,113207.52,Gold,Cash,True,0,Rainy,True,Sunday,False,229,98,2024-03-24 14:01:00,2024,3,12,0
2244,5637,551,Laptop,Appliances,4,1715.09,1/24/2024 21:36,2,"New York, NY",424,66,284,156,2,70,Other,111671.4,Gold,Cash,False,BOGO,Stormy,False,Tuesday,True,447,124,2024-01-24 21:36:00,2024,1,4,0
2245,7236,366,Smartphone,Appliances,1,480.28,6/30/2024 21:40,11,"Dallas, TX",139,84,220,160,9,39,Male,84344.29,Gold,Credit Card,False,0,Cloudy,False,Monday,False,349,386,2024-06-30 21:40:00,2024,6,26,0
2246,8639,478,Headphones,Appliances,2,613.59,3/30/2024 23:50,13,"Dallas, TX",479,145,191,289,5,39,Male,22163.58,Bronze,Digital Wallet,True,0,Rainy,False,Tuesday,False,121,113,2024-03-30 23:50:00,2024,3,13,0
2247,9743,288,Tablet,Electronics,5,1025.77,4/21/2024 20:42,13,"New York, NY",343,137,107,352,5,49,Female,79029.68,Gold,Digital Wallet,False,0,Cloudy,False,Friday,True,370,394,2024-04-21 20:42:00,2024,4,16,0
2248,6886,310,Smartphone,Electronics,4,453.68,1/24/2024 15:41,18,"Los Angeles, CA",261,137,127,379,1,34,Male,50802.19,Silver,Digital Wallet,False,BOGO,Stormy,False,Thursday,False,104,423,2024-01-24 15:41:00,2024,1,4,0
2249,6053,675,Laptop,Electronics,4,1009.39,3/16/2024 5:53,17,"Dallas, TX",437,85,148,332,10,69,Other,33789.95,Bronze,Cash,True,0,Stormy,False,Friday,False,244,231,2024-03-16 05:53:00,2024,3,11,0
2250,5285,824,Camera,Appliances,2,224.05,2/16/2024 0:31,1,"Los Angeles, CA",253,148,247,165,4,70,Female,67876.06,Bronze,Credit Card,False,BOGO,Rainy,False,Thursday,False,193,258,2024-02-16 00:31:00,2024,2,7,0
2251,6892,135,Washing Machine,Appliances,1,414.44,2/21/2024 4:47,7,"Chicago, IL",338,113,267,222,9,61,Male,116843.47,Platinum,Cash,True,Percentage Discount,Rainy,False,Monday,False,412,397,2024-02-21 04:47:00,2024,2,8,0
2252,9401,781,Laptop,Electronics,2,603.19,1/21/2024 13:40,3,"Los Angeles, CA",54,141,272,398,7,23,Male,53750.66,Platinum,Digital Wallet,True,BOGO,Cloudy,False,Thursday,True,376,284,2024-01-21 13:40:00,2024,1,3,0
2253,9147,424,Washing Machine,Electronics,1,835.69,6/6/2024 21:40,13,"Dallas, TX",171,126,259,130,6,26,Male,119043.65,Platinum,Debit Card,False,0,Cloudy,False,Tuesday,False,295,340,2024-06-06 21:40:00,2024,6,23,0
2254,8635,452,TV,Electronics,1,1161.76,8/11/2024 14:21,13,"Dallas, TX",299,140,155,200,5,69,Male,94426.34,Gold,Debit Card,True,Percentage Discount,Stormy,True,Friday,False,123,288,2024-08-11 14:21:00,2024,8,32,0
2255,2615,251,Washing Machine,Electronics,5,1645.49,6/3/2024 19:03,10,"Los Angeles, CA",14,70,253,353,8,66,Male,39303.79,Bronze,Digital Wallet,False,0,Stormy,True,Sunday,True,193,275,2024-06-03 19:03:00,2024,6,23,0
2256,8692,481,Tablet,Electronics,3,799.59,3/30/2024 21:44,16,"Los Angeles, CA",428,149,260,160,2,41,Male,58526.09,Gold,Credit Card,True,0,Cloudy,True,Thursday,True,117,388,2024-03-30 21:44:00,2024,3,13,0
2257,6246,559,Laptop,Appliances,2,1942.08,7/5/2024 8:30,19,"Dallas, TX",161,124,144,264,10,24,Female,78440.14,Silver,Credit Card,False,0,Rainy,False,Thursday,True,226,168,2024-07-05 08:30:00,2024,7,27,0
2258,4328,652,Laptop,Electronics,4,1436.22,4/8/2024 12:19,12,"New York, NY",60,108,182,431,3,29,Female,89414.81,Silver,Digital Wallet,False,0,Rainy,True,Monday,False,232,404,2024-04-08 12:19:00,2024,4,15,0
2259,7073,266,Headphones,Appliances,4,1852.05,2/1/2024 20:36,3,"New York, NY",285,145,200,288,8,24,Other,39332.6,Platinum,Credit Card,True,0,Stormy,True,Thursday,False,486,495,2024-02-01 20:36:00,2024,2,5,0
2260,6126,646,TV,Electronics,2,1970.65,8/5/2024 15:51,5,"Chicago, IL",64,141,215,364,1,52,Female,43663.54,Silver,Digital Wallet,True,BOGO,Stormy,False,Friday,True,407,293,2024-08-05 15:51:00,2024,8,32,0
2261,7781,408,Smartphone,Appliances,1,805.31,8/2/2024 19:12,15,"Los Angeles, CA",466,91,256,305,6,52,Female,22331.98,Silver,Cash,False,0,Rainy,True,Thursday,True,227,297,2024-08-02 19:12:00,2024,8,31,0
2262,1749,224,Smartphone,Appliances,5,603.08,1/28/2024 18:35,19,"New York, NY",108,123,222,105,5,30,Female,79322.2,Silver,Debit Card,True,0,Cloudy,True,Friday,False,248,344,2024-01-28 18:35:00,2024,1,4,0
2263,4625,125,Tablet,Electronics,3,1671.92,5/16/2024 9:29,17,"New York, NY",238,61,277,193,9,62,Female,106448.9,Silver,Credit Card,False,0,Stormy,True,Monday,False,193,144,2024-05-16 09:29:00,2024,5,20,0
2264,3390,514,Tablet,Appliances,2,1634.01,3/1/2024 11:27,7,"New York, NY",249,141,297,305,8,30,Female,117482.05,Silver,Digital Wallet,False,Percentage Discount,Cloudy,True,Friday,True,226,228,2024-03-01 11:27:00,2024,3,9,0
2265,1265,611,Headphones,Appliances,4,94.74,6/19/2024 0:51,4,"Los Angeles, CA",87,84,177,254,5,36,Other,93194.81,Platinum,Credit Card,False,0,Sunny,True,Monday,False,475,473,2024-06-19 00:51:00,2024,6,25,0
2266,5272,886,Camera,Electronics,5,454.95,4/21/2024 19:25,6,"Chicago, IL",53,88,297,166,9,18,Female,56101.89,Gold,Credit Card,True,Percentage Discount,Cloudy,True,Monday,True,469,396,2024-04-21 19:25:00,2024,4,16,0
2267,7841,248,Washing Machine,Electronics,5,1887.7,9/8/2024 13:14,9,"New York, NY",30,117,273,207,8,59,Other,91409.52,Platinum,Digital Wallet,False,0,Stormy,True,Monday,False,208,467,2024-09-08 13:14:00,2024,9,36,0
2268,5836,569,Washing Machine,Electronics,1,1901.93,3/24/2024 13:31,5,"New York, NY",314,123,200,306,1,22,Male,33513.56,Gold,Debit Card,False,0,Rainy,False,Thursday,True,122,290,2024-03-24 13:31:00,2024,3,12,0
2269,3497,427,Camera,Electronics,1,1400.71,5/24/2024 8:09,18,"New York, NY",26,89,162,191,6,48,Female,57447.62,Gold,Cash,True,0,Stormy,True,Sunday,False,264,186,2024-05-24 08:09:00,2024,5,21,0
2270,4214,259,Headphones,Electronics,3,1643.71,6/15/2024 4:19,12,"Los Angeles, CA",247,52,123,470,7,54,Female,49035.26,Gold,Debit Card,True,0,Stormy,False,Sunday,False,482,400,2024-06-15 04:19:00,2024,6,24,0
2271,6404,104,Washing Machine,Electronics,4,844.95,3/1/2024 12:56,8,"New York, NY",129,50,295,254,7,63,Female,106594.26,Platinum,Credit Card,True,0,Sunny,True,Monday,False,296,315,2024-03-01 12:56:00,2024,3,9,0
2272,4768,856,Headphones,Electronics,4,761.49,7/14/2024 17:09,12,"Dallas, TX",147,123,222,273,3,22,Male,90645.02,Gold,Debit Card,False,0,Rainy,False,Sunday,False,356,312,2024-07-14 17:09:00,2024,7,28,0
2273,7223,659,Camera,Appliances,5,1568.43,6/24/2024 12:01,9,"New York, NY",131,134,299,360,4,55,Female,100923.95,Silver,Cash,True,BOGO,Cloudy,False,Friday,True,474,352,2024-06-24 12:01:00,2024,6,26,0
2274,5026,619,Washing Machine,Electronics,3,326.87,5/25/2024 15:50,3,"Dallas, TX",240,89,223,375,1,37,Male,36906.93,Bronze,Digital Wallet,False,0,Cloudy,False,Saturday,True,172,247,2024-05-25 15:50:00,2024,5,21,0
2275,9180,439,Laptop,Electronics,1,816.05,4/8/2024 20:37,13,"Los Angeles, CA",293,99,117,469,1,35,Male,54112.33,Gold,Credit Card,False,0,Rainy,True,Tuesday,True,163,259,2024-04-08 20:37:00,2024,4,15,0
2276,6530,762,Camera,Electronics,1,699.49,9/15/2024 3:41,1,"Los Angeles, CA",353,93,232,246,6,62,Female,106671.54,Gold,Digital Wallet,False,0,Sunny,False,Friday,False,425,338,2024-09-15 03:41:00,2024,9,37,0
2277,5216,822,Headphones,Electronics,1,1723.71,8/15/2024 17:56,3,"Los Angeles, CA",118,147,203,464,7,63,Male,27109.14,Gold,Credit Card,True,0,Sunny,True,Sunday,False,464,235,2024-08-15 17:56:00,2024,8,33,0
2278,9005,402,Camera,Appliances,4,1204.88,2/22/2024 20:18,19,"Chicago, IL",290,119,146,292,1,39,Other,29113.31,Bronze,Cash,False,0,Rainy,True,Wednesday,False,163,491,2024-02-22 20:18:00,2024,2,8,0
2279,9037,585,Washing Machine,Electronics,2,374.57,3/8/2024 13:56,20,"Miami, FL",54,82,204,479,10,58,Male,43505.25,Platinum,Credit Card,False,BOGO,Cloudy,False,Wednesday,True,129,380,2024-03-08 13:56:00,2024,3,10,0
2280,8550,396,Tablet,Appliances,2,1455.18,2/20/2024 22:48,3,"Los Angeles, CA",354,101,204,397,5,41,Female,59203.91,Silver,Credit Card,False,0,Stormy,False,Thursday,False,193,223,2024-02-20 22:48:00,2024,2,8,0
2281,3756,872,Headphones,Appliances,3,1356.13,5/12/2024 7:21,20,"Dallas, TX",36,80,287,205,5,48,Male,40264.75,Silver,Digital Wallet,True,0,Sunny,False,Monday,False,205,152,2024-05-12 07:21:00,2024,5,19,0
2282,6770,687,Laptop,Electronics,5,615.69,5/20/2024 3:47,18,"New York, NY",241,124,212,328,7,45,Male,55112.19,Gold,Debit Card,False,0,Cloudy,False,Wednesday,False,133,157,2024-05-20 03:47:00,2024,5,21,0
2283,3773,782,Smartphone,Electronics,1,126.83,2/20/2024 9:27,9,"Chicago, IL",63,69,288,135,2,65,Other,51529.78,Platinum,Cash,True,0,Sunny,False,Tuesday,False,119,448,2024-02-20 09:27:00,2024,2,8,0
2284,3293,250,Fridge,Electronics,1,117.05,6/30/2024 19:33,18,"Dallas, TX",248,132,295,243,6,42,Other,97419.64,Bronze,Cash,False,0,Rainy,True,Wednesday,False,220,267,2024-06-30 19:33:00,2024,6,26,0
2285,9954,918,TV,Appliances,4,1767.13,7/15/2024 4:47,1,"Dallas, TX",481,145,235,336,1,55,Female,105676.37,Platinum,Digital Wallet,True,0,Rainy,True,Saturday,False,448,147,2024-07-15 04:47:00,2024,7,29,0
2286,9000,678,Smartphone,Appliances,2,1366.84,1/18/2024 3:19,17,"Dallas, TX",128,87,205,431,2,66,Female,43519.43,Silver,Cash,True,0,Cloudy,False,Thursday,False,379,432,2024-01-18 03:19:00,2024,1,3,0
2287,4015,846,Camera,Appliances,5,325.44,1/14/2024 21:27,15,"Miami, FL",437,121,117,382,3,63,Male,93452.52,Bronze,Cash,True,0,Sunny,False,Friday,False,103,325,2024-01-14 21:27:00,2024,1,2,0
2288,9882,552,Washing Machine,Electronics,4,1114.9,1/9/2024 2:48,1,"Los Angeles, CA",365,144,203,354,4,42,Other,112772.85,Platinum,Debit Card,True,0,Cloudy,True,Sunday,True,356,202,2024-01-09 02:48:00,2024,1,2,0
2289,1962,446,Laptop,Appliances,1,1344.94,2/2/2024 20:44,4,"Chicago, IL",5,114,159,277,6,27,Male,41355.87,Platinum,Credit Card,False,Percentage Discount,Cloudy,False,Wednesday,False,431,94,2024-02-02 20:44:00,2024,2,5,0
2290,9584,805,TV,Appliances,2,218.4,9/16/2024 8:35,16,"Chicago, IL",15,113,157,113,1,40,Other,54778.68,Silver,Cash,False,0,Cloudy,True,Saturday,False,298,337,2024-09-16 08:35:00,2024,9,38,0
2291,1554,215,Fridge,Appliances,1,1349.75,1/12/2024 9:55,1,"Dallas, TX",102,121,295,365,7,30,Other,29953.96,Platinum,Cash,True,0,Sunny,False,Wednesday,True,408,432,2024-01-12 09:55:00,2024,1,2,0
2292,2217,849,Camera,Electronics,4,785.13,6/5/2024 16:48,17,"New York, NY",363,52,243,443,7,44,Male,109604.69,Silver,Cash,True,0,Sunny,True,Thursday,False,134,131,2024-06-05 16:48:00,2024,6,23,0
2293,1794,590,TV,Electronics,2,84.06,3/23/2024 5:41,13,"Chicago, IL",131,132,200,111,6,46,Female,110099.32,Gold,Credit Card,True,0,Sunny,False,Friday,False,411,342,2024-03-23 05:41:00,2024,3,12,0
2294,1104,141,Tablet,Electronics,2,217.73,8/14/2024 0:57,16,"Chicago, IL",182,111,153,282,7,24,Other,30789.11,Silver,Debit Card,True,0,Cloudy,True,Saturday,False,200,376,2024-08-14 00:57:00,2024,8,33,0
2295,7756,242,TV,Appliances,1,96.97,2/28/2024 0:34,4,"New York, NY",201,146,236,430,7,24,Other,32384.62,Silver,Debit Card,True,0,Cloudy,False,Friday,False,316,444,2024-02-28 00:34:00,2024,2,9,0
2296,3252,794,Fridge,Appliances,1,1543.1,9/10/2024 7:00,12,"Miami, FL",270,81,130,455,1,49,Other,85623.12,Silver,Credit Card,False,0,Stormy,True,Saturday,False,245,460,2024-09-10 07:00:00,2024,9,37,0
2297,4791,664,Tablet,Appliances,2,595.62,8/8/2024 20:15,6,"Miami, FL",347,111,161,335,6,25,Female,44412.72,Bronze,Debit Card,True,0,Stormy,True,Monday,False,399,273,2024-08-08 20:15:00,2024,8,32,0
2298,2113,219,Headphones,Electronics,5,1656.61,4/1/2024 18:56,2,"Miami, FL",455,100,102,421,1,65,Female,33967.93,Platinum,Cash,False,BOGO,Rainy,True,Tuesday,True,162,205,2024-04-01 18:56:00,2024,4,14,0
2299,3474,415,Washing Machine,Electronics,4,1016.24,6/13/2024 4:02,16,"Miami, FL",258,135,150,133,6,26,Female,40663.51,Platinum,Debit Card,False,BOGO,Stormy,True,Monday,False,216,269,2024-06-13 04:02:00,2024,6,24,0
2300,1149,125,Smartphone,Electronics,5,273.36,5/1/2024 15:40,15,"Miami, FL",352,131,136,134,10,20,Other,118527.18,Silver,Credit Card,False,Percentage Discount,Cloudy,True,Thursday,False,486,415,2024-05-01 15:40:00,2024,5,18,0
2301,4583,511,Headphones,Appliances,1,1911.0,7/11/2024 2:11,4,"Chicago, IL",141,136,290,354,1,32,Male,103085.74,Platinum,Debit Card,True,0,Sunny,False,Saturday,True,198,290,2024-07-11 02:11:00,2024,7,28,0
2302,9285,732,Camera,Electronics,5,445.69,6/8/2024 3:40,2,"Miami, FL",468,111,204,370,9,37,Female,66937.36,Silver,Digital Wallet,True,0,Cloudy,False,Sunday,True,483,215,2024-06-08 03:40:00,2024,6,23,0
2303,8471,961,Camera,Appliances,4,161.19,4/2/2024 19:12,16,"Chicago, IL",485,103,133,232,6,41,Male,88817.86,Gold,Digital Wallet,False,0,Stormy,False,Saturday,False,294,194,2024-04-02 19:12:00,2024,4,14,0
2304,7114,325,Fridge,Appliances,1,1307.68,3/13/2024 2:16,10,"Chicago, IL",271,82,177,423,6,62,Other,25411.92,Bronze,Credit Card,False,Percentage Discount,Stormy,True,Monday,True,255,95,2024-03-13 02:16:00,2024,3,11,0
2305,1990,556,Fridge,Appliances,4,1464.71,8/29/2024 22:51,2,"Chicago, IL",202,123,275,257,8,48,Other,38040.96,Platinum,Digital Wallet,False,Percentage Discount,Stormy,False,Wednesday,False,124,398,2024-08-29 22:51:00,2024,8,35,0
2306,8916,465,Headphones,Electronics,4,1977.29,4/18/2024 9:43,10,"Chicago, IL",168,110,257,242,7,62,Female,115132.93,Bronze,Digital Wallet,True,0,Rainy,True,Monday,True,452,348,2024-04-18 09:43:00,2024,4,16,0
2307,8993,194,Headphones,Appliances,2,674.52,4/13/2024 20:49,8,"Chicago, IL",345,76,232,125,6,35,Female,114525.31,Bronze,Cash,False,0,Rainy,False,Friday,False,166,451,2024-04-13 20:49:00,2024,4,15,0
2308,1257,434,TV,Appliances,2,870.58,3/17/2024 1:13,8,"Los Angeles, CA",477,107,207,130,8,25,Male,94127.25,Silver,Cash,False,0,Sunny,True,Monday,True,182,420,2024-03-17 01:13:00,2024,3,11,0
2309,1108,156,Laptop,Electronics,1,1328.14,2/29/2024 0:27,14,"New York, NY",249,117,177,179,9,58,Male,57043.18,Bronze,Cash,False,BOGO,Stormy,True,Monday,True,130,110,2024-02-29 00:27:00,2024,2,9,0
2310,9719,722,Camera,Electronics,1,473.29,1/5/2024 14:15,18,"Dallas, TX",386,55,106,475,10,46,Other,83208.14,Bronze,Digital Wallet,False,0,Rainy,False,Friday,False,359,97,2024-01-05 14:15:00,2024,1,1,0
2311,7739,756,Tablet,Electronics,3,1216.63,2/23/2024 8:02,19,"Miami, FL",106,91,256,349,4,39,Female,94004.22,Gold,Cash,True,Percentage Discount,Rainy,False,Friday,False,180,185,2024-02-23 08:02:00,2024,2,8,0
2312,1194,299,Fridge,Electronics,3,1537.12,2/16/2024 9:35,12,"Chicago, IL",245,81,164,233,8,42,Female,35183.5,Bronze,Credit Card,True,0,Rainy,True,Wednesday,False,274,482,2024-02-16 09:35:00,2024,2,7,0
2313,1274,697,Washing Machine,Appliances,3,1798.69,3/7/2024 21:31,15,"Chicago, IL",150,85,203,496,10,40,Male,101360.42,Platinum,Digital Wallet,True,Percentage Discount,Stormy,True,Saturday,True,348,476,2024-03-07 21:31:00,2024,3,10,0
2314,9673,639,Camera,Electronics,4,1633.06,7/9/2024 1:04,20,"New York, NY",399,68,201,360,4,69,Other,27659.72,Gold,Debit Card,True,0,Cloudy,False,Monday,True,413,287,2024-07-09 01:04:00,2024,7,28,0
2315,5501,327,Headphones,Appliances,1,224.35,6/18/2024 17:37,13,"Dallas, TX",142,94,193,408,10,57,Female,71655.9,Silver,Credit Card,False,0,Stormy,True,Friday,True,144,473,2024-06-18 17:37:00,2024,6,25,0
2316,9777,900,Tablet,Appliances,4,163.51,6/1/2024 7:29,15,"Dallas, TX",306,64,170,230,2,64,Male,22996.42,Silver,Cash,True,0,Rainy,True,Friday,True,122,477,2024-06-01 07:29:00,2024,6,22,0
2317,5697,885,Laptop,Appliances,1,1458.64,8/10/2024 16:01,5,"Miami, FL",193,122,245,187,10,29,Female,77239.71,Silver,Cash,False,0,Cloudy,True,Saturday,False,124,274,2024-08-10 16:01:00,2024,8,32,0
2318,1280,384,Washing Machine,Electronics,5,1199.2,7/28/2024 3:41,10,"Miami, FL",207,62,224,241,5,31,Female,41604.12,Platinum,Cash,False,0,Cloudy,False,Friday,True,429,107,2024-07-28 03:41:00,2024,7,30,0
2319,9228,300,Smartphone,Appliances,2,1076.33,1/18/2024 19:20,14,"New York, NY",193,118,215,257,8,18,Male,93085.04,Silver,Digital Wallet,True,0,Cloudy,False,Thursday,True,183,137,2024-01-18 19:20:00,2024,1,3,0
2320,8054,123,Washing Machine,Appliances,5,1210.62,5/6/2024 17:35,3,"Miami, FL",484,108,107,218,5,21,Other,70737.2,Gold,Debit Card,False,0,Rainy,False,Monday,False,314,370,2024-05-06 17:35:00,2024,5,19,0
2321,3937,185,Smartphone,Electronics,1,507.85,7/7/2024 11:33,2,"Miami, FL",2,65,299,326,4,26,Other,78475.08,Gold,Digital Wallet,True,0,Sunny,False,Thursday,True,189,109,2024-07-07 11:33:00,2024,7,27,0
2322,2753,651,Headphones,Appliances,4,1128.44,1/11/2024 10:19,11,"Dallas, TX",226,104,180,411,8,29,Other,41325.81,Silver,Debit Card,True,0,Stormy,False,Thursday,False,471,406,2024-01-11 10:19:00,2024,1,2,0
2323,2578,969,Smartphone,Appliances,1,1066.03,5/28/2024 0:36,3,"Miami, FL",69,66,157,204,3,36,Other,41894.39,Bronze,Debit Card,True,0,Stormy,True,Tuesday,True,220,414,2024-05-28 00:36:00,2024,5,22,0
2324,9591,556,Headphones,Electronics,4,1467.88,3/1/2024 4:01,3,"Chicago, IL",112,118,200,307,10,29,Male,24670.88,Platinum,Cash,False,0,Cloudy,True,Tuesday,False,145,379,2024-03-01 04:01:00,2024,3,9,0
2325,3439,793,Washing Machine,Electronics,3,1628.61,1/11/2024 23:20,2,"Dallas, TX",201,123,176,299,10,26,Female,85258.1,Gold,Debit Card,True,0,Cloudy,False,Saturday,False,164,118,2024-01-11 23:20:00,2024,1,2,0
2326,4948,787,Headphones,Appliances,3,653.96,7/16/2024 11:13,19,"New York, NY",193,107,168,319,1,32,Other,26322.13,Platinum,Credit Card,False,Percentage Discount,Rainy,True,Thursday,False,303,255,2024-07-16 11:13:00,2024,7,29,0
2327,4144,189,Tablet,Electronics,2,1656.7,7/27/2024 22:22,1,"Los Angeles, CA",373,89,163,126,4,46,Female,71627.27,Platinum,Digital Wallet,False,0,Sunny,False,Tuesday,False,352,433,2024-07-27 22:22:00,2024,7,30,0
2328,9625,624,Headphones,Appliances,4,1935.99,8/19/2024 2:41,2,"Miami, FL",29,106,165,246,6,23,Male,84916.71,Silver,Digital Wallet,True,0,Cloudy,True,Saturday,True,457,251,2024-08-19 02:41:00,2024,8,34,0
2329,5135,503,Laptop,Electronics,1,388.31,6/19/2024 7:29,16,"Chicago, IL",392,105,244,258,3,43,Male,28245.82,Gold,Credit Card,False,0,Cloudy,False,Tuesday,True,266,376,2024-06-19 07:29:00,2024,6,25,0
2330,6807,299,Washing Machine,Appliances,2,1305.21,6/20/2024 18:24,2,"Dallas, TX",149,108,266,375,2,42,Male,84483.43,Bronze,Cash,True,0,Sunny,True,Wednesday,False,427,437,2024-06-20 18:24:00,2024,6,25,0
2331,5379,602,Laptop,Appliances,2,1899.29,7/5/2024 3:52,4,"New York, NY",435,105,186,486,10,37,Female,76225.99,Gold,Debit Card,True,0,Cloudy,True,Wednesday,False,221,397,2024-07-05 03:52:00,2024,7,27,0
2332,7502,425,TV,Electronics,3,705.05,4/1/2024 15:28,16,"Los Angeles, CA",451,104,173,303,7,32,Male,119206.6,Silver,Credit Card,False,BOGO,Stormy,True,Wednesday,False,306,488,2024-04-01 15:28:00,2024,4,14,0
2333,2294,717,Headphones,Appliances,3,1906.09,3/18/2024 7:03,18,"Los Angeles, CA",407,138,126,476,1,31,Other,62276.59,Platinum,Cash,True,BOGO,Cloudy,False,Monday,True,170,255,2024-03-18 07:03:00,2024,3,12,0
2334,7112,719,Tablet,Appliances,2,175.71,3/8/2024 4:08,12,"New York, NY",240,101,133,334,10,60,Male,112866.98,Platinum,Digital Wallet,False,Percentage Discount,Stormy,True,Thursday,False,257,409,2024-03-08 04:08:00,2024,3,10,0
2335,7652,623,Laptop,Electronics,2,1110.32,3/8/2024 1:19,1,"Miami, FL",134,146,127,159,2,64,Female,36172.25,Platinum,Debit Card,True,BOGO,Stormy,True,Thursday,True,371,437,2024-03-08 01:19:00,2024,3,10,0
2336,8520,157,Washing Machine,Appliances,3,1889.48,7/28/2024 7:41,6,"Los Angeles, CA",53,57,267,161,1,30,Female,105841.97,Platinum,Debit Card,True,0,Cloudy,True,Saturday,True,450,303,2024-07-28 07:41:00,2024,7,30,0
2337,4984,782,Headphones,Electronics,2,1524.2,4/1/2024 0:33,1,"Los Angeles, CA",75,138,219,375,3,65,Female,102271.62,Platinum,Credit Card,True,Percentage Discount,Cloudy,False,Sunday,True,325,202,2024-04-01 00:33:00,2024,4,14,0
2338,4700,469,Laptop,Electronics,1,1268.74,2/19/2024 13:37,12,"Los Angeles, CA",3,128,197,368,8,69,Male,71016.06,Bronze,Debit Card,False,Percentage Discount,Sunny,True,Wednesday,False,356,503,2024-02-19 13:37:00,2024,2,8,0
2339,5914,507,Fridge,Appliances,4,148.62,1/17/2024 15:34,2,"Miami, FL",285,60,143,138,7,62,Male,76188.95,Silver,Digital Wallet,True,0,Cloudy,True,Wednesday,True,236,424,2024-01-17 15:34:00,2024,1,3,0
2340,2320,251,Camera,Electronics,1,1492.21,5/23/2024 7:51,5,"Chicago, IL",54,125,112,308,5,40,Male,60701.37,Platinum,Credit Card,True,0,Sunny,False,Sunday,True,360,273,2024-05-23 07:51:00,2024,5,21,0
2341,1519,833,Laptop,Appliances,2,146.27,6/17/2024 0:50,12,"Miami, FL",278,65,238,134,8,23,Male,111989.03,Silver,Debit Card,True,BOGO,Stormy,True,Tuesday,False,286,500,2024-06-17 00:50:00,2024,6,25,0
2342,2531,974,Laptop,Electronics,3,561.9,6/21/2024 3:25,10,"New York, NY",0,126,266,369,2,69,Other,93227.45,Platinum,Debit Card,False,0,Cloudy,True,Wednesday,True,302,270,2024-06-21 03:25:00,2024,6,25,0
2343,7640,537,Headphones,Electronics,2,480.22,6/12/2024 10:33,19,"Chicago, IL",98,74,108,186,5,56,Other,83583.49,Platinum,Debit Card,False,0,Cloudy,False,Monday,True,163,500,2024-06-12 10:33:00,2024,6,24,0
2344,7213,478,Smartphone,Appliances,2,914.79,1/18/2024 8:06,16,"Dallas, TX",223,96,119,478,3,57,Other,74560.08,Platinum,Cash,True,0,Rainy,False,Friday,True,181,186,2024-01-18 08:06:00,2024,1,3,0
2345,7179,495,Camera,Appliances,5,878.16,6/21/2024 11:36,6,"Los Angeles, CA",264,70,279,350,5,57,Female,46596.68,Silver,Cash,True,BOGO,Rainy,True,Sunday,False,386,359,2024-06-21 11:36:00,2024,6,25,0
2346,8798,481,Headphones,Appliances,3,522.76,8/28/2024 0:57,8,"New York, NY",304,98,145,467,4,46,Other,40392.81,Bronze,Debit Card,True,0,Stormy,False,Monday,True,326,321,2024-08-28 00:57:00,2024,8,35,0
2347,1919,112,Smartphone,Electronics,1,864.09,8/29/2024 1:39,20,"Miami, FL",107,82,235,325,3,58,Female,51779.8,Silver,Cash,True,BOGO,Stormy,True,Wednesday,False,251,417,2024-08-29 01:39:00,2024,8,35,0
2348,1154,391,Tablet,Electronics,2,382.27,3/15/2024 0:44,6,"Miami, FL",256,66,257,430,2,65,Female,119694.21,Platinum,Digital Wallet,True,0,Rainy,True,Monday,True,398,182,2024-03-15 00:44:00,2024,3,11,0
2349,3807,453,Headphones,Electronics,1,1836.57,9/6/2024 3:53,2,"New York, NY",327,93,163,212,2,28,Other,100759.55,Platinum,Digital Wallet,False,0,Cloudy,True,Monday,False,410,138,2024-09-06 03:53:00,2024,9,36,0
2350,2354,459,Smartphone,Electronics,5,98.23,6/11/2024 7:19,3,"Chicago, IL",78,123,165,251,2,22,Female,110668.41,Bronze,Debit Card,True,BOGO,Rainy,True,Monday,False,145,235,2024-06-11 07:19:00,2024,6,24,0
2351,9189,415,TV,Electronics,3,1588.3,2/16/2024 20:39,1,"Miami, FL",182,134,229,328,10,22,Male,62165.77,Gold,Cash,False,BOGO,Stormy,False,Saturday,False,341,322,2024-02-16 20:39:00,2024,2,7,0
2352,8109,556,Fridge,Appliances,3,210.58,6/25/2024 16:00,6,"Chicago, IL",430,133,141,337,1,22,Female,118427.36,Platinum,Credit Card,False,0,Sunny,False,Wednesday,False,301,320,2024-06-25 16:00:00,2024,6,26,0
2353,6427,995,Tablet,Electronics,4,1970.84,6/30/2024 21:35,20,"Los Angeles, CA",439,128,236,247,3,38,Female,44814.52,Gold,Cash,False,0,Stormy,True,Friday,True,122,98,2024-06-30 21:35:00,2024,6,26,0
2354,2562,674,Headphones,Electronics,4,1365.04,4/20/2024 3:16,16,"New York, NY",67,76,102,401,7,26,Female,114261.24,Bronze,Credit Card,False,0,Cloudy,False,Thursday,True,323,105,2024-04-20 03:16:00,2024,4,16,0
2355,9653,189,TV,Appliances,2,886.72,7/4/2024 7:19,12,"Dallas, TX",404,64,106,313,7,57,Female,70548.89,Bronze,Cash,False,BOGO,Cloudy,True,Thursday,True,320,487,2024-07-04 07:19:00,2024,7,27,0
2356,1697,320,Laptop,Appliances,4,180.22,8/17/2024 22:44,20,"New York, NY",273,107,272,324,3,28,Other,76105.78,Silver,Digital Wallet,False,BOGO,Cloudy,False,Sunday,True,197,459,2024-08-17 22:44:00,2024,8,33,0
2357,4764,845,Washing Machine,Electronics,5,1713.45,5/9/2024 2:07,20,"Los Angeles, CA",347,105,250,365,4,46,Male,56234.19,Silver,Cash,True,0,Rainy,True,Thursday,False,262,349,2024-05-09 02:07:00,2024,5,19,0
2358,4463,554,Camera,Electronics,1,1737.17,3/18/2024 14:47,16,"Chicago, IL",483,124,141,479,8,66,Male,74275.05,Gold,Credit Card,False,0,Cloudy,False,Sunday,True,500,158,2024-03-18 14:47:00,2024,3,12,0
2359,8790,859,TV,Appliances,2,1165.55,7/1/2024 17:22,9,"Los Angeles, CA",299,113,104,249,8,18,Female,119100.81,Platinum,Credit Card,True,0,Stormy,True,Wednesday,False,281,354,2024-07-01 17:22:00,2024,7,27,0
2360,5441,525,Fridge,Appliances,2,1570.63,7/21/2024 21:17,15,"Miami, FL",320,51,190,291,4,68,Female,65191.19,Silver,Digital Wallet,True,0,Stormy,False,Monday,True,232,460,2024-07-21 21:17:00,2024,7,29,0
2361,1762,922,Fridge,Electronics,4,1793.55,9/2/2024 17:19,11,"Los Angeles, CA",144,117,163,458,9,57,Male,85899.14,Silver,Credit Card,False,Percentage Discount,Rainy,True,Thursday,False,188,299,2024-09-02 17:19:00,2024,9,36,0
2362,2218,553,Fridge,Appliances,3,1963.72,9/9/2024 22:49,8,"Miami, FL",2,95,198,164,2,61,Male,102018.96,Silver,Credit Card,False,0,Cloudy,False,Friday,True,112,199,2024-09-09 22:49:00,2024,9,37,0
2363,5593,395,Tablet,Appliances,3,1549.75,1/26/2024 23:18,20,"Dallas, TX",156,103,182,336,4,55,Female,63563.71,Gold,Digital Wallet,True,0,Stormy,True,Wednesday,False,492,388,2024-01-26 23:18:00,2024,1,4,0
2364,9897,267,Headphones,Electronics,1,1701.27,9/10/2024 11:31,14,"Miami, FL",110,146,106,220,4,31,Other,23620.08,Platinum,Debit Card,False,0,Cloudy,False,Saturday,True,151,96,2024-09-10 11:31:00,2024,9,37,0
2365,1539,925,Headphones,Electronics,2,1750.04,8/12/2024 7:54,11,"New York, NY",297,107,173,454,1,64,Female,60785.51,Bronze,Credit Card,False,Percentage Discount,Stormy,False,Saturday,True,158,101,2024-08-12 07:54:00,2024,8,33,0
2366,3938,845,Headphones,Appliances,2,1827.15,2/15/2024 23:48,20,"Miami, FL",126,90,262,224,10,21,Other,69493.53,Silver,Cash,True,0,Sunny,True,Wednesday,True,342,91,2024-02-15 23:48:00,2024,2,7,0
2367,6152,534,Smartphone,Electronics,4,479.56,3/18/2024 23:28,15,"Los Angeles, CA",396,123,190,428,9,44,Female,25147.61,Gold,Cash,False,0,Sunny,True,Friday,True,440,194,2024-03-18 23:28:00,2024,3,12,0
2368,1256,846,Fridge,Electronics,4,1987.34,4/17/2024 20:42,10,"Dallas, TX",186,64,202,424,4,69,Other,47947.48,Bronze,Cash,True,0,Rainy,False,Saturday,False,204,299,2024-04-17 20:42:00,2024,4,16,0
2369,4394,524,Camera,Appliances,1,1733.17,4/17/2024 1:47,9,"Chicago, IL",59,53,234,427,2,48,Male,61872.63,Platinum,Credit Card,False,0,Cloudy,True,Saturday,False,379,510,2024-04-17 01:47:00,2024,4,16,0
2370,3362,242,Smartphone,Appliances,4,222.14,8/21/2024 9:36,6,"Dallas, TX",205,130,209,152,5,45,Other,47337.71,Silver,Cash,False,0,Cloudy,True,Thursday,False,404,431,2024-08-21 09:36:00,2024,8,34,0
2371,7525,955,TV,Electronics,5,1959.98,5/12/2024 9:19,12,"New York, NY",9,97,258,427,6,58,Female,112807.39,Platinum,Debit Card,True,0,Sunny,False,Monday,True,411,495,2024-05-12 09:19:00,2024,5,19,0
2372,2260,701,Headphones,Electronics,3,1377.72,5/12/2024 10:22,5,"Los Angeles, CA",70,133,207,364,3,34,Male,85608.47,Silver,Cash,True,Percentage Discount,Rainy,False,Thursday,True,164,309,2024-05-12 10:22:00,2024,5,19,0
2373,5903,712,Smartphone,Electronics,5,1896.41,5/17/2024 23:34,13,"Los Angeles, CA",202,105,253,366,4,26,Female,113501.89,Gold,Digital Wallet,False,0,Sunny,False,Thursday,False,146,219,2024-05-17 23:34:00,2024,5,20,0
2374,3661,188,Fridge,Electronics,1,1364.97,4/10/2024 5:23,20,"Los Angeles, CA",311,143,110,153,8,21,Female,72964.47,Silver,Cash,True,Percentage Discount,Rainy,True,Sunday,False,242,326,2024-04-10 05:23:00,2024,4,15,0
2375,4939,247,TV,Appliances,2,1496.28,6/3/2024 13:24,9,"Miami, FL",396,150,109,262,9,58,Male,118502.05,Platinum,Cash,True,0,Sunny,False,Wednesday,False,312,227,2024-06-03 13:24:00,2024,6,23,0
2376,7375,312,Headphones,Appliances,3,66.32,9/8/2024 22:41,6,"Dallas, TX",362,77,120,312,1,63,Female,92164.48,Gold,Digital Wallet,False,0,Rainy,True,Tuesday,False,163,310,2024-09-08 22:41:00,2024,9,36,0
2377,9856,410,Headphones,Electronics,3,1245.1,2/26/2024 11:18,2,"Dallas, TX",168,143,253,353,4,62,Male,47179.21,Gold,Cash,True,0,Sunny,False,Friday,True,144,350,2024-02-26 11:18:00,2024,2,9,0
2378,6435,586,Tablet,Appliances,3,1019.53,2/13/2024 23:15,10,"Miami, FL",247,125,143,267,5,68,Other,47334.45,Bronze,Digital Wallet,False,0,Rainy,False,Wednesday,True,398,176,2024-02-13 23:15:00,2024,2,7,0
2379,7288,988,Headphones,Appliances,5,445.47,8/2/2024 23:44,3,"Dallas, TX",498,133,155,245,7,25,Female,89056.22,Gold,Cash,True,BOGO,Stormy,False,Tuesday,False,163,129,2024-08-02 23:44:00,2024,8,31,0
2380,3292,637,Washing Machine,Appliances,5,923.34,9/12/2024 4:51,13,"Chicago, IL",225,135,148,161,4,64,Other,114655.57,Platinum,Debit Card,False,0,Rainy,False,Friday,True,394,160,2024-09-12 04:51:00,2024,9,37,0
2381,2284,443,Smartphone,Electronics,3,1032.48,7/12/2024 10:42,10,"New York, NY",191,103,122,209,4,67,Male,78376.93,Platinum,Credit Card,True,BOGO,Sunny,True,Sunday,False,361,164,2024-07-12 10:42:00,2024,7,28,0
2382,9204,167,Fridge,Electronics,1,1958.53,3/16/2024 1:56,4,"Miami, FL",67,112,180,271,3,23,Female,88639.11,Platinum,Credit Card,True,0,Cloudy,False,Tuesday,True,203,340,2024-03-16 01:56:00,2024,3,11,0
2383,6666,704,Fridge,Electronics,4,234.6,8/2/2024 8:21,12,"Los Angeles, CA",353,55,134,241,9,49,Male,67179.83,Gold,Digital Wallet,True,0,Stormy,False,Sunday,False,392,423,2024-08-02 08:21:00,2024,8,31,0
2384,1879,874,Tablet,Appliances,1,1189.83,6/6/2024 0:22,7,"Los Angeles, CA",470,134,176,421,8,66,Male,108071.02,Gold,Credit Card,True,BOGO,Rainy,True,Monday,False,159,391,2024-06-06 00:22:00,2024,6,23,0
2385,2600,484,Smartphone,Electronics,2,293.34,3/10/2024 23:24,15,"New York, NY",220,88,103,492,5,62,Male,77681.26,Gold,Debit Card,True,0,Cloudy,False,Friday,False,211,446,2024-03-10 23:24:00,2024,3,10,0
2386,8161,190,Washing Machine,Appliances,1,651.43,4/17/2024 12:27,10,"Chicago, IL",214,85,169,424,3,33,Female,100751.81,Bronze,Debit Card,False,0,Sunny,True,Tuesday,False,250,327,2024-04-17 12:27:00,2024,4,16,0
2387,4803,106,Camera,Appliances,1,1351.17,3/12/2024 16:24,2,"Dallas, TX",287,150,131,280,6,22,Other,110722.9,Silver,Cash,False,0,Cloudy,True,Saturday,False,185,306,2024-03-12 16:24:00,2024,3,11,0
2388,2245,519,Camera,Electronics,5,1232.49,5/29/2024 0:42,12,"Miami, FL",148,107,180,275,7,20,Other,45564.71,Platinum,Digital Wallet,False,BOGO,Stormy,False,Tuesday,True,436,250,2024-05-29 00:42:00,2024,5,22,0
2389,6580,754,Washing Machine,Electronics,1,975.02,1/30/2024 23:26,3,"Los Angeles, CA",484,111,263,438,6,22,Male,34490.18,Bronze,Credit Card,False,Percentage Discount,Cloudy,False,Wednesday,True,216,485,2024-01-30 23:26:00,2024,1,5,0
2390,7499,379,Camera,Appliances,3,845.97,7/6/2024 7:41,7,"Chicago, IL",286,111,216,324,7,20,Male,102834.27,Bronze,Credit Card,False,0,Rainy,True,Thursday,False,160,450,2024-07-06 07:41:00,2024,7,27,0
2391,6347,524,Fridge,Appliances,5,1733.85,8/3/2024 0:50,8,"Chicago, IL",478,64,183,405,9,57,Other,35295.1,Silver,Cash,True,Percentage Discount,Sunny,False,Saturday,True,267,196,2024-08-03 00:50:00,2024,8,31,0
2392,1485,279,Washing Machine,Electronics,5,1312.9,5/27/2024 20:14,15,"New York, NY",26,84,231,333,7,25,Male,109660.71,Silver,Credit Card,True,0,Cloudy,False,Sunday,True,208,110,2024-05-27 20:14:00,2024,5,22,0
2393,5478,669,Fridge,Appliances,1,1527.06,4/18/2024 11:31,20,"Dallas, TX",111,54,276,426,7,19,Other,46361.43,Bronze,Credit Card,False,Percentage Discount,Stormy,True,Friday,False,118,148,2024-04-18 11:31:00,2024,4,16,0
2394,8381,573,Fridge,Electronics,2,252.5,3/8/2024 2:12,8,"New York, NY",341,95,168,115,9,61,Other,78284.49,Platinum,Debit Card,False,0,Cloudy,True,Friday,True,319,338,2024-03-08 02:12:00,2024,3,10,0
2395,9038,827,Washing Machine,Appliances,4,1633.97,4/8/2024 3:06,15,"Chicago, IL",379,107,277,470,1,67,Other,23697.43,Platinum,Digital Wallet,True,0,Rainy,False,Sunday,True,151,332,2024-04-08 03:06:00,2024,4,15,0
2396,4737,681,Laptop,Appliances,5,882.92,2/15/2024 15:33,14,"New York, NY",50,109,137,335,6,34,Other,50117.35,Gold,Credit Card,True,0,Sunny,False,Tuesday,True,101,111,2024-02-15 15:33:00,2024,2,7,0
2397,6829,873,Laptop,Appliances,4,1395.65,4/28/2024 3:54,13,"Los Angeles, CA",218,57,218,407,9,43,Male,58686.6,Gold,Digital Wallet,True,BOGO,Sunny,False,Sunday,True,371,119,2024-04-28 03:54:00,2024,4,17,0
2398,7150,240,Fridge,Electronics,3,241.67,6/27/2024 10:14,19,"Dallas, TX",100,67,208,468,1,20,Female,77657.23,Bronze,Credit Card,True,BOGO,Stormy,False,Sunday,False,237,439,2024-06-27 10:14:00,2024,6,26,0
2399,8075,304,Tablet,Appliances,5,1015.72,4/19/2024 10:37,20,"Chicago, IL",204,96,232,131,1,21,Other,97546.99,Platinum,Cash,True,0,Stormy,False,Sunday,True,421,395,2024-04-19 10:37:00,2024,4,16,0
2400,4043,290,Smartphone,Appliances,5,826.35,7/12/2024 14:24,15,"Miami, FL",240,145,206,343,1,70,Female,101490.05,Gold,Debit Card,False,Percentage Discount,Cloudy,True,Thursday,True,481,480,2024-07-12 14:24:00,2024,7,28,0
2401,7227,952,Headphones,Appliances,4,1800.99,8/21/2024 6:55,13,"Los Angeles, CA",267,52,123,326,6,39,Male,102483.91,Gold,Debit Card,False,0,Stormy,True,Sunday,False,202,420,2024-08-21 06:55:00,2024,8,34,0
2402,2404,490,TV,Electronics,3,1333.49,8/19/2024 11:53,18,"Dallas, TX",35,139,266,428,9,29,Other,39022.72,Silver,Cash,True,0,Stormy,False,Sunday,False,496,209,2024-08-19 11:53:00,2024,8,34,0
2403,5839,396,Camera,Electronics,4,1108.25,8/1/2024 2:52,4,"New York, NY",235,60,144,128,10,59,Other,87312.97,Gold,Credit Card,False,0,Stormy,False,Saturday,True,181,226,2024-08-01 02:52:00,2024,8,31,0
2404,5037,667,Smartphone,Appliances,5,1918.47,5/26/2024 3:40,13,"Los Angeles, CA",161,96,222,258,6,20,Female,95439.41,Silver,Credit Card,False,0,Rainy,False,Thursday,True,225,274,2024-05-26 03:40:00,2024,5,21,0
2405,2204,602,Headphones,Electronics,4,847.88,2/7/2024 11:15,1,"Los Angeles, CA",76,97,214,423,4,37,Female,53586.75,Bronze,Credit Card,True,0,Stormy,False,Thursday,False,480,461,2024-02-07 11:15:00,2024,2,6,0
2406,2344,143,Laptop,Appliances,5,510.57,3/9/2024 8:25,17,"Los Angeles, CA",133,86,286,427,9,55,Male,82283.08,Silver,Debit Card,True,0,Stormy,True,Friday,False,438,331,2024-03-09 08:25:00,2024,3,10,0
2407,5390,942,Fridge,Appliances,4,1112.26,5/24/2024 5:31,11,"Los Angeles, CA",427,82,246,291,2,39,Other,55708.43,Gold,Credit Card,True,Percentage Discount,Sunny,True,Monday,True,156,230,2024-05-24 05:31:00,2024,5,21,0
2408,3526,946,Smartphone,Electronics,2,1816.8,4/10/2024 8:12,11,"Dallas, TX",331,129,290,272,6,70,Male,70949.63,Gold,Digital Wallet,True,Percentage Discount,Stormy,True,Friday,False,442,312,2024-04-10 08:12:00,2024,4,15,0
2409,7225,409,Fridge,Appliances,2,1350.2,1/31/2024 14:26,16,"Los Angeles, CA",283,86,150,207,8,42,Male,61658.0,Silver,Cash,True,0,Stormy,True,Saturday,True,180,252,2024-01-31 14:26:00,2024,1,5,0
2410,3527,954,Laptop,Electronics,4,97.92,1/6/2024 12:04,3,"Los Angeles, CA",34,54,161,113,6,44,Male,72481.21,Gold,Credit Card,False,0,Sunny,True,Monday,False,126,176,2024-01-06 12:04:00,2024,1,1,0
2411,7383,699,Washing Machine,Electronics,4,1470.98,5/27/2024 7:56,15,"Los Angeles, CA",127,131,157,110,1,52,Other,114741.83,Bronze,Credit Card,False,0,Stormy,False,Monday,True,140,456,2024-05-27 07:56:00,2024,5,22,0
2412,6188,411,Washing Machine,Electronics,1,823.2,9/10/2024 4:59,10,"New York, NY",173,150,161,136,2,69,Female,47315.35,Bronze,Digital Wallet,True,0,Cloudy,False,Sunday,False,254,214,2024-09-10 04:59:00,2024,9,37,0
2413,6909,605,Laptop,Appliances,1,1563.08,4/2/2024 7:28,20,"Chicago, IL",124,129,184,348,6,43,Other,98022.66,Silver,Cash,False,0,Rainy,False,Wednesday,True,370,489,2024-04-02 07:28:00,2024,4,14,0
2414,2745,672,Tablet,Appliances,5,1297.77,7/9/2024 23:32,2,"Miami, FL",249,138,211,200,5,63,Male,103489.88,Bronze,Credit Card,True,0,Sunny,True,Tuesday,False,338,171,2024-07-09 23:32:00,2024,7,28,0
2415,2499,857,Laptop,Appliances,5,946.79,9/4/2024 23:57,12,"Miami, FL",197,129,257,153,4,40,Other,73877.54,Platinum,Credit Card,False,0,Rainy,False,Thursday,False,492,108,2024-09-04 23:57:00,2024,9,36,0
2416,1085,574,Headphones,Appliances,3,832.96,4/24/2024 11:38,17,"Chicago, IL",453,118,179,497,9,23,Female,45214.73,Silver,Cash,True,0,Rainy,True,Monday,False,216,365,2024-04-24 11:38:00,2024,4,17,0
2417,6050,329,Tablet,Appliances,3,1204.64,3/20/2024 18:34,10,"Chicago, IL",137,91,139,234,6,19,Male,54038.37,Platinum,Credit Card,True,0,Rainy,True,Wednesday,False,279,486,2024-03-20 18:34:00,2024,3,12,0
2418,8286,127,Camera,Appliances,4,408.95,7/24/2024 23:37,20,"Chicago, IL",80,108,105,153,8,30,Female,47721.44,Platinum,Debit Card,True,0,Cloudy,True,Saturday,True,248,107,2024-07-24 23:37:00,2024,7,30,0
2419,6896,910,Tablet,Electronics,3,892.9,8/16/2024 22:27,13,"Miami, FL",312,91,123,177,9,53,Other,44167.18,Bronze,Cash,True,0,Cloudy,False,Saturday,False,244,180,2024-08-16 22:27:00,2024,8,33,0
2420,5419,102,Headphones,Electronics,1,915.51,5/27/2024 21:36,17,"Miami, FL",424,66,241,341,2,56,Other,65467.69,Silver,Digital Wallet,False,BOGO,Rainy,True,Wednesday,False,296,437,2024-05-27 21:36:00,2024,5,22,0
2421,2674,257,Washing Machine,Electronics,5,1670.06,8/16/2024 4:29,17,"Miami, FL",450,97,168,188,9,40,Other,101685.89,Platinum,Digital Wallet,True,BOGO,Rainy,False,Sunday,False,172,268,2024-08-16 04:29:00,2024,8,33,0
2422,3170,368,Camera,Appliances,2,1054.01,2/7/2024 3:26,3,"Miami, FL",484,99,165,279,1,31,Female,104280.04,Platinum,Credit Card,False,BOGO,Cloudy,True,Wednesday,True,291,312,2024-02-07 03:26:00,2024,2,6,0
2423,2430,407,Laptop,Electronics,4,1161.26,6/28/2024 8:24,9,"Dallas, TX",263,130,182,400,8,48,Female,85191.81,Bronze,Digital Wallet,False,0,Sunny,False,Friday,True,415,151,2024-06-28 08:24:00,2024,6,26,0
2424,4070,755,Tablet,Electronics,5,1391.18,3/23/2024 6:13,9,"Dallas, TX",117,77,214,189,8,61,Male,37235.76,Silver,Credit Card,True,0,Stormy,False,Friday,True,330,205,2024-03-23 06:13:00,2024,3,12,0
2425,8061,954,Laptop,Appliances,1,922.72,4/5/2024 20:30,19,"New York, NY",387,112,200,155,10,58,Female,61659.33,Silver,Credit Card,False,0,Cloudy,False,Thursday,True,440,202,2024-04-05 20:30:00,2024,4,14,0
2426,8353,751,TV,Appliances,5,824.31,2/25/2024 12:20,20,"New York, NY",313,83,196,426,5,29,Other,41783.49,Silver,Debit Card,True,0,Stormy,False,Friday,True,243,191,2024-02-25 12:20:00,2024,2,8,0
2427,9395,583,Smartphone,Electronics,1,1901.72,5/16/2024 5:18,2,"New York, NY",112,84,121,193,10,26,Other,54458.31,Bronze,Debit Card,False,0,Cloudy,False,Monday,False,108,211,2024-05-16 05:18:00,2024,5,20,0
2428,7685,227,Washing Machine,Appliances,5,1979.55,6/7/2024 11:54,17,"Chicago, IL",5,145,206,394,2,47,Male,64493.97,Gold,Digital Wallet,False,0,Stormy,True,Thursday,True,161,472,2024-06-07 11:54:00,2024,6,23,0
2429,2692,769,Smartphone,Electronics,1,683.49,5/7/2024 1:19,2,"Dallas, TX",107,120,283,420,5,67,Male,70679.71,Silver,Credit Card,False,Percentage Discount,Cloudy,True,Thursday,True,454,286,2024-05-07 01:19:00,2024,5,19,0
2430,1430,781,TV,Appliances,4,415.16,7/2/2024 5:33,7,"New York, NY",489,84,271,383,9,63,Female,27036.3,Platinum,Digital Wallet,True,0,Sunny,False,Wednesday,True,261,279,2024-07-02 05:33:00,2024,7,27,0
2431,2468,394,Smartphone,Electronics,3,1837.71,1/20/2024 16:54,11,"Los Angeles, CA",319,95,144,282,9,67,Other,112144.49,Silver,Credit Card,False,0,Sunny,True,Tuesday,True,152,494,2024-01-20 16:54:00,2024,1,3,0
2432,6798,527,Headphones,Appliances,5,1224.34,4/18/2024 15:44,17,"New York, NY",390,93,247,295,2,51,Other,55936.34,Bronze,Digital Wallet,True,0,Sunny,False,Monday,False,351,336,2024-04-18 15:44:00,2024,4,16,0
2433,2524,283,Headphones,Electronics,5,1789.38,6/1/2024 2:55,13,"Miami, FL",500,143,283,329,6,32,Other,103228.48,Silver,Debit Card,False,0,Stormy,False,Wednesday,False,424,312,2024-06-01 02:55:00,2024,6,22,0
2434,6315,603,Laptop,Appliances,2,1098.66,6/25/2024 17:39,6,"Los Angeles, CA",183,93,297,453,2,70,Female,79313.83,Silver,Digital Wallet,False,0,Stormy,True,Tuesday,False,163,129,2024-06-25 17:39:00,2024,6,26,0
2435,7311,804,Washing Machine,Electronics,1,1237.93,1/1/2024 22:08,10,"Chicago, IL",123,140,193,165,5,54,Male,60798.25,Gold,Debit Card,False,0,Sunny,False,Tuesday,True,251,110,2024-01-01 22:08:00,2024,1,1,0
2436,1202,760,TV,Electronics,4,954.41,6/6/2024 10:19,2,"New York, NY",306,135,113,232,5,29,Female,28687.71,Platinum,Credit Card,True,Percentage Discount,Rainy,True,Monday,True,456,230,2024-06-06 10:19:00,2024,6,23,0
2437,5781,350,Tablet,Electronics,3,1182.52,8/29/2024 16:22,12,"New York, NY",187,133,287,126,7,65,Female,90372.85,Platinum,Credit Card,True,Percentage Discount,Sunny,False,Tuesday,False,208,105,2024-08-29 16:22:00,2024,8,35,0
2438,7779,129,Tablet,Electronics,1,521.58,1/9/2024 11:33,15,"Dallas, TX",69,110,206,287,7,56,Female,50590.73,Gold,Cash,True,0,Sunny,False,Sunday,False,283,429,2024-01-09 11:33:00,2024,1,2,0
2439,7353,222,Laptop,Appliances,1,670.08,2/3/2024 7:06,9,"Los Angeles, CA",379,99,172,287,2,18,Other,62391.74,Silver,Digital Wallet,True,0,Sunny,False,Saturday,True,303,473,2024-02-03 07:06:00,2024,2,5,0
2440,2387,883,Smartphone,Electronics,4,1094.15,7/8/2024 6:10,9,"Chicago, IL",357,146,116,275,10,28,Female,57315.88,Platinum,Cash,False,BOGO,Rainy,True,Saturday,True,176,265,2024-07-08 06:10:00,2024,7,28,0
2441,4977,383,Tablet,Appliances,5,314.38,4/24/2024 6:16,11,"New York, NY",451,136,103,430,10,39,Male,86742.67,Bronze,Credit Card,True,0,Cloudy,False,Thursday,True,356,366,2024-04-24 06:16:00,2024,4,17,0
